Source,Title,Link,Date,Article
New Straits Times,"MBSB IB sees Brent, CPO holding above support",https://www.nst.com.my/business/corporate/2026/04/1417421/mbsb-ib-sees-brent-cpo-holding-above-support,"Tue, 14 Apr 2026 12:46:42 +0800","KUALA LUMPUR: MBSB Investment Bank Bhd expects benchmark Brent crude oil and crude palm oil prices to remain above support levels and potentially re-test resistance at US$114 per barrel and RM4,890 per tonne, respectively, in the near term.
In a research note today, it said the outlook is driven mainly by the United States military's planned blockade of Iranian ports from April 13.
""This (blockade), and any further escalation, would likely disrupt the market. We therefore recommend taking long positions in crude oil and other commodity-related stocks, supported by fundamental upside,"" it said.
RHB Investment Bank Bhd said in a more adverse scenario where the conflict persists or escalates, oil prices could rise sharply, potentially reaching US$140 to US$150 per barrel, depending on the severity and duration of supply disruptions.
""We do not expect oil prices to revert to pre-conflict levels immediately, as restart lags, logistical frictions and lingering risk premiums could keep prices elevated in the near term.
""However, as supply chains stabilise, we expect prices to settle around the mid-US$80 per barrel level before trending lower towards our medium-term assumptions,"" it said.
RHB raised its average Brent crude oil forecast for 2026 to US$82.50 per barrel from US$62 previously, and introduced a 2027 forecast of US$72 per barrel.
Year to date, Brent has averaged about US$80.50 per barrel, with first-quarter 2026 averaging US$77.80 per barrel, reflecting heightened geopolitical tensions.
Meanwhile, Hong Leong Investment Bank Bhd said that while the duration of the war remains uncertain, it expects Brent prices to stay elevated for about five months, similar to the period following the outbreak of the Russia-Ukraine war in 2022.
""We revise our Brent assumptions for 2026 and 2027 to US$90 per barrel and US$75 per barrel, from US$70 and US$65 previously,"" it said.
© New Straits Times Press (M) Bhd"
New Straits Times,"Phillip Capital initiates Keyfield with 'Buy', TP RM1.70",https://www.nst.com.my/business/corporate/2026/04/1417415/phillip-capital-initiates-keyfield-buy-tp-rm170,"Tue, 14 Apr 2026 12:37:11 +0800","KUALA LUMPUR: Phillip Research Sdn Bhd (Phillip Capital) has initiated coverage on Keyfield International Bhd with a ""Buy"" call and a target price of RM1.70, citing strong earnings growth over the next three years.
The firm projects a net profit compound annual growth rate of 17 per cent over the period, driven by fleet expansion, stronger margins and improved operational performance.
Keyfield recently expanded its fleet with three vessels, namely Keyfield Gratitude, Keyfield Blessing and Keyfield Harmony, which are expected to contribute a full year of earnings in 2026.
Phillip Capital said growth momentum will be supported by the newbuild vessels, comprising one anchor handling tug supply vessel and two anchor handling tug supply-equivalent assets, scheduled for delivery between 2027 and 2028.
The firm also highlighted Keyfield's expansion into the Middle East following its 65 per cent acquisition of Keyfield Biham.
The unit has secured three contracts since December 2025, improving earnings visibility and supporting higher fleet deployment.
Utilisation is projected to rise to 70 per cent in 2026, 72 per cent in 2027 and 74 per cent in 2028, from 63 per cent in 2025.
Phillip Capital said rising utilisation, coupled with the deployment of newer, higher-capability vessels commanding better charter rates, is expected to lift net profit margin to 31 per cent from 25 per cent.
Keyfield is trading at about eight times forward 2027 earnings, which could support a potential re-rating as sector sentiment improves, the firm said.
Key risks include weaker demand for offshore support vessels, higher-than-expected operating costs and a sharp decline in global crude oil prices.
Keyfield's competitive position is supported by its relatively young fleet, with an average age of nine years compared with the industry average of 12 years.
The group operates 14 vessels, including anchor handling tug supply vessels, platform supply vessels, accommodation work barges and a cable-laying barge.
As a Petronas-licensed operator, Keyfield also has access to tender pipelines from Petroliam Nasional Bhd (Petronas) and petroleum arrangement contractors, supporting recurring contract flows and utilisation stability.
© New Straits Times Press (M) Bhd"
New Straits Times,"Bus driver in viral video is married, say police [WATCH]",https://www.nst.com.my/news/nation/2026/04/1417413/bus-driver-viral-video-married-say-police-watch,"Tue, 14 Apr 2026 12:36:11 +0800","JASIN: Police have confirmed that the express bus driver seen in a viral video driving with a woman seated on his lap is married.
District police chief Superintendent Lee Robert said the 36-year-old man is believed to reside in Johor, while the identity of the woman has yet to be established.
He said police have not, at this stage, obtained further information regarding the relationship between the driver and the woman involved in the incident.
""Police view the matter seriously as it involves a public service vehicle carrying passengers.
""We also urge the express bus driver and the woman featured in the video recording to come forward immediately to the Traffic Enforcement and Investigation Department at the Jasin district police headquarters to assist in investigations,"" he said in a statement here today.
Earlier, the media reported that
police were tracking down the bus driver
who was recorded driving with a woman on his lap, with the video going viral on social media since yesterday.
Lee said preliminary investigations found that the incident occurred at about 7.30pm on April 12 at the southbound slip road to the Bemban Rest and Service (R&R) area.
Those with information on the incident are urged to contact investigating officer Inspector Marwan Shafiq Mohd Latfi at 011-1112 7533 or visit the nearest police station.
""The case is being investigated under Section 42(1) of the Road Transport Act 1987,"" he said.
© New Straits Times Press (M) Bhd"
New Straits Times,#NSTviral: Late-night delivery turns touching as customer gives duit raya to disabled rider [WATCH],https://www.nst.com.my/news/nst-viral/2026/04/1417408/nstviral-late-night-delivery-turns-touching-customer-gives-duit-raya,"Tue, 14 Apr 2026 12:32:48 +0800","MACHANG: A late-night food delivery has captured hearts online after a customer shared a brief but meaningful encounter with a disabled rider.
The woman said the man, known on TikTok as @zaik.grabrider94, was someone who often delivered her orders, describing him as hardworking and determined despite his condition.
During the exchange, she learned that he had yet to eat, even as he continued working late into the night.
Moved by his perseverance, she gave him duit raya as a token of appreciation.
The moment resonated with many, with some expressing admiration and offering prayers for the rider.
@mcteqmierah97
MasyaAllah semoga abang grab ni dikurniakan rezeki yang tak henti2 amin
#ibuscrubbywna
#founderibuscrubwna
original sound  - romiez
""May you be blessed with abundant sustenance, a long life, good health, and always be under Gods protection,"" wrote @ Efa Medina.
Another user, @bubur ayam, commented, ""I pray that this brother never encounters cruel people"".
""Even though this is his fate, he still works hard to earn a living,"" said @shashabalya.
In a short reply to the post, @zaik.grabrider94 simply said, ""Thank you"", a response that further touched many.
The story has since sparked calls for greater empathy towards delivery riders, especially those who continue to work tirelessly despite personal challenges.
© New Straits Times Press (M) Bhd"
New Straits Times,"Johari pledges RM50,000 to Southeast Asia's largest gurdwara",https://www.nst.com.my/news/nation/2026/04/1417405/johari-pledges-rm50000-southeast-asias-largest-gurdwara,"Tue, 14 Apr 2026 12:26:41 +0800","KUALA LUMPUR: Investment, Trade and Industry Minister Datuk Seri Johari Abdul Ghani has pledged RM50,000 to the Guru Nanak Darbar Tatt Khalsa Diwan, Southeast Asia's largest gurdwara.
Johari, who is also the Titiwangsa member of parliament, said the contribution, which had been promised last year, could now be delivered following confirmation from the government regarding the status of the gurdwara.
Johari made the announcement during the Vaisakhi Day celebration, attended by members of the Sikh community.
He also said the government would look into a request to install solar energy systems at the gurdwara to help reduce electricity costs.
""I will look into how the government can support this request and whether it can be implemented as soon as possible,"" he said.
Johari added that Vaisakhi is not merely a festive celebration, but a reflection of values such as courage, sacrifice, discipline, equality and service to humanity.
""These are values deeply embodied by the Sikh community, which continue to enrich our nation.""
Johari said the Sikh community has, for generations, played an integral role in nation-building, from service in the armed forces and police to contributions in the legal profession, business, education and public service.
He also highlighted the Sikh principle of seva (selfless service), describing it as a noble value that continues to inspire Malaysians of all backgrounds.
""In a diverse nation like ours, occasions such as this remind us that our strength lies in unity in diversity.""
He called on Malaysians to continue fostering harmony and mutual respect, while rejecting division and embracing the spirit of togetherness.
Johari also stressed the importance of unity and mutual respect among communities during festive celebrations, noting the contributions of the Sikh community to the nation.
""It is important that during festive occasions like this, we come together and respect one another, especially communities that have contributed significantly to the country.""
© New Straits Times Press (M) Bhd"
New Straits Times,"Sultan Nazrin warns of rising climate risks, urges shift in environmental mindset",https://www.nst.com.my/news/regional/2026/04/1417403/sultan-nazrin-warns-rising-climate-risks-urges-shift-environmental,"Tue, 14 Apr 2026 12:26:09 +0800","IPOH: Environmental management can no longer be treated as a secondary concern in an era of accelerating climate change, as its impacts are already being felt across the globe, warned the Sultan of Perak, Sultan Nazrin Muizzuddin Shah.
Sultan Nazrin said extreme weather events and climate-related disasters have increasingly caused widespread destruction to property, disrupted livelihoods, and forced population displacement in many countries.
""Extreme weather events and climate-related disasters have caused widespread damage to property and forced population displacement.
""Climate change has increased the risk of major floods, droughts, and landslides, directly affecting the lives of the people.
""We must recognise that when humanity acts with excess and injustice towards the environment, nature responds in kind, often in the form of disaster,"" he said.
Sultan Nazrin said this in his speech at the opening the Fourth Year of the Fifteenth Perak State Legislative Assembly at Bangunan Perak Darul Ridzuan here, today. Present was Raja Permaisuri Perak, Tuanku Zara Salim.
Sultan Nazrin said the high cost of recovery demonstrates that environmental degradation ultimately imposes a far greater financial burden on both the nation and the state.
""In truth, nature is responding to human actions that have exceeded the bounds of ecological ethics and reason. Strategic environmental management will therefore determine the future of the nation.
""The real solution lies not merely in enforcement, but in a fundamental shift in mindset from domination to responsibility, from exploitation to stewardship, and from human arrogance to humility as part of the natural world,"" he said.
Citing Nasa satellite data, Sultan Nazrin said the world is witnessing a marked increase in extreme weather intensity, including floods and droughts, which have doubled over the past five years compared with the 2003–2020 average.
""We are also facing the phenomenon of hydroclimatic whiplash, characterised by a rapid transition from prolonged drought to severe flooding within a short period.
""This has placed considerable strain on the resilience of existing infrastructure, which is increasingly unable to withstand the impact of such unpredictable disasters,"" he said.
Sultan Nazrin said proactive flood mitigation measures must be prioritised to safeguard lives and livelihoods, including flood control projects and targeted river maintenance.
""The implementation of flood control projects and targeted river maintenance has reduced flood hotspot locations across the state from 332 in 2024 to 280 in 2025,"" he said.
© New Straits Times Press (M) Bhd"
New Straits Times,"Govt to ensure 'projek rakyat' continue despite rising costs, global conflict",https://www.nst.com.my/news/nation/2026/04/1417401/govt-ensure-projek-rakyat-continue-despite-rising-costs-global-conflict,"Tue, 14 Apr 2026 12:25:46 +0800","KUALA LUMPUR: The government will ensure all people-oriented projects (projek rakyat) proceed despite the ongoing conflict abroad and rising costs, said Works Minister Datuk Seri Alexander Nanta Linggi.
He said the ministry remained committed to safeguarding projects that directly benefit the rakyat, even as global uncertainties, including geopolitical conflicts and fuel price hikes, continue to impact the construction sector.
""We are still able to withstand the challenges for now, but we must adapt our approach and work smarter to support the industry, especially contractors who are affected,"" he said after attending the Works Ministry's monthly assembly today.
Nanta said the ministry, through the Public Works Department (PWD), was exploring several mitigation measures to ensure projects could continue without disruption.
Among the steps being considered is downsizing certain projects, particularly smaller-scale works under contractors in the G1 to G4 categories, involving federal road maintenance and repair.
""For instance, if a project was initially planned at RM1 million per kilometre, we may reduce the length of the road involved, where feasible and if the project has yet to begin,"" he said.
He added that for projects already underway or nearing completion, adjustments would be limited, but the ministry would continue to assist contractors through various means.
Nanta expressed confidence that ongoing efforts would prevent projects from being halted.
""We hope that with the measures we are implementing, none of the projects will be stopped,"" he said, noting that 855 projects are currently being carried out nationwide under PWD.
Nanta said the ministry is actively involved in discussions under the National Economic Action Council (MTEN), which meets weekly to determine policy direction and necessary adjustments across ministries.
Separately, during his speech, he said contractors' cash flow issues must not be taken lightly.
He called on all agencies under the Works Ministry to prioritise the processing of complete claims, expedite the verification of completed works, and ensure that interim and final payments are not delayed without valid justification.
""When the government accelerates payments, we are not only helping contractors, but also safeguarding the entire employment chain within the construction sector,"" he said.
© New Straits Times Press (M) Bhd"
New Straits Times,"Another riot at KL entertainment centre, 13 arrested",https://www.nst.com.my/news/regional/2026/04/1417398/another-riot-kl-entertainment-centre-13-arrested,"Tue, 14 Apr 2026 12:22:55 +0800","KUALA LUMPUR: Police have arrested 13 men over a riot that broke out in front of an entertainment centre in Kepong.
Sentul police chief Assistant Commissioner Basri Sagoni said the suspects, aged between 18 and 45, have been remanded until April 16.
MORE TO COME
© New Straits Times Press (M) Bhd"
Malay Mail,"Police raided Pavilion Residence unit after CCTV showed govt vehicles moving boxes, bags, High Court told",https://www.malaymail.com/news/malaysia/2026/04/14/police-raided-pavilion-residence-unit-after-cctv-showed-govt-vehicles-moving-boxes-bags-high-court-told/216277,"Tue, 14 Apr 2026 13:55:10 +0800","KUALA LUMPUR, April 14 — A former senior police officer told the High Court today that the order to raid an unoccupied unit at Pavilion Residences in May 2018 was prompted by closed-circuit television (CCTV) footage showing several boxes and bags being transported in vehicles bearing the official markings of the Prime Minister’s Department, just days after the 14th General Election.
Former Bukit Aman Commercial Crime Investigation Department director Datuk Seri Amar Singh said he was informed by a subordinate that CCTV footage from Tower A of Pavilion Residences, dated May 11, 2018, showed several individuals moving a trolley laden with orange-coloured boxes into a unit on Level 45.
He said the information was relayed to him by Senior Assistant Commissioner Ahmad Nordin Ismail — one of five team leaders appointed by him to conduct searches at premises belonging to former prime minister Datuk Seri Najib Abdul Razak and his family members in connection with the 1MDB case.
“On May 17, 2018 at 1030am, Ahmad Nordin gave me further information after viewing the CCTV record that was given  to him by the Pavilion Residence Management and it was shown that two persons who are working as house   maids at the unit that he is currently conducting the search were seen together with some other persons carrying things into Unit B-45-02.
Thereafter, Amar said he instructed another subordinate of his, SAC Datuk Mohd Sakri Arifin to conduct a search at the aforementioned unit on the same day once a search warrant was obtained.
“Based on all the information that has been gathered on Unit B-45-02, there is reasonable suspicion that the said unit is being used by the ex-PM and credible information that boxes of items related to 1MDB case have been moved into the unit,” he said in his witness statement.
Amar, who led the federal CCID between October 2017 until December 2018, is testifying for the Royal Malaysia Police as a third party in a lawsuit filed by Lebanese firm Global Royalty Trading SAL (GRTS) against Datin Seri Rosmah Mansor.
Amar said he had later ordered the CCID’s cybercrime and multimedia division to conduct an in-dept analysis of the video recordings showing movements of bags and boxes into the unit after the police raid on May 17, 2018.
He said this was to determine when and how the bags and boxes were moved into Unit B-45-02, identify the individuals responsible for carrying the items into the unit, establish which vehicles were used to transport them and trace their point of origin.
“Investigations reveal that the bags and boxes were moved into Unit B-45-02 from the May 11, 2018 till the early hours of May 12, 2018  around 4am.
“All in 11 police personel, 8 army personel and 4 house helpers were responsible for the movement of the boxes and bags into Unit B-45-02 using the basement 2 Block B lift.
“The exhibits were moved from the residence at Jalan Duta to Pavillion using government vehicles and personal vehicles belonging to the above personnel,” he said in reference to Najib’s Langgak Duta residence.
He also said several trips were made transporting the bags and boxes into the unit.
Amar said two individuals entered the unit after the bags and boxes were moved in, one being a local air-conditioning contractor (on May 14) and another a Khazakhstani national (on May 16).
“The statements of these persons were all recorded except the Khazakhstani national since he had left the country on May 25, 2018 as soon as we found his details,” he said.
To a question from Rosmah’s lawyer Rajivan Nambiar whether the authorities had attempted to contact his client or Najib to be present at the unit during the raid, Amar said his subordinates did attempt but to no avail.
Separately, former Bukit Aman Commercial Crime Investigation Department (Intelligence and Operations) deputy director Datuk Mohd Sakri Arifin told the court that police found Unit B-45-02 locked upon arrival to conduct the raid after obtaining a search warrant.
He said a locksmith was later called in to unlock the unit, which was still under renovation.
“Its condition was messy and there was no electricity supply.
“In one of the rooms, I discovered several arranged luggage bags that were unlocked and zipped of which later contained various currencies and jewelry.
“In the next room, there were orange-coloured boxes filled with luxury bags arranged against the wall,” he said.
Sakri said he later contacted Amar to request his presence at the premises since the number of items seized were too many.
In the current suit, GRTS claims that of the 44 pieces of jewellery it had sent to Rosmah, only one (a diamond bracelet) had been recovered from the police following a raid conducted by the police in Pavilion Residences Kuala Lumpur and returned to the Lebanese firm in 2022.
Rosmah later brought in the Malaysian government as a third party in the suit due to her claim that the items could have been missing as a result of police seizure.
The trial before High Court judge Datuk Quay Chew Soon continues tomorrow."
Malay Mail,My50 stays: Govt keeps subsidised transport passes for Klang Valley commuters,https://www.malaymail.com/news/malaysia/2026/04/14/my50-stays-govt-keeps-subsidised-transport-passes-for-klang-valley-commuters/216272,"Tue, 14 Apr 2026 13:14:03 +0800","KUALA LUMPUR, April 14 — The government will continue its subsidised public transport pass schemes, including the widely used My50 programme, as part of efforts to ease the impact of rising fuel costs on urban commuters.
Transport Minister Anthony Loke said the initiative forms part of the broader rail usage campaign to address rising fuel costs.
“The My50 pass allows unlimited travel on rail and bus services in the Klang Valley for RM50 a month — about 67 per cent lower than its actual value,” Loke told a press conference here today.
MORE TO COME"
Malay Mail,Putrajaya pushes rail relief plan with discounted KTMB fares and monthly passes,https://www.malaymail.com/news/malaysia/2026/04/14/putrajaya-pushes-rail-relief-plan-with-discounted-ktmb-fares-and-monthly-passes/216270,"Tue, 14 Apr 2026 13:08:19 +0800","KUALA LUMPUR, April 14 — The government today introduced a rail-focused relief package offering discounted fares and new monthly pass options in an effort to cushion Malaysians from rising commuting costs linked to fuel prices.
Transport Minister Anthony Loke Siew Fook said the initiative is aimed at encouraging greater use of public transport, particularly rail, while improving affordability for daily commuters.
Under the scheme, Keretapi Tanah Melayu Berhad (KTMB) will provide a 30 per cent discount on Electric Train Service (ETS) tickets across all routes, as well as reduced fares for the Ekspres Rakyat Timuran (ERT) service on the JB Sentral–Tumpat line.
“The discount applies for travel from Monday to Thursday, excluding school holidays and public holidays, in a move aimed at managing demand while promoting more consistent ridership.
“Passengers will need to use a promotional code, to be released by KTMB, for bookings made between April 15 and April 30, with travel valid until October 14, 2026,” Loke told a press conference here today.
However, the discount does not apply to ETS business class tickets, first-class and sleeper services on ERT or concession ticket holders.
Alongside this, a targeted monthly travel pass will be offered by the Express Rail Link (ERL), with savings up to 90 per cent.
These include the MyPutrajaya pass for civil servants working or living in Putrajaya, and the MyKLIA pass for Malaysians employed at Kuala Lumpur International Airport terminals.
“Both passes provide unlimited travel within the validity period, significantly reducing commuting costs for frequent users.
“The combined measures reflect a broader strategy to strengthen rail as a primary mode of transport, helping Malaysians manage expenses while supporting a more sustainable and efficient public transport system,” Loke said.
He added that the public could plan ahead and take advantage of the incentives offered under the campaign."
