Source,Title,Link,Date,Article
Malay Mail,Fire Dept: Punggai Bypass bush fire 80pc contained as crews battle heat and strong winds,https://www.malaymail.com/news/malaysia/2026/03/25/fire-dept-punggai-bypass-bush-fire-80pc-contained-as-crews-battle-heat-and-strong-winds/213876,"Wed, 25 Mar 2026 20:23:57 +0800","KOTA TINGGI, March 25 — Firefighting operations involving a bush fire covering an estimated 150 hectares along the Punggai Bypass Highway towards Sebana Cove have reached 80 per cent containment as of 1pm today.
Punggai Fire and Rescue Station (BBP) chief Senior Fire Officer II Ezam Mistorerrodin said about 30 hectares remain active and are still being extinguished.
He said the fire spread rapidly due to hot and dry weather, as well as strong winds, which have hampered firefighting efforts.
“We are applying a direct attack technique using hose lines up to 1,200 feet, relay pumping systems and high-powered pumps, with water sourced from nearby reservoirs to ensure a continuous supply,” he said in a statement today.
The operation involves over 30 firefighters from Punggai and Sungai Rengit stations assisted by officers from Johor JBPM headquarters and the Zone 3 Drone Unit for aerial monitoring.
Also involved are the police (PDRM), Department of Environment, Johor Plantation Foundation, KEJORA and the Pengerang Municipal Council.
In a related development, Ezam said another bush fire was reported yesterday near the Pengerang People’s Housing Project (PPR), raising concerns among residents due to thick smoke affecting air quality and visibility.
The second fire covers about 10 hectares, with 4.7 hectares or 50 per cent extinguished so far.
He said conditions at the location remain challenging as the fire continues to burn dry vegetation, producing dense smoke.
“The thick smoke has hampered movement and firefighting operations. However, efforts are ongoing to prevent the fire from spreading to nearby residential areas,” he said. — Bernama"
Malay Mail,Sarawak police fast‑tracking investigation into Sri Aman crash that killed three,https://www.malaymail.com/news/malaysia/2026/03/25/sarawak-police-fasttracking-investigation-into-sri-aman-crash-that-killed-three/213875,"Wed, 25 Mar 2026 20:16:52 +0800","KUCHING, March 25 — Police will expedite investigations into a fatal accident in Sri Aman that claimed the lives of three family members recently.
Sarawak deputy police commissioner DCP Saifullizan Ishak said the investigation is being conducted from multiple angles.
He said no conclusion has been made to ensure fairness to all parties involved.
“Police will not make early assumptions and will allow a thorough investigation to be completed,” he told reporters after the 219th Police Day Commemoration Assembly at the Sarawak Contingent level here today.
The accident on March 20 involved a Proton X70 and a Perodua Alza along Jalan Serian-Sri Aman.
Three passengers in the Proton X70, including a 70-year-old man and two women, were killed, while several others were injured. — Bernama"
Malay Mail,"Buying fuel in containers? You need a special permit, says Domestic Trade Ministry following viral drum‑filling cases",https://www.malaymail.com/news/malaysia/2026/03/25/buying-fuel-in-containers-you-need-a-special-permit-says-domestic-trade-ministry-following-viral-drumfilling-cases/213874,"Wed, 25 Mar 2026 20:10:06 +0800","PUTRAJAYA, March 25 — Companies, organisations and individuals intending to purchase petrol or diesel at fuel stations for use outside vehicle tanks are required to obtain a Special Permit from the Ministry of Domestic Trade and Cost of Living (KPDN) under the Supply Control Act 1961.
KPDN Enforcement director-general Datuk Azman Adam said purchases under the permit are allowed only for quantities of 20 litres and above at prevailing pump prices, a measure aimed at preventing misuse of controlled and subsidised fuel.
“Permit holders may store the fuel in drums, plastic containers or other suitable and safe containers, subject to the approved quantity, fuel station location, duration and frequency of purchase,” he said in a statement today.
He said applications can be made online via the Supply Permit System at
spb.kpdn.gov.my
, with the permit offered free of charge to eligible applicants.
Azman said 10 categories qualify for the permit, namely forklift operations, water transport, residents in rural and island areas, food industry operators, water-based recreation, agriculture and livestock, emergency assistance, maintenance, tourism and small-scale construction.
“No parties other than Special Permit holders are allowed to purchase petrol or diesel in containers at fuel stations, except in emergency cases, where the permitted quantity is below 20 litres,” he said.
He added that KPDN had taken note of viral reports in mainstream and social media regarding the recent practice of filling petrol into containers.
Under the Act, he said fuel stations are only allowed to sell diesel and all grades of petrol into vehicle tanks, unless otherwise approved by relevant authorities or for individuals holding a Special Permit issued by KPDN. — Bernama"
Malay Mail,Saifuddin Nasution: Police followed SOPs in arresting teens over terror‑related activities,https://www.malaymail.com/news/malaysia/2026/03/25/saifuddin-nasution-police-followed-sops-in-arresting-teens-over-terrorrelated-activities/213873,"Wed, 25 Mar 2026 20:01:15 +0800","KUALA LUMPUR, March 25 — The Royal Malaysia Police’s (PDRM) action in arresting individuals, including underage teenagers believed to be attempting to revive a terrorist group ideology in the country, was carried out in accordance with standard operating procedures (SOP), said Home Minister Datuk Seri Saifuddin Nasution Ismail.
Saifuddin Nasution said investigations found that the teenagers had been accessing websites related to violence.
He explained that the group was found to have a multi-layered organisational structure, with teenagers often exploited and trained by leaders in their 30s and 40s through the dissemination of doctrines online.
“They may be 17 or 18 years old, but those above them who are training them are in their 30s and 40s. And it is not confined to Malaysia, as it also exists in other countries in the region. So it is far more complex than that,” he told reporters after the 219th Police Day Commemoration, officiated by Prime Minister Datuk Seri Anwar Ibrahim here today.
On March 6, the media reported that PDRM had foiled attempts to revive the group’s ideology through the arrest of six suspects aged between 16 and 21, including three underage teenagers.
All of them were detained in a special operation by the Special Branch over two days beginning Feb 14 in the Klang Valley, Johor, Kedah and Terengganu.
Meanwhile, in addressing potential long-term implications of the West Asian conflict, Saifuddin Nasution said the Cabinet has tasked the Home Ministry and the Defence Ministry with developing scenario planning to ensure national security remains intact.
“In the Cabinet meeting, the Prime Minister mentioned that at least two regulatory agencies — the Defence Ministry and the Home Ministry — are responsible for conducting observations involving the collection of accurate, valid and credible information,” he said. — Bernama"
Malay Mail,Meru police station in Klang introduces bell‑entry system for after‑hours access following brawl,https://www.malaymail.com/news/malaysia/2026/03/25/meru-police-station-in-klang-introduces-bellentry-system-for-afterhours-access-following-brawl/213872,"Wed, 25 Mar 2026 19:55:07 +0800","KLANG, March 25 — As a security measure, the Meru police station is now using a bell system to control public entry after midnight, following a brawl at the station on March 2.
North Klang district police chief ACP S. Vijaya Rao said this measure was taken to strengthen security aspects at the station, apart from ensuring the safety of police personnel and the public.
“This measure is important because there are still many police stations across the country operating in shoplots like the Meru police station and requiring more effective security control.
“So among the measures taken include closing the main door after midnight and only allowing the public to enter after pressing the bell provided outside the premises,” he said at a press conference in conjunction with the 219th Police Day celebrations at the Soo Jin Chinese National Type School (SJKC) Hall in Kapar here today.
Vijaya explained that the station’s operations will continue as usual but the bell facility is provided to assist the public who wish to conduct business even when the main door is closed at certain times.
He said that other safety measures include the installation of closed-circuit television (CCTV) cameras inside and outside the station, as well as the assignment of patrol officers in the surrounding areas to ensure continuous monitoring.
“Every night, at least two police personnel will be on duty at the station, with one receiving reports and the other on standby for patrol or external monitoring,” he said.
He said the same approach has been practiced for a long time in several other stations in North Klang, including Bandar Baru Klang, Bukit Raja, Meru and Bandar Sultan Sulaiman.
Elaborating further. Vijaya said the brawl incident at the Meru police station was unexpected and happened suddenly, and believed to have been due to a misunderstanding between two groups and not intended to attack police officers.
“I hope the public respects the police station as security institution. If you are not satisfied, resolve matters outside and channel it through a report so that an investigation can be conducted,” he also said.
In the incident, police arrested eight individuals from two different groups, and as a result of the investigation, three individuals were charged, while the others are witnesses.
The case involves several offences, including trespassing into the station, injuring a witness under Section 324 of the Penal Code and Section 90 of the Police Act 1967, as well as the offence of carrying a weapon. The case is currently in the trial process at the Klang Magistrate’s Court. — Bernama"
Malay Mail,"Malaysia keeps subsidised RON95 at RM1.99, raises RON97 and diesel prices after global oil surge",https://www.malaymail.com/news/malaysia/2026/03/25/malaysia-keeps-subsidised-ron95-at-rm199-raises-ron97-and-diesel-prices-after-global-oil-surge/213871,"Wed, 25 Mar 2026 19:42:28 +0800","PUTRAJAYA, March 25 — Malaysia will maintain the subsidised price of RON95 petrol at RM1.99 per litre under the Budi95 scheme, while prices of RON97 and diesel have been adjusted following a surge in global oil prices.
The Finance Ministry said the prolonged conflict in West Asia has pushed crude oil prices up more than 40 per cent to above US$100 a barrel, raising risks of supply disruption.
Under the Automatic Pricing Mechanism, retail fuel prices for the week of March 26 to April 1 are set at RM5.15 per litre for RON97, RM3.87 for unsubsidised RON95, RM5.52 for diesel in Peninsular Malaysia, and RM2.15 for diesel in Sabah, Sarawak and Labuan.
The ministry said the government remains committed to protecting consumers despite volatile global markets, noting that Malaysia’s domestic fuel prices are influenced by international supply as much of it is imported.
Measures include maintaining subsidies for eligible consumers, keeping diesel for public transport and logistics at RM2.15 per litre, raising monthly individual diesel assistance to RM300, tightening enforcement to prevent misuse, and banning RON95 sales to foreign registered vehicles.
The government also plans to introduce further controls on diesel purchases in East Malaysia to curb leakage.
The ministry said subsidies now exceed RM3 billion a month, and the government will continue balancing fiscal needs with consumer protection to safeguard economic wellbeing."
Malay Mail,"No Malaysian peacekeepers harmed in south Lebanon explosions, says defence minister",https://www.malaymail.com/news/malaysia/2026/03/25/no-malaysian-peacekeepers-harmed-in-south-lebanon-explosions-says-defence-minister/213870,"Wed, 25 Mar 2026 19:31:43 +0800","KUALA LUMPUR, March 25 — None of the Malaysian Battalion (MALBATT) 850-13 personnel were injured in the explosions that occurred near the United Nations Interim Force in Lebanon (UNIFIL) operating area in the south of that country.
Defence Minister Datuk Seri Mohamed Khaled Nordin said the incidents occurred following tensions between the Israel Defence Forces (IDF) and Hezbollah in the area.
“The Defence Ministry, through the Joint Forces Headquarters, is constantly monitoring the latest developments, particularly in MALBATT 850-13 operational areas. The safety of personnel remains a priority,” he said in a statement today.
He added that the UNIFIL Headquarters in Naqoura is also constantly monitoring the situation and issuing instructions to all peacekeeping teams to always remain vigilant.
“Additional security measures have been put in place, including scheduled patrolling, situational awareness and close communications between units,” he said.
He said that MALBATT 850-13 continues to carry out assignments in its areas of responsibility with a high level of readiness.
“We will continue to monitor the current situation and work closely with UNIFIL and other peacekeeping partners to ensure the safety of personnel, and the tasks entrusted continue to be carried out as best possible,” he said. — Bernama"
Malay Mail,"Mersing teen found drowned in Mersing river, body recovered 100m from last known location",https://www.malaymail.com/news/malaysia/2026/03/25/mersing-teen-found-drowned-in-mersing-river-body-recovered-100m-from-last-known-location/213869,"Wed, 25 Mar 2026 19:16:54 +0800","MERSING, March 25 — A 15-year-old boy who was reported missing while bathing in a river near the Kampung Peta Jetty in Endau here was found drowned today.
Mersing police chief Supt Abdul Razak Abdullah Sani said the body of Muhammad Adam Haziq Muhammad Hazriq was discovered at 12.41 pm.
He said the Fire and Rescue Department’s Water Rescue Unit (PPDA) found the body about 100 metres from where the boy was reported to have gone missing, and at a depth of about six metres.
“The body was taken to Mersing Hospital, and the case has been classified as sudden death,” he said when contacted.
Meanwhile, Endau Fire and Rescue Station (BBP) Operations Commander, Senior Fire Officer II Mohd Sahrel Anuar Mawarday, said they received an emergency call at 9.24 pm (on March 24) and dispatched six personnel to the scene.
“The team arrived at the scene, located about 135 kilometres from the Endau BBP, at 11.45 pm. An initial monitoring was carried out before the search and rescue (SAR) operation was implemented at 9 am today, following discussions with the victim’s family,” he said. — Bernama"
Malay Mail,Johor police nab sixth suspect in Southkey murder with help from Singapore,https://www.malaymail.com/news/malaysia/2026/03/25/johor-police-nab-sixth-suspect-in-southkey-murder-with-help-from-singapore/213866,"Wed, 25 Mar 2026 19:04:26 +0800","JOHOR BAHRU, March 25 — Police have arrested another suspect to assist in the investigation into the murder of a man in Southkey here on March 14, bringing the total number of arrests so far to six individuals.
Johor deputy police chief DCP Hoo Chuan Huat said the sixth suspect, a 30-year-old foreign man, was detained in Singapore this morning through close cooperation between the Royal Malaysia Police and the republic’s authorities.
“A remand application for the suspect will be made tomorrow,” he told a press conference at the assembly held to commemorate the 219th Police Day at the Johor police contingent headquarters (IPK) here today.
He said five individuals had been arrested earlier, comprising four men and a woman.
The first suspect, whose remand period had expired, had the remand extended until March 31, while applications for extension will be made for the other four suspects whose remand will end tomorrow.
He said the motive for the murder is still under investigation, and police will provide further updates once the probe is completed.
Earlier, the media reported the arrest of five suspects aged between 24 and 33, who were believed to have fled to Singapore after being pursued by police in connection with the case.
The first suspect was detained at 12.15 am on March 18 while attempting to get through immigration checks to enter Singapore.
Following the arrest, four more suspects were detained with the assistance of the Singapore police at 6 pm the next day.
In the March 14 incident that occurred at 5 am, a 32-year-old foreign man was attacked with sharp weapons, including being stabbed in the neck by several individuals. The victim was later confirmed dead at Sultan Ismail Hospital.
The case is being investigated under Section 302 of the Penal Code for murder. — Bernama"
Malay Mail,Fahmi: PKR will fully cooperate in probe into RM10m ‘corporate mafia’ allegation involving its MP,https://www.malaymail.com/news/malaysia/2026/03/25/fahmi-pkr-will-fully-cooperate-in-probe-into-rm10m-corporate-mafia-allegation-involving-its-mp/213865,"Wed, 25 Mar 2026 18:58:36 +0800","KUALA LUMPUR, March 25 — PKR is ready to fully cooperate with the authorities in connection with allegations of the party’s Member of Parliament’s (MP) involvement in misconduct involving a RM10 million transaction.
PKR Information chief Datuk Fahmi Fadzil said the party’s leadership has been informed of the news reports on the allegations and leaves it fully to the authorities to carry out further investigations.
“We have not held a meeting (regarding this matter). But the leadership has been informed of the news reports. If there is any misconduct, we leave it to the authorities to conduct investigations.
“We have nothing to hide, and the party will cooperate with the enforcement authorities,” he told reporters when met after the 219th Police Day celebration at the Police Training Centre (PULAPOL) here today.
Fahmi, who is also the Communications Minister, said Prime Minister Datuk Seri Anwar Ibrahim had previously sent a clear message that the government will not shield any party involved in any misconduct.
He said the principle applies to any group, including party members or MPs from the government’s own bloc.
Regarding further action by the party, Fahmi said any investigation must begin with the complainant lodging an official report with the enforcement bodies, such as the Royal Malaysia Police (PDRM) or the Malaysian Anti-Corruption Commission (MACC).
“It’s up to the complainant to make a police report or to any other enforcement bodies. That is the process that must be followed before further action is taken,” he said.
Yesterday, the media reported that businessman Victor Chin Boon Long had claimed that a PKR MP had asked him to provide RM10 million in cash to resolve alleged “corporate mafia” issues.
On March 16, police confirmed that they had raided several premises belonging to the corporate figure around Kemensah and Sunga Long, Kajang, but he and his wife were not at the location when the raids were conducted. — Bernama"
Malay Mail,Sabah Police Gallery opens with rare exhibits from 2013 Lahad Datu intrusion,https://www.malaymail.com/news/malaysia/2026/03/25/sabah-police-gallery-opens-with-rare-exhibits-from-2013-lahad-datu-intrusion/213863,"Wed, 25 Mar 2026 18:45:14 +0800","KOTA KINABALU, March 25 — The long-awaited Sabah Police Gallery features some never-seen-before photos and items from the Lahad Datu intrusion in 2013, one of the darkest spots in Sabah’s recent history.
Launched today in one of the oldest buildings in the State police headquarters’ complex, the gallery includes the state’s history involving the police, including seized items from the intrusion in Tanduo, Lahad Datu, such as weapons, gear and personal belongings of the militants involved in the deadly incident.
It also documents the various negotiation attempts made by the police during the tense period in February 2013 which saw the deaths of 72 people, including several members of the Malaysian armed forces and most of the militants who called themselves the Royal Security Forces of the North Borneo Sultanate.
Sabah chief minister Datuk Seri Hajiji Noor, who officiated the opening of the gallery today, described it as a “living archive” that preserves the history, hardships and commitment of the Royal Malaysia Police in Sabah and “not merely a place for exhibitions.”
He said the gallery stands as a testament to the struggle, sacrifice and dedication of police personnel in maintaining national security.
“It serves as a platform to express appreciation for the invaluable sacrifices, contributions and services of all police personnel, both serving and retired,” he said.
“I view the establishment of this gallery as highly significant and timely in ensuring that the sacrifices of national heroes remain etched in memory,” he said.
The Chief Minister said the gallery’s role was important as an educational centre and historical reference for younger generations to appreciate the value of peace and security.
“It educates the younger generation and reminds us all of the meaning of security, peace and the high discipline upheld by the police force,” he said.
Hajiji, meanwhile, said the state government will continue to support the needs of police personnel, describing them as key strategic partners in the state’s security and development.
“State security is the foundation of development stability, the well-being of the people and investor confidence,” he said.
Sabah Police Commissioner Datuk Jauteh Jikun said that moves to establish the gallery had been on the cards since 2019 and it finally became a reality.
He said that the gallery will be opened to the public soon."
Malay Mail,"MACC submits papers on DOE chiefs, targets graft tied to e‑waste and plastics",https://www.malaymail.com/news/malaysia/2026/03/25/macc-submits-papers-on-doe-chiefs-targets-graft-tied-to-ewaste-and-plastics/213861,"Wed, 25 Mar 2026 18:41:07 +0800","PUTRAJAYA, March 25 — The Malaysian Anti-Corruption Commission (MACC) is intensifying efforts to tackle corruption linked to the management of e-waste and plastic waste following recent progress in probes involving senior Department of Environment (DOE) officials.
MACC Chief Commissioner Tan Sri Azam Baki said investigation papers involving the DOE director-general and deputy director-general have been completed and submitted to the Attorney General’s Chambers (AGC) with a recommendation for prosecution.
“Regarding the case involving the director-general and deputy director-general of the DOE, the investigation papers have been finalised and presented to the Attorney General’s Chambers (AGC) with a recommendation for prosecution.
“The Commission is now awaiting the AGC’s decision to proceed with charges against both senior DOE officers in the near future,” he said.
He noted that papers concerning the director-general were submitted on February 26, 2026, while those involving the deputy director-general were handed over on March 6, 2026.
“The issue of e-waste and plastic solid waste has long been faced by the public and remains unresolved despite numerous pollution complaints. Ultimately, the MACC has taken action by investigating and detaining those entrusted with protecting the environment,” he added.
He also stressed that any element of corruption could have far-reaching implications, including on environmental sustainability and public health.
The MACC is leading the Special Task Force on the Direction of Enforcement Management for the Import of Plastic Waste and E-Waste, chaired by Azam himself.
Among measures introduced is a full ban on e-waste imports under the Absolute Prohibition category in the Customs (Prohibition of Imports) Order 2023, effective February 4, 2026.
The task force, formed after findings of e-waste smuggling involving hundreds of containers stranded at ports, brings together 12 agencies including the DOE, Royal Malaysian Customs Department, Malaysian Border Control and Protection Agency, and Royal Malaysia Police to tighten border controls."
