Source,Title,Link,Date,Article
New Straits Times,"Oil prices stay elevated amid geopolitical risk premium, says MARC Ratings",https://www.nst.com.my/business/economy/2026/05/1442474/oil-prices-stay-elevated-amid-geopolitical-risk-premium-says-marc,"Mon, 18 May 2026 18:10:52 +0800","KUALA LUMPUR: Global oil prices are holding at elevated levels due to ongoing geopolitical tensions, even though supply still exceeds demand in the market, according to Malaysian Rating Corporation Bhd (MARC Ratings).
Its chief economist and adjunct professor, Dr Ray Choy, said prolonged tensions in the region have raised concerns over possible oil supply disruptions after damage to key energy facilities and pipelines, with repairs expected to take at least six months.
""There are oil pipelines that have been shut and cemented to prevent spillovers, in addition to various logistical issues that continue to disrupt the global energy supply chain.
""Besides the issue of facility repairs, the cost of transporting oil has also increased, as well as oil shipment insurance costs, which are now significantly higher compared to before the conflict,"" he said during the MARC360 special edition webinar today.
Choy said that over the next year, oil-importing countries are expected to increase their strategic reserves to build buffers in case geopolitical tensions escalate again.
He said this could help sustain oil demand at elevated levels even though the global market is fundamentally in a state of oversupply.
As such, Choy noted that global crude oil prices are expected to remain in the range of US$80 to US$90 per barrel in the near term.
He noted that this will be driven by ongoing geopolitical tensions in the Middle East that continue to disrupt global energy supply chains and raise logistics and shipping security costs.
He said that while the global oil market remains structurally oversupplied, prices are being kept elevated by an ongoing geopolitical risk premium.
""Without the geopolitical risk premium, the global oil market would actually be in a state of oversupply.
""However, the ongoing conflict is keeping prices high.
""In the past, oil prices were in the range of US$60 to US$70 per barrel, but the current situation is different as the market is factoring in geopolitical risks that have yet to subside,"" he added.
On the regional economic outlook, Choy said countries that rely heavily on energy imports such as Thailand and the Philippines are expected to be more affected by the Middle East conflict compared to Malaysia.
He said a key issue to watch is the extent to which a slowdown in regional trade across Asia will impact Malaysia's net export position.
""Beyond trade, the tourism sector also needs to be monitored as higher airfares and more cautious consumer sentiment could weigh on tourism demand,"" he said.
He added that inflationary pressure is also expected to be the biggest challenge for the economy in the second quarter of the year, as rising producer costs begin to be passed on to consumers.
He said the key question is how far consumers are able to sustain their spending once cost pressures become more widespread.
""Some of the cost pressure will eventually be passed on to consumers, and the question is whether consumers can continue to spend or begin to cut back.
""However, a still-strong labour market and low unemployment rate are expected to help support consumer resilience,"" he said.
© New Straits Times Press (M) Bhd"
New Straits Times,"Malaysia, India to deepen ties under Comprehensive Strategic Partnership, says Anwar",https://www.nst.com.my/news/nation/2026/05/1442463/malaysia-india-deepen-ties-under-comprehensive-strategic-partnership,"Mon, 18 May 2026 18:02:57 +0800","KUALA LUMPUR: Malaysia will continue to strengthen its close ties with India for mutual benefit, regional stability and more inclusive prosperity for both nations, says Prime Minister Datuk Seri Anwar Ibrahim.
Anwar said the matter was discussed during a farewell courtesy call by India's High Commissioner to Malaysia, B.N. Reddy, who will soon conclude his tenure in the country.
He said the meeting further reinforced Malaysia-India bilateral relations, now elevated to a Comprehensive Strategic Partnership, reflecting both countries' commitment to expanding cooperation across multiple sectors.
The prime minister said areas of cooperation included trade, digitalisation, artificial intelligence (AI), food security, education and people-to-people exchanges.
""I also touched on the positive development in bilateral trade, which reached US$18.59 billion in 2025, maintaining India as Malaysia's largest trading partner in South Asia,"" he said in a Facebook post today.
Anwar, who is also Finance Minister, said cooperation in digital and emerging technologies had shown encouraging progress, including through the inaugural Malaysia-India Digital Council (MIDC) meeting and the MY-India AI Conclave recently held in Kuala Lumpur.
© New Straits Times Press (M) Bhd"
New Straits Times,"Oil prices stay elevated amid geopolitical risk premium, says MARC Ratings",https://www.nst.com.my/business/corporate/2026/05/1442458/oil-prices-stay-elevated-amid-geopolitical-risk-premium-says,"Mon, 18 May 2026 17:56:38 +0800","KUALA LUMPUR: Global oil prices are holding at elevated levels due to ongoing geopolitical tensions, even though supply still exceeds demand in the market, according to Malaysian Rating Corporation Bhd (MARC Ratings).
Its chief economist and adjunct professor, Dr Ray Choy, said prolonged tensions in the region have raised concerns over possible oil supply disruptions after damage to key energy facilities and pipelines, with repairs expected to take at least six months.
""There are oil pipelines that have been shut and cemented to prevent spillovers, in addition to various logistical issues that continue to disrupt the global energy supply chain.
""Besides the issue of facility repairs, the cost of transporting oil has also increased, as well as oil shipment insurance costs, which are now significantly higher compared to before the conflict,"" he said during the MARC360 special edition webinar today.
Choy said that over the next year, oil-importing countries are expected to increase their strategic reserves to build buffers in case geopolitical tensions escalate again.
He said this could help sustain oil demand at elevated levels even though the global market is fundamentally in a state of oversupply.
As such, Choy noted that global crude oil prices are expected to remain in the range of US$80 to US$90 per barrel in the near term.
He noted that this will be driven by ongoing geopolitical tensions in the Middle East that continue to disrupt global energy supply chains and raise logistics and shipping security costs.
He said that while the global oil market remains structurally oversupplied, prices are being kept elevated by an ongoing geopolitical risk premium.
""Without the geopolitical risk premium, the global oil market would actually be in a state of oversupply.
""However, the ongoing conflict is keeping prices high.
""In the past, oil prices were in the range of US$60 to US$70 per barrel, but the current situation is different as the market is factoring in geopolitical risks that have yet to subside,"" he added.
On the regional economic outlook, Choy said countries that rely heavily on energy imports such as Thailand and the Philippines are expected to be more affected by the Middle East conflict compared to Malaysia.
He said a key issue to watch is the extent to which a slowdown in regional trade across Asia will impact Malaysia's net export position.
""Beyond trade, the tourism sector also needs to be monitored as higher airfares and more cautious consumer sentiment could weigh on tourism demand,"" he said.
He added that inflationary pressure is also expected to be the biggest challenge for the economy in the second quarter of the year, as rising producer costs begin to be passed on to consumers.
He said the key question is how far consumers are able to sustain their spending once cost pressures become more widespread.
""Some of the cost pressure will eventually be passed on to consumers, and the question is whether consumers can continue to spend or begin to cut back.
""However, a still-strong labour market and low unemployment rate are expected to help support consumer resilience,"" he said.
© New Straits Times Press (M) Bhd"
New Straits Times,Loan shark runner jailed 11 and a half years for Molotov attack in Batu Pahat,https://www.nst.com.my/news/regional/2026/05/1442449/loan-shark-runner-jailed-11-and-half-years-molotov-attack-batu-pahat,"Mon, 18 May 2026 17:51:49 +0800","BATU PAHAT: ""Why did you burn the house? Who ordered you to do it?"" the Sessions Court judge, Osman Affendi Mohd Shalleh, asked before sentencing a man to 6 years' jail for acting as a runner for an illegal moneylender, or 'loan shark', in a case involving the firebombing of a senior citizen's home last month.
The accused, Mohamed Hanaffi Ahmad, 32, who had been sentenced to 66 months' imprisonment by the Segamat Sessions Court on April 30, pleaded guilty to the charge under Section 436 of the Penal Code.
The latest decision brings his total jail term to 138 months (11 and a half years), with the sentences ordered to run consecutively, Harian Metro reported.
The father of 3 was accused of throwing a Molotov cocktail, causing damage to the home of a 62-year-old man in Taman Nagaria, Senggarang, at 5.16pm on April 11.
He was charged under Section 436 of the Penal Code, which carries a jail term of up to 20 years and a fine upon conviction.
According to the facts of the case, the victim lodged a police report after discovering burn marks at the car porch area when visiting his rented property.
Following the report, police arrested the accused in Bandar Putra, Kulaijaya, along with his wife, who was also allegedly involved in the case.
Police also found a video on the wife's mobile phone showing the accused throwing the Molotov cocktail at the victim's rented house.
Investigations found that the accused was paid between RM200 and RM300 for each house targeted with the incendiary device.
During proceedings, the court was also shown a video of the accused placing a mobile phone on the roadside before carrying out the act.
The prosecution was conducted by deputy public prosecutor Sharifah Natasha Syed Ahmad, while the accused was unrepresented.
© New Straits Times Press (M) Bhd"
New Straits Times,'Pity the voters': Azalina says lawmakers shouldn't quit seats before term ends,https://www.nst.com.my/news/nation/2026/05/1442434/pity-voters-azalina-says-lawmakers-shouldnt-quit-seats-term-ends,"Mon, 18 May 2026 17:39:11 +0800","KUALA LUMPUR: Members of parliament should not arbitrarily vacate their seats before their terms have ended, said Datuk Seri Azalina Othman Said.
The minister in the Prime Minister's Department (Law and Institutional Reform) said that while quitting is a democratic right, elected representatives bear a fundamental responsibility to their constituents to voice their concerns in the Dewan Rakyat.
""Pity the people, the voters in Pandan (constituency). Because to me, they expect their representatives to be there. At least the people can knock on the door if they are unsatisfied or need help.
""But maybe they have their own reasons. However, I hope that in BN (Barisan Nasional), anyone with similar intentions will fulfill their service to the people first,"" she said after launching the Asian International Arbitration Centre's (AIAC) Echoes of Justice: Bridging Pro‑Bono Access initiative.
She was responding to reports that former economy minister Datuk Seri Rafizi Ramli (Pandan MP) and former natural resources and environmental sustainability minister Nik Nazmi Nik Ahmad (Setiawangsa MP) had submitted their resignation letters to the Dewan Rakyat Speaker today.
Azalina said that as long as parliament has not been dissolved, lawmakers should complete their full five-year mandates.
""After that, if you want to contest or join another party, that's up to you.""
She added that the views of voters must be factored into such heavy political decisions.
""What is important is the people who vote. People like those in my Pengerang constituency want their elected representatives to finish their terms.
""But maybe as leaders, they have their own views. I don't want to comment further. But sometimes I'm afraid the people will get angry because they are tired of constantly going out to vote,"" she said.
Azalina also said that any potential legal or punitive action against elected representatives who quit their party depends entirely on the internal contracts they signed.
She added that BN candidates sign a different kind of contract when contesting under the coalition's banner.
""It's up to their respective parties what contract they have regarding taking action for quitting. Under BN, whoever contests under our banner has a contract, but our terms and conditions are different,"" she said.
Under the provisions of the Anti-Hopping Law, enacted via the Federal Constitution (Amendment) (No. 3) Act, MPs do not automatically lose their seats if they are expelled from their party, which historically prompted individual party contracts.
However, upon their resignation today, Rafizi and Nik Nazmi vacated their parliamentary seats.
The duo had announced yesterday that they were taking over leadership of Parti Bersama Malaysia, a minor political outfit originally founded in 2016 by Tan Gin Theam.
© New Straits Times Press (M) Bhd"
New Straits Times,EcoWorld shareholding shift sees entry of Syed Mokhtar as substantial Investor,https://www.nst.com.my/business/corporate/2026/05/1442429/ecoworld-shareholding-shift-sees-entry-syed-mokhtar-substantial,"Mon, 18 May 2026 17:38:02 +0800","KUALA LUMPUR: Eco World Development Group Bhd has announced a change in its substantial shareholder structure following the transfer of all of Datuk Leong Kok Wah's shares in Syabas Tropikal Sdn Bhd to Tan Sri Syed Mokhtar Albukhary.
Following the transaction, Leong ceased to be a substantial shareholder, while Syed Mokhtar emerged as a new substantial shareholder via indirect interest.
The restructuring involves the transfer of Leong's entire stake in Syabas Tropikal to Syed Mokhtar. Syabas Tropikal wholly owns Sinarmas Harta Sdn Bhd, which in turn holds 969.9 million EcoWorld shares, or about 30.1 percent of EcoWorld's issued share capital.
EcoWorld executive chairman Tan Sri Liew Kee Sin expressed appreciation to Leong for his long-standing support over the past 13 years, while welcoming Syed Mokhtar as the new substantial shareholder of EcoWorld.
""We look forward to working with him to take EcoWorld to greater heights in the years ahead,"" Liew said in a statement.
Syed Mokhtar is one of Malaysia's most prominent businessmen and philanthropists, with Forbes estimating his net worth at around US$3.5 billion in its latest listings. Widely regarded as a low-profile yet highly influential figure in the corporate sector, he has built a diversified business empire spanning infrastructure, ports, logistics, manufacturing, and automotive interests.
His corporate footprint is anchored through key listed entities such as MMC Corp Bhd and DRB-Hicom Bhd, which together form the backbone of his strategic holdings across Malaysia's industrial and transport ecosystem.
EcoWorld currently holds about 4770 hectares of landbank across the Klang Valley, Iskandar Malaysia, Penang, and Negeri Sembilan, and a total estimated gross development value of RM100 billion.
The company has five sizeable and diversified revenue pillars, namely Eco Townships, Eco Rise, Eco Hubs, Eco Business Parks, and QUANTUM, enabling it to serve all segments of the real estate market.
Through projects undertaken by EWI Capital Bhd (formerly Eco World International Bhd) from 2015 to 2025, the EcoWorld brand has also extended its reach to the United Kingdom and Australia.
© New Straits Times Press (M) Bhd"
New Straits Times,"Expired road tax: RTD nets Rolls-Royce, Bentley and more in KL operation",https://www.nst.com.my/news/nation/2026/05/1442427/expired-road-tax-rtd-nets-rolls-royce-bentley-and-more-kl-operation,"Mon, 18 May 2026 17:32:35 +0800","KUALA LUMPUR: The Road Transport Department (RTD) has impounded 41 luxury vehicles under ""Ops Luxury"" conducted in the Federal Territory from January to mid-May this year.
Kuala Lumpur RTD director Hamidi Adam said 11 vehicles remained in custody, while 30 cases had been resolved following enforcement action against owners.
He said among the main offences detected were expired road tax and failure to maintain valid insurance coverage.
""Ops Luxury is carried out continuously to identify luxury vehicle owners who fail to comply with road regulations despite owning high-value vehicles. Some vehicles had outstanding road tax amounting to RM10,000,"" he told reporters here today.
Hamidi said the vehicles seized included a Bentley Continental Flying Spur, Rolls-Royce Ghost, Aston Martin V8 Vantage, Porsche Cayman, Mercedes-Benz AMG, BMW, Audi, Land Rover Defender and Ford Mustang.
He said that checks also found some vehicles had road tax that expired as far back as 2018, while others had not renewed insurance coverage.
He added that enforcement action would continue without compromise against any vehicle owners who flout regulations.
© New Straits Times Press (M) Bhd"
New Straits Times,"Boat carrying migrants sinks off Selangor coast; 16 rescued, 3 missing",https://www.nst.com.my/news/regional/2026/05/1442425/boat-carrying-migrants-sinks-selangor-coast-16-rescued-3-missing,"Mon, 18 May 2026 17:32:04 +0800","SHAH ALAM: The Malaysian Maritime Enforcement Agency (MMEA) in Selangor has launched a search and rescue operation for three missing migrants after a ""pom-pom"" boat carrying 19 people reportedly sprang a leak and sank 2.1 nautical miles southwest of Sungai Apong in Sabak Bernam on Saturday.
Selangor MMEA director Captain Abdul Muhaimin Muhammad Salleh said the agency received an emergency call from a crew member at 4.45am.
""Our first asset, Penggalang Boat 41, which arrived at the scene, reported that the vessel had completely sunk at about 9am after efforts to stem the heavy water ingress failed.
""So far, 16 victims have been rescued while three remain missing, prompting the search area to be expanded to locate them as quickly as possible,"" he said in a statement today.
Abdul Muhaimin said the maritime vessel Bagan Datuk was also deployed to strengthen early intervention efforts within the emergency zone.
He said the rescued victims comprised 10 men, including two Bangladeshis and eight Indonesians, as well as six Indonesian women aged between 24 and 50.
""Initial investigations found that all the victims were first assisted by a local fishing vessel near the incident site before being transferred to enforcement assets that arrived later.
""We have also activated a Forward Search and Rescue Base at Jeti Kelong Paradise, which serves as the main command centre to coordinate logistics, strategy and personnel deployment,"" he said.
Entering its third day, Abdul Muhaimin said the search and rescue operation began at 7am today with joint involvement from the Marine Police Force and the Fire and Rescue Department, covering an area of 236 square nautical miles.
© New Straits Times Press (M) Bhd"
Malay Mail,GSF 2.0: Eight Malaysians detained by Israeli forces in Gaza-bound flotilla interception,https://www.malaymail.com/news/malaysia/2026/05/18/gsf-20-eight-malaysians-detained-by-israeli-forces-in-gaza-bound-flotilla-interception/220476,"Mon, 18 May 2026 19:51:53 +0800","SEPANG, May 18 — The Sumud Nusantara Command Centre (SNCC) has confirmed that eight Malaysians participating in the Global Sumud Flotilla (GSF) 2.0 mission were detained by the Israeli Forces as of 6pm Malaysian time today after the vessels they were travelling on were intercepted while en route to deliver humanitarian aid to Gaza.
Activist Zainal Rashid Ahmad was detained at 5pm while sailing aboard the vessel Amanda.
Muhamad Muhsin Zaidi, who was on board the Isobella, was intercepted at 5.20pm while three Malaysians travelling on the Ferluto — S. Patmanathan, Muhammad Amirul Afif Mohd Azhar and Dr Syakirin Muhamed Senin — were detained at 4.50pm.
Two others detained were Mohammad Syazly Mohammad Shees and Tengku Ahmad Taufik Tengku Noor Zahari after their vessel, Cactus, was intercepted at 4pm.
Activist Ahmad Musa Al-Nuwayri Kamaruzzaman, who was sailing on the Josef/Yusuf, was detained at 5.35pm.
SNCC director-general Datuk Dr Sani Araby Abdul Alim Araby said the flotilla was about 241 nautical miles from the Gaza coast when it was intercepted, within recognised international waters protected under the United Nations Convention on the Law of the Sea (UNCLOS).
“The IOF adopted provocative tactics by deploying several rigid inflatable boats (RIBs) towards the flotilla, while the presence of two warships and a prison ship was also detected near the flotilla’s operational area,” he told a press conference on the latest developments surrounding the GSF 2.0 mission here today.
Sani Araby said 11 flotilla vessels had been intercepted, approached and subjected to direct interference by Israeli forces, namely Cactus, Zio Faster, Holy Blue, Ferluto, Kyriakos, Amanda, Blue Toys, Barbaris, Isobella, Josef and Tenaz (Freedom Flotilla).
He said two other individuals detained involved Sumud Nusantara delegates Abdul Sattar Edhi Muhammad Saad from Pakistan, who was aboard the Zio Faster, and Indonesian national Andi Anga Prasadewa, who was travelling on the Josef.
Sani Araby said 41 flotilla vessels, including those carrying 21 Malaysians, were continuing their voyage to Gaza despite facing extremely high security risks due to ongoing threats of interception, harassment and aggressive action by Israeli forces.
“SNCC is closely monitoring the latest developments involving the flotilla operation and will continue to provide official updates from time to time regarding the safety status and movement of the flotilla.
“SNCC also calls on the international community, human rights organisations and the global maritime community to give serious attention to the intimidation and security threats faced by this civilian humanitarian mission in international waters,” he said. — Bernama"
Malay Mail,Zara Qairina inquest hears emotional mother-daughter audio recordings,https://www.malaymail.com/news/malaysia/2026/05/18/zara-qairina-inquest-hears-emotional-mother-daughter-audio-recordings/220475,"Mon, 18 May 2026 19:28:36 +0800","KOTA KINABALU, May 18 — The Coroner’s Court here today heard a glimpse of a daughter’s love and distress, as six of 42 audio recordings between the late Zara Qairina Mahathir and her mother, Noraidah Lamat, were played in court. Each recording lasted up to four minutes.
Among the moments played were Zara Qairina expressing her love and longing for her mother, as well as her frustration over losing money.
“Bye, sayang, cinta, rindumu. Muah. I love you,” Zara Qairina was heard saying, to which Noraidah tenderly replied, “I love you, Ra. Bye, Ra.”
Noraidah’s lawyer, Shahlan Jufri, explained that only a handful of recordings were selected for the court hearing, as playing all 42 would take nearly two hours.
Shahlan then directed a question to the 70th witness, assistant supt Mohamad Zaidi Abu Hassan, 44, a forensic analyst from the Royal Malaysia Police Computer Crime Investigation Unit.
He asked whether the conversation recordings had ever been extracted during the analysis of a piece of evidence marked as WK11.
Mohamad Zaidi said he only extracted recordings of conversations from WhatsApp, and the ones played in court could not be retrieved using the analysis software he employed.
“I only extracted these conversation recordings from WhatsApp. They could not be extracted through my analysis software,” he said before Coroner Amir Shah Amir Hassan.
The witness said he “did not find” the conversation recordings between Zara Qairina and her mother in the results of his analysis because it was limited to audio from WhatsApp and other social media platforms.
He confirmed that the audio recordings played in court were authentic.
However, he added that if a re-analysis were to be conducted, the process would take approximately three to four hours, in addition to going through the required report preparation procedures.
Zara Qairina, 13, died on July 17 at Queen Elizabeth Hospital, where she had been admitted a day earlier after being found unconscious near a drain at her school hostel in Papar at 4am.
The Attorney General’s Chambers ordered her remains exhumed for a post-mortem on August 8, before announcing a formal inquest into her death on August 13.
The inquest proceedings resume tomorrow. — Bernama"
