Source,Title,Link,Date,Article
New Straits Times,FMM urges tax relief as supply chain disruptions hit manufacturers [WATCH],https://www.nst.com.my/business/economy/2026/05/1450660/fmm-urges-tax-relief-supply-chain-disruptions-hit-manufacturers,"Fri, 29 May 2026 08:00:18 +0800","KUALA LUMPUR: The Federation of Malaysian Manufacturers (FMM) has called on the Finance Ministry to temporarily suspend import duties and sales taxes on critical raw materials, as manufacturers reroute sourcing away from disrupted Middle Eastern supply chains towards alternative markets including China, India and Asean countries.
FMM president Jacob Lee Chor Kok told Business Times that the industry body has also requested a double tax deduction on extraordinary logistics costs, saying these unplanned expenses are weighing heavily on manufacturers' working capital amid ongoing supply chain disruptions.
He added that FMM has urged the government to temporarily expand diesel subsidy quotas for industrial freight and domestic haulage operators, warning that worsening logistics bottlenecks could threaten manufacturing continuity in the second half of 2026.
Lee said transport bottlenecks have intensified as haulage operators exhaust subsidised diesel allocations earlier than expected, driven by longer port waiting times and rerouted supply chains linked to the prolonged Middle East conflict.
He warned that the conflict is emerging as a serious risk to industrial operations, with disruptions potentially shifting from a logistics issue into a broader structural threat involving production slowdowns and temporary shutdowns.
According to FMM's latest impact surveys, disruptions to global shipping corridors and energy markets have pushed raw material shortages to critical levels, particularly key inputs such as resins, polymers, industrial chemicals and metals.
""Already, 70 per cent of manufacturers have reported severely deteriorating supply conditions. This is compounded by soaring freight costs, domestic haulage bottlenecks arising from diesel quota exhaustion, and severe working capital strain affecting 68 per cent of firms,"" he said.
Lee said FMM has also found that nearly half of Malaysian manufacturers, or 48.2 per cent, have been forced to reduce output or suspend certain product lines.
""If targeted fiscal relief measures, tax exemptions on inputs and diesel subsidy expansions are not implemented swiftly, the current situation of reduced shift hours and deferred investments affecting 60 per cent of manufacturers could escalate into factory shutdowns and widespread retrenchments,"" he said.
Lee said downstream plastics fabricators, chemical manufacturers and industrial processors face the highest risk of prolonged shutdowns, citing a tightening of West Asian petrochemical feedstocks such as naphtha, benzene, liquefied petroleum gas and sulphur.
He added that electrical and electronics (E&E) manufacturers are also highly exposed due to depleted inventories and longer lead times for speciality chemicals used in surface treatments and industrial coatings.
""FMM also cautions that heat-intensive and high-diesel-intensity sectors such as ceramics, quarrying, glass manufacturing and heat-intensive food processing are on the brink of operational suspension.
""These energy-reliant industries are struggling to survive under a combination of high global oil prices and fuel pressures. Since margins are thin, companies are unable to absorb sustained production cost increases exceeding 10 per cent,"" he said.
Lee also said FMM's May 2026 impact survey shows manufacturing small and medium enterprises (SMEs) are bearing the brunt of the crisis due to narrower cost bases and limited financial buffers.
He said 68 per cent of smaller firms are under severe cash flow pressure, exacerbated by a double squeeze where suppliers demand advance payments while buyers delay payments due to extended shipping transit times.
""To manage day-to-day operations under these conditions, SMEs are aggressively sourcing alternative raw materials from regional neighbours such as China and Thailand, despite facing quality mismatches and lengthy client approval timelines,"" he said.
He added that firms are deferring long-term capital investments, tapering production volumes and introducing flexible or hybrid work structures to mitigate rising overheads and preserve working capital.
Factory Closures Reflect Rising 'High Demand, Low Supply Resilience' Risk in 2026
UniKL Business School economic analyst Associate Professor Dr Aimi Zulhazmi Abdul Rashid said temporary factory closures under current conditions reflect a ""high demand, low supply resilience"" risk that has become more pronounced in 2026.
He said even short shutdowns of three to seven days can lead to permanent export losses as global buyers quickly shift orders to competing manufacturing hubs such as Vietnam, Thailand and Indonesia.
""In many cases, contracts are not recovered for two to three years due to loss of supply confidence,"" he said.
He added that fixed operating costs continue even during shutdowns, with wages, rent, loans and maintenance still payable.
""A one-week closure can erode about 1.5 to two per cent of margins. Many E&E and furniture players are already operating on margins of around six to eight per cent,"" he said.
Aimi said disruptions at a single plant, particularly in Penang, can ripple through global supply chains, affecting downstream assembly lines in markets such as Germany as buyers shift to perceived more stable suppliers.
On external pressures, he said prolonged Middle East tensions and potential disruptions in the Strait of Hormuz would continue to push global energy costs higher.
Malaysia, while a net exporter of liquefied natural gas, remains a net importer of crude oil, diesel and refined fuels, resulting in a net negative impact from rising energy prices, he said.
He added that inflationary pressure is already filtering through the economy via fuel and transport costs, with Brent crude at about US$98 per barrel pushing RON97 to RM4.85 per litre and diesel to RM4.97 per litre in late May 2026.
""As diesel accounts for around 80 per cent of goods transport, every 10 sen increase adds about 0.15 to 0.2 per cent to CPI for food and household items,"" he said.
He added that higher freight insurance premiums for Gulf routes have also raised landed costs by two to four per cent.
If diesel remains above RM4.80 for more than two months, second-round effects such as wage adjustments and service price increases are likely, he said.
Aimi said logistics, airlines, food processing and construction sectors are among the most exposed.
He noted that airlines such as AirAsia X have flagged jet fuel cost increases of about RM90 million a month at current oil prices.
He added that SMEs in food and beverage and construction are likely to freeze hiring or reduce shifts amid margin pressure.
To improve resilience, Aimi suggested diversification of sourcing beyond China to include Thailand, Indonesia and Turkey, alongside forward buying of raw materials to hedge against oil price volatility.
He also recommended that exporters include price adjustment clauses tied to Brent crude movements above US$100 per barrel, a mechanism already used in some European contracts.
IPP Wealth Managers director of investment strategy and chief economist Mohd Sedek Jantan said the concerns raised by FMM are valid given the fragility of global supply chains and Malaysia's reliance on imported inputs and external demand.
He noted that Malaysia's manufacturing sales rose 5.3 per cent year-on-year to RM173.1 billion in March 2026, while employment growth expanded only 1.1 per cent, suggesting limited slack in the sector.
""Temporary shutdowns within the manufacturing sector could have a disproportionately larger impact on Malaysia's growth outlook because manufacturing remains one of the key pillars of the economy, particularly in exports, industrial production, employment and SME activity.
""The immediate impact would likely appear through slower industrial output, weaker export growth and softer private sector activity.
""However, the broader concern is the spillover effect across the domestic economic ecosystem,"" he said.
Sedek said policy support should shift towards long-term resilience, including supplier diversification, automation, digitalisation, and strengthening domestic vendor ecosystems.
He also called for improved logistics efficiency through faster customs clearance, better port operations and infrastructure upgrades.
""Beyond immediate support measures, Malaysia also needs to strengthen its medium-term competitiveness.
""In a more fragmented global environment, countries that can offer operational stability, reliable supply chains and resilient industrial ecosystems will likely attract a larger share of global trade and investment flows.
""Ultimately, the issue is no longer solely about managing short-term geopolitical shocks.
""It is increasingly about whether Malaysia can position its manufacturing sector to remain resilient, competitive and integrated within evolving global supply chains over the next decade,"" he said.
© New Straits Times Press (M) Bhd"
New Straits Times,Austrian jihadist jailed for 15 years for Taylor Swift concert attack plan,https://www.nst.com.my/world/world/2026/05/1450655/austrian-jihadist-jailed-15-years-taylor-swift-concert-attack-plan,"Fri, 29 May 2026 07:37:07 +0800","WIENER NEUSTADT, Austria: An Austrian court on Thursday sentenced a 21-year-old who admitted plotting a foiled jihadist attack on a Taylor Swift concert to 15 years in jail.
The US megastar was forced to cancel the three Vienna shows of her record-breaking ""Eras"" tour in the summer of 2024 after authorities warned of the plot by the so-called Islamic State group (IS).
Accused of planning the attack and forming an IS cell, the jury found Austrian national Beran A. guilty on all counts after deliberating for hours.
The judge then handed him a 15-year jail sentence.
While listening to the verdict, Beran A. looked into the court room repeatedly, sniffling loudly, his leg and hands shaking.
Beran A. went on trial last month on terror offences and other charges in Wiener Neustadt outside Vienna.
The defendant – who was arrested the day before the cancelled concert and has been detained since – pleaded guilty to all charges except being an accomplice to attempted murder.
BOMB-MAKING INSTRUCTIONS
Beran A. faced a maximum sentence of up to 20 years in prison.
Another 21-year-old, Arda K., who was on trial together with Beran A., was sentenced to 12 years in jail.
The sentences can still be appealed.
In their closing remarks, both defendants apologised.
""I just want to say that I'm sorry,"" Beran A. told the court.
In his testimony last month, Beran A. said he had become convinced that he ""had to wage jihad"" but was ""afraid to die.""
He told the court he picked the packed Ernst Happel Stadium in Vienna during Swift's concert as a target.
He detailed how he got instructions and tried but failed to make a bomb. He also sought advice on what weapons to choose in several chat groups and from a high-ranking IS member.
'SEND A CLEAR SIGNAL'
Beran A. and Arda K. were accused, together with a third Austrian, Hasan E., of forming a ""highly dangerous IS terror cell"" planning to carry out several attacks, mainly abroad, in the name of IS, prosecutors say.
Hasan E. is currently in prison in Saudi Arabia, accused of stabbing a security official in Mecca in 2024 and injuring four others.
Defence lawyer Mair used her closing argument to urge the jury to acquit Beran of the charge of encouraging Hasan over the stabbing, arguing there was no evidence.
""Beran is not a leader, he is not an ideological mastermind,"" she said.
The prosecution told the jury they had the ""chance to send a clear signal"" that those who commit crimes will be held accountable on all counts, adding Beran A. encouraged Hasan E. through ""intensive contact"" and other ways.
Beran A. is accused of having been a member of a terror organisation from 2023, according to prosecutors.
By sharing IS propaganda, he participated and ""openly aligned himself"" with IS, they said.
The Swift concert plot was thwarted with the help of US intelligence.
Swift later wrote on social media that ""the reason for the cancellations filled me with a new sense of fear, and a tremendous amount of guilt because so many had planned on coming to those shows.""
Last year, a Berlin court convicted a Syrian teenager of contributing to the plot to attack the Swift concert.
The 16-year-old was given an 18-month suspended sentence.
© New Straits Times Press (M) Bhd"
New Straits Times,Trump's face could appear on US$250 bill,https://www.nst.com.my/world/world/2026/05/1450650/trumps-face-could-appear-us250-bill,"Fri, 29 May 2026 07:15:49 +0800","WASHINGTON: President Donald Trump could soon appear on a new US$250 bill, in the Republican's latest move to shatter US traditions by putting his personal stamp on national institutions.
A proposal for the new bill, featuring a glaring Trump, was first reported Thursday by the Washington Post.
If carried out, it would be the first time the image of a living person -- let alone a president -- had appeared on US currency in a century and a half.
""Right now there is proposed legislation -- front of the House, in front of the Senate -- to change the first requirement so that a living person, Donald J. Trump, could be on a US$250 bill,"" US Treasury Secretary Scott Bessent told a media briefing Thursday.
""I don't think that there's anything untoward about having the President of the United States, the person who's president of the United States, on the 250th anniversary bill,"" Bessent said.
He said the Treasury Department has made advance preparations if legislation were passed, but ""will stick to the law.""
A design mock-up obtained by the Washington Post showed the words ""America 250 anniversary,"" a nod to the United States declaring its independence on July 4, 1776.
According to the Post, two Trump appointees at the Treasury Department last year began urging staff at the Bureau of Engraving and Printing to prepare prototypes.
Employees there, speaking on condition of anonymity, told the Post that the plan raised concerns because it would violate a federal law banning the depiction of living presidents on US money.
A Treasury spokeswoman told AFP that the Bureau of Engraving and Printing is ""conducting appropriate planning and due diligence"" in response to the proposal.
She added that US Treasurer Brandon Beach had not asked staff to print the note before congressional action occurred.
Printing bureau director Patricia Solimene had pushed back, warning officials including Beach of legal and procedural obstacles, the employees told the Post.
Solimene was abruptly reassigned from her role, the paper reported.
Such worries have not stopped the Trump administration from pressing ahead with its effort to slap his likeness or name on cultural institutions and other items -- sparking accusations of a cult of personality around the 79-year-old leader.
Earlier this year the US Commission of Fine Arts, whose members were appointed by Trump, unanimously approved the minting of a commemorative ""Semiquincentennial Gold Coin"" made of 24-carat gold.
In recent months both the John F. Kennedy Center for the Performing Arts and the US Institute of Peace have been rebranded to include Trump's name.
His likeness also stares down from banners draping the Department of Justice and Department of Agriculture -- and it will soon appear in some US passports, according to the State Department.
Legislation to allow Trump to appear on a US$250 bill was introduced in Congress last year but has sat idle.
Reaction among Democrats was critical, with Senator Mark Warner, a member of the Senate's banking committee, saying the unprecedented proposal amounted to the White House blatantly ""stoking the president's ego."" - AFP
© New Straits Times Press (M) Bhd"
New Straits Times,Test kits key to sniffing out fentanyl [WATCH],https://www.nst.com.my/news/nation/2026/05/1450645/test-kits-key-sniffing-out-fentanyl-watch,"Fri, 29 May 2026 07:00:40 +0800","KUALA LUMPUR: Test kits to detect fentanyl are crucial in efforts to combat the extremely potent drug  as   it is  colourless, odourless and easily trafficked due to the small amount needed for thousands of users, said   experts.
Asian Criminological Society board member Datuk Dr P. Sundramoorthy said     even a very small amount of fentanyl could suppress breathing and lead to death within minutes.
He said unlike traditional narcotics, fentanyl could be easily mixed into other drugs, pills or even vape liquids without the users' knowledge, significantly increasing the risk of   overdose.
Sundramoorthy said synthetic drugs such as fentanyl were highly profitable products for organised crime groups.
""Small quantities can produce thousands of doses, making trafficking easier, more discreet and more lucrative.
""Its synthetic nature further reduces reliance on traditional cultivation methods, enabling criminal groups to manufacture and distribute the drug more efficiently through clandestine networks.""
Fentanyl is an opioid made entirely in laboratories. According to the United States National Institues of Health, as little as 2mg  of fentanyl can be fatal. By comparison,  a lethal dose of cocaine is about 600 times more.
Sundramoorthy said fentanyl could cause extreme drowsiness, respiratory depression, loss of consciousness and  breathing failure.
This potency is why   fentanyl is often mixed into other substances, like vape liquids.
Sundramoorthy called for stricter regulation of vape liquids  that includes laboratory testing and stronger enforcement to prevent drug rings from using them as a medium of distribution.
He  also warned that  younger vape users might be particularly vulnerable to drug-laced liquids as they  might underestimate the danger of the product.
""Vape products are often perceived as less harmful, which reduces risk awareness.
""If fentanyl is introduced into such products, users may unknowingly consume highly dangerous substances with potentially fatal consequences.""
Toxicologist Professor Dr Mustafa Ali Mohd said fentanyl was currently among the most concerning synthetic opioids globally.
He said fentanyl was estimated to be about 50 to 100 times more potent than morphine.
""The difference between a dose causing euphoria and a dose causing fatal respiratory depression is very small.""
He said fentanyl   was   colourless, odourless and often tasteless in very small amounts, making contamination difficult to detect.
Mustafa warned that vape devices allowed rapid delivery of substances into the lungs and bloodstream, meaning users could experience sudden toxicity with little warning if fentanyl or other synthetic psychoactive substances were added into vape liquids.
He said this increased risks of overdose, seizures, respiratory failure and sudden death.
Earlier, National Anti-Drug Agency   director-general Datuk Ruslin Jusoh said specialised test kits would be rolled out next month to detect fentanyl and emerging synthetic substances amid growing concerns over drug-laced vape liquids.
He said authorities had, prior to this, not had the capacity to check for such drugs in vape liquids during raids.
© New Straits Times Press (M) Bhd"
New Straits Times,US Treasury chief threatens to sanction Oman if it joins Hormuz tolls,https://www.nst.com.my/world/world/2026/05/1450642/us-treasury-chief-threatens-sanction-oman-if-it-joins-hormuz-tolls,"Fri, 29 May 2026 06:53:32 +0800","WASHINGTON: US Treasury Secretary Scott Bessent on Thursday threatened to target ally Oman if it helped impose a tolling system in the key Strait of Hormuz, warning of sanctions against all parties involved in such actions.
""Oman, in particular, should know that the US Treasury will aggressively target any actors involved – directly or indirectly – in facilitating tolls for the Strait and any willing partners will be penalized,"" Bessent warned in a post on X.
He said the United States would ""not tolerate any effort to impose a tolling system in the Strait of Hormuz,"" a reference to Iranian proposals to do so as part of a potential agreement with Washington.
Bessent later told a White House press briefing that he spoke with the Omani ambassador earlier Thursday, and received assurances that ""there were no plans for tolling"" the critical waterway.
""I told him that this was a non-starter and he did not want to risk either the Oman individuals or Omani financial institutions getting sanctioned,"" Bessent said.
The strait, through which about a fifth of the world's energy supplies normally passes, has been a flashpoint since the United States and Israel launched the war on Iran in late February.
Teheran's retaliatory actions have engulfed the region in violence and seen Iran virtually block the strait, sending global energy and fertilizer prices soaring.
Oman had mediated talks between Washington and Teheran in Geneva before the war, and has itself come under attack from Iran.
On Wednesday, US President Donald Trump appeared to threaten Oman when asked about a possible short-term arrangement allowing it and Iran to control Hormuz, saying he would ""blow them up"" if Muscat did so.
The White House did not immediately respond when asked by AFP if Trump had misspoken and had intended to refer to Iran rather than its ally Oman.
Thursday's threat by Bessent came hours after the Treasury sanctioned Iran's ""Persian Gulf Strait Authority,"" Teheran's new agency that collects fees for transiting the strait.
Washington extended the threat of sanctions to anyone paying the fees, because they ""may be providing support to and receiving services from"" Iran's Revolutionary Guards, and therefore may ""be exposed to sanctions risk.""
On Thursday, the United States and Iran accused each other of violating an ongoing truce following an exchange of fire, the most serious salvos since they agreed to a ceasefire in April.
The two countries have been locked in weeks-long indirect talks through mediators to bring the conflict to an end, so far to no avail.
© New Straits Times Press (M) Bhd"
New Straits Times,"EU sanctions seven Israeli settlers, organisations",https://www.nst.com.my/world/world/2026/05/1450640/eu-sanctions-seven-israeli-settlers-organisations,"Fri, 29 May 2026 06:39:14 +0800","BRUSSELS, Belgium: The EU formally sanctioned seven Israeli settlers and organisations on Thursday over violence against Palestinians and settlement expansion in the Israeli-occupied West Bank.
On May 11, European Union foreign ministers agreed on the sanctions which had been stalled by Hungary's former prime minister Viktor Orban but his ouster paved the way for the veto to be lifted.
The sanctions consist of travel bans and asset freezes, and EU citizens and companies are also banned from making funds, financial assets or other economic resources available to those listed.
The sanctioned individuals included Daniella Weiss, a leading figure in the settler movement.
The EU also sanctioned 10 representatives of the Palestinian militant group Hamas, the European Council, representing the 27 member states, said.
The occupied West Bank has been gripped by almost daily violence involving Israeli troops and settlers since the start of the Gaza war in October 2023.
The EU has also come under pressure by Spain and Italy to sanction Israel's National Security Minister Itamar Ben Gvir, who posted a video showing detained activists from a Gaza-bound flotilla forced to their knees with hands bound.
© New Straits Times Press (M) Bhd"
