Source,Title,Link,Date,Article
Malay Mail,Malaysia to review diesel quota rates for commercial vehicles by August,https://www.malaymail.com/news/malaysia/2026/06/27/malaysia-to-review-diesel-quota-rates-for-commercial-vehicles-by-august/225462,"Sat, 27 Jun 2026 17:53:10 +0800","PUTRAJAYA, June 27 — The government will review the fixed quota rates of subsidised diesel for several types of land transport vehicles for goods under the Subsidised Diesel Control System (SKDS) to ensure that the subsidy distribution is more accurate and in line with actual operational needs.
Domestic Trade and Cost of Living Minister Datuk Armizan Mohd Ali said the decision was made following yesterday’s Cabinet Meeting which discussed the status of progress in implementing targeted fuel subsidy through the BUDI Diesel, BUDI95, Subsidised Diesel Control System (SKDS) and Subsidised Petrol Control System (SKPS) mechanisms.
“Prime Minister Datuk Seri Anwar Ibrahim has ordered improvements to be implemented in several aspects to ensure that the people’s feedback is met through strategies and approaches that take into account the people’s cost of living factors, leakage risk management and the country’s position and fiscal space,” he said in a press conference after a field session in conjunction with the implementation of the BUDI Diesel early access, here today.
Armizan said under the improvements, which are expected to be implemented by August, the adjustment of diesel quotas under SKDS will no longer be based solely on average consumption by vehicle type, but will also take into account several technical factors.
Among the factors that will be assessed are the weight with load (BDM), engine capacity, lorry category, fuel consumption levels and the operating pattern of each vehicle.
“There are vehicles of the same type of transport but different BDMs, so if previously there was a uniform fixed quota for the type of transport, which was the same, whereas in terms of usage we know that transport vehicles with larger BDMs in terms of weight, size and also the size of the load, then the fuel consumption would definitely be more.
“So yesterday the Cabinet decided to make an adjustment to the fixed quota not only by looking at the average previous usage, we have the previous usage record, but also by looking at other technical factors so that the quota is more in line with the operating costs of companies involved in the transportation of consumer goods,” he said.
He said the Ministry of Domestic Trade and Cost of Living (KPDN), the Ministry of Transport (MOT) and the Ministry of Finance (MOF) had been instructed to take immediate follow-up action to implement the Cabinet’s policy decisions by identifying appropriate channeling mechanisms including the need for modifications and integration into the existing implementation system.
“God willing, KPDN, MOT and MOF will work closely so that the policy decisions made by the Cabinet yesterday are implemented immediately so that more people would benefit from the targeted fuel subsidy agenda,” he said.
In addition, Armizan said the Cabinet also agreed to expand the distribution of diesel subsidies to small traders who have diesel vehicles such as jeeps and pickups registered in the name of a business or company under the class or code of private business use.
He said previously, the eligibility conditions for diesel subsidies were limited to vehicles registered in the name of individuals for BUDI Diesel and business vehicles or goods transport companies under the class or code of use for consumer goods transport for SKDS.
“Yesterday the Cabinet decided to expand this policy because it saw that these were small businesses that we needed to support,” he said.
Meanwhile, Armizan said owners of private diesel vehicles such as jeeps and pickups who were eligible under BUDI Diesel and wanted to apply for an additional 100-litre quota, bringing the total quota to 300 litres compared to the basic quota of 200 litres, could apply online or fill out a physical form.
“There are still those who think that the quota for BUDI diesel is only 200 litres, which is actually not correct, the basic quota is 200 litres for all those who have diesel vehicles registered in the name of individuals, but those who have diesel vehicles such as jeeps and pickups can apply for an additional 100 litres, so it is actually 300 litres.
“Actually, the way to apply is easy, it is on the official BUDI MADANI portal at www.budimadani.gov.my. Anyone who wants to apply physically, can go to the nearest Inland Revenue Board (LHDN) office, there will be an LHDN officer there who will assist,” he said, adding that LHDN offices in Sabah and Sarawak will be open tomorrow for the purpose of applying for additional BUDI Diesel quotas.
Commenting on the results of a field trip session at a petrol station here following the implementation of the early access BUDI Diesel for private diesel vehicles in Peninsular Malaysia, Armizan said he was satisfied with the level of readiness of the stations involved.
During the early access period, eligible consumers can buy subsidised diesel at RM2.15 per litre through MyKad verification at participating petrol stations.
“The survey covered the level of implementation preparation at the retail level of petrol stations including the stability of the transaction system, the verification process using MyKad and the oil company’s digital application, training for staff as well as aspects of customer-friendly services to ensure the smooth operation of the mechanism once it comes into effect,” he said.
He said that as a result of close collaboration between the government and the industry, 10 oil companies, namely PETRONAS, Shell, Petron, Caltex, BHPetrol, Five, Smart Stream, Xcel, PETROS and IPTB, had confirmed their respective readiness for the implementation of BUDI Diesel.
A total of 4,146 petrol stations nationwide were ready for the full implementation of BUDI Diesel as one of the fuel subsidy targeting mechanisms.
Through BUDI Diesel, eligible Malaysians will enjoy subsidised diesel at RM2.10 per litre at petrol stations either through MyKad verification or the company’s digital application. — Bernama"
Malay Mail,"Australian woman assaulted in George Town cemetery, ex‑hotel guard jailed 12 years, caning",https://www.malaymail.com/news/malaysia/2026/06/27/australian-woman-assaulted-in-george-town-cemetery-exhotel-guard-jailed-12-years-caning/225460,"Sat, 27 Jun 2026 17:20:09 +0800","GEORGE TOWN, June 27 — A former hotel security guard was sentenced to 12 years’ imprisonment and 12 strokes of the cane by the Sessions Court here after admitting to raping and committing unnatural sex on an Australian woman last year.
The court handed down concurrent sentences after the accused changed his plea to guilty earlier this week,
Free Malaysia Today
(FMT) reported.
Judge Juraidah Abbas ordered both sentences to run concurrently from the date of arrest.
Deputy public prosecutor Anuarul Hakim Abdul Muen represented the state, while defence counsel was Arvind Santhanam.
The accused was initially brought before the court on July 4 last year. He entered a not guilty plea later that month but reversed his position and admitted the charges on June 24 this year.
According to FMT, case records show that at about 3am, the man approached the victim and her British companion outside a bar in Love Lane, claiming he could drive them to hospital after the companion complained of feeling unwell. He then forced the companion out of the vehicle, took the woman to a cemetery near Mount Erskine and assaulted her, threatening her with a pair of scissors between 5.20am and 6am.
The victim was discovered by a couple passing the area, who assisted her in lodging a police report. The accused was detained later the same day, with closed circuit television footage and forensic findings linking him to the offences."
Malay Mail,Dr Zaliha says former PKR members’ election bid under Bersama will not affect Pakatan campaign,https://www.malaymail.com/news/malaysia/2026/06/27/dr-zaliha-says-former-pkr-members-election-bid-under-bersama-will-not-affect-pakatan-campaign/225459,"Sat, 27 Jun 2026 17:06:50 +0800","JOHOR BAHRU, June 27 — The presence of several former PKR members contesting under the Parti Bersama Malaysia (Bersama) ticket in the Johor state election (PRN) will not affect grassroots support for Pakatan Harapan (PH) candidates, says Johor PKR chairman Datuk Seri Dr Zaliha Mustafa.
She said PKR members remained united in facing challenges from all parties contesting the 56 Johor state seats.
“That is their choice to leave PKR and contest under the Bersama ticket. However, based on what we have seen so far, especially during this morning’s nomination process, support from party members and the local community in every constituency has been very encouraging.
“At the same time, we are strengthening our campaign by deploying senior party leaders to every constituency we are contesting, while also implementing the ‘adopted state’ approach to assist campaign efforts in each state seat,” she told a press conference at the Johor PKR Operations Centre here today.
Among the former Johor PKR members contesting under the Bersama ticket are Stanley Tan in the Stulang state seat, who previously served at the service centre of Johor Bahru Member of Parliament Akmal Nasrullah Mohd Nasir, and Dr Zamil Najwah, PKR’s candidate for the Larkin state seat in the 2022 Johor election.
Dr Zaliha said PH’s campaign would also focus on helping voters understand global issues, particularly those involving oil supply, energy prices and the crisis in West Asia.
“We have seen attempts to attack PKR, PH and the government led by Prime Minister Datuk Seri Anwar Ibrahim over issues relating to oil and energy supply. Therefore, we will intensify our engagement with the people by providing explanations and helping them understand that these are global issues.
“The people need a comprehensive explanation that these issues are not the result of weaknesses in the Prime Minister’s administration. On the contrary, Datuk Seri Anwar Ibrahim has worked tirelessly, including making visits to Russia and Turkmenistan, to ensure stable supplies in the market,” she said.
Asked who would be PH’s Menteri Besar candidate should the coalition win the Johor election, Dr Zaliha said the matter would be finalised by the coalition’s top leadership involving PKR, Amanah and DAP.
The 56-seat Johor State Legislative Assembly was dissolved on June 1, with the Election Commission (EC) fixing July 7 for early voting and July 11 as polling day.
According to the EC, the election involves 2,727,926 registered voters, comprising 2,703,175 ordinary voters, 12,041 military personnel and their spouses, as well as 12,710 police personnel and their spouses.
For the latest updates on the 16th Johor state election, visit https://prn.bernama.com/johor/. —Bernama"
Malay Mail,Pakatan ditches ‘idealistic’ hundred-page manifestos for ‘realistic’ Johor vows; keeping MB choice under wraps,https://www.malaymail.com/news/malaysia/2026/06/27/pakatan-ditches-idealistic-hundred-page-manifestos-for-realistic-johor-vows-keeping-mb-choice-under-wraps/225453,"Sat, 27 Jun 2026 16:15:02 +0800","KULAI, June 28 — Pakatan Harapan (PH) will unveil its Johor election manifesto in the coming days with what it says will be a more practical and realistic set of promises, while keeping the identity of its menteri besar candidate close to its chest for now.
PH secretary-general Datuk Seri Saifuddin Nasution Ismail said the coalition’s manifesto has been finalised and is awaiting final endorsement by its top leadership at a meeting on June 29 before being launched,
Harian Metro
reported this afternoon.
“In the past, Datuk Seri Amirudin Shari and I were too idealistic when preparing manifestos. They ran into hundreds of pages and covered all sorts of things. But over time we became much more realistic. A manifesto should be something realistic that people can understand and relate to,” he was quoted as saying in a press conference here.
Saifuddin Nasution said this time the coalition wanted to present a manifesto that was “realistic, tangible and reasonable”, with a simpler presentation that would not dilute its policy offerings.
He said the manifesto would focus on economic stability and prosperity, public welfare, political stability, good governance, increasing state revenue and ensuring the benefits of growth are shared more fairly with Johoreans.
He also said PH would continue championing what it described as performance-based politics over identity politics, arguing that voters were better served by solutions than divisive rhetoric.
He said Johor also stood to benefit from having a state administration that worked in tandem with the federal government to accelerate development and deliver more effectively on public policies.
On the question of PH's menteri besar candidate should the coalition win the Johor state election, Saifuddin Nasution said an announcement would only be made when the time was right.
He said PH's immediate priority was to campaign for its candidates and present its manifesto to voters across the state.
Saifuddin Nasution, who is also PKR's joint election director, said all 56 PH candidates successfully submitted their nomination papers yesterday, describing it as a positive start to the coalition's campaign.
Speculation over PH's choice for Johor menteri besar has continued throughout the election campaign, with former education minister Datuk Maszlee Malik widely tipped as a possible candidate if the coalition forms the next state government.
Maszlee was today nominated as PH’s Puteri Wangsa candidate."
Malay Mail,Orang Asli party ASLI makes election debut with Endau seat bid in Johor polls,https://www.malaymail.com/news/malaysia/2026/06/27/orang-asli-party-asli-makes-election-debut-with-endau-seat-bid-in-johor-polls/225451,"Sat, 27 Jun 2026 16:07:15 +0800","JOHOR BAHRU, June 27 — Parti Orang Asli Malaysia (Asli) has made its first election appearance by fielding a candidate for the Endau state seat in the 16th Johor state election.
Its candidate, Jati Awang, was confirmed eligible after the nomination process concluded today, marking the party’s maiden participation in a democratic contest.
The Endau seat, with 28,767 registered voters, will see a four-cornered fight involving Jati, Barisan Nasional (BN) candidate Alwiyah Talib, Pakatan Harapan (PH) candidate Saiful Nizam Samat and Perikatan Nasional (PN) candidate Hasnul Hakimi Hussien.
Jati, 52, an Orang Asli from Endau, said ASLI’s participation aims to elevate the voice of the community, particularly in state leadership.
“We want the Orang Asli community to have its own representative who can more effectively voice its issues and needs,” he said after the nomination process at Endau Multipurpose Hall, Mersing.
ASLI’s debut also marks its first official election entry after its earlier plan to contest the 2024 Kuala Kubu Baharu by-election did not materialise when it withdrew before nomination day due to technical issues.
The Election Commission has set July 7 for early voting and July 11 for polling day.
For the latest updates on the 16th Johor state election, visit https://prn.bernama.com/johor/. — Bernama"
Malay Mail,"Anwar urges Pakatan candidates to win Johor voters’ trust, prove civil politics can prevail",https://www.malaymail.com/news/malaysia/2026/06/27/anwar-urges-pakatan-candidates-to-win-johor-voters-trust-prove-civil-politics-can-prevail/225449,"Sat, 27 Jun 2026 16:00:18 +0800","JOHOR BAHRU, June 27 — Pakatan Harapan (PH) chairman Datuk Seri Anwar Ibrahim today wished all PH candidates contesting the 16th Johor state election a successful campaign.
In a Facebook post, Anwar urged the candidates to engage with the people, not merely to seek votes, but to carry out the trust placed in them wholeheartedly.
The prime minister also stressed the importance of working hard, reaching out to people from all walks of life, and proving that civil politics will always prevail over politics of hatred.
“Insya-Allah, if we are sincere in championing the welfare of the people of Johor, they will make the right choice for the future of their beloved state,” he said.
Anwar, who is also PKR president, also quoted verse 159 of Surah Ali ‘Imran, which calls on Muslims to place their trust in Allah after making every effort.
Nomination for the 16th Johor state election concluded today, with 172 candidates confirmed to contest the 56 seats.
PH and Barisan Nasional (BN) are fielding 56 candidates each, followed by Perikatan Nasional (PN) with 33, Parti Bersama Malaysia with 15, the Malaysian United Democratic Alliance (Muda) with four, Parti Orang Asli Malaysia (Asli) and Parti Sosialis Malaysia (PSM) with one candidate each, while six candidates are contesting as Independents.
Polling will be held on July 11, with early voting on July 7.
For the latest updates on the 16th Johor state election, visit https://prn.bernama.com/johor/. — Bernama"
Malay Mail,"Anwar to join Johor election campaign with Pakatan grand finale two days before polling, says Saifuddin Nasution",https://www.malaymail.com/news/malaysia/2026/06/27/anwar-to-join-johor-election-campaign-with-pakatan-grand-finale-two-days-before-polling-says-saifuddin-nasution/225448,"Sat, 27 Jun 2026 15:54:59 +0800","KULAI, June 27 — Prime Minister Datuk Seri Anwar Ibrahim is expected to hit the campaign trail in Johor, with a grand finale Pakatan Harapan (PH) programme scheduled for July 9, just two days before Johoreans head to the polls.
PH secretary-general Datuk Seri Saifuddin Nasution Ismail confirmed the news, saying the Prime Minister will be lending his weight to the PH campaign.
“Yes, the PM will be coming down,” he said after a walkabout with PH candidates contesting seven state seats.
The candidates were Arthur Chiong Sen Sern (Bukit Batu), Mohd Syafwan Ani (Bukit Permai), Wong Bor Yang (Senai), Yeo Tung Siong (Pekan Nanas), Haniff @ Ghazali Hosman (Pulai Sebatang), Guna Balakrishnan (Layang-Layang) and Nor Hafiz Roslan (Machap).
“It depends on how happy he is with our performance. If he’s satisfied with me, Amir (PKR vice-president), and the machinery, he might not come often. But if he’s here frequently, that means we have problems,” Saifuddin joked when pressed on how often Anwar would show up.
The PH grand finale on July 9 will also see all component party presidents in attendance, Saifuddin revealed.
“We’ll announce more details later. All the presidents will be there,” he said, adding that the Prime Minister’s schedule would be confirmed closer to the date.
“For now, our focus is on the campaign,” he said. — Bernama"
Malay Mail,Anwar says Bandar Malaysia Malay Reserve Land move requires political courage to protect Bumiputera interests,https://www.malaymail.com/news/malaysia/2026/06/27/anwar-says-bandar-malaysia-malay-reserve-land-move-requires-political-courage-to-protect-bumiputera-interests/225447,"Sat, 27 Jun 2026 15:51:29 +0800","PUTRAJAYA, June 27 — Prime Minister Datuk Seri Anwar Ibrahim said the decision to gazette 50 acres (20.23 hectares) of land in Bandar Malaysia as Malay Reserve Land is a significant step to safeguard Bumiputera interests, requiring both political courage and careful consensus-building.
He said the 480-acre Bandar Malaysia site was taken back by the government after the project failed due to alleged abuses under the previous administration, and is now being managed by Khazanah Nasional Bhd and Petroliam Nasional Bhd.
“The 50 acres is equivalent to 5,000 acres in Kedah in terms of value. It is not small in value, and I know this will be controversial if not handled properly.
“I emphasise that this is a decision to defend Bumiputera interests, which is very important and critical to me. It takes a lot of political courage and wisdom in engaging with all sectors,” he said at the opening of the National Convention of the Syariah Legal Profession 2026 here today.
The Prime Minister stressed that the decision does not involve taking land from any community, as the area is already government-owned.
Anwar said the government has briefed leaders from various communities on the rationale behind the move to prevent misunderstandings and ensure smooth implementation.
On June 27 last year, the Finance Ministry said further studies were being conducted on the development strategy for the 50-acre Malay reserve land within Bandar Malaysia to ensure alignment with the government’s aspiration of turning the development into an international business hub.
The ministry said several key principles are being considered, including clustered settlement areas near relevant facilities such as mosques, integrated development aligned with inclusivity under Malaysia MADANI, and potential cultural tourism attractions showcasing Malay heritage.
The project, located at the former Kuala Lumpur Air Base in Sungai Besi, is expected to have a gross development value of RM140 billion. — Bernama"
Malay Mail,"‘Competing in the daytime but friends at night’, Mat Sabu says Pakatan‑BN clash confined to Johor polls",https://www.malaymail.com/news/malaysia/2026/06/27/competing-in-the-daytime-but-friends-at-night-mat-sabu-says-pakatanbn-clash-confined-to-johor-polls/225445,"Sat, 27 Jun 2026 15:52:40 +0800","JOHOR BAHRU, June 27 — The contest between Pakatan Harapan (PH) and Barisan Nasional (BN) in the Johor state election does not in any way disrupt the administration of the federal unity government, said Agriculture and Food Security Minister Datuk Seri Mohamad Sabu.
He said that since the dissolution of the Johor State Legislative Assembly, relations and duties, particularly those involving Cabinet ministers from both parties, have continued smoothly.
The Amanah president said that although both sides have their own strategies and calculations at the state level to win the election, this does not affect stability at the federal level.
“Yes, it does not disrupt. For example, in Cabinet meetings, everything runs smoothly. Our interactions are also fine. If there are good matters, we support each other; we also advise one another. Everything is fine.
“Here (in Johor) we are contesting (against BN), but at the federal level, no. That is Malaysian politics at the moment – it is a bit unusual. We hope after the election we can find the best way forward because now we are competing in the daytime but friends at night,” he told reporters here today.
Mohamad Sabu was met after accompanying the PH candidate for the Permas seat, Sharon Teo, to the nomination centre for the Johor state election at Dewan Muafakat, Taman Mawar here.
Teo is in a four-cornered fight against Perikatan Nasional candidate T. Vela, Dr Zamil Najwah of Parti Bersama Malaysia (Bersama) and the incumbent Baharudin Mohamed Taib (BN).
Commenting on a statement by Amanah Pasir Gudang calling for a boycott of Teo’s candidacy and campaign in Permas, Mohamad Sabu said the party’s campaign machinery to secure victory for their candidate is proceeding as normal.
“No problem. It’s normal that in any party, when a decision is made, there will be some individuals who disagree. There is no boycott. In fact, today I am happy to see many supporters marching together to send our candidate to the nomination centre,” he said.
The Johor State Legislative Assembly, which has 56 seats, was dissolved on June 1, with the Election Commission (EC) setting July 7 for early voting and July 11 as polling day.
According to EC statistics, the election involves 2,727,926 registered voters, comprising 2,703,175 ordinary voters, 12,041 military personnel and spouses, and 12,710 police personnel and spouses.
For the latest updates on the 16th Johor state election, visit https://prn.bernama.com/johor/ — Bernama"
