Source,Title,Link,Date,Article
Malay Mail,Banting school stabbing: Student stable after hospital treatment,https://www.malaymail.com/news/malaysia/2026/07/06/banting-school-stabbing-student-stable-after-hospital-treatment/226604,"Mon, 06 Jul 2026 18:17:43 +0800","SHAH ALAM, July 6 — A student injured in a stabbing incident at a secondary school in Banting, Kuala Langat, is in stable condition after receiving emergency treatment at Hospital Banting, the Selangor Health Department said today.
In a statement, the department said the student arrived at the hospital’s Emergency Department at 10.13am and was immediately attended to by the medical team.
“The victim was given emergency treatment without delay. The patient’s condition is currently stable and he or she remains under close observation while undergoing further assessment to ensure appropriate follow-up treatment,” the statement said.
The department said the case is being investigated by the Royal Malaysia Police (PDRM) and urged the public to refrain from speculating or sharing unverified information, advising them instead to rely on official channels for accurate updates.
Hospital Banting said it remains committed to providing the best possible care to the patient but would not disclose further details on the victim’s condition out of respect for patient confidentiality and the family’s privacy.
“The hospital will continue to provide its full cooperation to the authorities throughout the investigation,” the statement added.
Earlier today, the Selangor Education Department confirmed that the suspect is in police custody and said counselling teachers had been mobilised to provide psychosocial support and intervention for students, teachers and staff affected by the incident.
The department also said its immediate priority was ensuring the injured student received the best possible care while supporting the victim’s family.
Kuala Langat police have confirmed the stabbing incident, while investigations into the case are ongoing. Authorities have repeatedly appealed to the public not to circulate unverified information that could interfere with the investigation."
Malay Mail,"Storm alert for Selangor, KL, Johor, other states until 9PM",https://www.malaymail.com/news/malaysia/2026/07/06/storm-alert-for-selangor-kl-johor-other-states-until-9pm/226602,"Mon, 06 Jul 2026 18:09:00 +0800","KUALA LUMPUR, July 6 — Thunderstorms, heavy rain and strong winds are expected to hit eight states and Kuala Lumpur until 9 pm tonight.
According to a warning issued by the Malaysian Meteorological Department (MetMalaysia) this evening, the states affected are Perak (Hulu Perak, Kuala Kangsar, Kinta, Kampar, Batang Padang and Mualim) and Kelantan (Jeli and Kuala Krai).
Similar conditions are also expected to hit Pahang (Cameron Highlands, Raub, Bentong and Rompin), Selangor (Sabak Bernam, Kuala Selangor, Hulu Selangor, Klang, Gombak, Petaling and Hulu Langat), Negeri Sembilan (Seremban and Jelebu) and Johor (Segamat, Kluang, Mersing, Kulai, Kota Tinggi and Johor Bahru).
In Sarawak, the affected areas are Sri Aman, Sibu (Sibu and Selangau), Kapit (Song), Bintulu (Tatau), Miri (Miri and Marudi) and Limbang.
In Sabah, the bad weather is expected to affect the Interior (Tenom, Beaufort and Tambunan), West Coast (Ranau), Tawau, Sandakan (Telupid, Kinabatangan, Beluran and Sandakan) and Kudat (Kota Marudu). — Bernama"
Malay Mail,Three arrested for robbing migrant worker while posing as police in Manjung,https://www.malaymail.com/news/malaysia/2026/07/06/three-arrested-for-robbing-migrant-worker-while-posing-as-police-in-manjung/226601,"Mon, 06 Jul 2026 17:58:57 +0800","IPOH, July 6 — Police have busted a robbery syndicate that impersonated policemen with the arrest of three local men within hours of their alleged robbery of a Bangladeshi man in Manjung last Thursday.
Perak Police Chief Datuk Mohd Alwi Zainal Abidin said the 45-year-old victim lodged a police report at 8.06 pm, claiming he had been robbed by two local men who identified themselves as policemen in an incident at Pantai Remis at about 4.30 pm the same day.
He said the victim was forced into a Nissan X-Trail sport utility vehicle (SUV) while being handcuffed before the suspects seized his bag and fled with RM8,000 in cash.
“The suspects had threatened to take the victim to the Pantai Remis Police Station for further inspection. However, the victim became suspicious that he was being robbed when the suspects did not head towards the police station but instead drove in another direction,” he told a press conference here, today.
He said the victim then grabbed the steering wheel, causing the vehicle to veer onto the road shoulder at Batu 12, Segari, near Lumut, before the two suspects fled with the victim’s cash after stopping a passing motorcyclist to escape from the scene.
Mohd Alwi said acting on information, a team from the Criminal Investigation Division of the Manjung District Police Headquarters along with policemen from Pantai Remis and Segari police stations, arrested three local men along Jalan Besar Gunung Tunggal in Changkat Keruing at about 8.30 pm on the same day.
He said police also seized a Nissan X-Trail, several mobile phones, ATM cards, cash, handcuffs, an auxiliary police authority card and various other items believed to be linked to the case.
“Checks revealed that all three suspects have previous criminal records involving robbery, theft, vehicle theft, causing hurt, criminal intimidation and drug-related offences. Preliminary investigations also found that two of the suspects admitted to their involvement in the robbery,” he said.
According to him, the three suspects have been remanded for seven days from July 3 to 9 to facilitate investigations under Section 395 of the Penal Code for gang robbery and Section 170 of the Penal Code for impersonating a public servant.
He said police have not ruled out the possibility that the syndicate was involved in several other robbery cases using the same modus operandi in other districts in Perak.
Members of the public with information on the case are urged to contact investigating officer Insp Munawarrah Ahmad at 011-16240391 or the Manjung District Police Headquarters Operations Room at 05-6899222 to assist investigations. — Bernama"
Malay Mail,Woman fined RM500 after admitting using criminal force against Perak Sultan during state-level National Day event,https://www.malaymail.com/news/malaysia/2026/07/06/woman-fined-rm500-after-admitting-using-criminal-force-against-perak-sultan-during-state-level-national-day-event/226594,"Mon, 06 Jul 2026 17:20:32 +0800","KUALA LUMPUR, July 6 — A woman who admitted using criminal force against the Sultan of Perak during last year’s state-level National Day celebrations was fined RM500 by the Magistrates’ Court in Ipoh today.
According to
Sinar Harian
, Magistrate Norizan Riduan imposed the fine after Nurhaswani Afni Mohamad Zorki, 42, pleaded guilty to the charge.
The court also ordered her to serve one month’s imprisonment if she fails to pay the fine.
Nurhaswani, a single mother of five, was charged with using criminal force against Sultan Nazrin Muizzuddin Shah at about 8.20am on August 31, 2025, in front of the Ipoh City Council building on Jalan Panglima Bukit Gantang Wahab in the Kinta district.
She was charged under Section 352 of the Penal Code, which carries a maximum sentence of three months’ imprisonment, a fine of up to RM1,000, or both upon conviction.
The case was first brought before the same court on September 8, 2025, but no plea was recorded after the court ordered Nurhaswani to undergo a month-long psychiatric assessment and observation at Hospital Bahagia Ulu Kinta in Tanjung Rambutan under Section 342 of the Criminal Procedure Code.
Deputy public prosecutor Nasrul Hadi Abdul Ghani urged the court to impose a sentence reflecting the seriousness of the offence, noting that the incident took place on National Day and involved the state’s reigning monarch.
He said the punishment should serve as a reminder to the public not to commit similar acts.
In mitigation, defence counsel Datuk Naran Singh, who represented Nurhaswani on a pro bono basis, conveyed his client’s apology to the Sultan of Perak for her actions and appealed for a lenient sentence.
He said she had previously worked as a restaurant waitress earning about RM1,700 a month, but is now unemployed and supported by her children after her divorce.
“This is the accused’s first offence and she also suffers from schizophrenia, for which she has previously received treatment,” he said.
Naran Singh also urged the court to consider the 55 days she had already spent in custody, including periods of remand, investigation, detention and hospital observation.
The court subsequently imposed a RM500 fine and ordered that her bail be refunded.
Court documents stated that Nurhaswani, dressed in black, climbed onto the stage during the National Day celebration before suddenly running towards Sultan Nazrin and grabbing him, causing the Ruler to nearly lose his balance.
Security personnel immediately restrained her before a police report was lodged.
Nurhaswani was subsequently diagnosed with schizophrenia at Hospital Bahagia Ulu Kinta. However, a psychiatric assessment concluded that she was fit to stand trial and capable of entering a plea."
Malay Mail,"Sentul swoop uncovers World Cup betting hub doubling as unlicensed entertainment outlet, 33 foreigners detained",https://www.malaymail.com/news/malaysia/2026/07/06/sentul-swoop-uncovers-world-cup-betting-hub-doubling-as-unlicensed-entertainment-outlet-33-foreigners-detained/226587,"Mon, 06 Jul 2026 17:22:34 +0800","KUALA LUMPUR, July 6 — Police raided a premises in Taman Wahyu, Sentul, yesterday, believed to be used as a 2026 World Cup football betting call centre as well as an unlicensed entertainment outlet, detaining 34 individuals, including 33 foreigners.
Kuala Lumpur police chief Datuk Fadil Marsus said the raid was conducted at 3.30am by the Gambling, Vice and Secret Societies Division (D7) of the Sentul district police headquarters' Criminal Investigation Department, following surveillance and intelligence gathering.
He said those detained, aged between 20 and 40, comprised 28 Chinese nationals, three men from Myanmar, one man from South Korea, one woman from Thailand and one local woman.
“Initial investigations found the premises were used to manage, organise, and promote online gambling involving 2026 World Cup football betting, besides operating as an unlicensed entertainment outlet.
“The premises is believed to have been operating since mid-June, daily from 5pm to 3am,” he said in a statement today.
Fadil said police also seized 15 mobile phones, two laptops, RM60 in cash and musical equipment believed to have been used at the premises.
The case is being investigated under Section 4(1)(c) and Section 6(3) of the Betting Act 1953, Section 4(1) of the Entertainment (Federal Territory of Kuala Lumpur) Act 1992, and Section 6(1) of the Immigration Act 1959/63. — Bernama"
Malay Mail,"PMO proposed every Jana Wibawa contractor, Tengku Zafrul tells ex-PM Muhyiddin’s trial",https://www.malaymail.com/news/malaysia/2026/07/06/pmo-proposed-every-jana-wibawa-contractor-tengku-zafrul-tells-ex-pm-muhyiddins-trial/226584,"Mon, 06 Jul 2026 17:00:18 +0800","KUALA LUMPUR, July 6 — All of the Malaysian government’s projects under the Muhyiddin administration’s Jana Wibawa programme were awarded to contractors that had been proposed directly by the Prime Minister’s Office (PMO), former finance minister Datuk Seri Tengku Zafrul Tengku Abdul Aziz said today.
Tengku Zafrul said this while testifying as the 11th prosecution witness in former prime minister Tan Sri Muhyiddin Yassin’s power abuse and money laundering trial in connection to the Jana Wibawa project.
Tengku Zafrul served as the finance minister from March 2020 to August 2021 when Muhyiddin was the prime minister, and said his ministry’s role was only to screen and appoint these firms if they met the required conditions.
“Throughout the Jana Wibawa programme, all contractor companies that were awarded projects are companies that had been proposed by the Prime Minister’s Office only.
“The Finance Ministry’s role is only as the implementer in terms of evaluation and also to finalise the appointment of companies after passing the conditions and rules in force,” he told the High Court here.
Following Muhyiddin’s instruction in 2020 to the Finance Ministry to find solutions to help Bumiputera contractors during the Covid-19 crisis, Tengku Zafrul said the Finance Ministry had proposed the Jana Wibawa programme as an economic stimulus for Bumiputera contractors and the construction sector.
Under the Jana Wibawa programme, Tengku Zafrul said there were two types of methods where government projects were given out subject to the Finance Ministry’s approval: direct negotiation (a government contract is given to one company without an open tender and without competing on price with other contractors); and pre-qualified tender (pre-screened companies with the required experience, financial and technical capabilities are allowed to join in the tender).
Tengku Zafrul said the prime minister actually has no powers to decide if a Jana Wibawa project will be carried out through direct negotiation or pre-qualified tenders, and that it is instead the finance minister who has the power to approve the method used.
Tengku Zafrul as finance minister had in a July 23, 2020 letter proposed to Muhyiddin for the Jana Wibawa programme to be expedited, with the latter as PM in an August 3, 2020 minute stating he agreed with the programme and instructing for it to be expedited.
“If the prime minister did not agree with this proposal letter, the Jana Wibawa programme would certainly not be carried out,” he said today in court.
Former prime minister Tan Sri Muhyiddin Yassin arrives at the Kuala Lumpur High Court Complex on July 6, 2026. — Picture by Yusof Isa
Muhyiddin suggested 54 contractors for 54 Jana Wibawa projects
On November 13, 2020, Tengku Zafrul had presented to the Cabinet about government procurement matters including the Jana Wibawa programme, and that the Cabinet’s discussions in the Muhyiddin-chaired meeting were only on Jana Wibawa as a policy and did not include the programme’s procurement methods.
On the same day as the Cabinet meeting, Muhyiddin had issued a letter to Tengku Zafrul to propose the appointment of 54 contractors for 54 projects under Jana Wibawa through direct negotiation.
Muhyiddin’s letter also included a list of the proposed projects and project value for the proposed contractors.
This letter was personally signed by Muhyiddin and had instructed the Finance Ministry to immediately consider his proposal, Tengku Zafrul said.
“I don’t know from where did Tan Sri Muhyiddin Yassin obtain the names of the 54 companies listed in this letter. I also don’t know how these 54 companies’ names could be listed in this letter,” Tengku Zafrul said, adding that these names did not come from him or the Finance Ministry.
Tengku Zafrul said he did not know if these companies had an interest in Muhyiddin as the latter never told him about it: “Tan Sri Muhyiddin also never told me that he and the Parti Pribumi Bersatu Malaysia would receive donations from the companies listed in this letter.”
Tengku Zafrul said he had never received any donations or financial rewards from these 54 companies and do not know if these companies had ever donated to any political parties.
Tengku Zafrul said these 54 companies never met him or sent in application letters for the projects listed in Muhyiddin’s letter.
He confirmed that one of the 54 companies is KCJ Engineering Sdn Bhd, with the proposal listing this company for a RM100 million project to build a new road connecting Felda Bukit Jalor to Gemas, Negeri Sembilan.
Based on documents in court, KCJ Engineering had failed the Finance Ministry’s initial evaluation for the project, but had passed a second evaluation after the Prime Minister’s Office provided additional information on the company through a February 3, 2021 letter.
KCJ Engineering then received Tengku Zafrul’s approval on July 6, 2021 and was awarded the 34-month project through direct negotiation at RM62 million.
Previously, the court in this trial had heard that KCJ Engineering had given money to Muhyiddin’s party Bersatu via cheques.
Tengku Zafrul today said Muhyiddin had never informed him or the Cabinet that Bersatu had received donations from KCJ Engineering.
Two other projects to Sutracom and Nepturis
Tengku Zafrul said the Prime Minister’s Office had in a March 17, 2021 letter attached six companies’ application for a project to build and upgrade the Pulau Indah highway in Klang, Selangor, with Muhyddin signing a written minute there on March 16, 2021 saying “Agree with the pre-qualified method”.
He said this project was never advertised and the pre-qualified tender process meant only a few companies competed on price, and did not know how these companies found out about the project which they had applied directly to Muhyiddin.
Tengku Zafrul said he did not know these companies’ owners, and that they had never met him or applied through letters to him for the project.
He also said that he does not know if these companies had ever donated to any political parties.
Sutracom was eventually approved for this 36-month project and would receive RM605.2 million if it completes the project according to the contract, he said.
Similarly, Nepturis Sdn Bhd was eventually approved by the Finance Ministry for a RM141 million project to be completed in 191 weeks to build the Klang Utara district police headquarters in Selangor under Jana Wibawa.
The PMO’s February 3, 2021 letter to Tengku Zafrul came together with attached applications from five companies (including Nepturis) for the project, and Muhyiddin had in a written note said he agreed for it to be via pre-qualified tender.
Those five companies had written directly to Muhyiddin, with Tengku Zafrul saying he did not know why they had addressed it directly to the prime minister and the companies can actually also apply to the Finance Ministry or himself.
Tengku Zafrul said he did not know how these companies knew about the project’s existence.
Tengku Zafrul said Muhyiddin had never told him that Bersatu received donations from the companies in this letter, and also said he did not know if these companies had ever given donations to any political parties.
Based on previous court testimonies by bank employees and banking documents in this trial, four cheques from KCJ Engineering totalling RM800,000 were deposited into Bersatu’s CIMB account on October 12, 2022, while a RM1 million cheque from Nepturis was deposited into Bersatu’s AmBank account on February 21, 2022.
In this trial, Muhyiddin is facing seven charges, namely four counts of alleged power abuse to obtain RM225.3m bribes for Bersatu (from Nepturis, Azman Yusoff, Bukhary Equity Sdn Bhd, and Mamfor Sdn Bhd) and three counts of alleged money laundering through money that Bersatu received from Bukhary Equity.
The trial before High Court judge Noor Ruwena Md Nurdin resumes tomorrow, with Tengku Zafrul expected to continue testifying.
Recommended reading:
Tengku Zafrul tells Jana Wibawa trial he bears no malice against Muhyiddin"
Malay Mail,Sitiawan raids reveal 208 live bullets and weapons cache as police move on trafficking suspect,https://www.malaymail.com/news/malaysia/2026/07/06/sitiawan-raids-reveal-208-live-bullets-and-weapons-cache-as-police-move-on-trafficking-suspect/226582,"Mon, 06 Jul 2026 16:50:20 +0800","IPOH, July 6 — Police seized 208 live rounds of ammunition and several objects resembling firearms, besides arresting a local man in two raids linked to drug trafficking activities in Sitiawan, near Manjung, last Wednesday.
Perak police chief Datuk Mohd Alwi Zainal Abidin said the operation conducted by the Perak Narcotics Criminal Investigation Department (NCID) also resulted in the seizure of drugs believed to be Methylenedioxymethamphetamine (MDMA) and ketamine, with a total estimated value of RM6,547.
“The first raid was carried out in the Taman Terus Maju area in Sitiawan, where police stopped a Proton Wira driven by the 29-year-old suspect.
“An inspection of the vehicle uncovered three red plastic packets containing substances believed to be MDMA, weighing 66.64 grammes,” he told a press conference at the Perak Police Headquarters here today.
He said said following the arrest, police raided a house in Jalan Kampung Cina, Sitiawan, where they found 12 transparent plastic packets containing substances believed to be ketamine, weighing 64.30 grammes.
Mohd Alwi said further inspection of a wooden shed behind the house led to the discovery of an object resembling a pistol, seven rifle-like barrels, two crossbow-like barrels, 208 live rounds of ammunition and eight spent cartridge casings.
“Initial investigations also found that the suspect is believed to have been actively involved in drug trafficking for about four months, selling the drugs directly to users. The drugs seized were estimated to be sufficient to supply about 100 addicts,” he said.
He said the suspect was found to have no criminal record, while preliminary urine screening showed he was tested positive for ketamine.
According to him, police also seized RM720 in cash under the Dangerous Drugs (Forfeiture of Property) Act 1988, bringing the total value of the seizures and confiscations to RM7,267.
“The suspect was remanded for six days from July 2 until today to facilitate investigations. The case is being investigated under Section 39B of the Dangerous Drugs Act 1952 and Section 8A of the Firearms Act 1960,” he added. — Bernama"
Malay Mail,High Court sets Oct 12 showdown as MCMC takes Papagomo to task over censorship talk,https://www.malaymail.com/news/malaysia/2026/07/06/high-court-sets-oct-12-showdown-as-mcmc-takes-papagomo-to-task-over-censorship-talk/226581,"Mon, 06 Jul 2026 16:41:45 +0800","KUALA LUMPUR, July 6 — The High Court today fixed October 12 to hear an inter partes interim injunction application by the Malaysian Communications and Multimedia Commission (MCMC) against blogger Wan Muhammad Azri Wan Deris, better known as Papagomo, in a defamation suit.
Judicial Commissioner Datuk Dr Arik Sanusi Yeop Johari set the date during case management, which was also attended by defence counsel Muhammad Rafique Rashid Ali.
“The parties are to file the affidavit in reply by July 20, the affidavit in response by August 3, written submissions by August 24 and reply submissions by September 7. The court also extends the ad interim injunction,” the judge said.
On June 19, the court granted an ex parte interim injunction sought by the MCMC, restraining Wan Muhammad Azri from publishing allegedly defamatory statements against the commission and ordering him to immediately cease publishing and disseminating harmful online content through social media.
The order also prohibits Wan Muhammad Azri from using any social media platform, whether through existing or new accounts, to publish or distribute false, misleading or harmful content.
Earlier, MCMC counsel Nurshafiqa Balqish Jaffri informed the court that Wan Muhammad Azri had entered an appearance in the suit.
“Today was fixed for the inter partes hearing. However, the defendant has entered an appearance, and both parties have agreed that the inter partes hearing will proceed after the exchange of affidavits. I also seek an extension of the ad interim injunction until the disposal of this application,” she said.
Muhammad Rafique confirmed the arrangement.
On May 27, the MCMC filed the suit, alleging that Wan Muhammad Azri had posted defamatory statements on social media claiming the commission had censored court reports relating to Communications Minister Datuk Fahmi Fadzil’s case against him.
In its statement of claim, the MCMC said it had never been involved in any form of censorship regarding reports on the Kuala Lumpur High Court proceedings involving Fahmi and the defendant.
The commission maintained that the defendant’s allegations were false, baseless and had undermined public confidence in the regulator. — Bernama"
