Source,Title,Link,Date,Article
New Straits Times,Mideast war revs up electric car demand in Asia,https://www.nst.com.my/news-cars-bikes-trucks/2026/04/1417452/mideast-war-revs-electric-car-demand-asia,"Tue, 14 Apr 2026 13:19:48 +0800","HANOI: Electric vehicle sales have jumped in Southeast Asia as cost-conscious buyers have poured into dealerships looking to dodge the fuel price spikes driven by the Middle East war.
Asian nations have been particularly hard hit due to a sharp fall in the crude shipments they rely on -- and have few alternatives to replace them.
Yet the energy crisis has been a windfall for Vietnam's leading electric vehicle maker Vinfast as well as Chinese manufacturers.
Vietnamese office worker Do Thi Lan explained the simple math of the cars' appeal at a Vinfast showroom in Hanoi.
""We have to calculate our monthly expenses, as the money we spend on petroleum has been on the rise,"" she said.
She said her family owns a car that runs on petrol but was considering buying an electric vehicle to save money.
Dao Thi Hue, also at the showroom, was looking to go electric too.
""Driving an EV is so much better than driving a petroleum vehicle, in terms of costs and also in terms of saving fuel, queuing to fill up,"" the school teacher said.
Crude oil prices have soared by around 50 per cent since the start of the Middle East war and again exceeded US$100 per barrel on Monday, driving up the cost at the pump.
Vinfast, listed on the Nasdaq, saw a 127 per cent surge in annual sales in Vietnam in March, reaching 27,600 cars.
About 40 per cent of cars sold in Vietnam in 2025 were electric, but the trend has been accelerating.
""At this point in time, clients consider fuel costs a lot when making a decision on which cars to buy,"" said Pham Minh Hai, deputy head of sales at a Vinfast showroom.
""In March we sold 300-400 cars,"" he said, noting that the showroom normally sells between 200 and 250 cars a month.
Hai said more than 50 per cent of his clients changed from petroleum to electric cars last month, while the number of customers at the showroom was up by around 30 per cent.
He added that opening hours had been extended to deal with the rush.
Outside Vietnam, Chinese manufacturers specialising in electric vehicles, particularly Tesla's main rival BYD, are booming.
- 'Punished by gas prices' -
At the Bangkok Auto Show earlier this month, BYD secured the most orders of any manufacturer, surpassing Japan's Toyota for the first time.
""I drive a lot, nearly 100 kilometres (60 miles) a day... with the current fuel situation and no idea how long it will last, it's become a major factor pushing me to make the switch,"" said Pleng Nawintham, a 36-year-old pharmacist from Thailand.
BYD was also seeing increased sales in the Philippines.
Mae Anne Clarisse Bacquiano, manager of a BYD showroom in the suburbs of Manila, said foot traffic at the dealership was ""at another level"".
""It was all because of the rise in fuel prices,"" she said. ""Earlier today, I had a customer, a doctor who was ranting to me about how he is being punished by gas prices... He was in a hurry to go full electric. There'd be a huge difference in expenses.""
She added that all of her stock for the month had already been reserved by buyers.
""I don't expect the gas (prices) to go back down over the next couple of months,"" said Arlone Abello, an entrepreneur who was browsing BYD models at the showroom.
As BYD sales decline in China due to fierce local competition, the manufacturer hopes to gain international momentum.
The company told analysts that it now expects to exceed 1.5 million exported vehicles in 2026, well above the 1.3 million target announced in January.
- Structural change -
Exports of Chinese electric vehicles -- for which Southeast Asia is a major market -- doubled in March, compared to the same month last year across all manufacturers, according to the industry association CPCA.
Economic factors are at the forefront of the increased demand for greener vehicles.
""You have the individual consumer response to what they are seeing in terms of the price of petrol or diesel suddenly surge,"" said Euan Graham, an electricity and data analyst at energy think tank Ember.
The installation of charging stations in the region is also growing rapidly.
Jakarta promised last week to take ""more serious steps to accelerate the development of a national electric vehicle ecosystem"" to combat its ""high level of energy consumption"".
Electric vehicles are gaining momentum beyond Southeast Asia.
""There are signs that global demand has already picked up substantially,"" Capital Economics said, adding that registrations of electric vehicles in Japan, South Korea, and New Zealand more than doubled in March, and rose by over 50 per cent in India, Australia.
© New Straits Times Press (M) Bhd"
New Straits Times,"'10pct return in 30 minutes' lure leaves man RM427,000 poorer",https://www.nst.com.my/news/regional/2026/04/1417450/10pct-return-30-minutes-lure-leaves-man-rm427000-poorer,"Tue, 14 Apr 2026 13:19:25 +0800","KUANTAN: A salesman's decision to sell a piece of land in pursuit of higher returns ended in a devastating loss when he was tricked out of RM427,000 in a dubious investment scheme.
The 44-year-old private sector employee was lured by promises of 10 per cent returns within 30 minutes of investment through the scheme.
Pahang police chief Datuk Seri Yahaya Othman said the victim was contacted by an unknown individual via WhatsApp on Dec 17 last year, inviting him to invest in a ""Growth Investment"" scheme.
""The victim was attracted to the scheme, which promised a 10 per cent return within 30 minutes.
""He was then added to a WhatsApp group chat and instructed to download an investment application before registering as a member.
""The man made 11 transactions totalling RM427,000 into two separate bank accounts between Feb 10 and April 3.
""He believed the scheme was genuine after receiving RM23,000 in profits, but there have been no updates since then,"" he said in a statement today.
He said the victim lodged a police report at the Kuantan district police headquarters yesterday after realising that he had been cheated.
""The victim claimed he used his personal savings and proceeds from the sale of a piece of land to invest in the scheme,"" he said.
Yahaya reminded the public to verify bank account numbers via https://semakmule.rmp.gov.my/
before making any transactions.
© New Straits Times Press (M) Bhd"
New Straits Times,No medications were administered to Zara on the way to hospital,https://www.nst.com.my/news/nation/2026/04/1417448/no-medications-were-administered-zara-way-hospital,"Tue, 14 Apr 2026 13:18:42 +0800","KOTA KINABALU: No medications, including the anti-epileptic drug, phenytoin, were given to the late Zara Qairina Mahathir before she arrived at the Queen Elizabeth Hospital (QEH), the coroner's court was told.
Medical assistant Mohd Faiszal Md Saimi from Kinarut Health Clinic, testified that no drugs were administered during the initial emergency treatment until his team handed Zara Qairina over to personnel at QEH.
""The priority in early emergency treatment for unconscious trauma patients, suspected of having head injuries, is the management of the airway, control of bleeding and circulation, instead of administering medications.
""Administering medication may worsen the victim's condition, such as causing a drop in blood pressure or increased bleeding,"" Mohd Faiszal, the 69th witness, told coroner Amir Shah Amir Hassan.
On July 16 at about 3.23am, Faiszal responded to an emergency call and arrived at 3.45am at Zara Qairina's school dormitory at SMKA Tun Datu Mustapha.
Replying to a question from coordinating officer Sofia Samayan, the 40-year-old said his role as a medical assistant prevented him from prescribing and administering drugs.
Mohd Faiszal said drugs he could prescribe include paracetamol, aspirin, glyceryl trinitrate, oral rehydration salts, and infusion fluids such as 0.9 per cent normal saline.
He also denied administering phenytoin, which is an anti-epileptic drug. The witness said Zara Qairina was unresponsive and did not display any signs of having a seizure.
Questioned further by lawyer Shahlan Jufri about phenytoin, Mohd Faiszal said the drug similar to diazepam, is a controlled medicine that can only be prescribed by medical officers.
""Phenytoin, according to the guidelines, is kept at health clinics.
""But for seizure cases, the first choice is diazepam. Phenytoin is the last-line drug for uncontrolled seizure cases, such as when the patient remains in a state of seizure for over five minutes or has repetitive seizures despite being given diazepam.""
The witness said the public could also buy phenytoin in tablet or capsule form from pharmacies with a prescription from medical officers or specialists.
Shahlan is representing Zara Qairina's mother in the inquest.
The
post-mortem toxicology report
for Zara Qairina indicated that traces of phenytoin were found in her kidney.
In previous proceedings, neither the QEH Emergency and Trauma Department medical officer nor the neurosurgeon who attended to Zara Qairina testified to administering phenytoin
during their respective shifts.
Zara Qairina, 13, was found unconscious on the ground floor of her hostel before being pronounced dead the following day, on July 17, 2025, at the hospital.
The inquest will resume on Thursday.
© New Straits Times Press (M) Bhd"
New Straits Times,PKR slams Trump's retort to Pope's plea for peace,https://www.nst.com.my/news/nation/2026/04/1417444/pkr-slams-trumps-retort-popes-plea-peace,"Tue, 14 Apr 2026 13:16:36 +0800","KUALA LUMPUR: PKR's International Affairs Bureau has expressed its solidarity with Pope Leo XIV, commending his principled stand against rising military tensions involving the United States and Iran.
The bureau's chairman, Dr Maszlee Malik, praised the Pope's call for restraint and the sanctity of human life amid the beating of the drums of war.
""Keadilan views with contempt the retort issued by US President Donald Trump against the leader of the Catholic Church.
""For a political leader to dismiss the Holy Father as 'weak on crime' and 'terrible for foreign policy' simply for advocating dialogue is the height of diplomatic indecency,"" Maszlee said in a statement today.
He added that Trump's demand for the Church to confine its views to his political agenda was an assault on religious freedom and moral independence.
The bureau has consistently condemned the militarism of the US administration, describing it as a violation of international law and the UN Charter.
Maszlee noted that the administration's penchant for unilateral strikes and the use of religious imagery to depict the president as a Christ-like figure exposed a ""delusion of omnipotence"".
He said the Pope had rightly reminded the global community that religion should not be used to justify war, stating that his refusal to be intimidated by the US administration embodied moral courage.
""We echo the sentiments of global leaders and Catholic communities who see President Trump's reaction as an insult not only to 1.3 billion Catholics but to all people of conscience who value peace,"" he said.
Keadilan also called on the international community to support the Vatican's plea for immediate de-escalation and a return to multilateral diplomacy.
© New Straits Times Press (M) Bhd"
New Straits Times,MCBA logs 231 enforcement cases involving RM36.2mil in goods,https://www.nst.com.my/news/nation/2026/04/1417442/mcba-logs-231-enforcement-cases-involving-rm362mil-goods,"Tue, 14 Apr 2026 13:13:16 +0800","PORT KLANG: The Malaysian Border Control and Protection Agency (MCBA) has taken enforcement action on 231 containers between January and March this year, involving goods valued at RM36.2 million.
Port Klang MCBA commander Datuk Nik Ezanee Mohd Faisal said the cases stemmed from investigations conducted by multiple agencies, including Maqis, the Health Ministry and the Customs Department.
""Overall, enforcement actions taken by MCBA from January to March involved 231 containers, with a total value of RM36,243,214.11,"" he said at a press conference today.
MORE TO COME
© New Straits Times Press (M) Bhd"
New Straits Times,"Over 400,000 ANPR transactions recorded since January, says Nanta",https://www.nst.com.my/news/nation/2026/04/1417439/over-400000-anpr-transactions-recorded-january-says-nanta,"Tue, 14 Apr 2026 13:01:49 +0800","KUALA LUMPUR: More than 400,000 transactions have been recorded through the Automated Number Plate Recognition (ANPR) system since its pilot rollout in January.
Works Minister Datuk Seri Alexander Nanta Linggi said the figure reflects growing public acceptance of the system, which is part of the government's broader push towards a seamless toll collection mechanism.
""So far, we have recorded over 400,000 transactions since January 2026. This is a positive indicator that the platform is gaining traction,"" he said at a press conference after attending the Works Ministry's monthly assembly.
The pilot project covers the Hutan Kampung–Sungai Dua stretch, involving nine toll plazas, namely, Hutan Kampung, Alor Star Utara, Alor Star Selatan, Pendang, Gurun, Sungai Petani Utara, Sungai Petani Selatan, Bertam and Sungai Dua.
Nanta said the ANPR system is currently operational at nine toll plazas nationwide, covering 78 lanes.
He added that about 28,000 users have registered on the JomGo platform, which was developed by Plus Malaysia Bhd in collaboration with other highway concessionaires.
""The number of users and transactions shows that the system is functioning well and can be further expanded,"" he said.
Nanta added that there have been no major technical issues reported since the system's introduction.
""From the feedback received, operations have been smooth, and the system is performing as expected,"" he said.
The ANPR system allows toll payments to be made automatically by detecting vehicle number plates, eliminating the need for physical payment methods.
It forms part of Malaysia's transition towards the Multi-Lane Free Flow (MLFF) system, which is targeted for full implementation by 2027.
Nanta said the government would continue to monitor the system's performance and leave further expansion plans to the concessionaires involved.
""We will allow the operators to carry out their plans in line with the overall target of implementing MLFF by 2027,"" he said.
During the pilot phase, physical barriers will remain in place, and users are advised to maintain speeds of 20 to 25km/h when passing through toll plazas.
© New Straits Times Press (M) Bhd"
New Straits Times,MCBA seizes RM1 million worth of frozen meat over falsified documents,https://www.nst.com.my/news/nation/2026/04/1417436/mcba-seizes-rm1-million-worth-frozen-meat-over-falsified-documents,"Tue, 14 Apr 2026 13:00:01 +0800","PORT KLANG: The Malaysian Border Control and Protection Agency (MCBA) has seized seven containers of frozen meat worth more than RM1 million following the discovery of suspected falsified import documents.
Port Klang MCBA commander Datuk Nik Ezanee Mohd Faisal said the seizure at North Port on April 9 was based on a public tip-off.
The operation involved six containers of frozen chicken and one container of frozen duck, weighing a total of 187,800kg.
""The total estimated value of the seized goods is RM1,062,048. Initial checks found discrepancies in the documentation submitted, including invoices and packing lists that did not match the Notice of Arrival,"" he said at a press conference today.
MORE TO COME
© New Straits Times Press (M) Bhd"
New Straits Times,First batch of 15 e-waste containers shipped out of Malaysia,https://www.nst.com.my/news/nation/2026/04/1417430/first-batch-15-e-waste-containers-shipped-out-malaysia,"Tue, 14 Apr 2026 12:52:20 +0800","PORT KLANG: Malaysian authorities have shipped out the first batch of 15 containers of illegal electronic waste (e-waste), marking a key milestone in ongoing enforcement efforts at Port Klang.
Port Klang Malaysian Border Control and Protection Agency (MCBA) commander Datuk Nik Ezanee Mohd Faisal said the containers were transported via Westports at 8am today as part of coordinated operations under Op Green Shield.
""Alhamdulillah, today 15 e-waste containers have been shipped out.
""This is the result of close coordination between the Joint Task Force comprising MCBA, Customs Department, the Department of Environment, SIRIM and the Port Klang Authority,"" he told reporters here today.
The operation was carried out under Op Green Shield, which was established on Jan 27 this year to strengthen monitoring, inspections and enforcement actions, as well as to streamline the re-export of illegal e-waste to its country of origin in accordance with existing laws and international conventions.
Nik Ezanee said the milestone comes amid a broader enforcement effort, where 254 containers confirmed to contain e-waste have been detained following inspections conducted under multiple phases of the operation.
He added that, to date, a total of 803 containers have been subjected to enforcement action for removal from the country, reflecting the scale of the ongoing crackdown.
""This is a milestone for us. It shows that when all agencies work together with a shared objective, we can move forward effectively in addressing illegal e-waste imports,"" he said.
However, he cautioned that the more challenging phase lies ahead, particularly in sustaining coordination and clearing the remaining backlog of containers.
""The main challenge is yet to come. Maintaining this level of cooperation and momentum will be crucial in ensuring all remaining containers are successfully repatriated,"" he said.
Nik Ezanee also expressed appreciation to shipping liners for facilitating the process, noting that their cooperation was key to ensuring smooth repatriation.
Under Op Green Shield, authorities have intensified inspections of containers suspected of carrying prohibited electronic waste, in line with the absolute ban on e-waste imports enforced through the Customs (Prohibition of Imports) Order.
The operation forms part of ongoing efforts to ensure Malaysia does not become a dumping ground for illegal e-waste, while strengthening enforcement at entry points to safeguard environmental sustainability and national sovereignty.
To date, MCBA has seized over 6,200 tonnes of e-waste detected through Op Green Shield at ports here.
In one of its most recent operations on April 8, MCBA Port Klang seized more than 210 tonnes of electronic and scheduled waste.
The operation, led by Port Klang MCBA deputy commander Wan Fazli Wan Hamat, involved 18 officers from the participating agencies.
Preliminary investigations found nine containers carrying electronic waste (SW110) weighing 184,627kg, while one container contained scheduled waste (SW103) weighing 26,200kg.
The total weight of seized waste amounted to 210,827kg.
Five containers containing plastic and metal scrap were handed to SIRIM for further action.
Authorities also uncovered false declarations submitted by two companies on K1 forms, leading to enforcement action and referral to Customs for follow-up.
© New Straits Times Press (M) Bhd"
New Straits Times,Mida Singapore sees growing investment into Johor,https://www.nst.com.my/business/economy/2026/04/1417428/mida-singapore-sees-growing-investment-johor,"Tue, 14 Apr 2026 12:49:48 +0800","SINGAPORE: Johor continues to see a good traction of investment coming from Singapore, providing a seamless journey for investors looking to expand their businesses in the southern state, said the Malaysian Investment Development Authority (Mida).
MIDA Singapore director Vinothan Tulisinathzan said that among the major industries attracting investment from Singapore are the digital economy, semiconductor, and food and beverages (F&B) businesses.
He noted that investment opportunities in the digital economy within Johor fell into two main sections -- digital technology providers and digital infrastructure providers.
""In the digital technology provider (section), you have blockchains, artificial intelligence (AI), things like that, but you can see more traction in the digital infrastructure provider, which is the data centre players.
""Johor has an amazing traction in attracting data centres, and we are being more selective in data centres to be more AI, energy efficient and so forth,"" he said.
He was speaking during a roundtable discussion entitled ""How Johor and Singapore are reshaping cross-border investment"" organised by Singapore Press Club and the Johor Economic, Tourism and Cultural Office Singapore (Jetco) on Monday.
According to Vinothan, Mida also saw rising interest from Singaporean semiconductor players entering Johor, both from the back-end and front-end firms.
""Most importantly, we can see a good traction of the Singapore-based companies that are involved in the supply chain, and they could be the tier one or tier two,"" he added.
Additionally, the agency witnessed growing interest among F&B operators in expanding their operations to Johor Bahru amid the rising cost of doing business.
""We have a company that has headquarters in Singapore, but it sets up a central kitchen in Johor, and it has a halal operation, which gives the company a competitive edge to export its products in the region and even in the Middle East,"" he said.
Also present at the event were Malaysian High Commissioner to Singapore Datuk Azfar Mohamad Mustafar and Jetco executive chairman Datuk Seri Hasni Mohammad.
© New Straits Times Press (M) Bhd"
New Straits Times,"Medicine supply stable until June, public told to avoid stockpiling",https://www.nst.com.my/news/nation/2026/04/1417425/medicine-supply-stable-until-june-public-told-avoid-stockpiling,"Tue, 14 Apr 2026 12:47:49 +0800","KUALA LUMPUR: The supply of medicine in the country is expected to remain stable at least until the end of June, with the public advised against panic buying or stockpiling.
Health Ministry Pharmacy Practice and Development Division senior principal assistant director Muhammad Md Zin said stocks at government healthcare facilities are continuously monitored to ensure uninterrupted supply.
He cautioned that excessive stockpiling was impractical as medicines have expiry dates and require specific storage conditions.
""Keeping excessive supplies increases the risk of using damaged or expired medicines, which can be harmful. It is best to manage medication wisely, avoid bulk purchases and seek advice from healthcare professionals,"" he said.
Muhammad was speaking on the Apa Khabar Malaysia programme on Bernama TV today, where he discussed the impact of the global energy crisis on domestic medicine supplies.
He advised patients with chronic conditions, such as hypertension and diabetes mellitus, not to alter or ration their prescribed medication without professional guidance.
""There is no concept of saving money by reducing dosage. Continue taking medication as prescribed. Any adjustments must be made in consultation with medical experts to avoid health risks,"" he stressed.
Muhammad further warned against purchasing medicines indiscriminately, especially through online platforms, without verifying their authenticity and registration with the Health Ministry.
He said consumers can check the legitimacy of medicines through the National Pharmaceutical Regulatory Agency website or by consulting healthcare professionals.
""Buying medicines without a prescription also carries the risk of incorrect dosage, which can be dangerous,"" he added.
© New Straits Times Press (M) Bhd"
New Straits Times,#NSTviral: Netizens back public lesson as illegally parked car in Kajang gets 'rubbish treatment',https://www.nst.com.my/news/nst-viral/2026/04/1417423/nstviral-netizens-back-public-lesson-illegally-parked-car-kajang,"Tue, 14 Apr 2026 12:47:44 +0800","KAJANG: A Facebook post showing a car obstructing a shop lot road in Sepakat Indah 2 has gone viral, with many netizens expressing support with the person who left rubbish on the vehicle.
The post features images of a grey Proton Saga parked in the middle of a narrow access road, with multiple garbage bags placed on its roof and around the vehicle.
The obstruction appeared to disrupt traffic flow, forcing other road users to carefully manoeuvre past the car.
According to the caption accompanying the post, the vehicle owner had allegedly left the car in the middle of the road while dining nearby, blocking access for others.
Many commenters appeared to support the retaliatory act, viewing it as a justified response to inconsiderate parking.
""This is the right way to teach those who behave irresponsibly,"" one Facebook user @CikAsmaraIsabelle said.
Another user @Rahim Bakar commented, ""Good way to deal with drivers who park without thinking of others.""
The incident has sparked online debate, with some arguing that such reactions reflect growing frustration over irresponsible behaviour, while others cautioned against taking matters into one's own hands.
© New Straits Times Press (M) Bhd"
