Source,Title,Link,Date,Article
New Straits Times,UK police review race plan amid anger over treatment of dying student,https://www.nst.com.my/world/world/2026/06/1454600/uk-police-review-race-plan-amid-anger-over-treatment-dying-student,"Wed, 03 Jun 2026 17:48:09 +0800","LONDON: British police chiefs are reviewing anti-racism guidance following outrage over the treatment of a white student, who was handcuffed as he lay dying after being stabbed by a Sikh man, officials said Wednesday.
Far-right figures have seized on the case of 18-year-old Henry Nowak, who was handcuffed and heard on police bodycam footage repeatedly telling officers he could not breathe as he lay mortally wounded in December.
His attacker, Vickrum Digwa, however, lied and said he was the victim as Nowak had racially insulted him.
Digwa, 23, was jailed for at least 21 years on Monday for stabbing Nowak to death using a ceremonial knife with a 21-centimetre (eight-inch) blade in the southern city of Southampton.
Two people were arrested late on Tuesday during a protest that turned violent, despite pleas from Nowak's father that his son's murder not be used ""to create further division, hatred or tension.""
Hard-right lawmaker Nigel Farage and high-profile agitator Tommy Robinson claim that the incident was an example of so-called ""two-tier policing"", in which officers are seen as dealing with ethnic minorities more leniently.
Prime Minister Keir Starmer and his Labour government vehemently deny that two-tier policing exists.
But the National Police Chiefs Council (NPCC) said it would look at its Race Action Plan, which advises officers to treat suspected criminals differently depending on their ethnicity.
""We are listening to legitimate concerns about how some of these commitments are worded or phrased, and where needed we can and will make changes, but this should not detract from the intent, which is to improve the quality of policing,"" chairman Gavin Stephens said in a statement.
The guidance published last year said the organisation's commitment to racial equality ""does not mean treating everyone 'the same' or being 'colour blind'.""
It was introduced as part of efforts to improve policing for black people, who statistics show are more than two times more likely to be arrested than white people in Britain.
[[nid:1454597]]
Policing minister Sarah Jones said it was ""right"" that the guidance was being reviewed.
Footage played during Digwa's trial showed police accepting Digwa's accusation of racist abuse, and rather than helping Nowak, initially handcuffing him despite his pleas that he had been stabbed and could not breathe.
Moments later, the student collapsed and became unconscious.
Starmer, a former chief state prosecutor in England and Wales, has said he ""felt sick"" watching the footage and that there were ""serious questions"" to answer about the case.
The Independent Office for Police Conduct (IOPC) watchdog is investigating and is expected to report back within the next three months.
Three of the officers involved in the incident are still serving and one has resigned, Hampshire Police have confirmed.
More than 1,000 protesters demonstrated in Southampton late Tuesday, with some attacking a line of riot police near where Nowak was murdered.
A group of around 100 protesters pulled apart garden fences, threw bricks, flares and chairs, and rolled a flaming bin at police, who used a spray on demonstrators and hit them with riot shields.
Interior minister Shabana Mahmood accused demonstrators of ""hijacking this tragedy to stir up violence and disorder.""
© New Straits Times Press (M) Bhd"
New Straits Times,Cops to take statements from 14 hikers who trekked with Jaslinda,https://www.nst.com.my/news/nation/2026/06/1454594/cops-take-statements-14-hikers-who-trekked-jaslinda,"Wed, 03 Jun 2026 17:37:14 +0800","KUALA LUMPUR: Police will record statements from all 14 hikers who participated in the Trans Spencer Chapman expedition with missing hiker Jaslinda Saludin as part of ongoing investigations into her disappearance.
Tapah district police chief Superintendent Abdul Malik Hasim said investigators would obtain statements from all members of the hiking group to establish a clearer timeline of events.
He said the exercise formed part of standard police procedures and was aimed at gathering all available information relating to Jaslinda's disappearance.
Abdul Malik said that so far, police had not found any evidence suggesting criminal involvement in the case.
He said investigations were continuing while search and rescue operations remained ongoing.
Jaslinda, 49, was reported missing after joining an expedition involving 13 other hikers and two Forestry Mountain Guides (MGP).
She was last seen by the guides at about 7.30am on May 24 after reportedly continuing her hike towards the summit.
© New Straits Times Press (M) Bhd"
New Straits Times,"Online-bought soy milk maker explodes, injures mother and daughter in Penang",https://www.nst.com.my/news/regional/2026/06/1454590/online-bought-soy-milk-maker-explodes-injures-mother-and-daughter,"Wed, 03 Jun 2026 17:35:32 +0800","GEORGE TOWN: A mother and her daughter suffered burn injuries after a soy milk maker purchased through a China-based e-commerce platform allegedly exploded during its first use at their home in Sungai Ara here yesterday.
The incident was highlighted by the Impak Madani Welfare Organisation of Penang to the New Straits Times today.
According to the organisation's advisor, John Ooh Sin Hwa, the victim, identified only as Madam Zhang, had purchased the appliance online because her daughter enjoys soy milk.
The soy milk maker was delivered at about 4pm yesterday and was used for the first time shortly afterwards.
He said the appliance exploded while in operation, causing boiling liquid to splash onto the faces and shoulders of both victims.
The mother and daughter were subsequently taken to a nearby medical centre for treatment.
Ooh said an inspection of the appliance found that it did not appear to carry the Sirim safety certification mark, which is required for electrical products marketed in Malaysia.
""How can such electrical appliances, allegedly lacking the necessary safety certification, enter the local market and be sold directly to consumers through overseas e-commerce platforms?"" he questioned.
Ooh cited Regulation 97(1) of the Electricity Regulations 1994, which requires low-voltage electrical appliances sold to the public in Malaysia to obtain approval and a Certificate of Approval from the Energy Commission, as well as certification by Sirim.
He said they had submitted complaint letters to the Malaysian Communications and Multimedia Commission (MCMC) and the Domestic Trade and Cost of Living Ministry, urging the authorities to investigate the matter.
""We want stricter monitoring of imported electrical appliances sold through foreign online shopping platforms to ensure compliance with Malaysian safety standards.
""We advise consumers to verify that electrical appliances purchased online carry recognised safety certification before use to reduce the risk of accidents,"" he added.
Ooh said electrical products that do not comply with local safety requirements could pose risks of injury and fire.
© New Straits Times Press (M) Bhd"
New Straits Times,Hundreds flee as South Africa anti-migrant mobs go door-to-door,https://www.nst.com.my/world/world/2026/06/1454587/hundreds-flee-south-africa-anti-migrant-mobs-go-door-door,"Wed, 03 Jun 2026 17:34:24 +0800","GANSBAAI: Hundreds of foreigners fearing for their lives have taken shelter in community halls on South Africa's south coast, saying mobs of locals were going door-to-door telling them to leave the country.
Mostly nationals of Malawi and Mozambique, many told AFP they had fled their homes at the weekend and spent nights in the mountains and bush, before making their way to the small-town community centres.
""They said 'you are a foreigner, you don't belong in South Africa, so you must go',"" Mozambican Thomas Vincent Baloyi told AFP in Gansbaai, around 110 kilometres (70 miles) southeast of Cape Town.
""I said, 'no, I got documents to be here in South Africa'. They didn't want to know,"" said Baloyi, who has been in the country for nearly 16 years working in construction and gardening.
""They just chased us away like dogs... that is unfair because, actually, I'm a human being,"" the 32-year-old said. ""We just stayed in the bush until six in the morning.""
Weeks of mostly small protests across South Africa against illegal foreign nationals exploded into violence at the weekend in the town of Mossel Bay, 250 kilometres up the coast, where 55 shacks were torched.
The South African police say two people from Mozambique were killed but did not link the deaths to an anti-illegal migrant march held hours before.
The Mozambique government said five of its citizens were killed as a ""direct consequence of the xenophobic attacks.""
Around 300 fled back across the border on Saturday and hundreds more will follow, it said.
The deaths would be the first linked to a new wave of anti-migrant protests by fringe groups that accuse undocumented foreign nationals of crime and taking scarce jobs and resources away from locals.
After one anti-illegal migrant group set a June 30 deadline for undocumented migrants to go home, small bands of people brandishing whips, sticks, wooden clubs and sometimes axes are reported to have taken to the streets in various places to reinforce the ultimatum.
Ghana has already flown home 300 of its citizens, with hundreds more due to leave this weekend, and Nigeria has also announced emergency repatriation flights.
""They were dragging people out of their houses... whether you are legal or illegal, they say they don't want any foreign nationals in the township,"" local councillor Msa Nomatiti told AFP.
Locals turned on foreigners in an informal settlement in Gansbaai on Monday, he said, alleging some of the groups going door-to-door to search for foreign nationals were accompanied by the police.
[[nid:1454584]]
More than 500 people had fled their homes Monday, he said.
By late Tuesday, small groups could still be seen walking out of informal settlements in the area, hauling their belongings in the dark night and soft rain as they made their way to places of safety.
""Some of them lost their passports because of the beatings and being dragged out of their houses,"" Nomatiti said. Government officials were sent to help with documentation and voluntary repatriations.
Around 50 people huddled over large buckets of food at the tiny Gansbaai mosque, which was crammed with people and belongings, sharing one toilet and a single tap.
In the small coastal town of Kleinmond, 40 kilometres closer to Cape Town, nearly 100 foreigners, most of them Malawian, sought shelter at a local community hall.
Large bags of clothing and blankets lined the walls and chairs were the only furniture. Volunteers served warm meals and donations from local residents trickled in.
Landlords told non-South Africans on Saturday to leave immediately as locals were going door-to-door in search of foreign nationals, Malawian Michael Markson told AFP.
""So we came out in the night hours, we went to the bush. There's a mountain up there, we slept there,"" said the 31-year-old, his eyes bloodshot.
""They're taking pangas... dangerous tools. They can hunt someone,"" he said.
In the town of Standford less than 20 kilometres inland, another Malawian national, Talibo Mbewe, said he had been sheltering at the community hall for two days.
""The thieves, they have already taken all our stuff at home, so we don't have anything. But it's better to go home without anything than to lose our lives,"" he said.
© New Straits Times Press (M) Bhd"
New Straits Times,Will SpaceX IPO make Elon Musk a trillionaire?,https://www.nst.com.my/opinion/columnists/2026/06/1454579/will-spacex-ipo-make-elon-musk-trillionaire,"Wed, 03 Jun 2026 17:25:40 +0800","HE is already the richest man in the world, but when SpaceX finally makes its hotly anticipated stock market debut, Elon Musk could become the planet's first trillionaire.
Forbes magazine on Tuesday estimated Musk's net worth at nearly US$835 billion, as compared with $342 billion in its annual rich list in March 2025.
He is far beyond Google co-founder Larry Page, who is second at US$298 billion.
SpaceX's market debut, expected around June 12, will ""all but guarantee his net worth rising above US$1 trillion,"" Forbes said in early April, when the company first filed to list on the Nasdaq.
The valuation of the company, founded in 2002, is expected to range from US$1.7 trillion to US$2 trillion, up from a range that topped out at US$1.5 trillion in March.
On Tuesday, platforms for trading unlisted shares valued the group at about US$1.5 trillion, with an individual share going for about US$129 on Forge Global (up from US$53 in mid-December) and US$118 on Nasdaq Private Market.
The 54-year-old Musk currently holds 12 per cent of common SpaceX shares and about 94 per cent of Class B shares (each one retains 10 votes), according to a filing submitted to the US Securities and Exchange Commission.
According to AFP calculations, after the company goes public, Musk would hold about 42 per cent of SpaceX capital and 79 per cent of all voting rights – or the equivalent of US$735-US$840 billion, given the latest valuation estimates.
""Current trends are an incredible and continued centralization and concentration of wealth"" in the hands of about 3,000 billionaires, William Robinson, a professor of sociology at the University of California, Santa Barbara, told AFP.
""At the top end of those billionaires, the concentration is accelerating.""
Robinson noted that at the same time, five billion people on Earth are living below the poverty line, creating an ""extreme inequality"" that can spawn civil wars and other crises.
[[nid:1454576]]
He says the ""new billionaire class"" – more precisely, the ""tech oligarchy"" – holds a structural power over states, economies and society that echoes the rise of Nazism and fascism 100 years ago.
In February, SpaceX took over Musk's artificial intelligence outfit xAI, which itself had absorbed the X social network (formerly Twitter) a year before.
Musk also own about 12 per cent of electric car maker Tesla, whose market capitalisation currently sits at about US$1.58 trillion.
In mid-February, Musk said his net worth was almost entirely tied up in Tesla and SpaceX shares, and that less than 0.1 per cent of his fortune was in cash.
Analysts expect to see a 2027 merger of SpaceX and Tesla, which is increasingly focused on robotics, energy and autonomous transport.
The two companies are already jointly developing some projects, such as the giant semiconductor manufacturing plant Terafab.
""We continue to believe that SpaceX and Tesla will eventually merge into one company in 2027 with the groundwork already in place for both operations to become one organisation,"" said analysts at Wedbush Securities, noting that Tesla is a minor shareholder in SpaceX via its investment in xAI.
Musk also holds shares in The Boring Company, a tunnel construction service, and Neuralink, which is developing implantable brain-computer interfaces.
Robinson said Musk could take on an ""aura of God"" for some people should he become the world's first trillionaire – but might develop a bit of a god complex himself as a result.
His net worth could balloon even more if he meets the criteria of the compensation plan drawn up in 2025 by Tesla's board of directors.
Should he meet the numerous financial and operational benchmarks, he could pocket another roughly US$1 trillion over the course of 10 years.
At SpaceX, he stands to make more than US$130 billion from two compensation plans – but one of the conditions involves establishing a permanent human colony on Mars of at least one million people.
* The writer is from AFP
© New Straits Times Press (M) Bhd"
New Straits Times,Lembah Kiara Park RM6.5mil upgrade focused on infrastructure works - Yeoh,https://www.nst.com.my/news/nation/2026/06/1454575/lembah-kiara-park-rm65mil-upgrade-focused-infrastructure-works-yeoh,"Wed, 03 Jun 2026 17:24:31 +0800","KUALA LUMPUR: Upgrading works at Lembah Kiara Park costing RM6.5 million have been completed, with most of the allocation spent on rehabilitating the park's drainage system, retention ponds and electrical infrastructure.
Minister in the Prime Minister's Department (Federal Territories) Hannah Yeoh said the recreational park, located within Bukit Kiara Federal Park, is managed by the National Landscape Department and not Kuala Lumpur City Hall (DBKL).
She said only about RM700,000 of the total project cost was allocated for landscaping works, including repairs to pedestrian walkways, two gazebos and related facilities, while the remainder was used for infrastructure upgrades and drainage rehabilitation.
""RM2.5 million was allocated to upgrade the park's electrical system, including feeder pillars, underground cables and the replacement of 233 damaged lamp posts,"" she said after inspecting the park here today.
She said the remaining RM3.3 million was used for pond and drainage rehabilitation works, including the restoration of the upstream pond, sediment basin, streams and the park's main retention pond.
The upgrading project also involved the construction of two eco-walls, desilting works and the installation of maintenance facilities to improve pond management efficiency and reduce future maintenance costs, she said.
She said the park has reopened to the public following the completion of the upgrading works, with operating hours from 5.30am to 8pm.
The project remains under a one-year defects liability period until April next year, during which the landscape department and the Department of Irrigation and Drainage (DID) will continue to monitor the upgraded facilities, she said.
Yeoh also expressed appreciation to the departments and representatives from Kampung Sungai Penchala and Taman Tun Dr Ismail who joined the site visit, describing the project as an initiative long-awaited by the community.
– Bernama
© New Straits Times Press (M) Bhd"
New Straits Times,"Private infra, real estate capital to play larger financing role in AI data centre boom",https://www.nst.com.my/property/2026/06/1454573/private-infra-real-estate-capital-play-larger-financing-role-ai-data,"Wed, 03 Jun 2026 17:21:04 +0800","KUALA LUMPUR: Private infrastructure and real estate capital are expected to play a larger role in financing the AI-driven data centre boom, as companies move beyond traditional forms of funding, Goldman Sachs said in a note on Tuesday.
Goldman increased its combined capex forecast for the four largest hyperscalers – Meta, Microsoft, Amazon, and Alphabet – to US$5.3 trillion between fiscal years 2025 and 2030.
Prior to the start of first-quarter earnings, the Wall Street broking forecast capex at US$4.5 trillion for the same period.
Goldman expects companies will tap into public, securitised and private markets to attain the scale and scope of this funding need.
""Private infrastructure and real estate will play an even larger role in the years ahead,"" Goldman said.
The boundaries between private infrastructure and real estate are blurring as data centre projects extend into different categories such as land, power, building and equipment.
Private infrastructure's structured income generation and inflation-protection characteristics will likely boost further growth, the broking said.
""Infrastructure sits at the epicentre of multiple structural tailwinds, which we expect will drive its growth and provide additional capacity for financing,"" Goldman added.
From 2021 to 2024, the private infrastructure market grew at an annualised rate of roughly 11.5 per cent, Goldman said.
Goldman expects this growth rate to increase, potentially closer to the 16 per cent to 17 per cent annualised growth that prevailed for much of 2012 to 2021.
This growth rate would push the infrastructure assets under management (AUM) comfortably above US$3 trillion by 2030, the broking added.
© New Straits Times Press (M) Bhd"
New Straits Times,"Toronto home sales rise the most in 10 months, prices dip",https://www.nst.com.my/property/2026/06/1454570/toronto-home-sales-rise-most-10-months-prices-dip,"Wed, 03 Jun 2026 17:19:12 +0800","TORONTO: Greater Toronto Area home sales posted their biggest monthly gain in 10 months in May, helped by improved affordability, while prices resumed their recent decline, Toronto Regional Real Estate Board data showed on Wednesday.
Seasonally adjusted sales increased 10 per cent last month from April to 5,364 units, marking the third straight month of gains and the largest since July last year.
The board's home price index edged 0.2 per cent lower month-over-month, after seasonal adjustment, to C$927,800 (US$670,569.53). It follows a flat reading in April, which ended a streak of 10 straight monthly declines.
The Greater Toronto Area includes Toronto, Canada's most populous city, and four surrounding regional municipalities.
""Spring sales have been stronger than last year, reflecting improved affordability stemming from lower selling prices and borrowing costs,"" the board's president, Daniel Steinfeld, said in a statement.
""Sales are forecast to improve further as we move through the second half of this year. Recovery would be further bolstered by positive news on the trade front along with an easing of geopolitical tensions and related uncertainty,"" Steinfeld said.
Canada faces uncertain negotiations to renew a continental trade pact that has helped shield its goods from US tariffs.
The recent surge in energy costs due to the war in the Middle East has raised the outlook for inflation globally.
On a year-over-year basis, sales rose 6.3 per cent, while new listings declined 18.9 per cent and the price index was down 6.7 per cent.
© New Straits Times Press (M) Bhd"
Malay Mail,Lawyer seeks Federal Court’s leave to appeal over Agong’s refusal to declare emergency five years ago,https://www.malaymail.com/news/malaysia/2026/06/03/lawyer-seeks-federal-courts-leave-to-appeal-over-agongs-refusal-to-declare-emergency-five-years-ago/222433,"Wed, 03 Jun 2026 19:54:18 +0800","PUTRAJAYA, June 3 — Lawyer Syed Iskandar Syed Jaafar Al Mahdzar has filed an application at the Federal Court seeking leave to appeal in relation to his judicial review challenge concerning the former Yang di-Pertuan Agong’s refusal to a request by the then prime minister to declare a state of emergency five years ago.
When contacted by Bernama, Syed Iskandar confirmed that the notice of motion was filed last Friday through law firm Messrs R.Kengadharan & Co.
On May 4 this year, the Court of Appeal three-man bench comprising Federal Court judge Datuk Collin Lawrence Sequerah and Court of Appeal judges Datuk Supang Lian and Datuk Dr Alwi Abdul Wahab, dismissed Syed Iskandar’s appeal.
Syed Iskandar had filed an originating summons in 2020, seeking a declaration that the Constitution (Amendment) Act 1981 (Act A514), which added Clauses 8 (a) and (b) to Article 150, is unconstitutional, null and void and of no effect on the ground that it violated the basic structure of the Federal Constitution.
He named the Malaysian Government and 10 others as defendants in the suit.
On February 15, 2024, the High Court in Kuala Lumpur dismissed the originating summons. The court ruled that Article 150(8) does not violate the basic structure of the Federal Constitution and cannot be struck down under Article 40(1), which states that the Yang di-Pertuan Agong shall act on the advice of the Cabinet.
In dismissing Syed Iskandar’s appeal, Justice Sequerah ruled that matters concerning emergency powers under Article 150 of the Federal Constitution are non-justiciable.
“A court would not be equipped to decide on the legality of the Yang Di-Pertuan Agong’s satisfaction of national threats as it would be impossible to adduce all available facts before the courts, and as such it would be inappropriate for a court exercising powers of judicial review to make value judgments of non-judicial nature,” he said in his grounds of decision.
He further said that there was a need to include Clause 8 to exclude the court from reviewing the proclamation of emergency and any related ordinance, as certain sensitive information is only available to the Executive, and it was not wise for such sensitive information to be disclosed to the public and be subjected to judicial review.
Justice Sequerah added that the courts were also ill-equipped to deal with matters involving national security. — Bernama"
