Source,Title,Link,Date,Article
New Straits Times,Thai court accepts petition challenging government's US$12bil borrowing decree,https://www.nst.com.my/world/region/2026/05/1442546/thai-court-accepts-petition-challenging-governments-us12bil-borrowing,"Mon, 18 May 2026 19:40:03 +0800","BANGKOK: Thailand's Constitutional Court on Monday accepted a petition from the parliamentary opposition challenging the legality of a government emergency decree to borrow 400 billion baht (US$12.26 billion) to support the economy amid the fallout from the Middle East conflict.
The court in a statement said it has instructed the government to submit explanatory documents within seven days.
The government approved the loan decree earlier this month, with half of the borrowing for mitigating the cost of living, largely through a consumer subsidy scheme, and the other half for supporting a transition to clean energy.
Finance Minister Ekniti Nitithanprapas earlier said the decree remains in effect and can still move forward.
When filing the petition, opposition People's Party leader Natthaphong Ruengpanyawut said he supported the transition to clean energy, but ""we do not agree with using an emergency borrowing decree.""
The finance minister said on Monday that the impact of the war will be felt in the current quarter after Southeast Asia's second-largest  expanded 2.8pct on the year, more than expected, in the first quarter of 2026.--REUTERS
© New Straits Times Press (M) Bhd"
New Straits Times,Kedah BN weighs going solo too,https://www.nst.com.my/news/regional/2026/05/1442540/kedah-bn-weighs-going-solo-too,"Mon, 18 May 2026 19:33:20 +0800","SIK: Kedah Barisan Nasional (BN) has not ruled out the possibility of contesting solo in the next election, following Johor BN's recent move ahead of its own state polls.
""I see that as a good example for us to follow in the future,"" Kedah BN chairman Datuk Seri Mahdzir Khalid told reporters after officiating the Keda Village land grant handover ceremony for the Sik district at Desa Keda Sungai Semiar here today.
""If Johor can propose it, Kedah can also do the same. However, any party decision must be made collectively with the top leadership, not individually. So, whatever decision is reached, we will refer to a collective decision when the time comes,"" he said.
Mahdzir added that Johor BN came to its decision to contest solo in all 56 state seats after weighing various factors.
""They have their justifications and they have weighed the pros and cons in making the decision, which is why they chose to move solo in all 56 seats,"" he said.
On Saturday, Johor BN chairman Datuk Onn Hafiz Ghazi announced that the coalition would field candidates in all 56 state seats in the upcoming state election, saying the decision was finalised after discussions with state Umno and BN grassroots leaders.
The move drew immediate flak from
Johor Pakatan Harapan (PH) chairman
Aminolhuda Hassan, who said BN was sending a clear signal that the door to political cooperation in the state is now closed.
The escalating tension prompted a stern warning from PH chairman and prime minister, Datuk Seri Anwar Ibrahim, at the 2026 PH Convention yesterday.
Anwar said that
PH would retaliate
if any party attempted to betray or undermine the coalition, hinting at the possibility of dissolving parliament to hold an early 16th General Election (GE16) if coalition partners continued to destabilise the political landscape.
In response to the friction, Johor BN rejected claims today that its decision to contest solo amounts to a betrayal, insisting that participating in elections is a fundamental democratic right.
Johor BN secretary Datuk Abdul Halim Suleiman said attempts to portray the coalition's decision as an act of disloyalty were
misleading and unfair
. He stressed that Johor's political landscape differs from the federal arrangement, as the current state administration was formed based on the people's mandate during the 2022 Johor state election.
""The Johor state government today was formed based on the people's mandate in the 2022 state election, led by BN, with all state executive councillors coming from BN.
""Pakatan Harapan and Perikatan Nasional in Johor are not part of the state administration.
""They play the role of checks and balances in the state assembly, and that role continues to be respected,"" Abdul Halim said in a statement today.
© New Straits Times Press (M) Bhd"
New Straits Times,"Jealousy, unrequited love believed motive in woman's stabbing case",https://www.nst.com.my/news/regional/2026/05/1442534/jealousy-unrequited-love-believed-motive-womans-stabbing-case,"Mon, 18 May 2026 19:28:08 +0800","ALOR STAR: Jealousy and unrequited love are believed to have been the motives behind a man who allegedly stabbed a woman in the neck while inside a car in front of a restaurant along Jalan Titi Gajah near here last night.
Kedah police chief Datuk Adzli Abu Shah said, however, that investigations were ongoing to establish the exact motive in the incident involving a 32-year-old suspect and a 35-year-old victim.
""Police received a call at 9.24pm reporting a fight in front of a restaurant. The female victim sustained a neck injury, believed to have been caused by a sharp object, and was found inside the car covered in blood.
""The suspect fled the scene immediately after the incident and was later
arrested
while hiding near a place of worship in Taman Uda, about 6km from the location,"" he said at a press conference at the Kedah police headquarters today.
Adzli said the victim, a single mother, and the suspect, a divorcee, had known each other for more than a year and both worked in the real estate sector.
""The incident is believed to have happened shortly after they arrived at the restaurant. Both had not yet exited the vehicle when the suspect got out of the victim's car and fled towards a nearby padi field.
""The victim's quick action in sounding the car horn attracted public attention, and initial assistance was provided to stem the bleeding.
""The stab wound is believed to have been inflicted from the left side of the neck and penetrated through to the right. The weapon used could have been an ice pick, screwdriver or a Rambo knife,"" he said.
[[nid:1442541]]
He added that the victim was now in stable condition and that statements will be recorded from her and several witnesses to assist investigations.
Adzli said the suspect had a prior criminal record under Section 326 of the Penal Code for causing grievous hurt to his former girlfriend several years ago.
""Urine screening returned negative for drugs, and the suspect has been remanded for seven days until May 24. The case is being investigated under Section 326 of the Penal Code,"" he said.
Earlier, it was reported that the suspect had been remanded for seven days until May 24 to assist in the investigation of a stabbing case involving a woman in a car here.
Magistrate Noor Shifa Mohd Hamzah issued the
remand
order at the Alor Star court lockup.
© New Straits Times Press (M) Bhd"
New Straits Times,99 Speed Mart posts higher net profit of RM188.56mil in Q1,https://www.nst.com.my/business/corporate/2026/05/1442532/99-speed-mart-posts-higher-net-profit-rm18856mil-q1,"Mon, 18 May 2026 19:15:47 +0800","KUALA LUMPUR: 99 Speed Mart Retail Holdings Bhd posted a higher net profit of RM188.56 million in the first quarter of its financial year ended March 31, 2026 (Q1 2026), compared with RM144.90 million in the same period last year.
In a Bursa Malaysia filing today, it said the performance was driven by an improved non-essential product mix and effective energy-saving measures.
The revenue jumped to RM3.07 million in Q1 2026 compared to RM2.61 million in Q1 2025, attributed to the continued expansion of its outlet network, with a net addition of 253 outlets year-on-year, bringing the total outlet count to 3,086 as of March 31, 2026.
""Revenue growth was also supported by the implementation of earlier operating hours nationwide. Accordingly, total sales transactions increased 18.0 per cent to 141.1 million, while the average basket size remained stable at RM21.70,"" it said.
The company also declared a first interim dividend of 2.25 sen per ordinary share, amounting to a payout of approximately RM189 million for the financial year ending Dec 31, 2026, with an entitlement date of June 5, 2026, and payment to be made on June 16, 2026.
Commenting on the company's performance, its chief executive officer, Lee Thiam Wah said the operations continue to benefit from resilient consumer demand, as they provide affordable daily necessities and accessible services to customers nationwide, in line with their Near 'n Save ethos.
He also said the group also continued to broaden their product offerings across the outlets -- including selected small electrical appliances -- to provide greater convenience and cater to the evolving needs of their customers.
""As consumer spending patterns continue to shift towards greater value consciousness, we will further strengthen our 'four items for RM10' promotional campaign and continue enhancing the 99 Bulksales platform to deliver better affordability and value to customers nationwide.
""At the same time, managing costs and improving utility efficiency remain key priorities for the group.
""We continue to implement various energy-saving initiatives, including the installation of solar panels across our retail and distribution operations and optimisation of lighting operating hours across our outlets, to enhance operational efficiency and support sustainable long-term growth,"" he said.
© New Straits Times Press (M) Bhd"
New Straits Times,Iran announces new body to manage Strait of Hormuz,https://www.nst.com.my/world/world/2026/05/1442529/iran-announces-new-body-manage-strait-hormuz,"Mon, 18 May 2026 19:12:30 +0800","TEHERAN: Iran's top security body announced on Monday the formation of a new body to manage the Strait of Hormuz, which Teheran has effectively closed and wants to charge ships to traverse.
On its official X account, the Supreme National Security Council shared a post for the Persian Gulf Strait Authority (PGSA) saying it would provide ""real-time updates on the #Hormuz_Strait operations and latest developments.""
The account of the Revolutionary Guards navy shared the same post.
It was not immediately clear what the new body would do but earlier this month Iranian English-speaking broadcaster Press TV said it constituted a ""system to exercise sovereignty over the Strait of Hormuz"" and that ships passing through the strait were sent ""regulations"" from the email info@pgsa.ir.
Iran has largely blocked shipping through the vital strait since the outbreak of war with the United States and Israel on Feb 28. A fragile ceasefire has been in place since April 8.
Iran's grip over the waterway has rattled global markets and given Tehran significant leverage, while the United States has imposed its own naval blockade on Iranian ports.
In peacetime, the route accounts for roughly a fifth of global oil and liquefied natural gas shipments, along with other key commodities including fertiliser.
Since the war began, Iran has repeatedly said that maritime traffic through the strait would ""not return to its pre-war status"" and last month it said it had received the first revenue from tolls on the waterway.
On Saturday, Ebrahim Azizi, head of the Iranian parliament's national security commission, said Iran ""has prepared a professional mechanism to manage traffic"" through the strait, adding that it will be ""unveiled soon.""--AFP
© New Straits Times Press (M) Bhd"
New Straits Times,Kedah cop linked to Langkawi drug syndicate transferred amid probe,https://www.nst.com.my/news/regional/2026/05/1442527/kedah-cop-linked-langkawi-drug-syndicate-transferred-amid-probe,"Mon, 18 May 2026 19:10:23 +0800","ALOR STAR: A police officer believed to be the mastermind, known as ""Mr A"", in a drug trafficking network operating around Langkawi has been immediately transferred to another department, Kedah police confirmed.
Kedah police chief Datuk Adzli Abu Shah said the transfer was not intended to protect the officer, but was carried out as investigations were still ongoing.
""We will take action even if the suspect is a member of the police force,"" he said at a press conference at the Kedah police headquarters today.
Adzli said the case required thorough investigations, including credible evidence and witness statements, before further action could be taken.
He also revealed that 54 police officers and personnel in Kedah had been arrested for drug abuse between 2023 and April this year.
Of that number, 38 have been charged in court and suspended from duty, while three others are still facing action.
In a related development, Adzli said police had also taken action against a 47-year-old man known as ""Bagok"", who was linked to a viral chart related to the so-called ""Pablo Escobar 2.0"" drug activities in Langkawi.
He said the suspect had been arrested twice this year, with the latest arrest on May 16.
""The first arrest was on April 11, when no drugs were found. However, an investigation paper was opened under Section 15(1) of the Dangerous Drugs Act after his urine test returned positive.
""More recently, he was arrested again three days ago and tested positive for methamphetamine,"" he said.
Adzli added last year, a police officer in Kedah had also been subjected to action under the Special Preventive Measures for suspected involvement in drug trafficking.
© New Straits Times Press (M) Bhd"
New Straits Times,Pos Malaysia's net loss narrows to RM19.5mil in Q1,https://www.nst.com.my/business/corporate/2026/05/1442523/pos-malaysias-net-loss-narrows-rm195mil-q1,"Mon, 18 May 2026 19:05:48 +0800","KUALA LUMPUR: Pos Malaysia Bhd's net loss narrowed to RM19.54 million for the first quarter ended March 31, 2026, from a net loss of RM41.52 million in the same period last year, supported by stronger contributions across its business segments.
The postal and parcel services provider saw revenue growth of 7.3 per cent to RM501.35 million from RM467.06 million, driven mainly by its postal segment.
According to its Bursa Malaysia filing, the revenue from the postal segment rose 1.44 per cent to RM283.15 million from RM279.11 million, supported by higher contributions from the courier business, although this was partially offset by lower international mail revenue.
Its aviation, logistics, and other segments also recorded higher revenue for the quarter.
No dividend was declared for the period.
Pos Malaysia said it remains focused on reducing losses, supported by ongoing transformation initiatives including network rationalisation, digital channel expansion and disciplined cost management.
However, it said that the operating environment is expected to remain challenging due to structural industry pressures, competitive dynamics, and geopolitical uncertainties.
This also includes the developments in the Middle East, which may impact global freight rates, fuel costs, flight volumes, and air cargo demand relevant to its aviation segment.
© New Straits Times Press (M) Bhd"
New Straits Times,KLK's net profit jumps 91pct in Q2 boost by manufacturing segment,https://www.nst.com.my/business/corporate/2026/05/1442521/klks-net-profit-jumps-91pct-q2-boost-manufacturing-segment,"Mon, 18 May 2026 19:03:15 +0800","KUALA LUMPUR: Kuala Lumpur Kepong Bhd's (KLK) net profit jumped 90.6 per cent to RM294.05 million in the second quarter ended Mar 31, 2026 versus RM154.27 million in the corresponding period last year due to improved results from the manufacturing segment.
Revenue for the quarter under review climbed to RM6.55 billion from RM6.34 billion in the same quarter last year.
KLK said the improved performance was also attributable to land sales amounting to RM126.8 million.
In a filing with Bursa Malaysia, the company said that its plantation segment posted a decline in profit by 21.1 per cent to RM358.5 million due to weaker selling prices of crude palm oil (CPO) and palm kernel.
These factors offset the higher sales volume in CPO and palm kernel as well as the reduction in CPO production cost.
The company said that it also posted a lower fair value loss of RM24.9 million from the valuation of unharvested fresh fruit bunches (FFB).
Its manufacturing segment recorded a wider loss of RM42.2 million in the second quarter despite higher revenue of RM5.7 billion.
""The weaker performance in the current quarter was mainly dragged down by a decline in profit contribution from the oleochemical division, partially mitigated by lower losses from the refineries and non-oleochemical divisions,"" it said.
The property  segment's profit fell 47.2 per cent to RM1.9 million on the back of lower revenue of RM25.7 million in the quarter under review.
For the six months ended Mar 31, 2026, the company posted a higher net profit of RM676.46 million from RM374.73 million. Revenue rose to RM12.9 billion from RM12.3 billion a year prior.
Looking ahead, KLK said performance for its plantation segment is expected to remain stable, supported by healthy production levels, notwithstanding the potential operational disruptions amid the conflict in the Middle East.
Margins across the manufacturing segment are also likely to remain competitive, amid elevated feedstock and utility costs.
""Supported by resilient plantation operations and improving downstream contributions, the group remains optimistic of delivering an improved operational performance for the financial year,"" it added.
© New Straits Times Press (M) Bhd"
New Straits Times,Gaza-bound flotilla says Israeli forces intercepting fleet near Cyprus,https://www.nst.com.my/world/world/2026/05/1442519/gaza-bound-flotilla-says-israeli-forces-intercepting-fleet-near-cyprus,"Mon, 18 May 2026 19:01:14 +0800","JERUSALEM: Israeli forces were intercepting a Gaza-bound aid flotilla on Monday after it set sail from Turkey last week, with organisers saying one of the vessels was stopped west of Cyprus.
""Military vessels are currently intercepting our fleet and IDF forces are currently boarding the first of our boats in broad daylight,"" the Global Sumud Flotilla posted on X.
""We demand safe passage for our legal, non-violent humanitarian mission. Governments must act now to stop these illegal acts or piracy meant to maintain Israel's genocidal siege on Gaza.
""Normalisation of the occupation's violence is a threat to us all.""
Around 50 ships had departed from southwestern Turkiye on Thursday as part of the flotilla.
On Monday, Israel had vowed to block the vessels.
""Israel will not allow any breach of the lawful naval blockade on Gaza,"" the foreign ministry posted on X.
""Israel calls on all participants in this provocation to change course and turn back immediately.""
The ministry did not immediately respond to requests for comment on whether Israeli forces were intercepting the boats.
The Global Sumud Flotilla is the third initiative in a year aimed at breaking an Israeli blockade of Gaza, which has suffered severe shortages of food, water, medicine and fuel since the Israel-Hamas war broke out in October 2023.
Israeli authorities reject claims of aid shortages, saying the Palestinian territory is ""flooded"" with supplies.
Israeli forces intercepted the second flotilla in international waters off Greece on April 30, expelling most of the activists to Europe.
But they arrested two of them, who were held for several days in Israel before they were deported.
Rights groups said the arrests were illegal and that the men suffered abuse while in Israeli detention.
Israeli authorities have rejected the abuse allegations but filed no charges against the pair.--AFP
© New Straits Times Press (M) Bhd"
New Straits Times,"MARKET PULSE PM MAY 18, 2026 [WATCH]",https://www.nst.com.my/business/corporate/2026/05/1442517/market-pulse-pm-may-18-2026-watch,"Mon, 18 May 2026 19:00:24 +0800","KUALA LUMPUR: Bursa Malaysia closed lower on Monday, as selling pressure spread across key index-heavy stocks.
The benchmark index ended the session at 1,727 points, with sentiment weighed down by rising geopolitical uncertainty linked to the Iran conflict.
In the currency market, the ringgit weakened against the US dollar, closing at 3.9680.
Meanwhile, Bitcoin was steady at RM305,370,  while Ethereum remained stable at RM8,407
That wraps up today's Market Pulse.
© New Straits Times Press (M) Bhd"
New Straits Times,"TVET-AI programme to be rolled out in five SBP schools this year, says MoE",https://www.nst.com.my/news/nation/2026/05/1442513/tvet-ai-programme-be-rolled-out-five-sbp-schools-year-says-moe,"Mon, 18 May 2026 19:00:05 +0800","PUTRAJAYA: The Education Ministry (MoE) has formalised a strategic collaboration through a memorandum of understanding with Multimedia University and Huawei Technologies (Malaysia) Sdn Bhd to strengthen Technical and Vocational Education and Training (TVET) in artificial intelligence (AI) at fully residential schools.
The ministry said the TVET-AI initiative would be implemented this year in five selected fully residential schools before being expanded nationwide.
The schools involved are Sekolah Menengah (SM) Sains Banting in Selangor, SM Sains Setiu in Terengganu, SM Sains Alor Gajah in Melaka, SM Sains Kuching in Sarawak, and SM Sains Tun Syed Sheh Shahabudin in Penang.
It said the collaboration reflected its ongoing commitment to education reform aimed at strengthening academic excellence alongside future-ready technical skills through the integration of AI.
""This strategic initiative adds significant value to the ministry's efforts to enhance student employability through the Huawei Certified ICT Associate – Artificial Intelligence (HCIA-AI) professional certification, which is internationally recognised,"" it said in a statement.
The ministry said the programme was aligned with the 13th Malaysia Plan (13MP) and the Malaysian Education Blueprint 2026–2035, which emphasise future talent development, strengthening the TVET ecosystem and enhancing industry-academia collaboration. — BERNAMA
© New Straits Times Press (M) Bhd"
New Straits Times,Sunway Construction's Q1 net profit up 56pct to RM118.41mil,https://www.nst.com.my/business/corporate/2026/05/1442510/sunway-constructions-q1-net-profit-56pct-rm11841mil,"Mon, 18 May 2026 18:57:07 +0800","KUALA LUMPUR: Sunway Construction Group Bhd's net profit for the first quarter ended March 31, 2026 (Q1 FY26) surged by 56 per cent to RM118.41 million compared with RM75.71 million in the same quarter last year, underpinned by higher contributions from all operating segments.
In a filing with Bursa Malaysia today, it said revenue, however, decreased to RM1.02 billion from RM1.40 billion previously.
The group declared a total dividend of 22.8 sen per share in the current quarter for the financial year ending Dec 31, 2026, comprising a single-tier first interim dividend of 7.60 sen per share and a special dividend of 15.2 sen per share.
Its managing director Liew Kok Wing said the group's healthy outstanding order book, coupled with robust order book replenishment, continues to provide strong visibility for its earnings growth trajectory.
""In Q1 2026, the group secured RM3.59 billion worth of new orders, achieving more than 50 per cent of its 2026 order book replenishment target,"" he said in a separate filing.
On prospects, he said the group continues to strengthen its position in Malaysia's key growth sectors, particularly the advanced technology facilities (ATF) segment, while maintaining a diversified construction order book profile across various sectors, including Sunway Group's projects.
Within the ATF segment, the group secured three new data centre projects and onboarded a new international hyperscale operator in Q1 2026, further strengthening its multinational technology client base, he said.
""Sunway Construction has delivered more than 180 megawatt (MW) of data centre capacity to date and is currently managing 10 ongoing projects for global technology clients,"" said Liew.
He added that the group remains cautiously optimistic for the remainder of 2026, supported by its healthy and diversified outstanding order book of RM8.157 billion.
It remains vigilant amid evolving geopolitical developments and the spillover effects from cost escalation and supply chain disruptions.
© New Straits Times Press (M) Bhd"
