Source,Title,Link,Date,Article
New Straits Times,US Fed set to hold rates steady again on cost hikes from Mideast war,https://www.nst.com.my/business/economy/2026/04/1426487/us-fed-set-hold-rates-steady-again-cost-hikes-mideast-war,"Sun, 26 Apr 2026 12:35:11 +0800","WASHINGTON: The US central bank is widely expected to keep interest rates unchanged at its policy meeting next week, as energy prices stay high and supply chains snarled due to war in the Middle East.
The Federal Reserve's two-day meeting, starting Tuesday, could be chairman Jerome Powell's last at the helm of the independent institution.
But it takes place against a tricky backdrop. Powell's successor has faced a bumpy road to confirmation, while policymakers battle competing pressures as steeper fuel prices drive inflation and job market worries linger.
Fed officials are set to keep rates steady at a range between 3.50 per cent and 3.75 per cent, extending their pause since the start of the year.
""We still have a very high level of uncertainty on what's happening in the Middle East,"" KPMG senior economist Kenneth Kim told AFP.
Oil and gasoline prices remain elevated even if they have peaked, meaning ""there's certainly an energy shock that's still impacting both consumers and businesses,"" he said.
The Fed has a dual mandate of maintaining price stability and low unemployment. It tends to keep interest rates high to curb inflation or lower them to spur growth, meaning that current conditions pull officials in different directions.
Navy Federal Credit Union Chief Economist Heather Long expects Powell to be ""non-committal"" on the path of rates, as the full impact from the war on Iran remains unknown.
The oil price hikes came after US-Israeli strikes targeting Iran from February 28 sparked Tehran's retaliation in virtually closing the Strait of Hormuz -- a key waterway for energy transit.
- Containing inflation -
Fed officials will likely focus more on containing inflation than the jobs market this meeting, with the war entering its ninth week.
The strait is also a key passage for fertilizers, and disruptions threaten to hit food production.
Already, US consumer inflation reached its highest level in nearly two years in March at 3.3 per cent as energy costs rocketed.
Fed Governor Christopher Waller, who earlier backed lower rates to support employment, indicated this month that a prolonged conflict could make it hard for the central bank to cut rates this year.
If there were high inflation and a weak labor market, one would have to balance risks on both sides.
This ""may mean maintaining the policy rate at the current target range if the risks to inflation outweigh those to the labor market,"" he told an Alabama event.
KPMG's Kim said solid hiring recently ""gives the Fed some cushion"" to temporarily focus more on prices.
Analysts will monitor if the Fed signals in its post-meeting statement that rate hikes are a possibility.
- 'Critical juncture' -
The Fed is also taking its next steps under intense political scrutiny.
President Donald Trump has made no secret of his wish for lower interest rates, and regularly slammed Powell for not cutting them aggressively.
Beyond rhetoric, Trump has sought to oust Fed Governor Lisa Cook over claims of mortgage fraud. The Supreme Court is set to rule on whether he can fire her.
Meanwhile, Trump's choice of new Fed chairman -- Kevin Warsh -- has faced a bumpy road to confirmation.
Republican senator Thom Tillis on the Senate Banking Committee vowed to block Fed appointments until a Justice Department probe into the Fed and Powell is resolved, setting up a potential impasse on the panel Warsh needs to clear.
But the Department of Justice said Friday it would drop the investigation linked to renovation costs overruns, potentially paving the way for Warsh's ascendance.
Asked by journalists Saturday about the DOJ's move, Trump said he still wants to look into the cost of the Federal Reserve building renovations, which he has claimed is too high.
""I tell you, I want to find out. I have an obligation to find out,"" he said.
Warsh has repeatedly pledged to remain independent if confirmed.
""We're at a critical juncture for the Fed,"" EY-Parthenon chief economist Gregory Daco told AFP.
""It may be that under Warsh, we're going to see less Fed transparency, less Fed communication than we had in the past,"" he said, referring to Warsh's confirmation hearing testimony.
Powell's chairman term expires May 15, and he originally intended to stay on the Fed's board of governors until the probe on him is completed.
All eyes are on his future plans at his scheduled press briefing Wednesday.
© New Straits Times Press (M) Bhd"
New Straits Times,Trump says shooting won't 'deter' him from Iran war,https://www.nst.com.my/world/world/2026/04/1426485/trump-says-shooting-wont-deter-him-iran-war,"Sun, 26 Apr 2026 12:33:15 +0800","WASHINGTON: US President Donald Trump said Saturday a shooting at the White House correspondents dinner would not deter him from the Iran war, although he believed the incident was unlikely to be linked to the conflict.
""It's not going to deter me from winning the war in Iran. I don't know if that had anything to do with it, I really don't think so, based on what we know,"" Trump told reporters in a briefing at the White House after the security incident.
Trump had earlier said, however, that ""you never know"" if it could be linked to the Iran war, and said investigators were working on the motive of the shooter whom he described as a ""lone wolf.""
The US leader earlier Saturday cancelled his envoys' trip to Pakistan for peace talks with Iran, after being unimpressed with Teheran's negotiating position following nearly two months of war.
© New Straits Times Press (M) Bhd"
New Straits Times,"Student, 17, rescued after falling into 7m-deep school well",https://www.nst.com.my/news/regional/2026/04/1426483/student-17-rescued-after-falling-7m-deep-school-well,"Sun, 26 Apr 2026 12:30:49 +0800","TUMPAT: A 17-year-old student sustained head and body injuries after falling into a seven-metre-deep well at his school in Wakaf Bharu here today.
Wakaf Bharu Fire and Rescue Station operations commander Azmi Sulaiman said the department received an emergency call regarding the incident at 9.12am.
""Six firemen were deployed to the scene and arrived 11 minutes later.
""Upon arrival, they found the victim trapped inside the well and immediately initiated a rescue operation using specialised equipment, including ropes and a rescue ladder,"" he said.
Azmi said firemen took more than 20 minutes to extricate the student from the well.
""The operation was completed around 10am. The victim suffered minor injuries and was sent for treatment,"" he said.
The victim, identified as Wan Ahmad Mukhlis Wan Md Fadhli, was reportedly sitting on a concrete slab covering the well when the incident occurred.
The slab is believed to have cracked as it could not support the victim's weight, causing him to plunge into the well.
The well was previously used as a groundwater source by the school but has long been abandoned.
© New Straits Times Press (M) Bhd"
New Straits Times,Six passengers injured evacuating from Swiss Air flight in India,https://www.nst.com.my/world/world/2026/04/1426481/six-passengers-injured-evacuating-swiss-air-flight-india,"Sun, 26 Apr 2026 12:30:08 +0800","BENGALURU: Six passengers were injured and hospitalised after a Swiss Air flight from Delhi to Zurich aborted takeoff and was evacuated on the runway at the Indira Gandhi International Airport early Sunday, the Economic Times reported.
The incident occurred when one of the aircraft's engines failed and caught fire during the takeoff roll, prompting the crew to stop the aircraft and initiate an emergency evacuation, the report said.
© New Straits Times Press (M) Bhd"
New Straits Times,#NSTviral: Hit-and-run caught on video in Jalan Templer traffic,https://www.nst.com.my/news/nst-viral/2026/04/1426479/nstviral-hit-and-run-caught-video-jalan-templer-traffic,"Sun, 26 Apr 2026 12:27:49 +0800","KUALA LUMPUR: A viral video has surfaced showing a hit-and-run incident along Jalan Templer involving a tour bus during heavy traffic yesterday.
The 27-second clip, shared by Mynewshub+ on Facebook, shows a tour bus crashing into a silver Perodua Myvi before driving away.
The post also included images of the Myvi, with its front section severely damaged.
It is unclear whether there were any injuries or fatalities, and whether any arrests have been made in connection with the incident.
The New Straits Times is reaching out to authorities for further information.
© New Straits Times Press (M) Bhd"
New Straits Times,Fed-up traders call for protests to be held outside city centre,https://www.nst.com.my/news/nation/2026/04/1426469/fed-traders-call-protests-be-held-outside-city-centre,"Sun, 26 Apr 2026 12:01:46 +0800","KUALA LUMPUR: A group representing hawkers and petty traders has expressed frustration over rallies being held in business hotspots instead of open spaces.
Federation of Malaysian Hawkers and Petty Traders Association president Datuk Seri Rosli Sulaiman said demonstrations in city centres lead to congestion and road closures.
""I am puzzled as to why these must be held in popular areas. Why not hold them elsewhere, such as Padang Merbok or areas that do not disturb the public and traders?"" Rosli said.
He said traders are invariably affected whenever demonstrations occur near the Sogo shopping complex in Jalan Tuanku Abdul Rahman, with many reporting a drop in sales.
""People visit the area for various purposes, including buying fabric, jewellery, and daily necessities. When conditions become uncomfortable, they choose not to come,"" he said.
Yesterday, a commotion broke out at a rally held in protest of Malaysian Anti-Corruption Commission chief commissioner Tan Sri Azam Baki after
fireworks
were set off at the gathering site.
Rosli said popular public areas should remain accessible for those wishing to shop and relax.
""Friday, Saturday, and Sunday are the primary trading days when people go out to shop. These days should not be disrupted, especially when our economic situation remains uncertain.
""I hope the authorities will be firmer and ensure this does not happen again,"" he said.
© New Straits Times Press (M) Bhd"
New Straits Times,UUE Holdings RM536mil orderbook offers two-year earnings visibility,https://www.nst.com.my/business/corporate/2026/04/1426465/uue-holdings-rm536mil-orderbook-offers-two-year-earnings,"Sun, 26 Apr 2026 11:58:06 +0800","KUALA LUMPUR: UUE Holdings Bhd's outstanding orderbook of RM536.4 million is expected to provide more than two years of earnings visibility, RHB Research said.
The research house said the orderbook includes a recently secured RM16 million engineering, procurement, construction and commissioning contract.
""We view this as strategically significant as it signals UUE Holdings' ability to move up the value chain,"" it said in a note.
Meanwhile, RHB Research said a memorandum of understanding with Asean Cableship involving a potential joint venture for subsea horizontal directional drilling works has lapsed.
However, the firm is not overly concerned, as UUE Holdings can still participate in subsea tenders independently, potentially retaining full profit share compared with the previously proposed 50:50 structure.
UUE Holdings reported fourth-quarter financial year 2026 (FY26) core net profit of RM7.3 million, bringing full-year core net profit to RM22.1 million.
RHB Research said the results exceeded expectations, coming in at 106 per cent of its forecast and 110 per cent of consensus estimates, mainly driven by stronger-than-expected margins.
The research house lowered its FY27 to FY28 earnings forecasts by three per cent and 13 per cent respectively, mainly due to adjustments in orderbook recognition timing.
""That said, we maintain our RM320 million annual contract replenishment assumption, which we believe is achievable given UUE Holdings' strong positioning in Tenaga Nasional Bhd-related projects,"" it said.
RHB Research maintained its ""Buy"" call on the stock with a target price of 48 sen.
© New Straits Times Press (M) Bhd"
New Straits Times,Rising resin costs to weigh on Southern Cable,https://www.nst.com.my/business/corporate/2026/04/1426463/rising-resin-costs-weigh-southern-cable,"Sun, 26 Apr 2026 11:56:20 +0800","KUALA LUMPUR: Southern Cable Group Bhd is expected to face margin pressure in the second half of 2026 as rising polyethylene prices weigh on Malaysian cable manufacturers, Hong Leong Investment Bank Bhd (HLIB) said.
The firm said Southern Cable's margins are likely to remain steady in the first half of the year, with any compression skewed towards the second half.
""Southern Cable has polyethylene inventory coverage until June 2026, in line with peers, with the next Tenaga procurement cycle for July to September to be locked in from June onwards.
""This should keep first-half margins stable before higher input costs begin flowing through in the second half of 2026,"" it said in a note.
HLIB said its sensitivity analysis showed that every one per cent increase in polyethylene prices would trim gross profit margin by about 0.06 percentage point.
It noted that plastic costs for long-term contracts were locked in during 2024 at relatively elevated levels.
""The recent price increases were still below those levels and should moderate margins versus financial year 2025 rather than push the segment into losses,"" it said.
However, HLIB said a repeat of the 2022 margin squeeze, which saw the company's net margins contract sharply during a high polyethylene price environment, was unlikely.
It said this was due to structurally improved operating conditions.
""In any case, our conservative earnings forecasts provide a buffer if margins erode in the second half of 2026.
""Our back-of-the-envelope calculations suggest polyethylene prices would need to rise by another 10 per cent before challenging our margin assumptions.
""All in, we maintain our Buy call with an unchanged target price of RM2.59,"" it added.
© New Straits Times Press (M) Bhd"
New Straits Times,Immigration officer among 10 held in 'Ops Toyu' smuggling syndicate bust,https://www.nst.com.my/news/nation/2026/04/1426462/immigration-officer-among-10-held-ops-toyu-smuggling-syndicate-bust,"Sun, 26 Apr 2026 11:56:18 +0800","ALOR STAR: A senior Immigration officer and a Thai agent were among 10 people detained following an operation at the Bukit Kayu Hitam Immigration, Customs, Quarantine and Security (ICQS) complex yesterday.
The 12.50pm operation, dubbed ""Ops Toyu"", was conducted by a special task force from the Putrajaya Immigration Department's Intelligence and Operations Division, with support from Kedah Immigration and the Border Control and Protection Agency (MCBA).
Immigration officials said the syndicate, which has been active since early this year, is estimated to have caused a RM4.1 million leakage in national revenue.
In a statement, the department said investigations revealed the syndicate's modus operandi involved smuggling prohibited immigrants, primarily from India, across the land border.
A ""transporter"" posing as a taxi driver would ferry the foreigners from Thailand into Malaysia to evade suspicion.
Upon reaching the border, the senior officer acting as a ""facilitator"" would endorse the passports despite the individuals failing the entry requirements.
The syndicate allegedly charged RM1,000 per person, with RM400 paid to the officer for every passport endorsed.
During the raid, authorities arrested the senior officer, the Thai agent, two local men, one of whom acted as a transporter, five Indian nationals, and one Pakistani man.
One of the Indian nationals was found to be on a blacklist, while the Pakistani man possessed a suspected forged e-visa.
Officers seized six passports, Malaysian and Thai border passes, an immigration security stamp, 12 mobile phones, and 30,000 Indian Rupees.
A Nissan Sentra and two motorcycles were also impounded.
Three suspects are being investigated under Section 26A of the Anti-Trafficking in Persons and Anti-Smuggling of Migrants (Atipsom) Act 2007, while one local man is held under Section 26J of the same Act.
The foreign nationals are being investigated under the Immigration Act 1959/63 for various offences. Four other locals have been issued notices to assist in the investigation.
© New Straits Times Press (M) Bhd"
New Straits Times,"Immigration busts syndicate using layered transit route via Singapore, Thailand",https://www.nst.com.my/news/regional/2026/04/1426459/immigration-busts-syndicate-using-layered-transit-route-singapore,"Sun, 26 Apr 2026 11:53:46 +0800","KUALA LUMPUR: The Immigration Department has busted an Indonesian migrant smuggling syndicate that used a complex, multi-layered transit route involving Singapore and Thailand to evade Malaysian authorities.
The operation was carried out by officers from the Anti-Trafficking in Persons and Anti-Smuggling of Migrants (Atipsom) and Anti-Migrant Labour Abuse (Amla) Prevention Division at the Immigration Headquarters in Putrajaya.
In a statement, the department said the operation, conducted yesterday, led to the arrest of 10 Indonesian migrants and two transporters, aged between 27 and 60, at Terminal Bersepadu Gombak and Terminal Bersepadu Selatan.
A Mazda CX-5, believed to have been used to transport the migrants, was also seized during the raids. Authorities were alerted to the group's arrival in Klang Valley from Kelantan via express bus.
""Preliminary investigations revealed that the syndicate had shifted its modus operandi from using sea routes in Selangor waters to a more complex, layered approach involving both air and land routes to throw off enforcement agencies.
""The syndicate also avoided direct flights into Malaysia, as many of the migrants involved were believed to have been blacklisted from entering the country,"" the statement said.
Migrants reportedly travelled from Indonesia to Singapore or via Kuala Lumpur International Airport as transit points before flying to Hat Yai, Thailand.
From Hat Yai, they were moved to transit houses before entering Kelantan through illegal routes in Bukit Bunga, Tanah Merah. Once in Kelantan, the migrants were transported to Kuala Lumpur using various overnight express bus services to avoid detection.
The department added that the syndicate charged each migrant between RM3,500 and RM4,000 to facilitate illegal entry into Malaysia.
""Each agent plays a specific role, including managing migrant arrivals, arranging transit accommodation, and forging entry stamps in passports to mislead authorities.
""This layered network structure is designed to separate and isolate information links between migrants and syndicate members, making detection more difficult,"" the department said.
The department also believes locals assisted the syndicate with logistics and bus ticket purchases, and is working to track down those involved based on intelligence.
The suspects are being held at an Immigration Detention Depot for investigation under the Act 670 of the Anti-Trafficking in Persons and Anti-Smuggling of Migrants (Atipsom) Act 2007 and Act 155 of the Immigration Act 1959/63.
© New Straits Times Press (M) Bhd"
New Straits Times,"China FM tells Myanmar leader Beijing will back its security, sovereignty",https://www.nst.com.my/world/region/2026/04/1426456/china-fm-tells-myanmar-leader-beijing-will-back-its-security,"Sun, 26 Apr 2026 11:51:06 +0800","BEIJING:  China's top diplomat Wang Yi said Beijing will ""firmly support"" Myanmar in safeguarding its national sovereignty and security, in a meeting with junta chief-turned-president Min Aung Hlaing.
Wang has been on a three-country visit to Southeast Asia this week, travelling to Cambodia, Thailand and Myanmar, seeking to strengthen ties in the face of ""risks"" and present Beijing as a more stable alternative to the United States.
Beijing supports Myanmar ""in forging a successful development path that aligns with its national conditions and enjoys the support of its people"", Wang told Min Aung Hlaing during a visit to capital Naypyidaw, according to a Chinese foreign ministry readout published late Saturday.
""As this year marks the first year of the new Myanmar government's tenure, both sides should seize this opportunity to carry forward and promote their traditional friendship, (and) open up new prospects for bilateral relations,"" Wang said.
Min Aung Hlaing was sworn in as president this month, continuing his rule from a civilian post five years after snatching power in a military coup.
The parliamentary ceremony where he was sworn in was attended by representatives including from China, which analysts say was the junta-backed election's biggest supporter.
Democracy watchdogs have described the tightly controlled election that concluded in January as an effort to rebrand military rule, with voting not taking place in swathes of the country controlled by rebels who are fighting the military and rejected the poll.
China, Wang added, was also willing to cooperate with Myanmar to ""resolutely and thoroughly eradicate the scourge"" of online gambling and telecommunications fraud.
Myanmar has emerged as a hotspot for cyberscam operations in recent years.
Transnational crime groups initially mostly targeted Chinese speakers before widening their reach and stealing tens of billions of dollars annually from victims around the world.
© New Straits Times Press (M) Bhd"
New Straits Times,Malaysia Smelting prospects bright on tin rally,https://www.nst.com.my/business/corporate/2026/04/1426454/malaysia-smelting-prospects-bright-tin-rally,"Sun, 26 Apr 2026 11:46:09 +0800","KUALA LUMPUR: Malaysia Smelting Corp Bhd is poised for stronger earnings growth amid expectations of elevated tin prices and improving mining operations, Public Investment Bank Bhd (PublicInvest) said.
Following a recent site visit to Malaysia Smelting's Rahman Hydraulic Tin (RHT) open-pit mine, the research house said optimism was also supported by steady gains in operational efficiency and recovery rates.
""Although production costs are expected to increase, largely due to higher diesel prices, this is expected to be offset by higher selling prices.
""Each one-ringgit increase in diesel price is estimated to raise production cost by US$1,000 per tonne, while tin prices are trading at around US$50,000 per tonne,"" it said.
Meanwhile, PublicInvest said the commissioning of the company's new tin tailing scavenging plant is set to lift daily tin concentrate production to 14 tonnes from 11 tonnes previously.
It said the company is investing RM10 million to install a new rotary furnace at RHT, with completion expected in the third quarter of 2026.
""The furnace will process 10 tonnes of tin per day, enabling on-site conversion of ore into crude tin.
""This will reduce haulage volume, logistics costs and overall transportation complexity, while improving operational efficiency,"" it said.
PublicInvest maintained its ""Outperform"" call on Malaysia Smelting with an unchanged target price of RM2.60.
""We maintain our view that the company is in a strategic position to play a more important role in this field should opportunities arise in the future,"" it added.
© New Straits Times Press (M) Bhd"
New Straits Times,"Simultaneous Melaka, Johor polls could save millions, says analyst",https://www.nst.com.my/news/nation/2026/04/1426450/simultaneous-melaka-johor-polls-could-save-millions-says-analyst,"Sun, 26 Apr 2026 11:32:24 +0800","PUTRAJAYA: Holding the Melaka and Johor state elections simultaneously could save millions in taxpayer funds due to the proximity of the two states, an analyst said.
Universiti Malaya political analyst Dr Mohammad Tawfik Yaakub said combined polls would allow for more organised logistics for both government machinery and political parties.
The Melaka and Johor state assemblies are set to dissolve automatically on Dec 27, 2026, and April 21, 2027, respectively.
By law, the Election Commission (EC) must hold an election within 60 days of a dissolution. This means the Melaka state election must be held by late February 2027, while Johor's must take place by June 2027, should both assemblies reach their full terms.
However, elections could be held simultaneously or in close succession if the assemblies are dissolved around the same time.
""Party machineries would not need to be deployed twice to the south, and party workers and government agencies could perform their duties for both states within a short period,"" Tawfik said.
He added that supporters and workers from afar would also avoid doubling their travel costs.
Universiti Teknologi Malaysia Perdana Centre associate professor Dr Mazlan Ali shared a similar view, noting that simultaneous elections would help conserve resources during a period of global energy crises.
He said holding elections for a single state involves high costs, whereas the EC could save money if two states went to the polls together.
""If held separately, costs would certainly increase as the EC would need to mobilise its staff and resources on multiple occasions,"" he said.
© New Straits Times Press (M) Bhd"
