Source,Title,Link,Date,Article
New Straits Times,New Zealand PM survives leadership vote,https://www.nst.com.my/world/world/2026/04/1423378/new-zealand-pm-survives-leadership-vote,"Wed, 22 Apr 2026 06:00:31 +0800","Your browser does not support the audio element.
Prime Minister Christopher Luxon survived a leadership vote yesterday after a run of poor polls stoked speculation about his future.
The centre-right National Party leader called the vote as his government languished in opinion polls ahead of November's general election.
Luxon said after a nearly three-hour meeting with his party caucus that he still had the support of his party.
""I moved a formal motion of confidence in my leadership,"" said Luxon. ""That motion was passed confirming what I have been saying — I have the support of my caucus as their leader.""
Luxon did not say by what margin he won the vote, but claimed he had the unanimous support of his members of parliament.
The final vote count was kept secret, even from Luxon.
Only party members who attended the caucus meeting were allowed to vote. Several members were unable to attend because of bad weather, which cancelled many flights into the capital here.
Questions about Luxon's leadership have been mounting in recent months as his party dipped below 30 per cent in opinion polling.
His personal approval rating has also plummeted.
Media reports suggested last week that several members of Luxon's caucus were unhappy with his leadership, with some lawmakers unlikely to return to parliament on current polling.
Luxon said speculation about his future was a ""media soap opera"".
""If the media want to keep focusing on speculation and rumour, I am not going to engage,"" he said.
Transport Minister Chris Bishop was rumoured to have considered usurping Luxon as leader late last year, but said he had voted for Luxon after a ""good, honest, robust"" discussion.
""Now, we move forward together, united as a team,"" said Bishop.
Finance Minister and deputy National leader Nicola Willis said the ""caucus sent an emphatic message"".
Foreign Minister Winston Peters, leader of the populist New Zealand First, said the confidence vote was ""egotistical rubbish"".
© New Straits Times Press (M) Bhd"
New Straits Times,Vance delays expected departure for Iran talks amid White House meetings,https://www.nst.com.my/world/world/2026/04/1423370/vance-delays-expected-departure-iran-talks-amid-white-house-meetings,"Wed, 22 Apr 2026 01:55:32 +0800","WASHINGTON: Vice President JD Vance, expected to lead a US delegation at upcoming negotiations with Iran in Pakistan, was still in Washington midday Tuesday to participate in meetings, the White House said.
""Additional policy meetings are taking place at the White House in which the vice president will participate,"" an official said in a brief statement sent to AFP shortly after 1700 GMT.
The official did not provide further details. But Vance's departure – which has been the subject of contradictory announcements – was scheduled for Tuesday morning, according to recent reports.--AFP
© New Straits Times Press (M) Bhd"
New Straits Times,Iran confirms US truce expiry time as tensions remain over deadline,https://www.nst.com.my/world/world/2026/04/1423365/iran-confirms-us-truce-expiry-time-tensions-remain-over-deadline,"Wed, 22 Apr 2026 01:43:56 +0800","TEHERAN: Iranian state TV said a ceasefire with the United States in force since April 8 would expire at 3.30am Wednesday, Teheran time (0000 GMT Tuesday).
The timing is consistent with when the 14-day truce went into effect, though US President Donald Trump recently said it would end a day later, on Wednesday evening Washington time.
Mediator Pakistan had said earlier in the day that the ceasefire would expire at 2350 GMT on Tuesday.
""Ceasefire ends at 4.50am PST, 22 April,"" Information Minister Attaullah Tarar posted on X, referring to Pakistan Standard Time.
Trump had given the Wednesday evening end date in comments to Bloomberg, and said it was ""highly unlikely"" he would agree to extend the truce.
Pakistan has invited the warring sides to a second round of talks in Islamabad, but Iran has yet to formally respond, Tarar said.
He added that a decision by Teheran was ""critical"" before the truce expired.
Shortly thereafter, Iranian foreign ministry spokesman Esmaeil Baqaei said a final decision on participating still hadn't been made.
""The reason for this is not indecision; the reason for this situation is that we are faced with contradictory messages, contradictory behaviours, and unacceptable actions from the American side,"" he said.--AFP
© New Straits Times Press (M) Bhd"
New Straits Times,"'It's like solving a puzzle,' says Immigration intelligence director on Pakistani fugitive recapture",https://www.nst.com.my/news/nation/2026/04/1423361/its-solving-puzzle-says-immigration-intelligence-director-pakistani,"Wed, 22 Apr 2026 01:41:40 +0800","KUALA LUMPUR: It is like solving a puzzle built from scattered intelligence pieces.
This was how Immigration Department Intelligence and Special Operations Division director Mohd Anas Mohd Dzarib described the operation to recapture a Pakistani fugitive who escaped on April 9 during a transfer at Sungai Buloh Prison.
In an interview with Tanah Berdaulat TV, Anas detailed to host Syahril A. Kadir how the effort to recapture the foreigner after almost nine days on the run relied on layered information gathering, media analysis, location tracking, and field intelligence.
""We cross-checked all the 'raw' information received from agencies and informants with our system.
""The information came in small pieces, like a puzzle, until the day we pinpointed the location of the subject,"" he said.
After being given the green light from Immigration Department director-general Datuk Zakaria Shaaban to assist with the manhunt, Anas said his division sprinted into action, checking all the information at their disposal including the Malaysia Digital Arrival Card (MDAC), which contained initial information on the foreigner's accommodation when he first arrived in the country in January last year.
This led his men to the address listed in the MDAC, but monitoring on April 11 and 12 showed no movement at the location, with local residents confirming the suspect was no longer there.
After receiving fresh intelligence, his division shifted focus to other areas such as Ampang and Gombak, known to be frequented by Pakistanis and located between 25km and 30km from the location where the fugitive escaped.
""Based on his facial features and other information, we finally identified that the subject is of Pashtun origin.
""This piece of information helped us narrow our search and scope in our pursuit to locate the subject (the fugitive),"" he said.
Anas said the operation reached a breakthrough on the day of the arrest on April 18 but with some hurdles, especially in the process of building trust with their multi-layered informants.
The team, he said, moved to the location as early as 8am and met the first informants.
""After building trust with him, he brought us to the second informant located between 5km and 6km away.
""However, the process of building trust with the second-layer informant took time, and it was only about 3pm that they contacted us again, bringing us to the exact location (where the subject was hiding),"" he said.
He said the team had already planned to lure the suspect out from a forested area before moving in for the arrest.
""When he came out, we moved in quickly and brought him into the vehicle as the location (of the arrest) was by the roadside,"" he said.
Anas said there was a brief struggle inside the vehicle as the suspect attempted to escape.
He also believed that difficulties in finding resources, especially food, might have compelled the suspect to come out from his hiding place.
""He appeared thin, possibly due to lack of resources,"" he said.
Anas also revealed that preliminary investigations showed the subject moved mainly on foot, with only one instance of him hitching a ride on a motorcycle.
During the period, the suspect survived by hiding in
forested areas
during the day and moving to construction sites at night in search of food and shelter.
During the interview, Anas also thanked all the agencies involved in the operation, the Pakistan High Commission, as well as the people who had helped with locating the subject.
It was reported the foreigner
escaped
during a transfer at Sungai Buloh Prison after attending court proceedings at the Shah Alam Court on April 9. He was being held for offences including robbery and the sexual assault of a minor.
The escaped detainee was
recaptured
along Batu 14, Jalan Gombak Lama about 5pm on April 18.
© New Straits Times Press (M) Bhd"
New Straits Times,Tensions flare as Israel hits Hizbollah position after cross-border rocket fire,https://www.nst.com.my/world/world/2026/04/1423359/tensions-flare-israel-hits-hizbollah-position-after-cross-border-rocket,"Wed, 22 Apr 2026 01:36:52 +0800","JERUSALEM: The Israeli military said it struck a Hizbollah rocket launcher on Tuesday after the Iran-allied group fired at troops in southern Lebanon.
""A short while ago, the Hizbollah organisation launched several rockets toward IDF soldiers operating south of the Forward Defence Line, in the area of Rab Thalathin in southern Lebanon,"" a military statement said, referring to the boundary marking the area occupied by Israeli forces.
""In response, the IDF struck the launcher from which the rockets were launched,"" it added.
The military also said sirens had sounded in two northern Israeli communities after a drone fired from Lebanon was intercepted before crossing into Israeli territory.
It called the launches a ""blatant violation of the ceasefire agreement"" in effect since Friday.
Israel has conducted airstrikes across Lebanon and invaded the country's south after Hizbollah entered the Middle East war in support of its backer Iran on March 2.
Despite the truce, Israeli troops are still present and actively fighting Hizbollah in Lebanon's south.
Israel and Lebanon are still engaged in talks under US mediation to prolong the current truce.
The two-week ceasefire between the US and Iran looms in the background of talks, with the truce set to expire overnight with no new deal yet struck.--AFP
© New Straits Times Press (M) Bhd"
New Straits Times,"Golden Dome, drones and warships: Trump sets US$1.5 trillion defence spending plan",https://www.nst.com.my/world/world/2026/04/1423357/golden-dome-drones-and-warships-trump-sets-us15-trillion-defence,"Wed, 22 Apr 2026 01:30:40 +0800","WASHINGTON: The Pentagon on Tuesday unveiled more details of President Donald Trump's US$1.5 trillion defence budget request for fiscal year 2027, by far the largest year-over-year increase in defence spending in the post-World War Two era.
In a new wrinkle, the Pentagon has created a category it is calling ""presidential priorities,"" covering Golden Dome missile defence, drone dominance, artificial intelligence and data infrastructure, and the defence industrial base, Pentagon officials told reporters.
Last year, Trump asked Congress for a national defence budget of US$892.6 billion then added US$150 billion through a supplemental budget request, sending the total price ​tag over US$1 trillion for the first time in history.
On shipbuilding, the budget includes over US$65 billion to procure 18 warships and 16 support ships made by General Dynamics and Huntington Ingalls Industries as part of what the Pentagon is calling the ""Golden Fleet"" initiative, the largest shipbuilding request since 1962, the officials said.
The budget ramps up Lockheed Martin F-35 procurement to 85 aircraft per year and includes US$102 billion for aircraft procurement and research and development, a 26 per cent increase over the prior year, the officials said. Development of next-generation systems like the Boeing Co F-47 fighter jet is also a priority, while US$6.1 billion is requested for Northrop Grumman's B-21 bomber.
On drones, senior officials described the request as the largest investment in drone warfare and counter-drone technology in US history. The budget requests US$53.6 billion for autonomous drone platforms and warzone logistics, along with US$21 billion for munitions, counter-drone technologies and advanced systems.
The Defence Autonomous Warfare Group, which previously received roughly US$225 million, would see its funding balloon to approximately US$54 billion. Senior officials said the vast bulk of that money is aimed at applying technology that exists today, not long-range basic research, and confirmed the group has effectively absorbed the Pentagon's earlier Replicator drone initiative.
The budget proposes multi-year procurement contracts for more munitions programs, arguing longer contracts give both large defence firms and their small and medium-sized suppliers the stability needed to expand production.
The request includes a pay raise weighted toward junior enlisted troops, getting a 7 per cent increase, 6 per cent for their superiors and 5 per cent for the top ranks. The budget also proposes expanding the force by 44,000 additional service members in fiscal 2027, following the addition of more than 20,000 in fiscal 2026.
Notably, the budget does not include funding for the conflict with Iran. A senior Pentagon official said the timing of the appropriations process means a supplemental budget request will likely be needed to address near-term operational costs and replenishment needs arising from the conflict.
The Pentagon's US$1.5 trillion total is split between a US$1.15 trillion funding request, and a US$350 billion supplemental budget request - requiring the passage of a reconciliation bill akin to a format used last year. --REUTERS
© New Straits Times Press (M) Bhd"
New Straits Times,US intercepts sanctioned oil tanker between Sri Lanka and the Strait of Malacca,https://www.nst.com.my/world/world/2026/04/1423355/us-intercepts-sanctioned-oil-tanker-between-sri-lanka-and-strait,"Wed, 22 Apr 2026 01:21:56 +0800","WASHINGTON: The US Defence Department said Tuesday that its forces intercepted and boarded a ""stateless sanctioned"" vessel as part of Washington's efforts against networks that provide support to Iran.
""Overnight, US forces conducted a right-of-visit, maritime interdiction and boarding of the stateless sanctioned M/T Tifani without incident in the INDOPACOM area of responsibility,"" the department posted on its X page.
The statement said the United States was determined ""to disrupt illicit networks and interdict sanctioned vessels providing material support to Iran – anywhere they operate.""
The exact location of the operation was not made clear. INDOPACOM is the US Indo-Pacific Command, which oversees a broad region that includes the Pacific and Indian oceans.
The Tifani is a ""Botswana-flagged tanker,"" according to the intelligence firm Vanguard Tech, which said the vessel was intercepted in the Indian Ocean.
Its last signal was detected on Tuesday halfway between Sri Lanka and the Strait of Malacca, according to the maritime tracking website Marine Traffic.
""International waters are not a refuge for sanctioned vessels,"" the Pentagon said in its post, which included video footage showing helicopters hovering just above a large, bright orange tanker.
AFP has identified the vessel as one affiliated with Iranian activity.
According to energy intelligence firm Kpler, the vessel had loaded approximately two million barrels of crude on Iran's Kharg Island on April 5 and passed through the Strait of Hormuz on April 9. Its tracking signal indicated it was heading toward Singapore.
The Tifani has in recent years carried out numerous ship-to-ship oil transfers off Singapore and Malaysia and made multiple round trips between this area and destinations including Iran and China.
US President Donald Trump has vowed to maintain a blockade on Iran ""until there is a deal"" to end the war.
On Monday, however, maritime data firm Lloyd's List Intelligence said ""at least 26 ships from Iran's ghost fleet [had] circumvented the US blockade"" since it was imposed last week.
Doubts remained Tuesday regarding whether a second round of negotiations between Teheran and Washington would take place in Islamabad.--AFP
© New Straits Times Press (M) Bhd"
New Straits Times,Israeli army jails soldiers for vandalising Jesus statue in Lebanon,https://www.nst.com.my/world/world/2026/04/1423353/israeli-army-jails-soldiers-vandalising-jesus-statue-lebanon,"Wed, 22 Apr 2026 01:12:07 +0800","JERUSALEM: The Israeli military on Tuesday said two soldiers would receive 30 days of military detention and be removed from combat duty over the destruction of a statue of Jesus Christ in southern Lebanon.
The decision comes after widespread condemnation of a photo shared online showing an Israeli soldier using a sledgehammer to strike the head of a statue of a crucified Jesus that had fallen off a cross.
The sculpture was located in the Christian village of Debl in south Lebanon, near the border with Israel.
Publishing the conclusions of an inquiry into the incident, the military said ""the soldier who damaged the Christian symbol and the soldier who photographed the act will be removed from combat duty and will receive 30 days of military detention.""
It said six additional soldiers who ""were present at the scene and did not act to stop the incident or report it"" had been summoned for ""clarification discussions.""
Israel has conducted airstrikes across Lebanon and invaded the country's south after Hizbollah entered the Middle East war in support of its backer Iran on March 2.
The fighting has killed more than 2,400 people and displaced more than a million, with the death toll continuing to rise even after a ceasefire came into effect last week as more bodies are found under the rubble.
Israel has lost 15 soldiers in the war.
""The inquiry determined that the soldiers' conduct completely deviated from IDF orders and values,"" the military statement said. It added that ""its operations in Lebanon are directed solely against the Hizbollah organisation and other groups, and not against Lebanese civilians.""
In a post on X, the Israeli military said the damaged sculpture in Debl was replaced by troops ""in full coordination with the local community"", sharing a photo of a new crucifix statue.
Israeli Prime Minister Benjamin Netanyahu had said on Monday he was ""stunned and saddened to learn that an IDF soldier damaged a Catholic religious icon in southern Lebanon"", vowing ""harsh disciplinary action against the offender.""--AFP
© New Straits Times Press (M) Bhd"
New Straits Times,"Israeli settler gunfire kills two Palestinians, including 14-year-old boy",https://www.nst.com.my/world/world/2026/04/1423350/israeli-settler-gunfire-kills-two-palestinians-including-14-year-old,"Wed, 22 Apr 2026 00:53:57 +0800","RAMALLAH: The Palestinian Authority said Israeli settler gunfire killed two Palestinians, including a 14-year-old boy, on Tuesday in the central occupied West Bank, while the Israeli military said it was reviewing the incident.
An AFP photographer saw the bodies at the morgue of the hospital in Ramallah where they were taken soon after the incident.
""Two martyrs were killed by settler gunfire in Al-Mughayyir, east of Ramallah... and three others were injured,"" the Palestinian health ministry said, confirming the deaths previously reported by the Red Crescent.
The health ministry identified the dead Palestinians as 14-year-old Aws Hamdi Al-Naasan and 32-year-old Jihad Marzouq Abu Naim, both from Al-Mughayyir.
At the hospital, distraught and weeping relatives crowded around the bodies, which were draped in Palestinian flags.
The Israeli military said it was ""aware of the claim regarding two Palestinians who were killed, and additional injuries"" in Al-Mughayyir and added that the circumstances of the incident were under review.
It said soldiers were dispatched to the area ""following a report of rock hurling towards an Israeli vehicle carrying several civilians, including a reserve soldier, who exited the vehicle and opened fire at suspects in the area.""
It said troops arrived at the scene and ""acted to disperse the violent confrontation"", without providing further details.
- 'INTENT TO CAUSE HARM' -
The mayor of Al-Mughayyir, Amin Abu Alia, told AFP by phone that Tuesday's shooting took place near the local boys' school.
He said he arrived at the scene at around 11.45am, just after the shooting began and saw at least 10 settlers and between five and seven Israeli soldiers.
""The attack took place at the entrance to the village; there are no Israeli civilians, no settlements and no Israeli roads. Any settler who reaches this area does so with the intent to cause harm,"" he said.
Kazem Al-Hajj Mohammad, a village resident who said he witnessed the incident, told AFP outside the hospital that ""settlers attacked the school and began firing live ammunition at it.""
""The army then immediately joined them, opening fire as we were trying to evacuate the students,"" he said.
In a post on X that included a photo of the slain teenager, the office of Palestinian prime minister Mohammad Mustafa asked: ""How many more lives must be lost before this ends?""
An AFP journalist saw several dozen men chant violent anti-Jewish slogans as they left the hospital carrying the two bodies.
The recent surge in settler attacks against Palestinian civilians in the West Bank has drawn criticism from Israel's opposition.
They accuse the government of Prime Minister Benjamin Netanyahu and his far-right allies of turning a blind eye to acts of ""Jewish terrorism"" in the Palestinian territory or even of supporting them.
Israel has occupied the West Bank since 1967 and violence there has risen sharply since the Oct 7, 2023 Hamas attack on Israel that triggered the Gaza war.
According to an AFP tally based on Palestinian health ministry figures, Israeli troops or settlers have killed at least 1,064 Palestinians – many of them fighters, but also scores of civilians – in the West Bank since the start of the Gaza war.
Official Israeli figures say at least 46 Israelis, including soldiers and civilians, have been killed in Palestinian attacks or during Israeli military operations in the same period.--AFP
© New Straits Times Press (M) Bhd"
New Straits Times,Mexico pyramid shooting was 'planned' attack,https://www.nst.com.my/world/world/2026/04/1423348/mexico-pyramid-shooting-was-planned-attack,"Wed, 22 Apr 2026 00:43:58 +0800","MEXICO CITY: Mexican security officials said Tuesday that a recent shooting at the world-famous Teotihuacan pyramids that left one person dead and 13 others wounded ""wasn't spontaneous.""
As authorities grappled with the security breach that occurred just weeks before Mexico hosts several World Cup football matches beginning in June, President Claudia Sheinbaum called for tighter gun controls at tourist areas.
The suspect, identified as 27-year-old Mexico City resident Julio Cesar Jasso Ramirez, ""made preliminary visits on multiple occasions to the archaeological site, stayed in hotels near the site ahead of time, and from there planned his violent acts,"" Mexico State Prosecutor Jose Luis Cervantes Martinez told reporters.
The Mexican attacker shot dead a Canadian and then died by suicide on the pyramid – less than an hour's drive from Mexico City – after military operatives approached and began to engage him.
At least 13 people were injured as they fled the chaos, including some who suffered gunshot wounds.
Following the shooting, Sheinbaum on Tuesday urged that gun controls be tightened at tourist sites.
""We need to have better security to make sure someone can't enter an archaeological site, a tourist site, with a firearm,"" she said at her morning press conference, barely seven weeks before Mexico City hosts the World Cup's opening match on June 11.--AFP
© New Straits Times Press (M) Bhd"
New Straits Times,Chinese automaker Chery targets Europe with 'French-designed' small EV,https://www.nst.com.my/news-cars-bikes-trucks/2026/04/1423346/chinese-automaker-chery-targets-europe-french-designed-small,"Wed, 22 Apr 2026 00:39:30 +0800","PARIS: Chinese carmaker Chery said Tuesday it wants to manufacture a small electric vehicle in Europe for the European market.
""We want to build a French car for the French,"" Chery France's director Yanbang Yu told AFP.
Chery is China's third-largest carmaker, but it has long been China's top exporter, selling abroad half of its 2.8 million vehicles it manufactured last year.
But it has only recently begun to sell cars in Europe, where it lags behind Chinese rival SAIC which sells cars in the region under the historic British badge MG.
Chery has been boosting the sales network of its Jaecoo and Omoda brands in Europe, which launched in France this month.
To reinforce its European operations, Chery has decided to install a research and development centre in Paris ""to work on a small city car, because France would be a very big market for this little car, and the best way is to design it in France,"" said Lionel French Keogh, Chery's commercial director in France.
""We want to learn what French consumers' tastes are, and we want a small, beautiful design,"" added Yu.
Chery has already begun assembling hybrid cars in Spain at a former Nissan plant, selling them under the Ebro brand.
It aims to raise production to 200,000 cars per year within three years and is looking at acquiring other manufacturing sites in Europe.
Spain and Hungary have been popular among Chinese companies looking to begin battery and car production in Europe to escape EU tariffs on imported vehicles.--AFP
© New Straits Times Press (M) Bhd"
