Source,Title,Link,Date,Article
New Straits Times,"Coffee shop told to remove halal, non-halal signage after uproar",https://www.nst.com.my/news/regional/2026/06/1454640/coffee-shop-told-remove-halal-non-halal-signage-after-uproar,"Wed, 03 Jun 2026 18:44:19 +0800","GEORGE TOWN: A coffee shop along Jalan Terengganu here has been ordered to immediately remove signage designating certain tables for halal and non-halal food after the issue went viral on social media.
Penang Island City Council (MBPP) public health committee alternate chairman Tan Soo Siang said the council had taken stern action against the coffee shop operator and issued a warning following public complaints.
She said the matter surfaced after a Malay-run burger stall began operating at the coffee shop and subsequently placed signs indicating separate seating areas for customers consuming halal and non-halal food.
""MBPP instructed the coffee shop to remove the signage immediately and issued a warning to the operator.
""The action was taken after the matter went viral and attracted public attention,"" she told the New Straits Times.
Tan said such actions could create unnecessary racial and religious sensitivities.
""We do not want issues that can affect racial harmony or create misunderstanding among the public.
""The signage could be perceived as divisive and may trigger sensitive issues involving race and religion,"" she added.
She said the stall operator did not obtain approval from MBPP before putting up the signs.
Tan also noted that the stall did not possess halal certification, and therefore had no authority to designate areas as halal or non-halal within the premises.
She said food operators must comply with existing regulations and seek approval from the relevant authorities before installing any signage or implementing measures that could affect patrons.
MBPP, she said, will continue monitoring the situation to ensure compliance and prevent similar incidents from recurring.
© New Straits Times Press (M) Bhd"
New Straits Times,Backbencher claims MyKhas access cut after attending Bersama event,https://www.nst.com.my/news/nation/2026/06/1454637/backbencher-claims-mykhas-access-cut-after-attending-bersama-event,"Wed, 03 Jun 2026 18:35:55 +0800","KUALA LUMPUR: Another government backbencher has reportedly lost access to constituency funds after attending former PKR deputy president Datuk Seri Rafizi Ramli's Parti Bersama Malaysia event.
Petaling Jaya member of parliament Lee Chean Chung said he is seeking clarification from the government after his access to constituency allocations was reportedly blocked via the MyKhas portal.
""What exactly is the offence I have committed?
""I am still a member of parliament who supports the unity government.
""I have never declared leaving the government bloc, nor have I ever voted against the government in parliament.
""The unity government has a responsibility to explain to the public why a government MP has suddenly lost access to allocation channels that have all along been used to serve the community,"" he said in a statement.
He said he had not received any explanation, either verbal or written, for the restriction.
""When funds are blocked, the most affected is not the elected representative, but the people who need help and support,"" he added.
Lee is the second PKR lawmaker to face funding restrictions via the MyKhas portal, following Subang mp Wong Chen.
Both were among PKR MPs who attended the Bersama Malaysia party launch last month.
Lee called for a clear response if PKR leadership objected to his attendance, saying due process should be followed if party discipline was in question.
""If my actions are deemed to breach party discipline, show disloyalty, or jeopardise the party's interests, then due process must be followed.
A warning letter can be issued, a show-cause letter can be requested, and a disciplinary inquiry can even be conducted through the established channels,"" he said.
Despite PKR secretary-general Datuk Fuziah Salleh stating that leadership would summon the six MPs involved, Lee said he had yet to be formally contacted.
He warned that such incidents could fuel perceptions that vocal backbenchers are penalised, while opposition MPs are rewarded with funding simply for declaring support for the administration.
""If today a member of parliament from the government's own ranks can lose access to constituency allocation channels due to unexplained political factors, then the public has every right to ask; is there a double standard or a two-tiered system when it comes to constituency allocations?"" he said.
© New Straits Times Press (M) Bhd"
New Straits Times,"Alliance Bank, 99 Speed Mart offer zero-interest instalment plan",https://www.nst.com.my/business/corporate/2026/06/1454632/alliance-bank-99-speed-mart-offer-zero-interest-instalment-plan,"Wed, 03 Jun 2026 18:31:15 +0800","KUALA LUMPUR: Alliance Bank Malaysia Bhd has partnered with 99 Speed Mart Retail Holdings Bhd to offer a zero per cent instalment payment plan through 99 Speed Mart's online bulk purchasing platform.
The initiative will be integrated into the 99 Bulksales website from June.
It allows Alliance Bank credit cardholders, including business credit cardholders, to convert eligible online purchases of RM500 and above into a three-month zero per cent instalment payment plan.
The collaboration was formalised through a memorandum of understanding signed by Alliance Bank group chief business and transaction banking officer Raymond Chui and 99 Speed Mart alternate director Albert Lee Yan Zhong.
""This timely financial solution empowers businesses with enhanced flexibility in managing cash flow, particularly in current uncertain times, reducing upfront payment burdens for bulk purchases and maintaining steady inventory turnover.
""It enables small and medium enterprises to free up working capital, streamline inventory purchases, and increase sales more effectively.
""Consumers with larger households can also take advantage of the plan by meeting the minimum spend requirement,"" both companies said in a joint statement.
Raymond said the collaboration allows it to reach a wider network of business owners through a practical, customer-centric and digital-first solution, while supporting the adoption of cashless and digital payment systems in Malaysia.
""We are confident that with this program, consumers and businesses can both benefit from lower prices, larger purchases and soften impacts to their cash flow,"" Albert said.
© New Straits Times Press (M) Bhd"
New Straits Times,"Deploying heavyweights to tough seats part of DAP culture, says Ong Kian Ming",https://www.nst.com.my/news/nation/2026/06/1454628/deploying-heavyweights-tough-seats-part-dap-culture-says-ong-kian-ming,"Wed, 03 Jun 2026 18:21:33 +0800","JOHOR BARU: DAP's long-standing election strategy is to deploy senior leaders into challenging constituencies to expand its footprint, said party member Dr Ong Kian Ming.
The former deputy international trade and industry minister and Bangi member of parliament said vacating safe seats to contest marginal or difficult constituencies was aimed at strengthening the party's reach in new political terrain.
Citing DAP stalwart Tan Sri Lim Kit Siang as an example, he said the veteran repeatedly moved to challenging seats, including Ipoh Timor in 2004 and Gelang Patah in 2013, winning both.
Ong said other leaders followed a similar path, including former secretary-general Lim Guan Eng, who led the party's expansion in Penang in 2008 after leaving Melaka, and Liew Chin Tong, who left Bukit Bendera after one term to win Kluang in 2013.
He also cited Teo Nie Ching, who moved from Serdang to win Kulai in 2013, and Nga Kor Ming, who shifted from Taiping to Teluk Intan in 2018.
""I benefitted from such strategic movements when Teo vacated Serdang in 2013, allowing me to contest the constituency, which became Bangi in 2018,"" he said in a Facebook post.
He said DAP's expansion in Johor would not have been possible without leaders like Lim Kit Siang, Liew Chin Tong and Teo Nie Ching contesting in constituencies previously held by MCA, which helped build organisational capacity in the state.
However, he said the strategy was not uniformly applied across all leaders and constituencies.
""Senior leaders like Tan Kok Wai, Teresa Kok and Fong Kui Lun remained in their respective strongholds of Cheras, Seputeh and Bukit Bintang for multiple terms due to different strategic considerations,"" he said.
Ong also referenced Gobind Singh Deo, who moved from Puchong to Damansara in 2022 to make way for Yeo Bee Yin.
Turning to recent discussions involving the Skudai state seat, Ong said initial plans reportedly did not involve Marina Ibrahim as the first-choice candidate.
He said there were considerations for Syahredzan Johan to contest the Iskandar Puteri parliamentary seat, which was expected to be vacated following Tan Sri Lim Kit Siang's retirement, making it difficult to field two Malay candidates in closely linked constituencies simultaneously.
However, the situation changed when party leadership became aware of his own intention to vacate the Bangi seat, opening the possibility for Marina to be fielded in Skudai.
He added that suggestions for Marina to contest in more difficult seats such as Tiram were likely driven by broader strategic calculations rather than personal intent.
Internal dynamics and competing interests at constituency level may also have influenced discussions surrounding Skudai.
On Marina's decision to step back from contesting, Ong praised her for making a clear and principled stand instead of delaying her announcement until the finalisation of the candidate list.
He said while the move may have placed party leadership in a difficult position, it reflected her commitment to avoiding internal complications.
Ong also addressed post-election roles, saying that offering positions in statutory bodies to former elected representatives aimed to retain experienced public servants in governance, noting such arrangements were not uncommon.
He added that he served as Malaysian Investment Development Authority (MIDA) director between 2023 and 2025 after GE15, supported by party leadership and the federal ministry.
Ong expressed hope that Marina Ibrahim would continue contributing to public service in Johor in whatever capacity she chooses moving forward.
© New Straits Times Press (M) Bhd"
New Straits Times,AirAsia Philippines ordered to cease ops over alleged unpaid airport fees [WATCH],https://www.nst.com.my/business/corporate/2026/06/1454626/airasia-philippines-ordered-cease-ops-over-alleged-unpaid,"Wed, 03 Jun 2026 18:18:49 +0800","KUALA LUMPUR: The Civil Aviation Authority of the Philippines (CAAP) has ordered Philippines AirAsia Inc. to cease operations at all airports under its administration over alleged unpaid airport-related charges amounting to 271.94 million Philippine pesos.
Business Times has seen a June 2 order issued by CAAP director-general Lt Gen Raul L Del Rosario directing the airline to ""cease and desist from conducting operations in all airports operated and administered by the CAAP"".
The regulator said the order would take effect three calendar days from receipt.
According to the order, the amount claimed by CAAP comprises unpaid air navigation charges, aircraft landing and parking fees, passenger service charges and other airport-related assessments.
CAAP said its records showed that despite repeated billing statements, collection efforts and a formal demand letter dated May 11 this year, the airline had not settled the amounts claimed by the regulator.
Under the directive, Philippines AirAsia must discontinue all operations, activities and utilisation of airport facilities, services and privileges under CAAP's jurisdiction once the order becomes effective.
The order also instructs airport managers, security units, aerodrome operations units and air navigation service units to implement and enforce the directive.
In addition, CAAP said no airport clearance, access, operational accommodation or airport-related privilege would be extended to the airline unless authorised in writing by the authority.
However, CAAP said airline operations across all airports under its administration remained normal and uninterrupted.
The authority said AirAsia Philippines had until June 6 to settle its alleged outstanding obligations, adding that discussions between both parties had been ongoing since last year.
""CAAP clarifies that AirAsia Philippines has been given until June 6, 2026 to settle its outstanding financial obligations. The Authority and the airline have been in discussions on this matter since last year,"" CAAP said in a statement when contacted by Business Times.
CAAP said any interruption to airline operations could have significant economic consequences, including employment displacement and disruptions to passenger and cargo services, and described settlement of the obligations as the most practical and preferred course of action.
Meanwhile, AirAsia Philippines assured passengers that it remained fully operational, with flights and services continuing as scheduled across its network.
""AirAsia Philippines assures the travelling public that it remains fully operational, with flights and services continuing as scheduled across its network, subject to normal operational considerations such as weather and other standard factors affecting airline operations,"" the airline said in a statement when contacted by Business Times.
The carrier did not address the amount claimed by CAAP, the cease-and-desist order or whether discussions were ongoing with the regulator.
© New Straits Times Press (M) Bhd"
New Straits Times,Widow seeks court order for rider's earnings data in RM1mil dependency claim,https://www.nst.com.my/news/nation/2026/06/1454618/widow-seeks-court-order-riders-earnings-data-rm1mil-dependency-claim,"Wed, 03 Jun 2026 18:07:35 +0800","KLANG: The widow of a deceased delivery rider will file civil action to obtain his earnings records from his second employer, after the company refused disclosure over data protection concerns.
Lawyer Mohd Faizi Che Abu, who is representing Nor Nadia Abdul Majid, 32, said a letter was sent on May 15 to the delivery company where the deceased had worked part time for three years.
He said the part time job was in addition to Amirul's full time employment as a store assistant at a machinery company for 15 years. Amirul died in a drink driving crash along Jalan Raya Barat on March 29.
Faizi said Nadia has already obtained complete payslips from Amirul's primary employer but still requires confirmation of income from his second job in order to establish his total annual earnings for dependency claim purposes.
The company replied on May 25 stating that it was unable to release the information unless compelled by a court order, in line with its internal data protection policies, he said.
""We respect the company's position and will now proceed to file an application for a court order compelling disclosure at the Kuala Lumpur High Court this week.
""The total income figure is crucial for the family's dependency claim as it will be combined with salary records from his primary employment to determine his average monthly income and the extent of financial loss suffered by dependents.
""We are not in a position to estimate or 'pluck a figure from the air'. The exact earnings must be verified for accuracy before the dependency claim can be filed, likely by July,"" he said at the court complex, here. https://www.nst.com.my/news/nation/2026/04/1408026/widow-plans-rm1mil-civil-suit-over-drink-driving-crash-killed-husband#google_vignette
Faizi said he is also assisting Nadia facilitate estate administration matters at the Small Estates Distribution Unit.
Nadia is planning to file a RM1 million civil suit against technician R. Saktygaanapathy, 28, who is facing charges of murdering Amirul and self-administering drugs.
Following Amirul's death, Nadia and her three children moved to Perak to be closer to family support.
Faizi is holding a watching brief on behalf of Nadia.
Saktygaanapathy was charged with murder of Amirul at 11.47am along Jalan Raya Barat on March 29.
No plea was recorded as the case falls under the jurisdiction of the High Court.
The charge, framed under Section 302 of the Penal Code, carries the death penalty or imprisonment of between 30 and 40 years upon conviction.
If the death sentence is not imposed, the offender must be whipped at least 12 times.
He is being held on remand at the Sungai Buloh Prison.
Separately, he claimed trial to an amended charge of self administering tetrahydrocannabinol at 3.30pm at the Klang Selatan district police headquarters narcotics investigation department on March 29.
The charge framed under Section 15(1) (a) of the Dangerous Drugs Act carries a maximum RM5,000 fine or a jail term not exceeding two years and police supervision not exceeding three years.
Both cases will be mentioned on July 22.
According to police investigations, Sakthygaanapathy allegedly crashed his car head on into Amirul, who was riding a motorcycle on his way to buy a mathematics book for his children.
Amirul was instantly killed after being struck by the car driven by the accused, who was allegedly travelling at high speed towards Klang town from Jalan Raya Barat.
He is believed to have overtaken several vehicles before veering into the opposite lane and colliding head-on with Amirul's machine.
The impact flung Amirul onto a Perodua Myvi. He was pronounced dead at the scene.
He was buried at the Kampung Repoh Islamic Cemetery in Larut, Perak.
© New Straits Times Press (M) Bhd"
New Straits Times,"B15 biodiesel rollout strengthens Malaysia's energy security, says minister",https://www.nst.com.my/news/nation/2026/06/1454614/b15-biodiesel-rollout-strengthens-malaysias-energy-security-says,"Wed, 03 Jun 2026 18:05:43 +0800","PUTRAJAYA: Plantation and Commodities Minister Datuk Seri Dr Noraini Ahmad encouraged Malaysians to shift to the new B15 biodiesel, which was rolled out on June 1.
She said the implementation also supports the nation's sustainability agenda through the use of more sustainable alternative energy sources.
She said the National Biodiesel Programme is supported by a nationwide network of 452 palm oil mills, 54 refineries, 19 biodiesel processing facilities and 34 blending depots.
While most parts of the country are already using B10 and B12 ahead of the B15 rollout, she said B20 biodiesel has already been adopted in regions such as Bintulu, Langkawi and Labuan.
""Previously, we have already implemented B10, B7 and B12. There shouldn't be a problem adapting to B15.
""The move reflects the government's continued commitment to strengthening the palm oil industry by increasing domestic palm oil consumption and advancing the biofuel sector,"" she told reporters at Petronas Precinct 16 during a media walkabout on the B15 rollout.
Last week, Deputy Prime Minister Datuk Seri Ahmad Zahid Hamidi announced the B15 biodiesel rollout would take place on June 1.
He also said Malaysia currently has 19 biodiesel production facilities generating approximately 1.5 million litres of oil per month.
By raising the blend from B10 to B15, Malaysia could save about RM1.5 billion annually in fuel subsidies.
In Malaysia, biodiesel use is dominated by industrial plantations, refineries and fuel supply chains.
A previous report stated annual
biodiesel
usage is expected to rise to about 801,000 tonnes, compared with 534,000 tonnes under the B10 programme.
© New Straits Times Press (M) Bhd"
New Straits Times,"Fire in Delhi hotel kills at least 21, police say",https://www.nst.com.my/world/world/2026/06/1454608/fire-delhi-hotel-kills-least-21-police-say,"Wed, 03 Jun 2026 17:56:25 +0800","NEW DELHI: At least 21 people were killed in a fire at a hotel in Delhi on Wednesday, police said, in one of the worst such incidents in the national capital in recent years.
Several people jumped out of the burning building to escape the flames, witnesses said, with residents dragging mattresses from a nearby store to try to break their fall.
""People spread mattresses, and a woman from the third floor jumped on it with a little kid,"" witness Sher Khan said.
Television footage showed two people jumping from a higher floor of the building as it was engulfed in flames, with smoke billowing out.
Local people who helped in the initial rescue said the fire broke out on the ground and first floors of the four-storey building, trapping those on higher floors.
""There is a mattress shop here ... We took the mattresses from there and laid them on the road to help those who were jumping out of the building,"" Wasim Raja, a local resident, told news agency ANI.
The fire broke out in the hotel in South Delhi's Malviya Nagar a little before 9 am (0330 GMT), and eight fire tenders were dispatched to douse the blaze, police said in a statement.
[[nid:1454605]]
The fire was extinguished around midday, a Reuters witness said.
""Through the coordinated efforts of police, fire services, and other emergency responders, more than 40 persons have been rescued and shifted to nearby hospitals for medical treatment,"" police said.
""It is with profound sorrow that 21 persons have been declared dead in this tragic incident,"" it said.
A spokesperson at the state-run All India Institute of Medical Sciences told Reuters the hospital had received 13 patients, two of whom were critical.
""There was reportedly a restaurant operating on the ground floor of the building ... it is most likely that the fire was connected to that restaurant,"" local administration official Jitendra Kumar told reporters.
Prime Minister Narendra Modi expressed his condolences for the loss of lives in a post on X. ""Authorities are providing all possible assistance to those affected,"" he said.
© New Straits Times Press (M) Bhd"
New Straits Times,Rohingya man held over fatal Marang crash,https://www.nst.com.my/news/regional/2026/06/1454604/rohingya-man-held-over-fatal-marang-crash,"Wed, 03 Jun 2026 17:55:12 +0800","KUALA TERENGGANU: A Rohingya man was detained over a crash in Marang that killed a motorcyclist last week.
He was remanded for three days today until Friday following an application by police to facilitate investigations under Section 41(1) of the Road Transport Act 1987, with the order issued by magistrate Noor Mazrinie Mahmood.
Marang police chief Supt Mohd Sofian Redzuan said the crash occurred at about 6pm on May 27 at Km12.5 of the Kuala Terengganu–Kuantan road near Kampung Rusila.
He said the 27-year-old victim was riding a Yamaha RXZ motorcycle from Kuala Terengganu towards Kampung Rusila when it is believed to have collided with a Proton Saga driven by the suspect, who was making a left turn along the same route.
The motorcyclist suffered serious head and leg injuries and was rushed to Sultanah Nur Zahirah Hospital (HSNZ) for treatment.
""However, the victim was pronounced dead on June 2 while receiving treatment in the intensive care unit (ICU),"" he said.
The case was initially investigated under Section 43(1) of the Road Transport Act 1987 for careless and inconsiderate driving.
Following the victim's death, police reclassified the case under Section 41(1) of the same Act for reckless or dangerous driving causing death.
Those convicted under the provision face between five and 10 years' imprisonment, a fine of between RM20,000 and RM50,000, and disqualification from holding a driving licence for at least five years.
Police have also seized the Proton Saga under Section 64(1) of the Road Transport Act 1987.
Anyone with information on the incident is urged to contact investigating traffic officer Inspector Nik Nur Farhanim Nik Mohamed Fauzee at 09-618 2222.
© New Straits Times Press (M) Bhd"
