Source,Title,Link,Date,Article
Malay Mail,"No diesel shortage, says domestic trade minister; delays at ports behind brief disruptions",https://www.malaymail.com/news/malaysia/2026/04/14/no-diesel-shortage-says-domestic-trade-minister-delays-at-ports-behind-brief-disruptions/216228,"Tue, 14 Apr 2026 09:22:48 +0800","KUCHING, April 14 — The government has assured that diesel supply remains sufficient, but enforcement measures will continue to be strengthened to prevent leakages in the supply chain amid current global uncertainties.
Domestic Trade and Cost of Living Minister Datuk Armizan Mohd Ali said several isolated disruptions had been reported, but these were due to logistical issues such as delays in deliveries to ports and depots, and not a shortage of supply.
“These issues have been and are being addressed promptly. In this regard, the public is encouraged to lodge complaints via the official platforms of the Domestic Trade and Cost of Living Ministry (KPDN) if any petrol stations face supply shortages,” he said.
He said this after attending the ‘Sentuhan Kasih’ programme and the Rahmah Madani Sales programme (PJRM) in Kampung Bratan here yesterday.
Meanwhile, he said the government will continue to strengthen PJRM as a key intervention mechanism to help the public cope with rising living costs.
He said that from Jan 1 to March 31 this year, a total of 7,320 PJRM programmes were carried out nationwide, recording more than 7.38 million transactions. — Bernama"
Malay Mail,Traffic cop injured in hit-and-run on Jalan Sultan Yahya Petra in KL; suspect held,https://www.malaymail.com/news/malaysia/2026/04/14/traffic-cop-injured-in-hit-and-run-on-jalan-sultan-yahya-petra-in-kl-suspect-held/216226,"Tue, 14 Apr 2026 09:06:03 +0800","KUALA LUMPUR, April 14 — Police have arrested the driver suspected of being involved in a hit‑and‑run incident that injured a traffic police officer on Jalan Sultan Yahya Petra here on Friday.
Kuala Lumpur Traffic Investigation and Enforcement Department (JSPT) chief ACP Mohd Zamzuri Mohd Isa confirmed that the suspect was detained yesterday to assist in the investigation into the incident.
“…police are now preparing a report after carrying out a urine screening test as well as a breathalyser test (EBA) on the suspect,” he said.
In the 10.47 pm incident, a 27‑year‑old traffic police constable was injured after being hit from behind by the vehicle while he was on duty directing traffic at the junction.
The driver then fled towards the Kuala Lumpur Police Training Centre (Pulapol).
The victim, who sustained injuries to his right palm and the back of his head, as well as pain in his ribs, was rushed to Kuala Lumpur Hospital. — Bernama"
Malay Mail,"Perak Sultan warns leaders not to exploit West Asia conflict for political purposes, urges unity",https://www.malaymail.com/news/malaysia/2026/04/14/perak-sultan-warns-leaders-not-to-exploit-west-asia-conflict-for-political-purposes-urges-unity/216225,"Tue, 14 Apr 2026 09:31:35 +0800","IPOH, April 14 —The Sultan of Perak, Sultan Nazrin Muizzuddin Shah, today reminded political leaders not to exploit the situation in West Asia for narrow partisan interests or to sensationalise the issue.
Sultan Nazrin called on members of the State Legislative Assembly as well as community and business leaders to find common ground and work together in unity.
“Everyone must demonstrate a shared commitment to addressing the impending economic challenges, uphold loyalty to the King and the nation, and prioritise the welfare of the people.
“By doing so, they can formulate effective solutions to confront this deeply concerning situation, ensuring national stability and the well-being of the
rakyat,
” he said in his royal address at the opening of the Perak State Legislative Assembly at the Perak Darul Ridzuan Building here.
The Ruler also called on the state government to treat the West Asia conflict as a wake-up call to take proactive steps towards reducing reliance on fossil fuels as a long-term solution.
He stressed that the state must urgently accelerate efforts to develop infrastructure that enables the public to adopt alternative energy options, including electric vehicles, as well as renewable energy sources such as solar and hydropower.
“The transition to alternative energy must be carefully planned, expedited, and implemented with full commitment.
“Investment in renewable energy is no longer an option, but a strategic necessity that must be pursued with urgency,” he said.
In facing these significant challenges, the Sultan said that while the government continues to spearhead efforts, the public also share a collective responsibility to stand united in solidarity.
He said Malaysians must embrace the spirit of mutual support and solidarity through these difficult and challenging times.
“This includes adopting prudent and frugal practices to help reduce fuel consumption and, in turn, lessen the government’s subsidy burden.
“The people should also practise energy-saving habits through responsible electricity usage, while cultivating a culture of moderation and avoiding wastage, particularly in food consumption,” he said.
Sultan Nazrin said the US–Israel conflict with Iran is not just political or military, but affects global stability, the economy, security, and people’s well-being worldwide.
As such, he said Malaysians must prepare both physically and spiritually to face the possibility of a prolonged global crisis.
“Strengthening the domestic economy, ensuring food security, maintaining financial stability, and preserving unity among the people are critical measures to prevent the nation from being swayed by sentiment and sensationalism,” he said.
In Malaysia’s multiracial and multireligious society, he stressed that harmony remains the nation’s most valuable asset and must be safeguarded at all costs.
He also warned that the country could face the risk of an energy emergency and disruptions to food supply.
“To effectively navigate such a critical crisis, both the government and the people must stand united.
“The public must be clearly informed about the causes and scale of the crisis, as well as its implications on daily life, through a well-planned communication strategy delivered in simple and accessible language,” he said."
Malay Mail,Malaysian writer Mohamed Nasser Mohamed shortlisted for Commonwealth short story prize,https://www.malaymail.com/news/malaysia/2026/04/14/malaysian-writer-mohamed-nasser-mohamed-shortlisted-for-commonwealth-short-story-prize/216201,"Tue, 14 Apr 2026 07:10:00 +0800","KUALA LUMPUR, April 14 — A Malaysian writer has made the cut in this year’s Commonwealth Short Story Prize shortlist, with 25 writers from 14 countries selected from nearly 8,000 entries worldwide.
Mohamed Nasser Mohamed is among seven writers shortlisted from Asia, with his story
The Missing Half (Separuh Yang Hilang)
— originally written in Malay and translated into English by Pauline Fan — highlighting the prize’s growing multilingual reach.
In a media release, the organisers said the 2026 edition received 7,806 submissions from 54 Commonwealth countries, underscoring the competition’s status as one of the most global and accessible literary awards. The shortlisted writers comprise 11 men and 14 women, aged between 25 and 68.
Asia’s shortlist features three Indian writers, two from Bangladesh, and one each from Malaysia and Singapore. Two of the shortlisted stories — including Mohamed Nasser’s — were submitted in languages other than English, namely Bengali and Malay.
The entries span a wide range of themes, from grief and forbidden love to migration, natural disasters and war, brought to life through diverse voices including musicians, migrant workers and even a stray dog. Judges highlighted stories featuring, among others, a young Indian man in Prague grappling with life choices, a father rebuilding after a flood, and a daughter in Singapore coping with loss.
Chair of judges Louise Doughty described the selection process as “almost impossible”, citing the depth and quality of submissions.
“With so much beautiful writing to consider… our choices came down to authors who were not only excellent writers but also had a grasp of the unique pleasures of the short story form,” she said, adding that the shortlisted works demonstrate the form’s ability to capture “the potential of a full-length novel in a few dense brushstrokes”.
Meanwhile, Razmi Farook said this year’s shortlist reflects the “remarkable creativity” across the Commonwealth.
“Storytelling continues to play a vital role in opening up alternative narratives and offering space for voices and perspectives… helping us better understand one another and imagine a more hopeful, inclusive future,” he said.
The prize, administered by the Commonwealth Foundation, is awarded annually for the best unpublished short fiction from across its 56 member countries. Submissions are accepted in multiple languages, including Malay, Bengali, Tamil and Swahili.
Five regional winners will be announced on May 13, with the overall winner to be revealed in late June.
This year’s shortlist also marks a milestone for Malta, with writer John Edward DeMicoli becoming the first from the country to be shortlisted."
Malay Mail,"As fuel costs rise, Malaysians urged to rethink spending, travel and daily habits",https://www.malaymail.com/news/malaysia/2026/04/14/as-fuel-costs-rise-malaysians-urged-to-rethink-spending-travel-and-daily-habits/216162,"Tue, 14 Apr 2026 07:00:00 +0800","PUTRAJAYA, April 14 — Amid global economic uncertainty driven by geopolitical tensions and volatile crude oil prices, the key question is no longer only how effectively governments can manage the crisis, but how far the public is prepared to help limit its impact.
As concerns over supply and rising prices intensify, early consumer responses, such as stocking up on essentials, are understandable. However, such actions must remain measured to avoid triggering wider market distortions.
Moderate steps, including reducing daily travel, planning purchases carefully and curbing waste, can have a direct impact on national fuel consumption.
Collective restraint would not only help the government contain rising subsidy costs but could also extend the availability of supply over a longer period.
While such measures may appear minor at the individual level, they can generate a significant impact when adopted widely across society.
This is particularly pertinent after Prime Minister Datuk Seri Anwar Ibrahim said recently that Malaysia’s fuel supply is expected to remain stable at least until June, following the crisis in West Asia.
At the same time, Anwar, who is also Finance Minister, said the government is not relying solely on that assurance and has already moved early to secure alternative sources.
Fiscal strain and budget recalibration
Rising subsidy costs remain a central concern, particularly if crude oil prices stay elevated while the government maintains the RON95 price at RM1.99 per litre despite mounting fiscal pressure.
Finance Minister II Amir Hamzah Azizan said on Friday that fuel subsidies for petrol and diesel have surged to RM6 billion, from RM700 million prior to the United States-Iran conflict.
Chief economist at Bank Muamalat Malaysia Bhd, Dr Mohd Afzanizam Abdul Rashid, told
Bernama
that if Brent crude averages between US$105 and US$120 per barrel over a sustained period, the government may need to recalibrate Budget 2026 to accommodate higher spending.
“In such a scenario, the fiscal deficit is expected to exceed four per cent of gross domestic product, compared with the earlier target of around 3.5 per cent,” he said.
He noted, however, that policymakers still have room to adjust without undermining overall economic stability. Lessons from the COVID-19 pandemic showed fiscal flexibility, with the deficit rising to about 6.1 per cent in 2020 and 6.4 per cent in 2021 before returning to a consolidation path.
“This indicates there is still room to manoeuvre, but any adjustment must be carefully calibrated and targeted,” he said.
Mohd Afzanizam added that earlier budget assumptions were based on crude prices of around US$60–US$65 per barrel, well below current levels.
One policy option is to refine the subsidy mechanism to make it more targeted. At present, a large share of fuel subsidies benefits higher-income groups, who tend to consume more.
“Restructuring subsidies by reducing benefits for the T10 group and reallocating them to the B40 and M40 could help sustain subsidised prices without increasing fiscal burdens,” he said.
Such an approach is seen as more effective than across-the-board consumption limits, which risk fuelling public discontent.
Support for businesses and SMEs
Beyond households, businesses particularly small and medium enterprises (SMEs), face rising operating costs that threaten profit margins.
Targeted government support, including concessional financing, loan restructuring and improved access to credit, is critical to ensure business continuity.
“If costs rise and margins shrink, firms may be forced to cut jobs. That must be avoided,” he said, adding that in a potentially slowing economy, fiscal support such as cash assistance could help stimulate domestic demand.
He also proposed expanding aid schemes such as Sumbangan Asas Rahmah (SARA), including allowing broader usage and channelling disbursements through digital payment methods such as QR codes.
Such measures would not only support households but also keep liquidity circulating within the domestic economy, particularly benefiting small traders.
Ultimately, Malaysia’s ability to weather the uncertainty hinges on a coordinated response involving government, businesses and the public.
“Beyond responsive fiscal and monetary policies, collective public action—prudent consumption, reduced travel and disciplined spending—is essential to maintaining economic stability.
“The current situation calls for rational, well-informed decisions, not panic-driven behaviour,” he added. — Bernama"
Malay Mail,"WFH trims travel expenses yet raises home power bills, says expert",https://www.malaymail.com/news/malaysia/2026/04/14/wfh-trims-travel-expenses-yet-raises-home-power-bills-says-expert/216143,"Tue, 14 Apr 2026 07:00:00 +0800","KUALA LUMPUR, April 14 — For Suzana Abdullah, the flexibility of working from home (WFH) on a rotational basis implemented by her company has provided her with significant relief in terms of daily expenses.
Without such an arrangement, the 32-year-old administrative officer at a telecommunications company would have to commute daily from her home in Seremban, Negeri Sembilan, to her office at Jalan P. Ramlee here.
“If I had to commute from home to the office, my expenses for petrol, toll and parking would usually reach up to RM400 a month. Traffic congestion also causes fuel to run out more quickly, and I have to send my car to the workshop every three months for maintenance.
“Now with the BUDI 95 fuel quota (Malaysia’s targeted fuel subsidy programme) temporarily reduced to 200 litres per month from 300 litres previously, I no longer have to worry about using up the 200-litre quota so quickly,” she told Bernama.
Suzana, who only needs to come into the office once a week, said the WFH flexibility given by her employer has enabled her to save up to RM700 per month.
However, for Elthan Koo, 38, an IT consultant at a government-linked company in Cyberjaya, the WFH policy means higher electricity consumption at home.
“If WFH is implemented, I would need to move my devices and computer from the office back home for work, as well as turn on the air-conditioning all the time due to the hot weather nowadays.
“However, I’m lucky because I’m currently living in a landed double-storey house and I installed 12 solar panels last year to reduce my (monthly) electricity bill, which previously reached up to RM300 during the Movement Control Order period in 2020,” he said.
EFFECTIVENESS OF COST SAVINGS
On April 1, Prime Minister Datuk Seri Anwar Ibrahim announced that federal ministries, government agencies, statutory bodies and government-linked bodies will implement a three-day-a-week work-from-home arrangement starting April 15.
He said the policy is aimed at reducing fuel consumption and ensuring more efficient fuel usage, amid the current global energy crisis.
However, the WFH arrangement is only applicable to government servants working in Putrajaya, Kuala Lumpur, Selangor and all state capitals and living more than eight kilometres from their office. Civil servants working in the security and defence, health and education sectors are exempted from the arrangement.
Private sector employees in Malaysia can request flexible working arrangements, including WFH, under the Employment (Amendment) Act 2022.
Can the WFH policy truly reduce the government’s operating costs, while also lowering expenses for those working from home?
Malaysia-based economist Dr Geoffrey William said WFH could offer cost savings for both consumers and the government, especially in reducing fuel consumption and subsidy spending.
“It is a win-win situation in terms of cost savings. Some companies also cover their employees’ petrol expenses, so they would benefit from lower costs as well.
“However, the overall impact of WFH may be limited due to the nature of employment in the public sector. Most public sector roles are in essential services such as healthcare, education and enforcement, where remote work is not feasible,” he told Bernama.
He said of the estimated 1.3 million public employees in Malaysia, only around 260,000 will be eligible to work from home.
He said based on the three WFH days per week, commuting could be reduced to eight days per month, resulting in estimated savings of 9.4 million litres of RON95 fuel and RM17.7 million in subsidies monthly.
“However, this accounts for only 0.7 percent of total petrol consumption and 0.4 percent of subsidy expenditure,” he said, adding that to have a more meaningful impact, WFH must be expanded to the private sector.
He noted that if widely adopted across both public and private sectors, the WFH policy can potentially reduce peak-hour traffic by 25 percent and generate monthly savings of up to RM1 billion in fuel costs and subsidies.
“Enforcement of the three-day WFH for half of all employees (in both government and private sectors) could cut petrol use by 25 to 30 percent too.
“At present, the policy poses no potential risk to the economy or government services because too few civil servants will be involved (in WFH). But the benefits are bigger if it (WFH) applies to the private sector as well,” he said.
According to environmental watchdog Rimba Watch, enabling half of the Klang Valley’s workforce to WFH could cut Malaysia’s fuel subsidies by up to RM169 million a month. — AFP file pic
SAVE UP TO RM169 MILLION A MONTH
According to environmental watchdog Rimba Watch, enabling half of the Klang Valley’s workforce to WFH could cut Malaysia’s fuel subsidies by up to RM169 million a month.
Based on data provided by the Department of Statistics Malaysia and other research sources, the Klang Valley has an employed population of 4.1 million.
Assuming a WFH arrangement for 50 percent of the workforce, 2.05 million workers would avoid daily commutes averaging 20 km each way, with fuel consumption in heavy traffic at 0.11 litres per km.
“Based on these parameters, the average Klang Valley commuter uses 2.2 litres of petrol daily to travel to work. If 50 percent of the working population works from home, this would save 4.51 million litres of petrol a day, or 90.2 million litres a month.
“Given the current fuel subsidy of RM1.87 per litre (based on the current pump price), this would amount to savings of RM169 million a month. If the geopolitical climate persists or worsens over a year, the subsidy savings could rise to RM2.03 billion,” it said in a statement recently.
While the shift to WFH reduces spending on petrol, toll and other commuting-related expenses, it also raises a new concern: higher electricity consumption at home.
This has prompted growing interest in longer-term solutions such as solar energy adoption, alongside greater reliance on public transportation, as households seek to balance cost savings with sustainable energy use amid the ongoing global energy pressures.
Universiti Kebangsaan Malaysia Solar Energy Research Institute (SERI) director Prof Dr Norasikin Ahmad Ludin said installing rooftop solar panels could significantly reduce household electricity costs, especially for those working from home.
She said for a typical landed property with a monthly electricity consumption of between 900 and 1,200 kWh, installing a five to six kWp rooftop solar system under the government’s Solar Accelerated Transition Action Programme (Solar ATAP) could reduce electricity bills by 70 to 85 percent.
(Solar ATAP replaced the previous Net Energy Metering scheme, effective Jan 1, 2026. The new programme focuses on high self-consumption with no fixed quota, allowing residential or commercial users to cover 100 percent of their maximum power demand).
“In real terms, a household currently paying between RM300 and RM400 per month could see their bills drop to around RM50 to RM80,” she told Bernama in an email interview.
With the base electricity tariff for 2025 to 2027 set at 45.4 sen per kWh, she said the potential savings are substantial, especially if tariffs increase further due to the global energy crisis.
“If electricity tariffs rise by 10 to 20 percent, the savings become even more significant as every kilowatt-hour generated from solar reduces reliance on higher-cost grid electricity,” she said, adding that homeowners who adopt solar power are effectively hedging against future tariff hikes.
She said WFH arrangements further enhance these savings as higher daytime electricity usage aligns with peak solar generation, allowing households to maximise self-consumption and reduce dependence on grid power.
UTILISE PUBLIC TRANSPORT
Meanwhile, renewable energy solution provider Samaiden Group Bhd chief strategy officer Dr Tee Wu Shun said for homes with higher energy usage, a larger system of solar panels in the 17kWP to 22.5 kWP range may be recommended to accommodate higher electricity usage during the day.
“Battery storage further enhances the system by allowing excess solar energy to be stored and used at night or during blackouts. This is especially useful for households with consistent evening usage and helps maximise self-consumption of solar energy rather than relying on the grid,” he said.
Climate Action Network Southeast Asia director and regional coordinator Nithi Nesadurai, meanwhile, said for those in essential services who are unable to WFH, using public transportation in the Klang Valley can help reduce their daily expenses compared to driving, while also easing traffic congestion and, most importantly, lowering air pollution.
“Public transportation is really the solution, not just EVs, because it is not only about rail-based systems such as LRT or MRT but also about strengthening bus networks.
“Improving bus systems could significantly reduce emissions from Malaysia’s transport sector, while also easing the financial burden on households affected by rising fuel prices.
“With dedicated lanes, buses can move like trains. They are fast, reliable and more accessible as bus stations can be located closer to residential areas compared to rail stations,” he said, citing successful models in cities such as Jakarta and Singapore.
He added that investing in bus-based transport is a practical and low-cost solution that can be implemented more quickly to address both congestion and climate concerns. — Bernama"
