Source,Title,Link,Date,Article
New Straits Times,"Takiyuddin tells MACC, police to probe RM10mil bribe claims involving PKR MP [WATCH]",https://www.nst.com.my/news/nation/2026/03/1403869/takiyuddin-tells-macc-police-probe-rm10mil-bribe-claims-involving-pkr,"Thu, 26 Mar 2026 10:42:58 +0800","KUALA LUMPUR: Perikatan Nasional (PN) secretary-general Datuk Seri Takiyuddin Hassan has called on the Malaysian Anti-Corruption Commission (MACC) and police to probe claims that a PKR member of parliament received nearly RM10 million in bribes.
Takiyuddin also called on the government, particularly PKR leaders, to explain the allegations and fully cooperate with investigators.
""Failure to address this openly and with integrity will erode public confidence in the government's fight against corruption and abuse of power,"" he said.
On Tuesday, businessman Victor Chin, also known as Chin Boon Loong and linked to a ""corporate mafia"" scandal, alleged that a PKR MP asked for RM10 million in cash to settle the matter.
In a 40-page document outlining the alleged events, he said he initially prepared RM9.5 million.
He added that the remaining RM500,000 was not paid as the issue was not resolved.
The ""corporate mafia"" claims include allegations that senior MACC officers ran intimidation campaigns, pressuring executives and shareholders of public-listed firms to resign or sell shares at steep discounts to connected businessmen.
On March 16, police raided several of Chin's premises in Kemensah and Sungai Long, Kajang.
LINK:
https://www.nst.com.my/news/nation/2026/03/1398850/corporate-mafia-probe-why-raid-my-house-asks-victor-chin
Yesterday, PKR vice-president Datuk Seri R. Ramanan denied allegations linking him to Chin and the alleged corporate mafia.
The Sungai Buloh member of parliament challenged Chin to substantiate his accusations and not keep the public guessing over the identity of ""Mr R"", describing the claims as baseless and part of a broader attempt to discredit the government.
LINK:
https://www.nst.com.my/news/nation/2026/03/1403523/ramanan-denies-he-mr-r-challenges-victor-chin-name-him
Former economy minister Datuk Seri Rafizi Ramli also denied allegations linking him to the bribes.
The Pandan MP said he could directly name ""Mr R"" based on the information provided by Chin, but he added that the bigger issue at present is the businessman's allegation that RM9.5 million was paid to a PKR MP.
He added that he will reveal the identity of ""Mr R"" today.
LINK:
https://www.nst.com.my/amp/news/nation/2026/03/1403462/it-wasnt-me-rafizi-denies-rm95m-claim
Takiyuddin said the identity of the MP should only be determined through due process to avoid speculation that could harm innocent parties.
He said the allegations were serious, involving a large sum and raising concerns over corporate governance, political influence and institutional integrity.
The Kota Baru MP said more troubling were claims that the money was meant to secure political interference in corporate matters.
""If true, this is a serious breach of good governance and integrity long championed by the government.
""It also risks creating the perception that political influence is being used to interfere in corporate affairs and law enforcement,"" he said.
He added that PN would monitor the case and raise it in Parliament if necessary to uphold accountability and integrity.
""Integrity is not just rhetoric. It must be proven through consistent transparency and accountability,"" he said.
© New Straits Times Press (M) Bhd"
New Straits Times,Couple arrive in Penang court to face indecency charges [WATCH],https://www.nst.com.my/news/nation/2026/03/1403865/couple-arrive-penang-court-face-indecency-charges-watch,"Thu, 26 Mar 2026 10:36:03 +0800","GEORGE TOWN: A couple arrested for an indecent act at a local Chinese cemetery arrived at the magistrate's court to face charges.
They appeared at about 8.15am, escorted by police and handcuffed.
They are expected to face charges under Section 377D of the Penal Code.
The law criminalises acts of ""gross indecency"" between persons, in public or private, with a maximum penalty of two years' imprisonment.
Police launched an investigation after a 69-year-old man reported a video showing a man and woman behaving inappropriately at the cemetery.
The 38-second video had gone viral, showing a man standing naked with his back to the camera, while a partially undressed woman sits on a tombstone.
The woman filming confronts them, saying they have been spotted at the cemetery before.
In the clip, the man is seen putting on his trousers.
The woman filming reprimands them, stressing that a cemetery is meant to honor the deceased.
Although the
man apologises,
the woman dismisses it and warns that the matter will be reported to the police.
© New Straits Times Press (M) Bhd"
New Straits Times,"US jury finds Meta, YouTube liable in social media addiction trial",https://www.nst.com.my/world/world/2026/03/1403861/us-jury-finds-meta-youtube-liable-social-media-addiction-trial,"Thu, 26 Mar 2026 10:19:36 +0800","LOS ANGELES: A Los Angeles jury on Wednesday found Meta and YouTube liable for harming a young woman because of an addictive design of their social media platforms, ordering the companies to pay $6 million in damages, including $3 million in punitive damages.
The verdict hands plaintiffs in more than a thousand similar pending cases significant leverage – and signals to the broader tech industry that juries are prepared to hold social media companies accountable for the mental health toll of their design choices.
The jury answered yes to all seven questions on verdict forms for both companies, finding that Meta and YouTube were negligent in the design and operation of their platforms and that their negligence was a substantial factor in causing harm to the plaintiff.
Jurors also found that both companies knew or should have known their services posed a danger to minors, that they failed to adequately warn users of that danger, and that a reasonable platform operator would have done so.
The panel awarded $3 million in compensatory damages, assigning Meta 70 percent of the responsibility for the plaintiff's harm – a $2.1 million share – and YouTube the remaining 30 percent, or $900,000.
In a second phase, jurors added a further $3 million in total punitive damages after finding both companies had acted with malice, oppression or fraud.
Both companies said they would appeal the verdict.
""This case misunderstands YouTube, which is a responsibly built streaming platform, not a social media site,"" Google spokesperson Jose Castaneda said.
A spokesperson for Meta said they ""respectfully disagree with the verdict,"" adding that ""teen mental health is profoundly complex and cannot be linked to a single app.""
Nine of the 12 furors further found that both companies had acted with malice, oppression or fraud, a finding that set the stage for the separate punitive damages.
The plaintiff, known in court documents by her initials K.G.M. and called Kaley at trial, began using YouTube when she was six, downloading the app on her iPod Touch to watch videos about lip gloss and an online kids game.
She joined Instagram at nine, getting around a block her mother had put in place to keep her off the platform.
She told jurors that her near-constant social media use ""really affected my self-worth,"" saying the apps led her to abandon hobbies, struggle to make friends and constantly measure herself against others.
In closing arguments, plaintiff attorney Mark Lanier cast the case as a story of corporate greed, saying that features like infinite scrolling, autoplay videos, notifications and like counts were engineered to drive compulsive use among young people.
- 'Existential' threat? -
Meta and YouTube had maintained throughout the trial that Kaley's mental health struggles had nothing to do with their platforms.
Meta's lawyer pointed to her life at home and a turbulent relationship with her parents, while YouTube disputed how much time Kaley actually spent on its platform.
The jury rejected both defences across all seven questions on each verdict form.
TikTok and Snap were originally named as defendants but settled on undisclosed terms before the trial got underway.
Two further bellwether trials are expected to follow in the same Los Angeles courthouse, with their outcomes likely to determine whether social media companies fight on or move toward a broader settlement, potentially including redesigning how their platforms work.
The penalty amounts are ""a slap on the wrist for companies like Meta and YouTube, which are two of the biggest ad sellers in the world,"" said Jasmine Enberg of Scalable, who tracks the social media industry.
""But if these companies are forced to redesign their products, that poses an existential threat to their business models.""
A separate New Mexico jury on Tuesday found Meta liable for endangering children by making them vulnerable to predators on its platforms and other dangers.
The state had sought the maximum $2.2 billion in damages, but the jury awarded a lesser amount of $375 million. - AFP
© New Straits Times Press (M) Bhd"
New Straits Times,Stocks on edge as Middle East ceasefire talks take centre stage,https://www.nst.com.my/business/corporate/2026/03/1403859/stocks-edge-middle-east-ceasefire-talks-take-centre-stage,"Thu, 26 Mar 2026 10:15:29 +0800","SINGAPORE: Asian stocks struggled for direction while the dollar held firm on Thursday as investors treaded cautiously amid dizzying developments in the Middle East, where Iran said it would weigh a US proposal to end the Gulf conflict.
The widening war has jolted global markets, sending oil prices soaring, reigniting inflation fears and scrambling global rate expectations.
It was a mixed picture in Asia in early trading with Japan's Nikkei up 0.6 per cent while South Korean stocks were down one per cent. MSCI's broadest index of Asia-Pacific shares outside Japan edged 0.23 per cent lower, set for an 8.7 per cent decline in the month, its biggest monthly drop since October 2022.
The dollar held firm near recent highs and was on track for a two per cent monthly gain, cementing its status as the markets' preferred safe haven.
The latest comments by Iran suggested some willingness by Tehran to negotiate an end to the war if its demands were met. The US sent a 15-point ceasefire proposal to Iran that was originally brushed aside by Iranian officials.
""While the headline flow points to a more constructive tone, markets remain unsure which signals to trust and act upon,"" Chris Weston, head of research at Pepperstone, said.
""Price action suggests participants expect further twists and turns, even as the probability of a negotiated outcome edges higher.""
The near month-long war triggered by joint US–Israeli strikes on Iran in late February has effectively shut the Strait of Hormuz, a conduit for a fifth of global oil and liquefied natural gas flows.
The disruption has sent prices surging above US$100 per barrel. Brent crude futures were at US$103.35 per barrel, up one per cent on the day, and set for a 42 per cent jump in the month.
""If you look at what the US wants to achieve, what Israel wants to achieve, and what Tehran wants to achieve, it will be very hard to reconcile all these points,"" said Matthias Scheiber, senior portfolio manager and the head of the Multi Asset team at Allspring Global Investments.
""We still think there is a case to make for structurally higher energy prices for the moment.""
Fears of an inflationary aftershock from soaring energy prices have pushed traders to price out any chance of a Federal Reserve rate cut this year, lifting the dollar. Bets on US rate hikes briefly gained traction but have since been pared back.
European Central Bank President Christine Lagarde opened the door on Wednesday to raising interest rates in the euro zone if war in the Middle East pushes up inflation in the region for some time.
""If the shock gives rise to a large though not-too-persistent overshoot of our target, some measured adjustment of policy could be warranted,"" Lagarde said in Frankfurt.
The euro was little changed at US$1.1562, while sterling bought US$1.3358. The yen hovered at 159.43 per dollar, clinging to the closely watched 160 level that traders see as a potential trigger for intervention.
In commodities, gold was 0.66 per cent higher at US$4,537 per ounce, but has largely sold off this month and is on course for a 14 per cent drop in the month, its steepest fall since October 2008.
© New Straits Times Press (M) Bhd"
New Straits Times,Retiree collects thousands of discarded lighters to decorate home,https://www.nst.com.my/news/nation/2026/03/1403851/retiree-collects-thousands-discarded-lighters-decorate-home,"Thu, 26 Mar 2026 09:37:33 +0800","KUALA TERENGGANU: A 71-year-old, Ismail Hassan, has turned his Kampung Kuala Bekah home into a vibrant, plastic-paved landmark through his unique approach to recycling.
While others sort their waste into bins, the retiree has spent the last three years adorning his walls with nearly 4,000 discarded lighters.
What began as a dormant curiosity has grown into a full-blown retirement passion.
""I have always had an affinity for collecting them, but I didn't have the time when I was younger,"" he said.
Ismail cycles daily to local wakaf (pavilions) and public resting spots, where spent lighters are often discarded.
His collection has also grown through the generosity of friends who now regularly contribute their own spent lighters instead of throwing them away.
[[nid:1403892]]
The spark for this unconventional project ignited during a visit to Setiu, where Ismail encountered a house decorated with recycled glass bottles.
""I thought, why not lighters? They are colourful, easy to source, and frequently thrown away as rubbish,"" he said.
His walls are neatly arranged with the lighters.
Using wire mesh and transparent fishing line, he aligns each row perfectly.
""Beyond just a hobby, there is immense satisfaction in taking something discarded and transforming it into a conversation piece that people find beautiful,"" he added.
With parts of his wall still bare, Ismail continues his mission, one bicycle ride at a time.
[[nid:1403891]]
© New Straits Times Press (M) Bhd"
New Straits Times,"Bursa Malaysia opens higher, retreats on volatile sentiment",https://www.nst.com.my/business/corporate/2026/03/1403838/bursa-malaysia-opens-higher-retreats-volatile-sentiment,"Thu, 26 Mar 2026 09:20:42 +0800","KUALA LUMPUR: Bursa Malaysia opened higher but pared its gains thereafter despite a positive overnight performance on Wall Street, with investor sentiment expected to remain volatile in the near term.
At 9.10am, the FTSE Bursa Malaysia KLCI (FBM KLCI) eased 0.51 of a point to 1,716.17 from Wednesday's close of 1,716.68. The key index opened 2.78 points higher at 1,719.46.
Market breadth was negative, with 187 losers leading 106 gainers. A total of 260 counters were unchanged, 2,205 untraded, and 76 suspended.
Turnover stood at 154.26 million shares worth RM124.57 million.
Rakuten Trade Sdn Bhd vice president of equity research Thong Pak Leng said Wall Street ended higher amid a decline in crude oil prices, as Iran received a 15-point proposal from the US to end the war.
""We believe bargain hunting to emerge at the current range. Thus, expect the index to hover within the 1,710-1,720 range today,"" he said.
Among the heavyweight counters, Malayan Banking Bhd added four sen to RM11.48, Public Bank Bhd fell two sen to RM4.91, CIMB Group Holdings Bhd rose one sen to RM7.90, Tenaga Nasional Bhd was flat at RM14.42, while IHH Healthcare Bhd slid five sen to RM8.94.
On the most active list, Sunway Healthcare Holdings Bhd topped up 10 sen to RM2.22, Astro Malaysia Holdings Bhd was flat at eight sen, TWL Holdings Bhd decreased half a sen to two sen, Handal Energy Bhd up half a sen to 3.5 sen, while Zetrix AI Bhd slipped two sen to 73 sen.
Among the top gainers, Allianz Malaysia Bhd added 36 sen to RM21.06, Petronas Chemicals Group Bhd rose 22 sen to RM5.68, Petronas Dagangan Bhd gained 12 sen to RM21.72, and Hong Leong Financial Group Bhd went up 10 sen to RM19.66.
Top losers included Nestle (M) Bhd, which slid 36 sen to RM97.64, United Plantations Bhd down 20 sen to RM33.40, Malaysian Pacific Industries Bhd lost 12 sen to RM28.78, and Carimin Petroleum Bhd fell 10 sen to 34 sen.
On the index board, the FBM Top 100 Index narrowed 9.93 points to 12,326.0, the FBM Emas Index weakened 12.28 points to 12,462.56, and the FBM ACE Index lost 10.35 points to 4,359.95.
The FBM 70 Index dropped 40.90 points to 16,922.86, and the FBM Emas Shariah Index contracted 13.76 points to 12,180.73.
By sector, the Financial Services Index climbed 20.50 points to 20,590.12, and the Industrial Products and Services Index inched up 1.03 points to 181.15. The Plantation Index fell 9.93 points to 8,569.52, while the Energy Index lost 0.91 of a point to 784.45.
© New Straits Times Press (M) Bhd"
New Straits Times,Indian real estate developer Puravankara sees jump in enquiries at Middle East office,https://www.nst.com.my/property/2026/03/1403836/indian-real-estate-developer-puravankara-sees-jump-enquiries-middle-east,"Thu, 26 Mar 2026 09:16:20 +0800","BENGALURU: Puravankara has seen enquiries at its Middle East office rise by up to 60 per cent in recent weeks as the real estate developer launches new projects and Indians show renewed interest in investing back home with regional tensions rising, an executive said.
The builder also unveiled plans on Wednesday to launch 30 projects primarily across South India and Mumbai over the next 24 months, with a gross development value of more than 550 billion rupees (US$5.85 billion).
The company's Middle East sales office typically receives 150–200 enquiries per week, but volumes have picked up, led largely by buyers who had deferred purchase decisions months earlier, managing director Ashish Puravankara told Reuters.
Dubai has in recent years attracted wealthy Asians with favourable policies, driving a property boom. But some are taking steps to move assets to Singapore and Hong Kong, advisers and lawyers said, as the war clouds the Gulf's safe-haven image.
Puravankara, though, cautioned against drawing long-term conclusions, expecting Dubai to ""bounce back.""
""This is an unprecedented situation,"" the executive said, adding that people tend to pause decision-making during wars, and recent events should not be taken as an indication of how Dubai's real estate market will fare in the long term.
Puravankara also said it ""should be able to absorb"" a rise in input costs from crude-linked materials such as cement, paints and plastics.
© New Straits Times Press (M) Bhd"
New Straits Times,"'Agak-agak', 'boleh' and 'kaypoh' added to Oxford English Dictionary",https://www.nst.com.my/news/nation/2026/03/1403834/agak-agak-boleh-and-kaypoh-added-oxford-english-dictionary,"Thu, 26 Mar 2026 09:13:42 +0800","KUALA LUMPUR: The Oxford English Dictionary has added several Malaysian English terms in its latest update, with words originating from the Malay language and dialect of the Minnan (Hokkien) language, reported Xinhua.
The update contains 11 new words from Singaporean or Malaysian English, highlighting the region's linguistic influence on global English, the dictionary publisher Oxford Languages said in a statement on Tuesday.
Among the new additions are ""agak-agak,"" which appears as both a noun and a verb and refers to approximation or estimation, most frequently used in the context of a particular way of cooking, as well as the word ""boleh,"" an intransitive verb meaning to have the power, ability, or capacity to do or deal with something successfully.
Hokkien contributions in this update include ""jialat,"" which describes a difficult or terrible situation. It originally also carried the sense of something irksome or exhausting.
Another Hokkien borrowing is ""kaypoh,"" which refers to a busybody and can function as a noun, adjective or verb.
Oxford Languages also said that readers can find more details on updates from Malaysia, Singapore, the Philippines, South Africa and Ireland in its World English release notes.
– BERNAMA-XINHUA
© New Straits Times Press (M) Bhd"
New Straits Times,Tropicana's RM89mil sukuk redemption boosts balance sheet,https://www.nst.com.my/property/2026/03/1403832/tropicanas-rm89mil-sukuk-redemption-boosts-balance-sheet,"Thu, 26 Mar 2026 09:13:18 +0800","KUALA LUMPUR: Tropicana Corp Bhd is accelerating its financial transformation through a series of decisive capital management moves, reinforcing investor confidence while positioning the group for sustainable growth.
The property developer has announced the full redemption of its Tranche 1 perpetual sukuk, originally issued in September 2019 to fund key projects across its strategic townships. The move forms part of a broader effort to pare down borrowings and strengthen balance sheet resilience.
This follows the group's RM139 million Tranche 4 repayment under its RM1.5 billion Islamic Medium-Term Notes (IMTN) Sukuk Wakalah Programme in October 2025, bringing total cumulative repayments to RM1.12 billion.
Further underscoring market confidence, Tropicana returned to the debt capital market in November 2025 with a RM300 million IMTN issuance – upsized from RM200 million after attracting strong investor demand. The offering was oversubscribed, with significant participation from government-linked institutional investors.
""The full redemption of the Tranche 1 perpetual sukuk reflects the steady progress we are making in strengthening Tropicana as an organisation and reinforces our commitment to meeting our obligations.
""We will continue transforming Tropicana into a future-ready group focused on sustainable growth. Our strategy prioritises strengthening our core property segment through an asset-light model, leveraging our development expertise,"" said the management.
It said the milestones highlight the group's disciplined financial management and firm commitment to meeting its obligations, even as it maintains solid operational momentum.
Tropicana's unbilled sales remain robust at RM2 billion, supported by a healthy pipeline of ongoing and upcoming projects with a combined gross development value (GDV) exceeding RM7.5 billion.
For the financial year ended Dec 31, 2025, Tropicana recorded revenue of RM1.5 billion, up 6.0 per cent year-on-year, driven by higher progress billings across key developments in the Klang Valley as well as the Southern and Northern regions.
Looking ahead, the group is sharpening its focus on sustaining growth through stronger sales execution, strategic monetisation of land banks and investment properties, and continued financial optimisation.
Reflecting these improvements, MARC Ratings upgraded Tropicana's outlook to positive from stable while affirming its A rating, citing balance sheet strengthening driven by deleveraging initiatives and asset disposals.
Operationally, Tropicana continues to gain traction with 11 new developments worth an estimated GDV of RM3.1 billion, spanning key locations including Kota Kemuning, Cyberjaya, Genting Highlands, Langkawi and Johor.
The group is also set to deliver vacant possession for several projects this year, further supporting earnings visibility.
With a landbank at 1,540 hectares and a total potential GDV of RM168.4 billion, Tropicana is well-positioned to unlock long-term value and drive sustained performance in the years ahead.
© New Straits Times Press (M) Bhd"
