Source,Title,Link,Date,Article
Malay Mail,Melaka police move to charge 39-year-old after toddler allegedly tests positive for cannabis-laced sweets ,https://www.malaymail.com/news/malaysia/2026/04/26/melaka-police-move-to-charge-39-year-old-after-toddler-allegedly-tests-positive-for-cannabis-laced-sweets/217707,"Sun, 26 Apr 2026 10:33:08 +0800","MELAKA, April 26 — A 39-year-old man is expected to face charges in court tomorrow for allegedly exposing a three-year-old girl to drug-laced sweets.
Melaka police chief Datuk Dzulkhairi Mukhtar said instructions to charge the suspect have been received from the deputy public prosecutor (DPP), Harian Metro reported yesterday.
“The investigation has been fully completed during the remand period.
“The case has now been referred to the DPP  and instructions have been issued to charge the suspect,” he was quoted as saying.
The suspect, who reportedly has a large online following, was arrested on April 15 after the case came to light when the child was treated at Melaka Hospital in a semi-conscious state on April 14.
Initial investigations found the sweets were allegedly purchased abroad by the suspect and later kept in a refrigerator at a relative’s home in Sungai Putat, where the child was under care.
The child is believed to have consumed the sweets before losing consciousness and being rushed to hospital.
Medical tests later showed traces of Tetrahydrocannabinol (THC), the psychoactive component of cannabis.
She has since recovered and been discharged.
Police confirmed the suspect has no prior criminal record and tested negative for drugs.
The sweets were not recovered during a search of the premises, and investigations were carried out under the Sexual, Women and Children Investigation Division (D11) before the case was referred for prosecution."
Malay Mail,"Usno split over GRS exit decision, deputy says move not unanimous",https://www.malaymail.com/news/malaysia/2026/04/26/usno-split-over-grs-exit-decision-deputy-says-move-not-unanimous/217706,"Sun, 26 Apr 2026 10:13:59 +0800","KOTA KINABALU, April 26 — United Sabah National Organisation (Usno) Deputy President Datuk Ibrahim Linggam today said the decision to leave Gabungan Rakyat Sabah (GRS) was not a unanimous one.
He described the decision by party president Tan Sri Pandikar Amin Mulia to withdraw from GRS as hasty and not reflective of the views of the party’s broader leadership.
Ibrahim said the move was made without adequately considering its impact on party members, many of whom were reportedly opposed to leaving the ruling coalition.
He also refuted claims that the decision had been made unanimously by the party’s Supreme Executive Council.
“Usno’s Supreme Executive Council comprises 37 members. However, only 18 attended the meeting on April 22, 2026. Therefore, it is inaccurate to say the decision was made unanimously,” he said in a statement on Saturday night.
According to Ibrahim, many council members who were absent from the meeting did not support the move to exit GRS.
He added that support for the coalition remains strong among Usno leaders at both central and divisional levels, particularly for Datuk Seri Panglima Hajiji Noor, who is GRS chairman and Sabah Chief Minister.
“The decision by Tan Sri Pandikar Amin to resign is a personal one in his capacity as Deputy Chairman of GRS under Usno’s quota.
“While we respect that, we maintain our support for GRS and do not agree with Usno leaving the coalition,” he said.
Ibrahim further claimed that there were elements of pressure in securing agreement for the decision, alleging that some members were told the party president might resign if objections were raised.
He also alleged that members who did not attend the meeting were instructed to sign letters in support of leaving GRS or risk being removed from their positions.
On the matter, Ibrahim stressed that democratic principles within the party must be upheld.
“While the president has the right to express his views and make decisions, the voices of other leaders must also be taken into account,” he said.
He maintained that there were no major disputes between Usno and GRS, noting that cordial relations continue at both leadership and grassroots levels.
“Any differences in opinion can still be discussed,” he added.
Ibrahim expressed hope that ties between Usno and GRS would endure, emphasising that priority should remain on the development of Sabah. — The Borneo Post"
Malay Mail,Azam Baki plans active retirement without politics after leaving MACC,https://www.malaymail.com/news/malaysia/2026/04/26/azam-baki-plans-active-retirement-without-politics-after-leaving-macc/217704,"Sun, 26 Apr 2026 10:01:48 +0800","KUALA LUMPUR, April 26 — Outgoing Malaysian Anti-Corruption Commission (MACC) chief commissioner Tan Sri Azam Baki said he intends to remain physically active after stepping down next month, while brushing aside talk of a political future.
Azam, whose contract ends on May 12, said he has yet to outline firm post-office plans but expects to keep up with regular exercise, The Star reported today.
“I remain in good health and will continue to stay active through activities such as jogging and cycling,” he was quoted telling reporters after attending an event in Negeri Sembilan yesterday.
He also dismissed speculation linking him to politics, stressing that his career has always been rooted in public service.
“I am a public servant. My duty has always been to serve the rakyat,” he added.
Azam at the same time called on MACC officers to remain united and fully support the incoming leadership as the agency transitions to a new chief commissioner.
He also expressed appreciation to His Majesty Sultan Ibrahim  for the confidence shown in him throughout his tenure, which included multiple contract extensions since he first took office in March 2020.
Azam said he hopes MACC personnel will put aside internal differences and continue strengthening the institution, adding that he believes the agency’s performance and integrity will be sustained under new leadership."
Malay Mail,"Ex-judge Abdul Halim as new MACC boss will rebuild public trust, says govt backbenchers chief",https://www.malaymail.com/news/malaysia/2026/04/26/ex-judge-abdul-halim-as-new-macc-boss-will-rebuild-public-trust-says-govt-backbenchers-chief/217691,"Sun, 26 Apr 2026 09:03:13 +0800","JOHOR BAHRU, April 26 —  The appointment of former High Court judge, Datuk Seri Abdul Halim Aman as the new Malaysian Anti-Corruption Commission (MACC) Chief Commissioner is a strategic move to strengthen institutional reform and enhance public confidence in the integrity of the enforcement agency.
Madani Government Backbenchers Club (BBC) chairman Datuk Seri Dr Zaliha Mustafa said the selection of a figure with a judicial background sends a clear signal that the Madani government is committed to ensuring the independence of the anti-corruption body.
“This will directly counter any perception of political interference, while restoring investor confidence in the country,” she said in a statement yesterday.
She also expressed hope that the appointment would accelerate efforts to achieve the targets set under the National Anti-Corruption Strategy (NACS), which aims to place Malaysia among the world’s top 25 countries by 2033.
The Sekijang MP said Malaysia’s improved ranking to 54th globally with a score of 52 in the Corruption Perceptions Index (CPI) 2025 reflects the effectiveness of ongoing governance initiatives.
At the same time, she conveyed her appreciation to Tan Sri Azam Baki for his service and contributions during his tenure leading the MACC.
His Majesty Sultan Ibrahim, King of Malaysia, has consented to Abdul Halim’s appointment, which will take effect on May 13. — Bernama"
Malay Mail,"Seri Puteri Symphonic Winds Orchestra gets RM100,000 boost from Anwar ahead of Netherlands world contest",https://www.malaymail.com/news/malaysia/2026/04/26/seri-puteri-symphonic-winds-orchestra-gets-rm100000-boost-from-anwar-ahead-of-netherlands-world-contest/217690,"Sun, 26 Apr 2026 08:54:35 +0800","PUTRAJAYA, April 26 —  Prime Minister Datuk Seri Anwar Ibrahim tonight announced a contribution of RM100,000 to the Sekolah Seri Puteri (SSP) orchestra, known as the Seri Puteri Symphonic Winds Orchestra (SPWinds).
Anwar, who is also the Finance Minister, stated that the contribution serves as a mark of support and encouragement for the group to carry out programmes and activities that contribute to student development through artistic excellence.
“An extraordinary performance... this (contribution) is to encourage the children,” he told reporters briefly after spending time to watch the performance “Winds of Glory: AM:PM Amir Masdi and SP Winds in Concert” here.
Earlier, Anwar – who arrived at 8:00 pm accompanied by Ministry of Education Secretary-General Datuk Dr. Aminuddin Hassim – spent nearly two hours at the Plenary Hall, Putrajaya International Convention Centre (PICC), with approximately 1,000 spectators witnessing a high-energy collaboration between local artist Amir Masdi and the SPWinds orchestra.
The concert serves not only as a platform to expose SPWinds to professional music standards but is also a crucial step in their preparations for the 2026 World Music Contest (WMC) in the Netherlands this July.
Organised by the SPWinds Parental Support Group (KSIB) under the Sekolah Seri Puteri Parent-Teacher Association (PIBG), the charity concert also aimed to raise funds for their upcoming trip to the Netherlands.
The SPWinds orchestra previously brought honor to the nation on the international stage by clinching the Gold Award at the 11th World Orchestra Festival held in Vienna, Austria, from July 23 to 26 last year. — Bernama"
Malay Mail,‘People will come and go’: Masidi says more applying to join GRS after Usno quits,https://www.malaymail.com/news/malaysia/2026/04/26/people-will-come-and-go-masidi-says-more-applying-to-join-grs-after-usno-quits/217689,"Sun, 26 Apr 2026 09:13:20 +0800","KOTA KINABALU, April 26 — Several political parties have applied to join Gabungan Rakyat Sabah (GRS), reflecting the state’s dynamic political landscape, said its secretary-general, Datuk Seri Masidi Manjun.
Masidi, who is also Sabah Deputy Chief Minister II and Finance Minister, said the decision by the United Sabah National Organisation (Usno) to leave GRS was also part of the ever-changing and unpredictable political reality in the state.
“People will come and go. But for now, there are already new applications from other political parties
“But of course, let the GRS chairman (Datuk Seri Hajiji Noor) announce it at the appropriate time,” he told reporters after attending the gala night organised by the Malaysia-China Chamber of Commerce (MCCC) Sabah branch here tonight.
Commenting on Usno’s decision, he said that politics is very fluid and dynamic, and it is sometimes impossible to foresee what will happen beyond the next day.
“Sometimes you cannot predict what will happen beyond tomorrow. While I wish they had stayed, we nevertheless respect their decision to quit GRS. I think we part as friends and not as enemies, and that is the most important thing,” he added.
Meanwhile, GRS information chief Datuk Joniston Bangkuai, who was also present, said he respected Usno’s decision and described it as a normal occurrence in politics.
“We understand the reason given – that they are no longer compatible. For us in GRS, we will continue to focus on uniting all parties and communities in Sabah. We will not lose our focus,” he said.
On Wednesday (April 22), Usno president Tan Sri Pandikar Amin Mulia confirmed that his party had left GRS during a meeting with Hajiji. — Bernama"
Malay Mail,DAP sec-gen says party fully respects royals amid backlash over Selangor pig farm proposal remarks,https://www.malaymail.com/news/malaysia/2026/04/26/dap-sec-gen-says-party-fully-respects-royals-amid-backlash-over-selangor-pig-farm-proposal-remarks/217687,"Sun, 26 Apr 2026 09:07:52 +0800","KUALA LUMPUR, April 26 — DAP has once again reaffirmed that it remains steadfast in its principle of holding the royal institution in the highest regard and has never compromised on that matter.
DAP Secretary-General Anthony Loke Siew Fook said that this stance has always been the party’s foundation in ensuring that harmony between the royal institution and the country’s administrative system is preserved.
However, he noted that at the same time, the party provides space for its elected representatives to voice their views, as it is part of their responsibility to the people.
“As a Member of the Legislative Assembly (Adun), they must have the space to convey views respectfully and in a proper manner. That is the responsibility of an elected representative.
“Therefore, I want to emphasise that the DAP leadership will defend the rights of our Aduns to deliver critical and insightful views in the State Legislative Assembly, even knowing they will face various pressures,” he said.
He said this following recent criticism directed at Seri Kembangan Adun Wong Siew Ki, regarding her statements which allegedly touched on sensitive issues related to pig farming.
Wong, while debating the Sultan of Selangor’s royal address during the State Legislative Assembly session, reportedly requested the state government’s consideration to allow for the exploration of modern and closed pig farming systems in Selangor.
She noted that the proposal takes into account the aspect of equality for all citizens as guaranteed under Article 8(2) of the Federal Constitution.
However, according to Loke, the proposal has been exploited by the opposition to attack the party for their own political interests.
“This has naturally been seized upon by Perikatan Nasional and the opposition to turn it into an issue, claiming that DAP does not respect the royal institution or the Sultan. I want to stress that DAP has always respected the royal institution and respects His Royal Highness the Sultan of Selangor,” he said.
Loke was met at the DAP Kinrara Charity Dinner in Pusat Bandar Puchong tonight, which was also attended by DAP National Chairman Gobind Singh Deo, Selangor Menteri Besar Datuk Seri Amirudin Shari, and Senior Political Advisor to the Prime Minister Tengku Datuk Seri Zafrul Abdul Aziz. — Bernama"
Malay Mail,"RM230m scandal: MACC extends remand on NGO deputy chief, company director till April 30",https://www.malaymail.com/news/malaysia/2026/04/26/rm230m-scandal-macc-extends-remand-on-ngo-deputy-chief-company-director-till-april-30/217688,"Sun, 26 Apr 2026 08:48:19 +0800","KUALA LUMPUR, April 26 — The Malaysian Anti-Corruption Commission (MACC) Selangor has obtained an order to extend the remand of a deputy president of a non-governmental organisation (NGO) and a company director to assist in investigations into the misappropriation of approximately RM230 million in funds.
According to a source, the five-day remand order until April 30 for both individuals was issued by Deputy Registrar Faizah Nor Randeran at the Shah Alam Magistrate’s Court this morning after their earlier remand period ended yesterday.
The two suspects, in their 50s and 60s, were previously remanded for four days starting last Wednesday and following the arrests, the MACC also froze 33 bank accounts involving approximately RM150 million.
Meanwhile, Selangor MACC director Mohd Azwan Ramli, when contacted, confirmed the development and said the case is being investigated under the MACC Act 2009.
Commenting on the same case, MACC Chief Commissioner Tan Sri Azam Baki yesterday said that so far, 40 witnesses had been identified with 11 of them had their statements recorded, while of the three arrests made, two individuals were remanded.
MACC had earlier confirmed that the case involved the misappropriation of public donations and not zakat funds. — Bernama"
Malay Mail,"The goodest girl: Meet Tessy, the German Shepherd sniffing out MRT cable thieves one theft at a time (VIDEO)",https://www.malaymail.com/news/malaysia/2026/04/26/the-goodest-girl-meet-tessy-the-german-shepherd-sniffing-out-mrt-cable-thieves-one-theft-at-a-time-video/216320,"Sun, 26 Apr 2026 07:00:00 +0800","KUALA LUMPUR, April 26 — Tessy may look like any other trained sniffer dog at first glance, but along the Klang Valley’s MRT rail alignments, her keen sense of smell has become a quiet yet formidable ally against a persistent and evolving threat.
Tessy, a seven-year-old female German Shepherd, is now at the forefront of Prasarana Malaysia’s latest efforts to outsmart increasingly sophisticated cable thieves targeting the combined 116km stretch of the Kajang and Putrajaya MRT lines.
According to her owner, Yew Wai Cheong, Tessy was not initially trained to sniff out concealed cable-cutting tools or track down thieves in hiding who might otherwise evade human detection.
“She was not my dog from the beginning and I adopted her from a very good friend of mine back in 2021.
As a matter of fact, Yew was already familiar with Tessy before her adoption because he had been looking after her brother from the same litter and when the opportunity arose, he took it.
Yew said he adopted Tessy from a good friend in 2021 and has served as his personal protection dog since. — Picture by Sayuti Zainudin
During her time with him, Tessy served as a personal protection dog and was also involved in providing security services.
Nose for trouble, heart for duty
Outside of her professional work, Tessy enjoys hiking, swimming and roaming through the woods and waterfalls in Kampar and Ipoh, Perak where Yew hails from.
She does not have a particular favourite food and is not a picky eater, as Yew puts it, ‘as long as she’s fed, she feels grateful’.
Her special quirks? As Yew puts it bluntly, Tessy is ‘a bit of a handful’— she sometimes knows she is not allowed to behave in a particular way but does it nonetheless.
“When I took over, she had received some training, but she has a lot of talent yet unfortunately it was not polished; but I could see she has very good potential,” he told
Malay Mail
during an interview near the MRT Taman Naga Emas station recently following an after-hours track inspection.
“Even though she knows there will be consequences, she does it anyway but afterward, she’s very apologetic.
“But when it comes to work, she is serious. She understands and dares not misbehave as you could observe just now,” he said.
Yew and Tessy conducting track inspection between the Taman Naga Emas and Sungai Besi MRT stations for any signs of tampering or trespass by cable thieves. — Picture by Sayuti Zainudin
Molded and forged for the frontline
Although possessing a specialised set of trained skills, Yew said Tessy did not initially come under Prasarana’s sniffer dog initiative, which began around December last year.
He said the security company he worked for initially reached out to him to employ Tessy for a similar initiative under the East Coast Rail Link (ECRL) project, but the plan never materialised.
Still, Yew said he saw through Tessy’s training, which took roughly about a month and a half, during which she was familiarised with cable-cutting tools, how to identify unauthorised individuals and potential hiding spots during track inspections.
Lacking prior experience in rail track inspection using a sniffer dog, Yew obtained feedback from Prasarana’s auxiliary police and management to tailor Tessy’s specialised training.
“These include training her to seek out thieves that may be hiding under the track walkway, which is difficult to see under normal circumstances,” he said.
The walkway beside the tracks offers a potential hiding spot for would-be cable thieves, where sniffer dogs are specially trained to detect concealed cutting tools and unauthorised individuals within. — Picture by Sayuti Zainudin
Before rail track inspections, both Yew and Tessy were assigned a more challenging and higher-risk duty —
patrolling
inside the MRT’s elevated viaduct hollow structural sections.
“That was much more difficult compared to the tracks...low oxygen, humid, dusty and if something were to happen, you have nowhere to go (because of the confined space).
“And sometimes when you reach the joints between the viaducts, the piers can be very high and you might fall,” he said.
Yew said the most challenging part was conditioning both himself and Tessy to work in such harsh environments inside the viaducts.
“One kilometre inside the viaduct equals three times the travel length on the outside, so the dog must be in very good condition from beginning to end.
“And for people who have not been inside the viaduct before, they have no idea how tricky it is,” he said.
So far, Yew said there have been no direct confrontations with cable thieves inside the viaducts but numerous tools, footprints and fingerprints have been found since they first started.
“Of course we do not wish for a confrontation because in such a situation, the suspect may decide to retaliate since they have nowhere else to run.
When asked if the risks ever scared him, Yew did not hesitate to admit that they do but added that he is not one to romanticise danger or “play superhero” in real life.
“Superheroes are good for movies, but not for real life.
There are some situations where, if you can avoid it, you avoid it. But of course, there are also situations where we have to confront it. So it depends.
“So far, Tessy has been doing great,” he said.
Tessy taking a break after performing a routine off-hours track inspection. — Picture by Sayuti Zainudin"
