Source,Title,Link,Date,Article
Malay Mail,"Perlis ruler urges state to pursue high-impact investments, explore new revenue sources for sustainable growth",https://www.malaymail.com/news/malaysia/2026/06/03/perlis-ruler-urges-state-to-pursue-high-impact-investments-explore-new-revenue-sources-for-sustainable-growth/222398,"Wed, 03 Jun 2026 15:16:41 +0800","KANGAR, June 3 — The Perlis state government must explore innovative approaches suited to local potential to address increasingly complex economic challenges, said the Raja of Perlis, Tuanku Syed Sirajuddin Jamalullail.
Tuanku Syed Sirajuddin said this includes strengthening high-value sectors, attracting strategic investments, and leveraging geographical advantages as well as existing resources.
His Royal Highness said the approaches adopted should be based on best practices that have proven successful, whether domestically or internationally, while taking into account the state’s specific context.
“Focus should be given to high-impact initiatives capable of generating long-term returns, rather than short-term programmes that offer limited value to the state’s economy,” he said in his royal address at the opening of the fourth term of the Perlis State Legislative Assembly sitting at Kompleks Seri Putra here today.
Also in attendance was the Raja Perempuan of Perlis, Tuanku Tengku Fauziah Tengku Abdul Rashid.
The Raja Muda of Perlis, Tuanku Syed Faizuddin Putra Jamalullail, and the Raja Puan Muda of Perlis, Tuanku Dr Hajah Lailatul Shahreen Akashah Khalil, were also present.
Tuanku Syed Sirajuddin also emphasised the importance of efforts to generate state revenue and to explore new, more sustainable and resilient sources of income.
Meanwhile, His Royal Highness stressed that all expenditure must be carried out prudently, transparently and with integrity, while delivering maximum returns to the people in the implementation of development projects in Perlis.
“I am of the view that true progress is not measured solely by figures, but by the level of well-being genuinely experienced by all segments of society. Therefore, every policy and initiative must be carefully designed, with a focus on improving the quality of life of the people in a comprehensive, inclusive and sustainable manner.
Tuanku Syed Sirajuddin also expressed hope that the state government will continue to maintain good relations with the federal government to ensure the well-being of the state. — Bernama"
Malay Mail,"GOF foils bid to smuggle exotic birds from Thailand, seizes parrots worth RM100,000",https://www.malaymail.com/news/malaysia/2026/06/03/gof-foils-bid-to-smuggle-exotic-birds-from-thailand-seizes-parrots-worth-rm100000/222397,"Wed, 03 Jun 2026 15:12:31 +0800","KOTA BHARU, June 3 — Four exotic birds worth approximately RM100,000, believed to have been smuggled from Thailand, were seized by the General Operations Force (GOF) in an operation near the illegal Kak Nah jetty in Pengkalan Kubor, Tumpat, yesterday.
GOF Southeast Brigade Commander SAC Ahmad Radzi Hussain said the seizure was carried out under Op Taring Wawasan Kelantan at about 7 pm after a Strike Force team detected a man unloading several cages on the Malaysian side of Sungai Golok.
He said the suspect fled by boat towards the Thai riverbank upon realising the presence of GOF personnel.
“Inspection of the abandoned cages found two Blue-and-Gold Macaws and two Blue-fronted Amazon parrots, believed to have been brought in without valid permits.
“Also seized were two cages used to transport the birds, bringing the total value of the seizure to an estimated RM100,200,” he said in a statement today.
According to Ahmad Radzi, the case has been handed over to the Kelantan Department of Wildlife and National Parks (Perhilitan) for further investigation and action under the Wildlife Conservation Act 2010 (Act 716).
He said the exotic birds are believed to be intended for local buyers, adding that patrols and monitoring along the border will continue to be intensified to curb wildlife smuggling activities. — Bernama"
Malay Mail,Perlis receives RM661.7m under 13MP as ruler calls for faster project implementation,https://www.malaymail.com/news/malaysia/2026/06/03/perlis-receives-rm6617m-under-13mp-as-ruler-calls-for-faster-project-implementation/222396,"Wed, 03 Jun 2026 15:07:59 +0800","KANGAR, June 3 — Perlis has received an allocation of RM661.70 million under the Rolling Plan 1 (RP1) of the 13th Malaysia Plan (13MP), with expenditure performance reaching RM87.46 million, or 13.22 per cent, as of last April.
The Raja of Perlis, Tuanku Syed Sirajuddin Jamalullail, said the spending involved the implementation of 354 projects.
“Under the Rolling Plan 5 (RP5) of the 12th Malaysia Plan (12MP), Perlis received an allocation of RM632.56 million involving 188 projects. Of that amount, RM474.17 million was spent, equivalent to 74.96 per cent last year,” he said.
His Royal Highness said this in his royal address at the opening of the fourth term of the Perlis State Legislative Assembly sitting at Kompleks Seri Putra here today.
His address was delivered on his behalf by the Raja Muda of Perlis, Tuanku Syed Faizuddin Putra Jamalullail.
Also in attendance were the Raja Perempuan of Perlis, Tuanku Tengku Fauziah Tengku Abdul Rashid, and the Raja Puan Muda of Perlis, Tuanku Dr Hajah Lailatul Shahreen Akashah Khalil.
Tuanku Syed Sirajuddin said that the implementation of all development projects must be expedited so that their benefits can be enjoyed by the people within a reasonable timeframe.
“I also call on all departments and agencies that have been allocated funds to take immediate steps to implement projects and ensure that spending is carried out efficiently and in an orderly manner,” he said.
The Ruler said this is crucial to stimulate the state’s economic activities, enabling the benefits of the economic cycle to be felt more quickly by the people through increased employment opportunities, income and local business activities.
His Royal Highness added that efficiency in implementation not only boosts public confidence but also ensures that the state’s financial resources are utilised optimally without wastage or undue delays. — Bernama"
Malay Mail,Woman pleads guilty to culpable homicide over death of one of her newborn twins in Johor Bahru,https://www.malaymail.com/news/malaysia/2026/06/03/woman-pleads-guilty-to-culpable-homicide-over-death-of-one-of-her-newborn-twins-in-johor-bahru/222394,"Wed, 03 Jun 2026 15:00:59 +0800","JOHOR BAHRU, June 3 — A 22-year-old woman pleaded guilty at the Sessions Court here today to a charge of culpable homicide over the death of one of her newborn twin daughters last month.
The accused, Nuran Batrisya Jamaludin, nodded and pleaded guilty after the charge was read out to her before Judge Mohd Zamir Suhaimee.
According to the charge sheet, she was accused of causing the death of a baby girl with the intention of causing bodily injury likely to result in death.
The offence was allegedly committed in the car park of Blok Rajawali at the Program Perumahan Rakyat Melana Indah flats in Taman Sutera Utama here between 11am and 2.30pm on May 20.
Nuran Batrisya was charged under Section 304(a) of the Penal Code for culpable homicide not amounting to murder, which carries a prison sentence of up to 30 years and a fine upon conviction.
Earlier, Deputy Public Prosecutor R. Nevina did not offer bail.
However, the accused, who is unmarried and unemployed, applied for bail on the grounds that she is caring for the victim’s twin sibling and has family commitments.
Under Section 304(a) of the Penal Code, bail may be granted at the discretion of the Sessions Court or High Court.
The court granted bail of RM20,000 with two local sureties and imposed additional conditions. The accused was ordered to surrender her passport to the court, report to the nearest police station once a month and refrain from interfering with witnesses.
The court fixed July 3 for mention, submission of documents and sentencing.
It was previously reported that police arrested a young mother for allegedly throwing her newborn baby girl from the 10th floor of a residential flat here last month.
Acting Johor police chief Deputy Commissioner Hoo Chuan Huat said police received a report on May 20 at 2.40pm regarding the discovery of the baby’s body in the parking area of a residential flat.
Based on investigations, police believed the suspect, who is the baby’s biological mother, was responsible for the incident.
She was detained at the compound of Sultanah Aminah Hospital (HSA) before being arrested."
Malay Mail,Chinese national pleads not guilty to murdering compatriot at Cheras shopping mall restaurant,https://www.malaymail.com/news/malaysia/2026/06/03/chinese-national-pleads-not-guilty-to-murdering-compatriot-at-cheras-shopping-mall-restaurant/222393,"Wed, 03 Jun 2026 15:01:41 +0800","KUALA LUMPUR, June 3 — A former restaurant waitress, a Chinese national, pleaded not guilty in the High Court here today to murdering her female fellow national by stabbing her multiple times at a restaurant in a shopping mall in Cheras two years ago.
Yang Yahong, 36, made the plea after the charge was read before Judge Datuk Aslam Zainuddin.
The woman was accused of murdering her colleague, cashier Zhang Wei, 34, at 4.30pm on November 29, 2024.
She was charged under Section 302 of the Penal Code, which provides for the death penalty or imprisonment of between 30 and 40 years, and is also liable to not less than 12 strokes of the cane upon conviction.
Deputy public prosecutor (DPP) Faridah Nurdinie Bahrum appeared for the prosecution, while the accused was unrepresented.
In the same court, a local man pleaded not guilty to a charge of trafficking 7,707.8 grams of Methamphetamine last year.
Kong Mung Kean, 33, was accused of trafficking the drugs in a shopping mall parking lot on Jalan Klang Lama here at 5.40pm on July 24, 2025.
He was charged under Section 39B(1)(a) of the Dangerous Drugs Act 1952, which carries the death penalty or life imprisonment, and if not sentenced to death, a minimum of 12 strokes of the cane upon conviction.
The prosecution was conducted by DPP Faridah Nurdinie, while Kong was represented by lawyer Evie Melynda Jee.
The court set July 16 as the next mention date for both cases. — Bernama"
Malay Mail,Man swept away in Sungai Pahang crossing found drowned,https://www.malaymail.com/news/malaysia/2026/06/03/man-swept-away-in-sungai-pahang-crossing-found-drowned/222387,"Wed, 03 Jun 2026 14:14:18 +0800","KUANTAN, June 3 — A man believed to have been swept away by strong currents while attempting to cross Sungai Pahang at Kampung Peragap, Temerloh yesterday was found drowned today.
A spokesman for the Pahang Fire and Rescue Department (JBPM) said the body of Samsul Azmi Ishury, 41, was discovered at 9.35am, approximately 2.2 kilometres from Kampung Loyang, Temerloh.
“Efforts to bring the victim ashore were carried out and the body was handed over to the police for further action,” he said when contacted today.
He added that a firefighter sustained a fractured left arm after being trapped between a boat and a fish cage during the search and rescue (SAR) operation yesterday, and was taken to Hospital Sultan Haji Ahmad Shah, Temerloh for further treatment.
Apart from the fire and rescue department, the operation also involved the police, the Malaysian Civil Defence Force (APM), and was assisted by local villagers.
The media reported yesterday that the man was feared drowned after allegedly being swept away while attempting to swim across the river at Kampung Peragap, before firefighters arrived at the scene at about 8am to conduct the SAR operation. — Bernama"
Malay Mail,"Wet weather ahead: MetMalaysia warns of thunderstorms, heavy rain in five states until 3pm",https://www.malaymail.com/news/malaysia/2026/06/03/wet-weather-ahead-metmalaysia-warns-of-thunderstorms-heavy-rain-in-five-states-until-3pm/222385,"Wed, 03 Jun 2026 14:06:53 +0800","KUALA LUMPUR, June 3 — Thunderstorms, heavy rain and strong winds are expected to hit five states until 3pm today, according to the Malaysian Meteorological Department (MetMalaysia).
It said that the areas involved are Perlis, Penang, and Kedah (Kubang Pasu, Kota Setar, Pokok Sena, Yan, Pendang and Kuala Muda).
“Similar weather conditions are also expected in Sarawak, involving Sibu (Sibu and Selangau) and Mukah (Tanjung Manis and Daro),” MetMalaysia said in a statement.
It added that in Sabah, the affected areas include the interior (Sipitang, Tenom, Beaufort, Keningau and Tambunan) and the west coast (Papar and Penampang). — Bernama"
Malay Mail,Azam Baki grilled for two hours at Bukit Aman over threat allegations by businessman Albert Tei,https://www.malaymail.com/news/malaysia/2026/06/03/azam-baki-grilled-for-two-hours-at-bukit-aman-over-threat-allegations-by-businessman-albert-tei/222384,"Wed, 03 Jun 2026 14:01:34 +0800","KUALA LUMPUR, June 3 — Former Malaysian Anti-Corruption Commission (MACC) chief commissioner Tan Sri Azam Baki was at Bukit Aman police headquarters today to give a statement over allegations by businessman Albert Tei that he had been threatened.
Azam said he arrived at about 9am and gave his full cooperation to investigators,
Sinar Harian
reported today.
“The statement-recording process took about two hours, during which I answered questions posed by officers from the Bukit Aman Criminal Investigation Department,” he said when contacted today.
Azam said he denied all allegations made by Tei.
He also informed police that he had never met the businessman or conducted any dealings with him.
“I have also never sent any lawyer to meet any party on my behalf.
“I submitted evidence to the investigating officer showing that I have never met or dealt directly with Albert,” he said.
Police recently said Azam would be called in to assist investigations into Tei’s claim that he had been threatened.
Bukit Aman CID director Datuk M Kumar said Tei lodged the report on May 13.
He said the case is being investigated under Section 506 of the Penal Code, and investigation papers will be referred to the Attorney General’s Chambers soon for further instructions and advice."
Malay Mail,Negeri Sembilan MB granted audience with Tuanku Muhriz at Istana Hinggap,https://www.malaymail.com/news/malaysia/2026/06/03/negeri-sembilan-mb-granted-audience-with-tuanku-muhriz-at-istana-hinggap/222380,"Wed, 03 Jun 2026 13:22:25 +0800","SEREMBAN, June 3 — Yang Dipertuan Besar Negeri Sembilan Tuanku Muhriz Tuanku Munawir today granted an audience to Menteri Besar Datuk Seri Aminuddin Harun at Istana Hinggap here.
The meeting, which began at 9 am, lasted almost two hours.
Speaking to reporters afterwards, Aminuddin said the audience was part of his regular weekly schedule ahead of chairing the State Executive Council meeting.
“It is the usual Wednesday meeting,” he said briefly.
Yesterday, several leaders of the Pakatan Harapan (PH) in the state were reported to have held a meeting at the Menteri Besar’s official residence.
Negeri Sembilan DAP secretary Cha Kee Chin said the meeting was held to discuss the coalition’s preparations for the next state election. — Bernama"
Malay Mail,Man suffers 50pc burns after suspected LPG explosion in Alor Gajah house,https://www.malaymail.com/news/malaysia/2026/06/03/man-suffers-50pc-burns-after-suspected-lpg-explosion-in-alor-gajah-house/222379,"Wed, 03 Jun 2026 13:19:58 +0800","ALOR GAJAH, June 3 — A man suffered burns to about 50 per cent of his body after being hit by an explosion believed to have been caused by a liquefied petroleum gas (LPG) leak at a house in Taman Baiduri, Kuala Ina here today.
Melaka Fire and Rescue Department (JBPM) zone 2 chief, Assistant Fire Superintendent Zulkhairani Ramli said his department received an emergency call about the incident at about 10.26 am before a team of personnel from the Alor Gajah Fire and Rescue Station (BBP) was dispatched to the location.
“Upon arrival at the location, the fire brigade found a 29-year-old man who was a tenant of the house injured after a sudden explosion in the kitchen.
“The JBPM Emergency Rescue and Treatment Service (EMRS) team provided initial treatment to the victim before handing him over to the Ministry of Health (MOH) medical team and taking him to Tampin Hospital for further treatment,” he said in a statement today.
Explaining further, Zulkhairani said it was understood that before the incident, the victim, who had just returned from his village in Pahang, noticed a sound believed to be caused by a gas leak in the house before inspecting the cooking gas cylinder.
He said that while the victim was inspecting, a sudden explosion occurred which caused him to suffer burn injuries and serious damage to the house.
“The explosion caused damage to the roof of the house in addition to affecting the building structure including doors and windows, ceiling and electrical wiring.
“Monitoring and safety inspections are also being carried out to ensure there is no risk of a subsequent gas leak, in addition to assisting with investigations into the incident,” he said.
He said the incident was suspected to have been caused by a leak of LPG gas that had accumulated in the house before the explosion and further investigations were still being carried out to determine the exact cause of the incident. — Bernama"
Malay Mail,"Retired civil servant loses nearly RM98,000 in TikTok investment scam",https://www.malaymail.com/news/malaysia/2026/06/03/retired-civil-servant-loses-nearly-rm98000-in-tiktok-investment-scam/222377,"Wed, 03 Jun 2026 13:02:04 +0800","KUALA TERENGGANU, June 3 — A retired civil servant here lost RM97,933 after being duped by a fraudulent online investment syndicate.
Kuala Terengganu district police chief ACP Azli Mohd Noor said that on May 14, the 59-year-old victim came across an investment advertisement on the TikTok application offering lucrative returns within a short period.
The victim then contacted the suspect via Telegram and agreed to make an initial investment using his pension funds.
“The suspect informed the victim that he had earned profits from the investment. However, he was required to make a payment in order to withdraw the purported returns.
“The victim, who was desperate, made several payments between May 20 and June 2, but still failed to receive any of the promised profits,” he said in a statement today.
Azli said the victim, upon realising he had been scammed, lodged a police report at 8.24 pm yesterday. The case is being investigated under Section 420 of the Penal Code. — Bernama"
Malay Mail,Fadhlina: Budget 2027 cost-saving measures will not affect key education initiatives,https://www.malaymail.com/news/malaysia/2026/06/03/fadhlina-budget-2027-cost-saving-measures-will-not-affect-key-education-initiatives/222368,"Wed, 03 Jun 2026 12:28:03 +0800","KUALA LUMPUR, June 3 — Government cost-saving measures in drafting Budget 2027 will not affect the Ministry of Education’s (MOE) key plans, particularly in the recruitment of new teachers and the construction of additional classrooms, said Education Minister Fadhlina Sidek.
She also assured that the measures would not disrupt beneficiaries of the Supplementary Food Programme (RMT), which she described as essential for students’ nutritional intake.
In addition, Fadhlina said that repairs to dilapidated schools and building maintenance will continue as usual.
“We do not want the public to feel anxious or worried. Although the call for cost-saving measures is very important and critical at this time, I would like to assure that it will not affect or disrupt matters closely related to the ministry’s priorities,” she said.
She said this when met by reporters after officiating the international symposium on literature, translation and artificial intelligence at Dewan Bahasa dan Pustaka (DBP) here today.
Fadhlina said the MOE will also ensure that any cost-saving measures will not affect the rollout of the new curriculum next year, as well as the intake of six-year-old children into Year One.
On May 29, Prime Minister Datuk Seri Anwar Ibrahim hinted that Budget 2027 will be drafted with greater emphasis on cost-saving measures amid mounting global economic pressures affecting the country’s fiscal position, including those involving the MOE and the Ministry of Higher Education (MOHE).
Anwar, who is also Finance Minister, said global geopolitical uncertainties - including escalating tensions following attacks by the United States and its ally Israel on Iran - have impacted the global economy, thus requiring more prudent government spending.
Meanwhile, regarding the RM100 book voucher for secondary school students under the MOE and students of public higher education institutions (IPTAs), announced by the Prime Minister during the opening of the Kuala Lumpur International Book Fair (PBAKL) 2026 last Friday, Fadhlina said it will be distributed once the school session resumes. — Bernama"
Malay Mail,Businessman pleads not guilty to dangerous driving charge over teen’s death in Kuala Terengganu crash,https://www.malaymail.com/news/malaysia/2026/06/03/businessman-pleads-not-guilty-to-dangerous-driving-charge-over-teens-death-in-kuala-terengganu-crash/222365,"Wed, 03 Jun 2026 12:15:04 +0800","KUALA TERENGGANU, June 3 — A businessman pleaded not guilty in the Magistrate’s Court here today to a charge of dangerous driving that caused the death of a teenage boy in an accident at Jalan Losong Feri in May.
Asrizal Hisham Khalid, 43, was charged with dangerous driving a Volkswagen GTI car that caused the death of Wah Han Keong, 18, at 3.36 pm, on May 19.
The charge was brought under Section 41(1) of the Road Transport Act 1987 and is punishable under the same section and act which provides for a prison sentence of not less than five years and not more than 10 years and a fine of not less than RM20,000 to RM50,000, if convicted.
In addition, the accused also faces a disqualification from holding or obtaining a driving licence for a period of not less than five years from the date of conviction.
Magistrate Sharifah Amirda Shasha Amir Shariffuddin granted Asrizal Hisham bail of RM10,000 with one surety and imposed an additional condition that the accused’s driving license be suspended until the case is heard.
The court set August 3 as the date for re-mention of the case.
The prosecution was conducted by deputy public prosecutor Ameena Azzuhriyyah Ahmad while the accused was represented by a lawyer from the National Legal Aid Foundation (YBGK).
Previously, it was reported that a Volkswagen GTI car carrying a family of five lost control and skidded into a Public Works Department (JKR) pole in the middle of the road.
The car then entered the opposite lane and hit a van carrying the victim and his father.
The accident caused the JKR pole to fall and penetrate the van before impaling the victim’s head. — Bernama"
Malay Mail,Labuan MP urges landlords to vet tenants after 57 arrested in online scam raid,https://www.malaymail.com/news/malaysia/2026/06/03/labuan-mp-urges-landlords-to-vet-tenants-after-57-arrested-in-online-scam-raid/222364,"Wed, 03 Jun 2026 12:12:31 +0800","LABUAN, June 3 — Labuan Member of Parliament Datuk Suhaili Abd Rahman has urged property owners on the duty-free island to exercise greater caution when renting out their premises to prevent them from being misused for online scam operations.
He said the recent police raid at a commercial building in downtown Labuan, which led to the arrest of 57 individuals believed to be involved in an international investment scam syndicate, should serve as a lesson to all property owners.
“The tenants had apparently misrepresented the purpose of renting the premises, claiming that the space would be used for agro-related investment activities.
“However, nobody would have expected that the premises would instead be used as a calling centre to carry out fraudulent investment schemes targeting victims overseas,” he told Bernama today.
Suhaili said landlords should conduct thorough background checks on prospective tenants, including verifying their business activities and supporting documents before entering into tenancy agreements.
He commended the police and other enforcement agencies for their swift action in dismantling the syndicate.
“I believe this is the second raid on this island thus far involving investment scams. The authorities acted quickly and professionally; their success has helped protect potential victims and safeguard Labuan’s reputation as a secure and reputable place for business and investment,” he said.
Suhaili stressed that criminal syndicates often disguise their operations as legitimate businesses, making vigilance among property owners increasingly important.
He said the building raided was previously operated as Sara Hotel before the management decided to cease hotel operations in December 2025.
It was then converted into commercial office space and rented out to various tenants.
On June 1, police raided the premises and arrested 57 individuals aged between 20 and 46 believed to be linked to an online investment scam syndicate targeting victims in South Korea. The suspects comprise 48 Chinese nationals, eight Vietnamese and a Malaysian.
The Sessions Court here yesterday granted a remand order against all the suspects until June 6 to facilitate investigations. — Bernama"
