Source,Title,Link,Date,Article
New Straits Times,"#NSTviral: BMW alleged to have evaded roadblock, crashes near Gua Musang highway",https://www.nst.com.my/news/nst-viral/2026/07/1482420/nstviral-bmw-alleged-have-evaded-roadblock-crashes-near-gua-musang,"Tue, 07 Jul 2026 09:00:13 +0800","KUALA LUMPUR: An older-model white BMW attempting to evade a roadblock lost control and slammed into a concrete wall near a petrol station in Kuala Lipis.
The incident, which occurred near a Shell station just before the Gua Musang highway, was captured on camera and uploaded to Facebook by user Naz Kdas.
In the
one-minute 53-second clip
circulating on social media, the heavily damaged car can be seen wedged under a structure after the high-speed impact.
""An old BMW fled a roadblock, speeding like crazy. It completely lost control after overtaking my car and literally flew, crashing straight into a concrete wall.
""Fortunately, it went airborne after passing my vehicle; otherwise it would have been a tragedy for me,"" Naz Kdas said.
Naz Kdas also claimed that the occupants of the vehicle were foreign nationals.
Following the crash, police arrived at the scene shortly after to conduct arrests.
""However, some of the passengers managed to flee on foot towards the back of a nearby village,"" he said.
Policemen were seen securing the area as a crowd of onlookers gathered at the scene.
In social media comments, users made various claims and speculations regarding the incident.
© New Straits Times Press (M) Bhd"
New Straits Times,Ringgit opens slightly higher against greenback amid focus on Fed outlook,https://www.nst.com.my/business/economy/2026/07/1482418/ringgit-opens-slightly-higher-against-greenback-amid-focus-fed,"Tue, 07 Jul 2026 08:53:52 +0800","KUALA LUMPUR: The ringgit opened slightly higher against the US dollar on Tuesday amid continued focus on the United States (US) Federal Reserve's (Fed) interest rate outlook.
At 8 am, the local note rose to 4.0815/0880 against the greenback compared with 4.0825/0875 at Monday's close.
Bank Muamalat Malaysia Bhd chief economist Dr Mohd Afzanizam Abdul Rashid said investors remained focused on the Fed, while the resilience of the US services sector was expected to keep the US dollar well supported.
© New Straits Times Press (M) Bhd"
New Straits Times,Police seek witnesses after fatal hit-and-run on Cheras-Kajang Highway,https://www.nst.com.my/news/nation/2026/07/1482416/police-seek-witnesses-after-fatal-hit-and-run-cheras-kajang-highway,"Tue, 07 Jul 2026 08:52:09 +0800","KAJANG: Police are seeking witnesses to a fatal hit-and-run accident involving a pedestrian and a car at Km13 of the Cheras–Kajang Expressway last night.
District police chief said the incident occurred about 10pm yesterday when a 46-year-old man was struck by a red Toyota Innova.
Initial investigations found that the victim, who was driving a silver Toyota Innova with five passengers, had parked on the left side of the road to fix a punctured tyre.
After completing the repair, the victim walked to the rear of his vehicle to remove a bucket he had placed as a warning for other motorists.
As he was removing the bucket, the red Toyota Innova struck him and sped off without stopping.
The victim was pronounced dead at the scene.
The case is being investigated under Section 41(1) of the Road Transport Act 1987.
Those with information on the incident can contact Inspector Nur Faezah Mohd Zakria at 012-3268496.
© New Straits Times Press (M) Bhd"
New Straits Times,"Samsung expects 1,800pct leap in quarterly operating profit on AI boom",https://www.nst.com.my/business/corporate/2026/07/1482414/samsung-expects-1800pct-leap-quarterly-operating-profit-ai-boom,"Tue, 07 Jul 2026 08:51:32 +0800","SEOUL: South Korean technology giant Samsung Electronics forecast on Tuesday a roughly 19-fold jump in second-quarter operating profit from a year earlier, buoyed by sustained AI-driven demand for memory chips.
The world's largest memory chipmaker estimated April-June operating profit at 89.4 trillion won (US$58.4 billion) – up 1,810 per cent year-on-year, a company statement said.
Frenzied global demand for advanced memory chips used in data centres for artificial intelligence has already helped South Korean semiconductor giants post record profits this year.
The boom has also strengthened workers' demands for higher pay, and Samsung avoided a major strike in May after reaching an agreement on worker bonuses.
Tuesday's estimate beat market forecasts by 6.2 per cent and marked another quarterly record, according to South Korea's Yonhap News Agency, citing its own data firm.
Revenue likely rose 129 per cent to 171 trillion won, Samsung said. The company is due to release its final earnings report at the end of the month.
Samsung and domestic rival SK hynix are involved in a massive public-private investment of 800 trillion won to build a new semiconductor fabrication hub in the country's southwest.
Some analysts see potential delays to AI infrastructure investment as the biggest risk to the current memory boom.
But MS Hwang, a research analyst at Counterpoint Research, said he did not see ""evidence that the gap between suppliers' production capacity and customers' demand is narrowing"".
""While some data centre projects associated with less competitive players may be delayed, it would be an exaggeration to interpret the situation as a broad slowdown in AI infrastructure investment,"" he told AFP.
- Tax windfall -
South Korea's AI semiconductor boom has also fuelled debate over what the country should do with the increase in tax revenue sparked by the success of Samsung Electronics and SK hynix.
Presidential chief of staff Kang Hoon-sik said Sunday that the tax windfall would help finance large-scale projects around AI and the semiconductor industry.
It would also help to reduce inequality and support young people in accessing housing, founding startups and finding jobs, he added.
A simple jacket bearing the SK Hynix logo went viral online earlier this year as a symbol of wealth and success, with parody posts depicting it as a ""golden ticket"" to luxury boutiques or better dating prospects.
Jobs at Samsung and SK Hynix now guarantee ""a boost in marriage market value"", Yonhap has reported, citing a rise in their ""desirability indices"" compiled by matchmaking agency Sunoo – putting them on a par with doctors and lawyers.
Analyst Hwang said Samsung's Tuesday estimate was a ""very reasonable provision"".
""While bonus accruals and losses in the set business may weigh on earnings, memory profits alone are likely to be substantial,"" he said.
© New Straits Times Press (M) Bhd"
New Straits Times,Big US banks explore Fiserv network deal,https://www.nst.com.my/business/economy/2026/07/1482412/big-us-banks-explore-fiserv-network-deal,"Tue, 07 Jul 2026 08:50:28 +0800","KUALA LUMPUR: US banks, including JPMorgan and Bank of America, have in recent months held early talks about a deal to buy a network owned by the payments firm Fiserv that could allow them to bypass federal debit-card fee caps, the Wall Street Journal reported on Monday, citing sources.
The cap banks are reported to be looking to sidestep traces back to the 2010 Durbin Amendment, which limits the fees large banks can collect from merchants on debit-card transactions when routed through an outside network.
However, banks would be exempt from that cap if they also own the network, the WSJ report said.
Other banks that have held preliminary and tentative discussions include Wells Fargo and PNC Financial Services Group, the report added.
The report sent Fiserv's shares up 4.3 per cent in after-hours trading.
Several of the companies that looked at the Fiserv network have already decided it would be unlikely for them to move forward, as they expressed concern that such a deal could prompt backlash from lawmakers, regulators and merchants, the report added.
JPMorgan declined to comment, while Fiserv, BofA, Wells Fargo and PNC Financial did not immediately respond to Reuters' requests for comment outside regular business hours.
© New Straits Times Press (M) Bhd"
New Straits Times,Government mulls national registry for domestic violence offenders,https://www.nst.com.my/news/nation/2026/07/1482409/government-mulls-national-registry-domestic-violence-offenders,"Tue, 07 Jul 2026 08:42:17 +0800","KUALA LUMPUR: The government is studying the establishment of a national Domestic Violence Offender Registry to track repeat offenders and strengthen protection for women and children.
Women, Family and Community Development Minister Datuk Seri Nancy Shukri said the proposal was discussed during the coordination meeting on domestic violence cases on April 29, which brought together representatives from various ministries and agencies.
She said the ministry is working with the police and the courts to develop a mechanism to record and monitor repeat offenders through criminal records or related registries.
""The proposed registry is aimed at strengthening prevention, enforcement and protection efforts for victims of domestic violence.
""At the same time, the proposal must carefully balance legal, ethical and human rights considerations,"" she said in a written parliamentary reply.
Nancy was responding to Rodziah Ismail (PH-Ampang), who asked for the latest status on the formation of a national Domestic Violence Offender Registry and the government's integrated monitoring and enforcement mechanisms involving the police, the Welfare Department (JKM), government hospitals and clinics, and non-governmental organisations.
She said the ministry remains committed to addressing domestic violence through a whole-of-government and whole-of-society approach focusing on prevention, protection, intervention and rehabilitation.
Nancy added that the Domestic Violence Committee would continue to coordinate, monitor and discuss policies, programmes and initiatives among relevant agencies to improve the national response to domestic violence.
She also said the ministry would continue reviewing and strengthening standard operating procedures and related service delivery to ensure complaint channels and victim protection systems remain responsive, effective and aligned with current needs and challenges.
© New Straits Times Press (M) Bhd"
New Straits Times,Court orders MDEC to pay ex-manager over RM500k for constructive dismissal,https://www.nst.com.my/news/nation/2026/07/1482407/court-orders-mdec-pay-ex-manager-over-rm500k-constructive-dismissal,"Tue, 07 Jul 2026 08:41:01 +0800","KUALA LUMPUR: Malaysia Digital Economy Corporation (MDEC) has been ordered to pay RM514,836 to a former senior manager after the Industrial Court ruled that he was constructively dismissed.
Industrial Court chairman Andersen Ong held that MDEC had breached the implied term of mutual trust and confidence through a series of actions that undermined Adlin Shah Abdul Latiff's role, authority, professional standing and dignity, leaving him with no reasonable option but to resign.
The award comprises RM343,224 in back wages, equivalent to 24 months, and RM171,612 in compensation in lieu of reinstatement.
Adlin joined MDEC on a fixed-term contract in August 2008 before being confirmed as a permanent employee in 2010. He was promoted to senior manager in 2016 and later served in the Stakeholder and Government Relations Department.
He resigned after nearly 15 years with the organisation, alleging that he had been constructively dismissed following what he described as sustained harassment, victimisation and a series of actions designed to marginalise him.
Among his complaints were that his managerial responsibilities had been substantially downgraded, he was excluded from meetings and communications related to his work, publicly humiliated by his immediate superior, and unfairly assessed in his 2022 Year-End Performance Appraisal (YPA).
In his judgment, Ong said the introduction of a ""flat reporting structure"" in January 2023 substantially reduced Adlin's role, despite his designation and salary remaining unchanged.
All employees who had previously reported to him were directed to report to his superior instead, effectively stripping him of his managerial and supervisory responsibilities.
""By reason of the flat reporting structure, the claimant's managerial and supervisory functions were significantly diminished.
""He was no longer entrusted with managing, supervising, guiding or mentoring his former subordinates.
""The claimant was effectively deprived of a substantial part of the managerial responsibilities which formed the very essence of his position,"" the court said.
The court also accepted Adlin's evidence that he had been excluded from meetings, departmental discussions, email correspondence and WhatsApp groups relating to matters under his responsibility.
""In the absence of any evidence to the contrary, the court has no reason to reject the claimant's evidence on this issue and accepts that he had, on various occasions, been excluded from meetings and discussions relating to his work and responsibilities.""
The court also criticised MDEC's handling of Adlin's 2022 Year-End Performance Appraisal after his supervisor admitted that a mandatory one-to-one performance discussion had never taken place despite it being recorded as completed.
""This was not merely a procedural omission but a false declaration in an official performance appraisal document,"" he said.
Although MDEC later recalibrated Adlin's appraisal score from 2.30 to 2.94 following a company-wide exercise, the court held that the revision did not cure the defects as it was carried out only after he had resigned.
MDEC argued that the restructuring was a legitimate exercise of management prerogative, that it had investigated Adlin's complaints, and that it had offered him alternative positions.
However, Ong rejected the defence.
""The company has failed to provide any real or cogent justification for the change in the reporting structure to demonstrate that it was a bona fide exercise of management prerogative,"" he added.
© New Straits Times Press (M) Bhd"
New Straits Times,"Stocks surge on chip news, oil holds at pre-war levels",https://www.nst.com.my/business/corporate/2026/07/1482401/stocks-surge-chip-news-oil-holds-pre-war-levels,"Tue, 07 Jul 2026 08:21:18 +0800","WASHINGTON: Wall Street surged on Monday and oil prices settled around pre-Iran war levels, as investors eyed new developments in the AI and chipmaker sector ahead of corporate earnings.
All three major U.S. indexes ended the day higher. The Dow Jones Industrial Average ended the day up 0.29%, while the S&P 500 jumped 0.72% and the Nasdaq Composite climbed 1.12%.
MSCI's gauge of stocks across the globe rose 0.41%. The global AI boom continued to dominate markets. South Korean chipmaker SK Hynix 000660.KS on Monday launched a U.S. share sale to raise 43 trillion won ($28.07 billion) and drew indications of interest for up to $7 billion from major investors. And Broadcom announced it had expanded its partnership with Apple to develop and supply custom chips through 2031. Elsewhere, Microsoft joined the trend of tech layoffs, announcing it would eliminate around 4,800 jobs, roughly 2.1% of its global workforce. Investors will be watching closely for how artificial intelligence-related companies are faring amid some fears about a bubble in the upcoming earnings season. Delta Air Lines and PepsiCo are the big U.S. names reporting this week. Samsung Electronics is set to make a splash on Tuesday as analysts expect an 18-fold increase in profit.
OIL STEADY
Oil prices were flat on Monday, as prices lingered around pre-Iran war levels. U.S. crude was steady at $68.69 a barrel and Brent fell just 0.03% to $72.10 per barrel. While there were no new developments in the fractious U.S.-Iran peace talks, ships are passing through the Strait of Hormuz, with 160 vessels reported transiting from Monday to Saturday of last week. Meanwhile, Saudi Arabia slashed its official selling prices, and OPEC+ approved another production target increase starting in August.
Calming in oil prices looks to be extending some relief to the private sector, as the decline helped to slow the pace of increase in services inflation, according to new data from the Institute for Supply Management. The ISM reported that U.S. services sector activity dipped in June, but employment rebounded after contracting for three straight months. U.S. President Donald Trump will attend a NATO meeting in Turkey this week, and Fed watchers will get another glimpse into how new Chairman Kevin Warsh steers the central bank when it releases Federal Open Market Committee minutes on Wednesday, the first of his tenure. Analysts expect Warsh to limit clues as to future interest rate moves, but Fed Governor Christopher Waller defended forward guidance in remarks on Monday, saying it can be a ""valuable tool"" under the right circumstances.
The yield on benchmark U.S. 10-year notes fell 0.77 basis point to 4.471%, from 4.479% late on Thursday. In currency markets, the dollar index fell slightly, dipping 0.01% to 100.86, treading water in the wake of Thursday's weaker-than-expected June U.S. payrolls report. The dollar firmed 0.44% to 162.08 yen, not far from 40-year peaks of 162.84, as speculators test Japanese authorities' resolve on intervention.
In commodity markets, gold was 0.29% lower at $4,163.10 an ounce, after bouncing 2% last week.
© New Straits Times Press (M) Bhd"
New Straits Times,Ringgit seen regaining ground despite recent pullback [WATCH],https://www.nst.com.my/business/economy/2026/07/1482385/ringgit-seen-regaining-ground-despite-recent-pullback-watch,"Tue, 07 Jul 2026 08:00:18 +0800","KUALA LUMPUR: The ringgit may have ended June as one of Asia's worst-performing currencies but economists remain upbeat about its prospects.
They are confident the ringgit will recover and strengthen towards the end of 2026, and viewed its recent sell-off as a temporary reaction to heightened global uncertainties rather than a reflection of weakening domestic economic fundamentals.
Most research houses continue to forecast the local currency ending the year between RM3.70 and RM4.10 against the US dollar, maintaining their outlook despite recent volatility.
They believe external factors, particularly the direction of United States (US) monetary policy and broader global risk sentiment, will remain the dominant drivers of the ringgit.
The local currency has given up much of its earlier gains after climbing to a year-to-date high of 3.8850 against the US dollar on Feb 26, with sentiment turning cautious amid prolonged geopolitical tensions involving the US and Iran.
In June, the ringgit fell 2.08 per cent to 4.0750 from 3.9920, marking its sharpest monthly decline this year and a steeper drop than May's 0.33 per cent depreciation.
Even so, the currency has remained relatively resilient overall, slipping just 0.30 per cent year-to-date to 4.0670 as of July 3, compared with 4.0550 at the start of the year.
This reinforces economists' view that Malaysia's underlying fundamentals remain intact despite short-term external headwinds.
Bank Muamalat Malaysia Bhd chief economist Dr Mohd Afzanizam Abdul Rashid said investors remain cautious as they await greater clarity on the US Federal Reserve's interest rate direction.
""My take is that market participants remain edgy as to what the Fed might do on their benchmark interest rate,"" he said.
He noted that the latest US nonfarm payroll data has added to the uncertainty. While the softer-than-expected reading suggests the Fed may keep interest rates unchanged, the situation remains fluid.
As such, he said traders will closely scrutinise the upcoming Federal Open Market Committee (FOMC) meeting minutes for further clues on the direction of US monetary policy.
Despite the cautious sentiment, Afzanizam remains positive on the ringgit's outlook.
He said the prospect of another Fed rate hike remains open to debate as the softening labour market and the absence of strong wage pressures could allow the central bank to leave the federal funds rate unchanged.
""As such, there is scope for ringgit appreciation towards the end of the year, especially when Malaysia's macroeconomic performance is expected to remain resilient,"" he said.
Afzanizam said the bank maintains year-end forecast of RM3.95-RM4.00.
IPPFA Sdn Bhd director of investment strategy and country economist Mohd Sedek Jantan said the recent weakness in the ringgit was driven more by external risk sentiment than any deterioration in the country's economic fundamentals.
Sedek noted that Malaysia continues to benefit from resilient domestic demand, improving exports, sustained private investment and a healthy external position.
However, he said investors remain cautious due to the Fed's higher-for-longer interest rate stance, persistent geopolitical tensions and continued demand for US dollar assets, which have weighed on the ringgit in the short term.
Despite these headwinds, IPPFA maintained its year-end forecast of RM4.05 against the US dollar.
Sedek said stronger domestic fundamentals should support gradual appreciation, although sustaining levels below RM4.00 would remain difficult under the current global environment.
""A structurally stronger US dollar environment, supported by higher US interest rates and recurring geopolitical uncertainty, is likely to remain a headwind for most emerging market currencies, including the ringgit,"" he said.
He added that the ringgit could outperform expectations if the Fed cuts interest rates faster than anticipated, geopolitical tensions ease, foreign capital inflows strengthen and Malaysia continues to record improvements in trade and investment.
Conversely, the currency could weaken if the Fed keeps interest rates elevated for longer, geopolitical tensions escalate further or global risk aversion triggers renewed demand for safe-haven US dollar assets.
DczLE33R_dI
© New Straits Times Press (M) Bhd"
New Straits Times,Cuba begins to restore power to Havana following nationwide blackout,https://www.nst.com.my/world/world/2026/07/1482381/cuba-begins-restore-power-havana-following-nationwide-blackout,"Tue, 07 Jul 2026 07:59:19 +0800","HAVANA: Cuba began to slowly restore power on Monday after the country's national electric grid collapsed earlier in the day, the latest blow to an island already suffering from severe energy, fuel and medicine shortages.
Grid operator UNE said it was providing electricity to some vital services, including hospitals and food production centres, but by late afternoon was able to serve only 1 per cent of the capital Havana's demand.
Officials have not yet said what caused the grid to collapse.
Cuba has for months suffered from hours-long and, more recently, days-long power outages linked in part to a decrepit grid and a US-imposed oil blockade that has cut off the island's fuel supply.
The nationwide outage and slow recovery are more bad news for Cubans already exhausted from rolling blackouts that make it impossible for many to work or sleep in the Caribbean summer heat.
""Look at my face, it says it all,"" said Ariel Sotelo, a bleary-eyed 57-year-old Havana resident who had been without electricity since the day before. ""We just have to grin and bear it, but it's not easy.""
Nearly two-thirds of the country was already without power when the grid collapsed on Monday, so many of the island's residents, largely without communications and accustomed to the lack of electricity, hardly registered the difference.
[[nid:1482387]]
A television newscast encouraged the lucky few with access to electricity to spread the word about the collapse of the nation's grid to friends and neighbours without.
Monday's nationwide blackout is the eighth since October 2025, and the third this year.
The administration of US President Donald Trump cut off fuel shipments from Venezuela to Cuba earlier this year and also pressured Mexico to halt shipments, and has threatened to slap tariffs on any nation delivering oil to the island nation.
The US has called Cuba's government a national security threat and says such sanctions are necessary to force a change in the island's government, a long-time aim of US policy towards Cuba.
Cuba, 90 miles (145km) off the shores of the Florida Keys, has long maintained it is not a threat to the United States.
For most Cubans, however, the issue is more practical than political.
""The heat, the mosquitoes, it's just unbearable,"" said Omar Ortega, 60, of Havana. ""How long is this going to go on? Honestly, we can't take it anymore.""
© New Straits Times Press (M) Bhd"
