Source,Title,Link,Date,Article
Malay Mail,"Perak exco defends 25-year Malaysia–Japan elephant deal after outcry, says welfare safeguards in place",https://www.malaymail.com/news/malaysia/2026/05/09/perak-exco-defends-25-year-malaysiajapan-elephant-deal-after-outcry-says-welfare-safeguards-in-place/219358,"Sat, 09 May 2026 17:32:34 +0800","BATU GAJAH, May 9 — The 25-year international cooperation agreement involving three Malaysian elephants – Dara, Amoi and Kelat (DAK), between Taiping Zoo and Night Safari (ZTNS) and Tennoji Zoo Osaka (TZO) has been described as reasonable.
Perak Housing and Local Government Committee chairman Sandrea Ng Shy Ching said the duration was determined based on long-term conservation and breeding efforts, with various views taken into account before the agreement was finalised.
“The three elephants remain the property of Taiping Zoo, while ownership of the first-generation calves has already been determined under the agreement. The first, third and fifth calves will belong to Tennoji Zoo, while the second, fourth and sixth calves will belong to Taiping Zoo.
“This is part of a conservation collaboration that requires a suitable timeframe,” she told reporters after officiating the Santai-Santai Open Day Ardea at the Taman Tasik Ardea housing project here today.
Meanwhile, Sandrea said the state government has no plans to establish a special task force to monitor the condition of DAK, which are currently housed at TZO.
She said the Department of Wildlife and National Parks (Perhilitan) had assigned mahouts to accompany the elephants during the adaptation process and monitor their condition in Japan.
“At the Perhilitan level, mahouts have been sent as Malaysia’s representatives to monitor the elephants and assist them in adapting. Taiping Zoo also receives periodic reports to ensure all three elephants remain in  healthy and stable condition.
“So far, we believe the existing mechanism is functioning well. Although the state government has faced considerable pressure, we will not act hastily. We want to ensure every aspect of the cooperation agreement is implemented properly, as the welfare of the three elephants remains our priority,” she said.
Earlier, coordinator of DAK Joint Solidarity Secretariat Neow Choo Seong described the memorandum of understanding period as excessively long and unreasonable, likening it to a “life sentence” for the elephants, particularly Kelat, which is now 25 years old.
Neow, who attended the solidarity gathering outside ZTNS in Taiping, also urged the government to immediately establish a special task force comprising elephant experts, animal specialists and independent zoologists to assess the elephants’ physical and mental wellbeing. — Bernama"
Malay Mail,Zahid says Umno open to taking in sacked Bersatu leaders under Rumah Bangsa plan,https://www.malaymail.com/news/malaysia/2026/05/09/zahid-says-umno-open-to-taking-in-sacked-bersatu-leaders-under-rumah-bangsa-plan/219357,"Sat, 09 May 2026 17:23:38 +0800","BAGAN DATUK, May 9 — Umno will consider applications from lawmakers and leaders of Bersatu who have been expelled or suspended should they seek to join the party through the Rumah Bangsa initiative, said Deputy Prime Minister and Umno president Datuk Seri Dr Ahmad Zahid Hamidi.
He said the party is open to accepting any individuals, particularly among the Malays.
“If there are applications, we will consider them. We are open because as a political party that upholds the concept of Rumah Bangsa, we have an open policy,” he said.
He said this at a press conference after launching the 2026 National-Level Mara Prihatin programme at Sultan Azlan Shah Maritime Polytechnic here today.
Ahmad Zahid was commenting on a statement by Umno secretary-general Datuk Dr Asyraf Wajdi Dusuki, who welcomed Bersatu lawmakers and leaders suspended or expelled from the party to join Umno through the Rumah Bangsa.initiative.
Yesterday, Bersatu’s Disciplinary Board expelled and suspended several lawmakers and party leaders with immediate effect.
Those expelled were Suka Menanti assemblyman and Bersatu Alor Setar division chief Dzowahir Ab Ghani, Sungai Tiang assemblyman Abdul Razak Khamis, and Hulu Langat division chief Muhammad Faiz Rahmad.
Five Members of Parliament were suspended from their membership rights for two party election terms, namely Datuk Seri Ikmal Hisham Abdul Aziz (Tanah Merah), Datuk Abdul Khalib Abdullah (Rompin), Nordin Ahmad Ismail (Lumut), and Datuk Rosol Wahid (Hulu Terengganu). — Bernama"
Malay Mail,"Former Indian chambers chief Kenneth Eswaran dies in KL at 65, wake set for Monday in Country Heights house",https://www.malaymail.com/news/malaysia/2026/05/09/former-indian-chambers-chief-kenneth-eswaran-dies-in-kl-at-65-wake-set-for-monday-in-country-heights-house/219353,"Sat, 09 May 2026 16:26:16 +0800","KUALA LUMPUR, May 9 — Prominent businessman and former Malaysian Associated Indian Chambers of Commerce and Industry (MAICCI) president Tan Sri Kenneth Eswaran died early this morning at the age of 65.
MAICCI president Datuk Seri N. Gobalakrishnan confirmed that Eswaran, who had been in poor health in recent years following a stroke, passed away at Pantai Hospital Bangsar at about 7 am today.
“He was admitted to the hospital three or four days ago after feeling unwell. He had suffered a stroke about five or six years ago,” he told Bernama when contacted today.
Gobalakrishnan said final respects will be held on Monday from 9 am to 11 am at Eswaran’s residence in Country Heights, Kajang.
He described Eswaran as one of the most prominent entrepreneurs in the Malaysian Indian community, serving as MAICCI president from 2000 to 2004 before returning to lead the organisation for another 10 years beginning in 2008.
“During his leadership, he played an important role in strengthening ties between the Indian business community and the government through various engagement sessions with ministries and relevant agencies to facilitate business matters and address issues affecting the community.
“In the corporate world and among business associations, he was also well known for championing the interests of the Indian community, particularly in economic development and business opportunities,” he said. — Bernama"
Malay Mail,"Police hunt burglars who fled with RM800,000 in valuables from Taman Melawati home",https://www.malaymail.com/news/malaysia/2026/05/09/police-hunt-burglars-who-fled-with-rm800000-in-valuables-from-taman-melawati-home/219351,"Sat, 09 May 2026 16:37:05 +0800","KUALA LUMPUR, May 9 — Police are hunting for suspects involved in a house burglary in Taman Melawati, Gombak, near here, with an estimated loss of RM800,000 after the incident went viral on social media Threads since yesterday.
Ampang Jaya district police chief ACP Khairul Anuar Khalid said the incident occurred at a house in Jalan I-Satu, Taman Melawati, when the victim returned home at about 11.30pm on Thursday to find the house ransacked.
“Further inspection found that the thieves entered via the backdoor,” he said in a statement today.
He said the police also found three fingerprints for further investigation.
“Further checks found that several pieces of jewellery and watches worth about RM800,000 were missing,” he said, adding that the case was being investigated under Section 457 of the Penal Code. — Bernama"
Malay Mail,"Redirect fuel subsidies from T20 to B40 and M40, Umno Youth chief tells govt",https://www.malaymail.com/news/malaysia/2026/05/09/redirect-fuel-subsidies-from-t20-to-b40-and-m40-umno-youth-chief-tells-govt/219350,"Sat, 09 May 2026 17:06:21 +0800","KUALA LUMPUR, May 9 — The government is urged to implement targeted subsidies more comprehensively, including reviewing the provision of RON95 petrol subsidy to the T20 group, said Umno Youth chief Datuk Dr Muhamad Akmal Saleh.
He said the subsidy should be channelled to the B40 and M40 groups who are more affected by the rising cost of living, as well as a step to strengthen the country’s economy in the face of global uncertainties.
“In the current economic situation, we need to re-rationalise subsidies and implement them in a very targeted manner to those who really need them, including by re-channelling fuel subsidies from T20 to B40 and M40,” he said during the National Round Table Consultation (Rimbun) 2.0 press conference today.
The proposal is among the 25 main resolutions discussed in the RIMBUN 2.0 programme which focuses on the issue of the country’s economic sovereignty.
He said the results of the discussions involving the 25 resolutions would be refined before being presented to the UmnoPolitical Bureau and Supreme Working Council for consideration before being brought to the attention of the Cabinet as a government policy proposal. — Bernama"
Malay Mail,Transport Ministry: BAS.MY free travel card now open to Form Six students and government trainees ,https://www.malaymail.com/news/malaysia/2026/05/09/transport-ministry-basmy-free-travel-card-now-open-to-form-six-students-and-government-trainees/219352,"Sat, 09 May 2026 17:13:22 +0800","KOTA SAMARAHAN, May 9 — The BAS.MY concession card usage has now been expanded to include Form Six students and trainees at government-owned training institutes nationwide, said Transport Minister Anthony Loke.
He said that previously, the unlimited travel facility was only offered to Malaysian school students (aged seven to 17), senior citizens (60 and above) and registered persons with disabilities.
Loke said that for Kuching and Kota Samarahan, it is expected to benefit about 2,350 Form Six students and more than 3,200 trainees at government-owned training institutes.
“Nearly 850,000 passengers have used the BAS.MY Kuching service as of April.
“This move is hoped to reduce financial burden as well as increase the use of public transport among both groups,” he said at the launch of the new route for the BAS.MY Kuching stage bus transformation programme here today.
Loke also gave an assurance that BAS.MY fares will remain unchanged despite global economic uncertainty, adding that the monthly unlimited travel pass had previously been reduced from RM50 to RM30.
He said there was no reason to increase fares as the government subsidises both fuel and operational costs under the contract model with bus operators.
“The government does not intend to make a profit from this service. We want more people to use public transport because it is an important and affordable alternative,” he said.
He said the ministry, through the Sarawak Commercial Vehicle Licensing Board, has introduced six new BAS.MY routes in Kuching and surrounding areas.
“The routes began operation on April 1, namely Q11 (Arang Road), Q12 (Taman Hui Sing), Q13 (Siburan), Q14 (Summer Mall), Q15 (Stutong Baru/Kuching Sentral) and Q16 (Taman Sukma).
“The launch of these new routes is not only aimed at expanding bus coverage, but also ensuring the public has access to more efficient, comfortable and reliable transport,” he said.
He also said the government is planning a second phase of BAS.MY expansion, which will focus on secondary cities such as Sibu and Bintulu in the near future. — Bernama"
Malay Mail,"Selangor records 1,675 new Muslim converts in 2025, credits NGOs and mosques for rise",https://www.malaymail.com/news/malaysia/2026/05/09/selangor-reports-rise-in-conversions-credits-ngos-and-mosques-for-support-of-1675-new-muslims-in-2025/219349,"Sat, 09 May 2026 16:51:08 +0800","SHAH ALAM, May 9 — A total of 1,675 individuals embraced Islam in Selangor in 2025, reflecting the effectiveness of the state’s systematic conversion management framework, said Mais chairman Datuk Salehuddin Saidin.
He said 772 individuals, or 82.1 per cent of the total, registered through the Conversion Management Centres (PPP), comprising mosque institutions and Islamic non-governmental organisations (PIBK), while the remainder registered through the Selangor Islamic Religious Council (Mais) headquarters and district Islamic religious offices (Paid).
According to him, the achievement reflects growing public confidence in Selangor’s conversion management system.
“In recognition of their role in facilitating and streamlining the registration process in accordance with established procedures, PPP Mais will receive RM94,000 as a token of appreciation,” he said at the PPP 2026 Appreciation and Ukhwah Ceremony held at the Selangor Agricultural Development Corporation (PKPS) building here today.
The ceremony also included the presentation of appreciation certificates to recipients for their commitment in strengthening conversion management efforts in the state.
According to Salehuddin, the contributions, funded through zakat allocations, were distributed to 41 PPP centres, with each receiving between RM100 and RM24,400 based on the number of registrations handled throughout the year.
He said the contributions were aimed at encouraging and motivating PPP Mais centres that had efficiently managed conversion registrations throughout 2025.
“It also recognises the important role played by these centres in assisting Mais and the Selangor Zakat Board (Zakat Selangor) in safeguarding the welfare, protection and religious education of converts in the state,” he said.
Meanwhile, Salehuddin said the Selangor branch of the Malaysian Islamic Welfare Organisation (Perkim) was among the main recipients after recording the highest number of registrations, followed by Hidayah Centre Foundation (HCF) and several other dakwah organisations.
He added that Mais currently operates 41 PPP centres across Selangor to provide the public with easier and more effective access to guidance and conversion registration services.
“The centres also play a vital role in providing consultation to individuals intending to embrace Islam, ensuring the decision is made willingly and without coercion.
“We always ensure every procedure is properly followed so that the welfare of converts is protected from the very first day they register under the supervision of Mais,” he said. — Bernama"
Malay Mail,Anwar pledges RM31m development package for remote Pulau Banggi in Sabah to narrow rural gap,https://www.malaymail.com/news/malaysia/2026/05/09/anwar-pledges-rm31m-development-package-for-remote-pulau-banggi-in-sabah-to-narrow-rural-gap/219345,"Sat, 09 May 2026 15:29:24 +0800","KUDAT, May 9 — Prime Minister Datuk Seri Anwar Ibrahim today announced a special allocation of more than RM31 million to drive development on Pulau Banggi, thus ensuring that the residents of Malaysia’s largest island are not left out of the national development trend.
He said the allocation through the federal government and the Implementation Coordination Unit (ICU) of the Prime Minister’s Department includes the development of roads, bridges as well as health, education, security and jetty facilities.
He said the projects included the upgrading of roads and bridges in Kampung Limbuak Laut, Kapitangan, Damaran and Bayangan Laut, as well as improvements to the Pulau Banggi police station and health facilities at Karakit Health Clinic.
According to him, also listed were projects to upgrade school dormitories on Pulau Banggi and Pulau Balambangan, the implementation of projects related to national security and defence by the Ministry of Defence, and the upgrading of the Karakit public jetty at the ferry terminal.
“I want Pulau Banggi to be an example to the people who are marginally poor or isolated that this Madani Government feels responsible for upholding the dignity and capabilities of every citizen,” he said when speaking at the Prime Minister’s Reception with the Residents of Pulau Banggi here today.
Also present were Deputy Chief Minister I Datuk Seri Dr Joachim Gunsalam representing Chief Minister Datuk Seri Hajiji Noor, Minister in the Prime Minister’s Department (Sabah and Sarawak) Datuk Mustapha Sakmud, and Minister in the Prime Minister’s Department (Religious Affairs) Datuk Dr Zulkifli Hasan.
Also present were the Chief Secretary to the Government Tan Sri Shamsul Azri Abu Bakar, Sabah State Secretary Datuk Seri Safar Untong and Banggi assemblyman Datuk Mohammad Mohamarin.
​
Touching on land transport infrastructure, Anwar said the project to upgrade the Kampung Limbuak Laut to Kampung Pengkalan Darat road is currently being implemented by the Sabah Public Works Department (JKR) at a cost of almost RM44 million.
“This project is very important because good roads will open up economic, educational and health access for the people in the interior of the island,” he stressed.
In the meantime, the Prime Minister also announced an additional government contribution of RM1.25 million which will be coordinated by agencies under the Office of the Minister in the Prime Minister’s Department (Religious Affairs).
Anwar said the funds would benefit the residents through the implementation of education, institutional empowerment, green technology, health and human development programmes.
He said that to strengthen the safety net and daily facilities in coastal areas, the government had also approved an allocation of RM1 million to upgrade the jetty in Kampung Dogoton for the use of residents and enforcement agencies.
“The government has also agreed to upgrade the jetty in Kampung Dogoton for the use of villagers and enforcement agencies amounting to RM1 million, which will be carried out by the Prime Minister’s Department’s ICU,” he said.
He stressed that the island’s remote geographical location is not an excuse for the community in the area to continue to lag behind, on the contrary, the Madani Government shouldered a great responsibility to protect the fate of all the people regardless of their location.
“Continuous efforts will always be made to ensure that every citizen has the opportunity to enjoy a better standard of living than before,” he said. — Bernama"
Malay Mail,‘Home-grown champions’ for Asean: Putrajaya eyes future K9 exports with Bomba’s RM2.4m breeding hub in Penang,https://www.malaymail.com/news/malaysia/2026/05/09/home-grown-champions-for-asean-putrajaya-eyes-future-k9-exports-with-bombas-rm24m-breeding-hub-in-penang/219344,"Sat, 09 May 2026 15:49:15 +0800","JOHOR BAHRU, May 9 — Malaysia aspires to become a K9 tracker dog breeding hub in Asean through the K9 Operations Centre under the Fire and Rescue Department (JBPM).
Housing and Local Government Minister Nga Kor Ming said the aspiration is achievable as JBPM has highly skilled officers with expertise in training tracker dogs.
He said the initiative would not only enable Malaysia to produce ‘home-grown champions’, but also position the country as an exporter, thereby reducing costs previously incurred in importing trained K9 tracker dogs from Birmingham, United Kingdom.
“A trained dog with a warranty of expertise was imported from Birmingham at a cost of nearly RM150,000.
“My vision is that one day we will be able to export them back to the United Kingdom and make the K9 Operations Centre a breeding hub in Asean, allowing us to sell to Singapore, Thailand, Indonesia and others,” he told reporters after launching the World Firefighters’ Day Carnival 2026 here today.
Nga said it is time for Malaysia to move towards becoming a K9 breeding nation rather than continuing to rely on foreign countries, while expressing confidence in JBPM’s expertise in training tracker dogs.
Earlier in his speech, he said JBPM has planned to develop a K9 Operations Centre in Bertam, Penang, which will carry out a domestic breeding programme.
He said the centre is currently in the design and tender procurement stage.
He added that the Madani Government has approved an allocation of RM2.4 million for the procurement of 16 new tracker dogs from the United Kingdom.
“JBPM currently has only 34 tracker dogs and still requires another 56 to achieve optimal operational capacity,” he added. — Bernama"
Malay Mail,"Eight-year-old boy, mocked for wanting to be PM, gets chance to hand heartfelt letter to Anwar in Pulau Banggi",https://www.malaymail.com/news/malaysia/2026/05/09/eight-year-old-boy-mocked-for-wanting-to-be-pm-gets-chance-to-hand-heartfelt-letter-to-anwar-in-pulau-banggi/219342,"Sat, 09 May 2026 16:04:55 +0800","KUDAT, May 9 — Mocked by friends for dreaming of becoming the Prime Minister one day, eight-year-old Syam Aariz Rayyan Abdullah, from Pulau Banggi, today managed to hand over a letter to none other than Prime Minister Datuk Seri Anwar Ibrahim.
For the youngster, the brief meeting with the Prime Minister at Anwar’s gathering with the local community of Pulau Banggi here was not just a sweet moment, but a testament that a child’s dream should not be taken lightly.
Syam Aariz Rayyan arrived at the venue as early as 8 am with his mother, Norsakinah Junaidi, 33, solely to wait for the opportunity to meet Anwar and hand over the letter he had written himself.
Norsakinah said her second child was very eager to write the letter after being informed that the Prime Minister would be visiting Pulau Banggi.
“I told him of the Prime Minister’s visit, and he told me he wanted to write a letter to the PM because his friends and teacher laughed at him when he said he wanted to become the Prime Minister.
“So, I want to write a letter … I want to prove it. I want to send it to the Prime Minister. Please, mama, deliver my letter to the Prime Minister,” she said when met by Bernama here today.
Norsakinah said that Syam Aariz Rayyan’s enthusiasm was clearly evident when he himself coaxed her to go early to the event location because he was too excited to meet the country’s leader.
As soon as he had the opportunity to meet Anwar, the joy on Syam Aariz Rayyan’s face was evident.
For the child, that brief meeting was not just a sweet memory, but an injection of motivation to continue believing that dreams should not be extinguished just because they were once laughed at.
Norsakinah said that as a mother, she will continue to support her child’s interests and aspirations, especially in education, because she believes that success starts with self-confidence and hard work.
For Syam Aariz Rayyan, that letter might just be a piece of paper, but for his mother, it is a symbol of the courage of a child from Pulau Banggi to express dreams and prove that great ambitions start with the courage to believe. — Bernama"
Malay Mail,One-stop SME portal coming soon as entrepreneurs struggle with scattered aid information,https://www.malaymail.com/news/malaysia/2026/05/09/one-stop-sme-portal-coming-soon-as-entrepreneurs-struggle-with-scattered-aid-information/219343,"Sat, 09 May 2026 16:16:30 +0800","BUTTERWORTH, May 9 — The Ministry of Entrepreneur and Cooperatives Development (MECD) will launch a one-stop portal for small and medium enterprises (SMEs) this month to facilitate access to information related to financing, training and various government support programmes.
Its Minister, Steven Sim Chee Keong said the portal was created following feedback received from industry players who described information related to SME assistance as too fragmented currently involving various ministries and agencies.
“The government has allocated large resources including RM50 billion through Budget 2026 and an additional RM10 billion announced by the Prime Minister, making a total of RM60 billion for the SME sector.
“But the problem is that it is spread across various agencies. There are entrepreneurs, especially small traders, who do not know where to look, what programmes there are, what policies and what sources of financing,” he told reporters after a town hall dialogue session with the Federation of Malaysian Manufacturers (FMM) Penang here today.
Sim said the portal is currently in the development process and is expected to be launched this month.
“The aim is to make it a one-stop portal in terms of information for SMEs because we understand that one of the complaints from small entrepreneurs is that they do not know which agency to refer to because there are too many channels available,” he said.
Earlier in the dialogue session, Sim said the government was actively working to open up more financing space not only through loans, but also through collaboration with the banking sector and private capital to help SMEs increase capacity and competitiveness.
He said his party had also held meetings with representatives of various SME associations, chambers of commerce and bank chief executive officers to discuss measures to strengthen the sector’s financing ecosystem.
“The government wants to help SMEs grow and improve competitiveness, but at the same time, the governance aspect needs to be ensured so that the assistance provided is truly utilised effectively,” he said.
Sim said his ministry had also engaged with banking institutions and private equity (PE) firms to find ways to expand access to financing for SMEs.
He said among the issues raised by the PE firms was the level of readiness of some local SMEs to accept equity investments as well as challenges related to the governance of family companies.
“The PE firms said they wanted to help potential SMEs, but there were challenges in terms of company structure and acceptance of external equity holdings,” he said. — Bernama"
