Source,Title,Link,Date,Article
New Straits Times,Labuan Airport reopens: WWII unexploded bombs safely disposed,https://www.nst.com.my/news/regional/2026/06/1474476/labuan-airport-reopens-wwii-unexploded-bombs-safely-disposed,"Sat, 27 Jun 2026 23:01:13 +0800","KUALA LUMPUR: Operations at Labuan Airport resumed as normal today after authorities safely disposed of three unexploded World War II bombs discovered near the runway.
According to Berita RTM, the operation was launched after a contractor discovered an object believed to be a bomb while carrying out construction work on a hillside near the airport yesterday.
Labuan police chief Superintendent Wan Mohd Firdaus Wan Zaki said inspections by the police Bomb Disposal Unit and the Royal Malaysian Air Force's (RMAF) Bomb Disposal Unit confirmed the object was a live aerial bomb.
A subsequent search uncovered two more unexploded bombs, all of which were safely destroyed to ensure the area was secure.
""The clearance and disposal process has been completed. Following a thorough inspection of the runway, the RMAF and Malaysia Airports Holdings Bhd reopened it after confirming it was safe for scheduled flight operations today,"" he was quoted as saying at a press conference.
The runway
was temporarily closed
at about 2.40pm yesterday after the bombs were discovered about 150m from the runway.
The closure resulted in five flights involving 1,219 passengers being cancelled, while two others were diverted to Kota Kinabalu International Airport.
Wan Mohd Firdaus also reminded the public not to approach suspicious objects believed to be explosives, and to notify the authorities immediately so appropriate action could be taken.
© New Straits Times Press (M) Bhd"
New Straits Times,Should we fear an AI bubble bust?,https://www.nst.com.my/opinion/columnists/2026/06/1474471/should-we-fear-ai-bubble-bust,"Sat, 27 Jun 2026 23:00:15 +0800","RECENT swings in tech stocks are reviving fears of an AI bubble, and some experts warn that if it pops, the fallout could be bigger than anything Wall Street has ever seen.
""There are many indications that we are in a bubble,"" said Itay Goldstein, a finance professor at the University of Pennsylvania's Wharton School.
""It seems likely that there is overpricing.""
The numbers back him up. The five biggest companies on Wall Street — all tech giants — are worth a combined US$18 trillion, almost the size of China's  economy.
Big tech has been pouring money into AI and now investors are getting nervous: will any of it actually pay off?
Six months ago, these same companies were buying back their own shares — a move that signals excess cash and drives up the stock price.
Now they're taking on debt to fund their AI buildout in a significant reversal.
""The amount of debt that's being taken on is still relatively modest,"" said Brent Fredberg, director of investments at Brandes Investment Partners.
But a rise in interest rates —  recently floated by the US Federal Reserve — could make that borrowing a lot more painful.
Fresh off its blockbuster IPO, space and AI giant SpaceX announced last week it plans to issue US$25 billion in bonds, raising new doubts about its financial health.
The news sent its share price lower.
Analysts also warn of ""circular financing"" — where big tech companies invest in AI startups, which then use that money to buy big tech's own products and services.
""This can lead to problems down the road,"" Fredberg said, calling out a potential house of cards.
Tech stocks took a beating  last week, reigniting old fears about an AI meltdown.
But not everyone is sounding the alarm. Some say the recent selloff is just a breather after a long run-up and not the start of a real crash.
""The recent volatility reflects a valuation test, profit-taking and flow-driven positioning amid higher rates — not a fundamental break,"" wrote Christian Stocker, a director at UniCredit, in a recent note.
Still, some warning signs are hard to ignore.
Oracle, one of the biggest names in software and cloud computing, just had its worst week since the dot-com bust of the early 2000s, with shares down 19 per cent in five days.
For comparison: during the dot-com crash in August 2001, Oracle fell 20 per cent, according to CNBC.
""The market is very skittish,"" Fredberg said.
If the AI bubble does burst, the consequences could be historic.
""We're talking about the biggest firms that are traded in the financial markets,"" Goldstein said.
""If they are taking a hit, that will certainly be felt across the board.""
The dot-com bust more than 25 years ago was bad, but it mostly wiped out smaller companies. A crash today would directly hit some of the largest corporations on earth.
Still, there is less wild speculation right now than in the late 1990s tech frenzy, Fredberg said.
But a severe tech crash would still send shockwaves through the whole economy, including for everyday Americans.
A huge portion of the US population holds stocks, either directly or through retirement accounts like 401(k)s.
If Wall Street tanks, so would the financial security of millions of people.
* The writer is from AFP
© New Straits Times Press (M) Bhd"
Malay Mail,Volkswagen Beetle believed destroyed in fire under Satok flyover,https://www.malaymail.com/news/malaysia/2026/06/28/volkswagen-beetle-believed-destroyed-in-fire-under-satok-flyover/225489,"Sun, 28 Jun 2026 09:28:53 +0800","KUCHING, June 28 — A classic car, believed to be a Volkswagen Beetle, parked beneath the Satok flyover here was destroyed in a fire early yesterday.
Firefighters from the Padungan Fire and Rescue Station were dispatched to the scene after receiving an emergency call at 9.45am.
“The fire was raging upon the firefighters’ arrival. Firefighters put out the flames using firefighting foam.
“However, the car was completely destroyed,” said the Fire and Rescue Department (Bomba) in a statement.
The operation ended at 10.11am, and the cause of the fire is still under investigation. — The Borneo Post"
Malay Mail,Sarawak Immigration detains 18 Indonesians in Kota Padawan joint operation,https://www.malaymail.com/news/malaysia/2026/06/28/sarawak-immigration-detains-18-indonesians-in-kota-padawan-joint-operation/225484,"Sun, 28 Jun 2026 09:13:46 +0800","KUCHING, June 28 — The Sarawak Immigration Department detained 18 foreign nationals during a joint operation with the Padawan Municipal Council (MPP) around Mile 10, Kota Padawan, on Friday.
According to a statement from the department, the operation ran from 6 pm to 11 pm and involved inspections of seven premises and shops suspected of operating online gambling and renting out rooms.
“A total of 26 foreign nationals were checked to verify their travel documents and immigration status.
“The operation resulted in the detention of 18 Indonesian nationals, comprising eight men and 10 women,” the statement said here yesterday.
The suspects are believed to have committed offences under Section 15(1)© and Section 6(1)(c) of the Immigration Act 1959/63, and Regulation 11(7)(a) of the Immigration Regulations 1959/63.
All those detained have been taken to the Immigration Detention Depot for further investigation and action. — Bernama"
Malay Mail,"Tourism Ministry sharpens strategy, targets China, Indonesia, Japan, India and key long‑haul markets",https://www.malaymail.com/news/malaysia/2026/06/28/tourism-ministry-sharpens-strategy-targets-china-indonesia-japan-india-and-key-longhaul-markets/225479,"Sun, 28 Jun 2026 09:04:10 +0800","IPOH, June 28 — The Ministry of Tourism, Arts and Culture (MOTAC) through Tourism Malaysia, is strengthening its strategy by focusing on high-performing and stable markets including China, Indonesia, Japan and India.
Deputy Minister Chiew Choon Man said this included focusing on long-haul markets such as Russia, Germany and Australia to ensure market diversification.
He said the ministry would also continue to work closely with industry stakeholders to address operational challenges and cost pressures.
“The momentum of the country’s tourism sector is on a positive trajectory.
“As of May this year, the country has received 17.5 million visitors, an increase of 3.4 per cent compared to 16.9 million last year. This current performance proves that we are on a strong track to maintain the positive momentum in 2026,” he said.
He said this when opening of the Festival Budaya Malaysia (FBM) 2026 at Bulatan Sultan Azlan Shah here, tonight.
Also present were Menteri Besar Datuk Seri Saarani Mohamad and Ministry of Tourism, Arts and Culture secretary-general, Datuk Shaharuddin Abu Sohot.
Meanwhile, Chiew said MOTAC is committed to placing arts and culture as the main attraction in promoting Malaysia on the world stage, especially in making the Visit Malaysia 2026 campaign a success.
He said that through synergy with state governments such as Perak, culture would no longer be trapped as a treasure of the past, but would instead emerge as a dynamic economic driver capable of lifting the dignity of the people’s identity on the world stage.
“This cultural tourism synergy is very important because when we empower local cultures such as the dabus dance, labu sayong, gold thread embroidery art or the uniqueness of Ipoh gastronomy, we are actually building a sustainable tourism product with high value.
“This is a two-pronged strategy for us to preserve our national identity and at the same time, boost the grassroots economy through the creative industry,” he said.
Therefore, he said, to ensure that this desire and momentum of development does not stop, solid support in the form of infrastructure development is very critical.
He said that for the state of Perak under the 13 Malaysia Plan (13MP) the federal government through MOTAC has allocated RM 44,189,100 involving 13 projects, namely six large-scale projects and seven projects for the maintenance or improvement of tourism facilities totaling RM1,393,000.
Six large-scale development projects include the conservation of the Leaning Tower, Teluk Intan, upgrading of the building of the Malaysian Handicraft Development Corporation, Perak Branch.
In addition, it includes the upgrading of the Tourism Area at Kinta Riverwalk, upgrading and renovating the existing information building at the Lumut Mangrove Discovery Centre, Manjung and developing the Bernam Riverfront in Tanjong Malim Town, Perak and developing the Lata Puteh Eco-Tourism in Selama. — Bernama"
Malay Mail,"Buy Malaysian Goods campaign rebranded as Jom Malaysia, says Armizan",https://www.malaymail.com/news/malaysia/2026/06/28/buy-malaysian-goods-campaign-rebranded-as-jom-malaysia-says-armizan/225478,"Sun, 28 Jun 2026 08:48:37 +0800","KUALA LUMPUR, June 28 — Four decades after its introduction, the Buy Malaysian Goods campaign has been rebranded as Jom Beli Produk Malaysia (JOM MALAYSIA) to strengthen the branding of local products and services while fostering a spirit of economic patriotism among Malaysians.
Domestic Trade and Cost of Living Minister Datuk Armizan Mohd Ali said the transformation goes beyond a change in name or logo, encompassing a shift in the campaign’s objectives, strategies and core focus to encourage Malaysians to prioritise local products and stimulate the nation’s economic growth.
““We want Jom Beli Produk Malaysia to become a national movement rooted in the values and spirit of patriotism, particularly economic patriotism,” he told reporters after launching the Jom Malaysia x Pesta Kita Festival at Central Market here yesterday.
He said the initiative would adopt a whole-of-nation approach, involving collaboration among ministries, government agencies, industry players, traders and the public to comprehensively strengthen the use of locally made products.
The rebranding also broadens the campaign’s scope from focusing solely on goods to encompassing locally produced products and services, in line with the country’s evolving economy and the growing importance of the services sector, he added.
Armizan said the campaign is aimed not only at local consumers but also at tourists and foreign visitors, helping to promote Malaysian products in international markets, and his ministry would continue strengthening support for local entrepreneurs through various cross-ministerial and cross-agency marketing, promotional and business development programmes.
“The government’s approach is not limited to stabilising the prices of goods and services, but also to increasing people’s incomes. One way to achieve this is by helping entrepreneurs expand their businesses and penetrate global markets,” he said.
The Jom Malaysia x Pesta Kita Festival at Central Market from June 26 to 28, features 123 entrepreneurs and exhibitors from across the country.
The festival showcases a wide range of Malaysian-made products and services and serves as a platform connecting entrepreneurs, manufacturers, retailers, industry players, government agencies and consumers.
To strengthen the implementation of the initiative throughout the year, the Domestic Trade and Cost of Living Ministry (KPDN) will roll out several strategic programmes, including KITA KLIK! in collaboration with e-commerce platforms, the Kita Untuk Kita programme with local supermarket and retail chains, partnerships with Kuala Lumpur Fashion Week (KLFW), and the Local to Global Retail Programme. — Bernama"
Malay Mail,Johor election: Zahid pledges full support for federal unity government if BN wins,https://www.malaymail.com/news/malaysia/2026/06/27/johor-election-zahid-pledges-full-support-for-federal-unity-government-if-bn-wins/225471,"Sat, 27 Jun 2026 19:14:04 +0800","PONTIAN, June 27 — BN chairman Datuk Seri Dr Ahmad Zahid Hamidi has assured that he will ensure that the Johor State Government moves in line and provides full support to the federal government if it is given a mandate in the Johor state election.
Ahmad Zahid, who is also Umno president, said that good leadership is rooted in strong political stability, especially when victory is achieved with a higher number of seats and majority.
The BN administration at the state level, he said, never intends to challenge the administration at the central level in any election campaign.
“I assure you that if the mandate is given again, the government in Johor state led by our friend will continue to work together with the central government for the benefit of the entire Johor people, God willing,” he said at the Johor State Kemas Staff Meeting at Pontian MARA Junior Science College here, today.
Ahmad Zahid, who is also deputy prime minister, also expressed his commitment to ensure full cooperation between the state administration and Putrajaya in order to strengthen the existing Unity Government.
“I would like to mention that the Johor Government that will be formed, let alone if a larger mandate is given, I and we (BN) will ensure that this Johor Government is a government that will continue to be in line with the central government in Putrajaya,” he said.
Therefore, Ahmad Zahid reminded all parties not to manipulate political sentiment by claiming that voters supposedly need to choose representatives from a certain group only to ensure harmony with the central government.
“And don’t play around with issues, only choose those who supposedly come from the same coalition or party. We are also in the same coalition,” he said.
He called on voters and candidates contesting throughout the 14-day campaign period to implement the democratic process maturely to choose representatives who are capable of strengthening stability and developing the state of Johor.
He also expressed his appreciation to the Royal Malaysia Police (PDRM) as well as government departments and agencies involved in ensuring the smooth and safe election process.
Meanwhile, Ahmad Zahid also praised the role of the Community Development Department (KEMAS) and expressed his wish that the salary scheme for KEMAS workers could be improved through proposals that would be submitted to the government.
For the latest news on the 16th Johor state election, please visit https://prn.bernama.com/johor/. — Bernama"
Malay Mail,Selangor religious dept denies mosque caused Ukay Perdana burial delay — blames family confusion and NGO,https://www.malaymail.com/news/malaysia/2026/06/27/selangor-religious-dept-denies-mosque-caused-ukay-perdana-burial-delay-blames-family-confusion-and-ngo/225469,"Sat, 27 Jun 2026 18:54:37 +0800","SHAH ALAM, June 27 — The Selangor Islamic Religious Department (Jais) has denied allegations that a delay in the burial process at the Islamic Cemetery in Ukay Perdana, Hulu Klang, which went viral last Thursday, was caused by the Nurul Hidayah Mosque in Kampung Pandan Dalam.
Jais director Datuk Mohd Shahzihan Ahmad said the delay stemmed from confusion among the family of the deceased over burial arrangements, which also involved a non-governmental organisation (NGO), the Salatulrahim Welfare Organisation (BKS).
He also rejected claims that the mosque had requested a payment of RM1,400 for handling the burial.
“Investigations and reviews conducted by Jais found that the deceased was a member of the Nurul Hidayah Mosque kariah and had died at 6.22 am on June 25.
“At the initial stage, the family dealt with BKS, which has no affiliation with the mosque, and intended to proceed with the burial at the Ukay Perdana Islamic Cemetery under the supervision of the Ampang Jaya Municipal Council (MPAJ),” he said in a statement today.
Mohd Shahzihan explained that the deceased’s father later met the Assistant Manager of Nurul Hidayah Mosque at about 10.30 am to obtain the Islamic Burial Application Form required for burial at the cemetery and agreed for the mosque to take over funeral arrangements from BKS.
He said the mosque subsequently issued the application form at 11.15 am after receiving the original Death Register.
However, the mosque was later informed that the deceased’s grandfather preferred for BKS to continue managing the funeral.
“Considering the possibility of confusion and disorder at the funeral home, the mosque requested police assistance to accompany its representatives there.
“When mosque personnel arrived at the funeral home at Surau An-Nur, Taman Cempaka, they were informed that the body had already been taken to the Islamic cemetery by BKS, while the Islamic Burial Application Form and the deceased’s Death Register remained with the mosque,” he said.
According to Mohd Shahzihan, because the body was transported to the cemetery without the required original documents, the burial process could not be done immediately.
He said the mosque was later contacted by the Ukay Perdana Islamic Cemetery management, who informed them that the body had already been placed in the grave.
The mosque then delivered the necessary legal documents to the cemetery to allow the burial to proceed.
He further revealed that the Muslim Burial Application Form submitted by the family of the deceased to the cemetery management, which enabled the burial process to continue, was later found to be fraudulent.
“As a result, a police report regarding the alleged document forgery was lodged on June 26,” he said.
Mohd Shahzihan advised the Muslim community to deal directly with mosque authorities within their respective kariah areas for funeral arrangements to ensure smooth coordination and avoid unnecessary delays.
He stressed that the management of Muslim funerals should be expedited and not be disrupted by the personal interests of any party. — Bernama"
Malay Mail,Jais raids Petaling Jaya premise over Shiite activities — 226 foreign nationals questioned,https://www.malaymail.com/news/malaysia/2026/06/27/jais-raids-petaling-jaya-premise-over-shiite-activities-226-foreign-nationals-questioned/225468,"Sat, 27 Jun 2026 18:46:45 +0800","SHAH ALAM, June 27 — The Selangor Islamic Religious Department (Jais) raided a premise at Jalan Pusat Perdagangan Lagoon Perdana in Petaling Jaya here, which was believed to be conducting activities contrary to fatwa and linked to Shiite teachings, two days ago.
Jais director Datuk Mohd Shahzihan Ahmad said the raid was conducted at 9.34 pm following public tip-offs, during which 226 foreign nationals comprising 147 men, 51 women and 28 children were inspected.
“The operation involved cooperation between JAIS, the Royal Malaysia Police, Malaysian Immigration Department, Fire and Rescue Department, the Malaysian Communications and Multimedia Commission, and the Subang Jaya City Council (MBSJ), with a total strength of 120 personnel,” he said in a statement today.
Shahzihan said the raid was conducted under the Syariah Criminal Offences Enactment (Selangor) 1995, involving investigations under Sections 12(c), 13 and 16 of the same enactment.
He said MBSJ also issued notices under Subsection 72(1)(a) and (c) of the Street, Drainage and Building Act 1974 [Act 133] regarding several non-compliances related to the construction and building renovations that were carried out without approval from the local authority.
“Members of the public who have information related to Shiite teachings are urged to contact the Jais hotline at 1800-88-2424.
“This is to enable appropriate action to be taken. Jais also advises Muslims not to be involved in any activities related to Shiite teachings,” he said. — Bernama"
Malay Mail,"Johor election key contests — Machap, Puteri Wangsa, Bukit Kepong in spotlight",https://www.malaymail.com/news/malaysia/2026/06/27/johor-election-key-contests-machap-puteri-wangsa-bukit-kepong-in-spotlight/225464,"Sat, 27 Jun 2026 18:07:51 +0800","JOHOR BAHRU, June 27 — Several high-profile contests are set to dominate the campaign for the 16th Johor state election, with heavyweight politicians, former ministers, and closely watched constituencies expected to shape the outcome when voters head to the polls on July 11.
Topping the list is Machap, where Johor Menteri Besar Datuk Onn Hafiz Ghazi of Barisan Nasional (BN) faces a straight fight against Pakatan Harapan’s (PH) Nur Hafiz Roslan, a lawyer.
The contest is widely seen as a referendum on Onn Hafiz’s leadership after four years at the helm of the Johor state government.
Another key battleground is Puteri Wangsa, where former education minister Dr Maszlee Malik of PH faces the election’s highest-profile five-cornered contest against BN’s Teow Chia Ling, Nicholas Paul Vincent of Parti Bersama Malaysia (Bersama), Rashifa Al Junied of the Malaysian United Democratic Alliance (MUDA), and Independent Wang Wee Siong.
With more than 128,000 registered voters, Puteri Wangsa is among Johor’s largest constituencies and is expected to be one of the fiercest contests in the election.
In the north of the state, Bukit Kepong is shaping up as another key battleground, with former Johor Menteri Besar Datuk Dr Sahruddin Jamal carrying Perikatan Nasional’s (PN) challenge against BN’s Ahmad Syar’e Yusof and PH’s C. Subramani.
Permas will also be closely watched after Amanah fielded Sharon Teo Siew Hui as its first Chinese candidate in a four-cornered contest involving BN’s Baharudin Mohamed Taib, PN’s T. Vela, and Bersama’s Dr Zamil Najwah Arbain.
Attention will also be on Pasir Raja, where former Health Minister Datuk Seri Dr Adham Baba returns to the state political arena after an eight-year absence. Representing BN, he faces PH’s Mohd Fakharuddin Moslim and PN’s Yuhanita Yunan in a three-cornered contest.
Urban voters will be watching Larkin, where BN incumbent Mohd Hairi Mad Shah, who is State Youth and Sports Committee chairman, takes on Pulai MP Suhaizan Kayat of PH, with Parti Bersama Malaysia’s Norsinah Abu adding another dimension to the contest.
Meanwhile, Endau will make electoral history as Parti Orang Asli Malaysia (ASLI) makes its election debut. The party has fielded Jati Awang against BN’s Alwiyah Talib, PH’s Saiful Nizam Samat, and PN’s Hasnul Hakimi Hussien in a four-cornered fight.
Universiti Teknologi Malaysia (UTM) Faculty of Social Sciences and Humanities dean, Associate Prof Dr Mazlan Ali, said several marginal seats narrowly won by BN in the 2022 state election, including Bukit Pasir and Parit Yaani, could ultimately determine whether the coalition retains its two-thirds majority or whether the opposition makes significant gains.
Polling is on July 11, with early voting set for July 7.
For the latest updates on the state election, visit https://prn.bernama.com/johor/. — Bernama"
