Source,Title,Link,Date,Article
New Straits Times,"US-Iran truce set to end Tuesday night, says Pakistan",https://www.nst.com.my/world/world/2026/04/1423344/us-iran-truce-set-end-tuesday-night-says-pakistan,"Wed, 22 Apr 2026 00:33:50 +0800","ISLAMABAD: A two-week ceasefire between the United States and Iran would expire at 2350 GMT on Tuesday, meditator Pakistan said.
""Ceasefire ends at 4:50am PST, 22 April,"" Information Minister Attaullah Tarar posted on X, referring to Pakistan Standard Time.
The truce has been expected to end overnight Tuesday, though in comments to Bloomberg, US President Donald Trump said it would only expire a day later, on Wednesday evening Washington time.
Trump said it was ""highly unlikely"" he would agree to extend it.
Pakistan invited the warring sides to a second round of talks in Islamabad, but Iran has yet to formally respond, Tarar said.
He added that a decision by Tehran was ""critical"" before the truce expired.--AFP
© New Straits Times Press (M) Bhd"
New Straits Times,"Viral duo move hearts as both refuse RM3,000 donation",https://www.nst.com.my/news/nation/2026/04/1423341/viral-duo-move-hearts-both-refuse-rm3000-donation,"Wed, 22 Apr 2026 00:31:49 +0800","KUALA LUMPUR: Two men featured in a viral video shared on the Minyak Hitam Jalanan Facebook page have drawn public attention after they were seen politely declining RM3,000 believed to have come from donations received during a social media livestream.
The Facebook page is run by a mechanic known for assisting people in need, particularly motorists stranded due to vehicle breakdowns.
In a recent video uploaded on the page, its owner said Dicky, whom he had previously assisted in an earlier
viral clip
, had received gifts estimated to be between RM5,000 and RM6,000 during a livestream session.
He said Dicky had intended to give half of the amount to him as a charitable contribution.
However, the
mechanic
said the RM3,000 should instead be channelled towards helping those in need.
""He had already offered it to me after someone recorded him saying he wanted to give the gift money to me,"" he said.
Dicky later said that the RM3,000 was meant to be returned to the mechanic as an act of charity.
""This is the money I received, and I want to donate it back,"" he said.
The mechanic, however, declined and urged him to keep the money for his family's needs.
In the same recording, he was heard saying the funds would be better used for the schooling needs of the man's son.
The moment turned emotional when Dicky broke down in tears as both men insisted the other should keep the money.
Social media users who viewed the video said they were moved by the sincerity shown by both men, describing it as a reminder that compassion and humanity remained strong in society.
© New Straits Times Press (M) Bhd"
New Straits Times,"US in 'very strong position' for Iran deal, says Trump",https://www.nst.com.my/world/world/2026/04/1423339/us-very-strong-position-iran-deal-says-trump,"Wed, 22 Apr 2026 00:27:22 +0800","WASHINGTON: President Donald Trump said Tuesday the United States is in a strong position for talks with Iran as his envoys prepared to hold a second round of negotiations in Pakistan.
""We're going to end up with a great deal. I think they have no choice...We're in a very, very strong negotiating position,"" Trump told broadcaster CNBC.
A US delegation led by Vice President JD Vance was expected to leave shortly from Washington for Islamabad, which earlier this month hosted a first round of talks, ending without progress. However, there was no confirmation of Vance's departure.
Trump is demanding Iran give up its uranium stockpile and end attempts to control the strategic Hormuz waterway used to transport Middle East oil and other commodities.
Despite being hit by weeks of US and Israeli bombing before a temporary ceasefire was declared, Iran has so far refused those conditions.
The ceasefire, in place since April 8, was due to expire late Wednesday in Washington, according to the White House.
In a social media post, Trump told Iran it could boost the chances of success in peace talks with the United States by freeing eight women that he said face execution.
""I would greatly appreciate the release of these women,"" Trump posted on Truth Social. ""Would be a great start to our negotiations!""
Trump's statement accompanied a re-posting of a claim on X by a pro-Israel youth activist in the United States, Eyal Yakoby, that eight women faced death by hanging.
Yakoby posted photographs of eight women but no names.
AFP could not verify the claim about most of the women. However, the picture of one of the women in the post was identical to an image published April 13 by the Norway-based Hengaw human rights group of Bita Hemmati, who has been condemned to death in Iran.
Iran has already carried out multiple executions of people connected to January anti-government protests which activists say were put down in a brutal crackdown that left thousands dead and tens of thousands arrested.
Trump was unclear in the interview with CNBC about whether he would extend the ceasefire if there is no progress in Pakistan.
""Iran can get themselves on a very good footing if they make a deal,"" he said.
Asked if he would carry out his previous threats to bomb Iran's bridges and power plants – something many analysts say could constitute war crimes – Trump said ""it's not my choice but it will also hurt them.""
He said the United States had intercepted a ship carrying a ""gift"" to Iran from China as Teheran tries to restock its military during the ceasefire.
The ship had ""a gift from China"" which ""wasn't very nice,"" Trump told CNBC. ""I was a little surprised,"" he added, saying he thought he had an ""understanding"" with China's President Xi Jinping.
A week ago, Trump announced that Xi had assured him there would be no Chinese weapons deliveries to Iran, a close partner with Beijing for years.--AFP
© New Straits Times Press (M) Bhd"
New Straits Times,"Govt prioritises people, supply and economic stability amid global crisis",https://www.nst.com.my/news/nation/2026/04/1423337/govt-prioritises-people-supply-and-economic-stability-amid-global,"Tue, 21 Apr 2026 23:44:07 +0800","KUALA LUMPUR: The Madani government's priority in addressing the current global supply crisis is to protect the people, maintain the supply of basic necessities, support industries and ensure the nation's growth momentum is not significantly affected.
Economy Minister Akmal Nasrullah Mohd Nasir said Malaysia was managing a prolonged and evolving crisis that required policy adjustments, cost management, safeguarding of essential needs and sustained economic momentum, with all government decisions reflecting a swift, focused and data-driven approach.
""We acknowledge the risks that are unfolding, but we are also confident that with strong coordination among ministries, industry cooperation and high implementation discipline, Malaysia is capable of navigating this period of uncertainty in a more structured manner.
""During this period, all parties are expected to make prudent adjustments together in support of the government's efforts to stretch available supplies,"" he said during a special briefing on the global supply crisis, which was broadcast live today.
He said among the measures being implemented were intensified public campaigns promoting prudent consumption, energy and electricity conservation, and more efficient travel planning to reduce fuel usage and daily costs.
Akmal Nasrullah said the approach aimed to ensure adjustments were carried out in a structured and controlled manner should the period of uncertainty persist, as the continuity of critical industries forms part of the nation's broader economic resilience strategy.
""This crisis once again reminds us that energy must not be viewed merely as a pricing issue, but as a matter of economic resilience, supply security and the country's ability to adapt to external shocks through medium- and long-term measures that must move in tandem,"" he added.
© New Straits Times Press (M) Bhd"
New Straits Times,"NEAC okays steps to protect supply chains, domestic industries",https://www.nst.com.my/news/nation/2026/04/1423333/neac-okays-steps-protect-supply-chains-domestic-industries,"Tue, 21 Apr 2026 23:34:10 +0800","KUALA LUMPUR: The National Economic Action Council (NEAC) today approved three proposals covering logistics facilitation, risk mitigation and market expansion to ensure supply chains and the continuity of domestic industries are not severely disrupted amid the global supply crisis.
Economy Minister Akmal Nasrullah Mohd Nasir said the measures were among strategic mitigation proposals put forward by the NEAC Crisis Management Task Force, the Investment, Trade and Industry Ministry (Miiti) and the Tourism, Arts and Culture Ministry.
He said the government was also assessing local supplies that could be utilised by affected industries, while strengthening bilateral negotiations based on national strategic needs and complementary trade principles.
""For the manufacturing sector, there have been complaints over shortages of key input materials that could disrupt value chains.
""Among the main challenges identified are difficulties in securing alternative supplies in the short term, as well as risks of restrictions or constraints from exporting countries,"" he said during a daily briefing on the global supply crisis.
Akmal Nasrullah said cooperation with Australia focused on ensuring continuity of energy and agricultural inputs, including Malaysia's need for phosphate for fertiliser production and Australia's demand for urea from Malaysia, alongside a shared commitment to maintaining stable energy supply flows.
""With China, the focus is on strategic measures to increase the supply of resin and naphtha to support domestic production of critical medical devices,"" he said.
He said the approach would help secure supply sources, reduce risks of global supply chain disruptions and strengthen the country's food, energy and healthcare security.
""In line with this, the government's action framework now focuses on three key priorities – ensuring and extending supply, as well as containing price increases.
""This approach is crucial because the crisis we face today is not merely about prices, but about ensuring the country has sufficient supply, flexibility to adjust, and the capacity to protect the public while maintaining uninterrupted access to essential goods until alternative supplies are strengthened,"" he said.
© New Straits Times Press (M) Bhd"
New Straits Times,"Enforcement officer held over RM11,000 graft tied to foreign workers protection",https://www.nst.com.my/news/regional/2026/04/1423331/enforcement-officer-held-over-rm11000-graft-tied-foreign-workers,"Tue, 21 Apr 2026 23:21:48 +0800","GEORGETOWN: The Penang Malaysian Anti-Corruption Commission (MACC) has detained an enforcement officer on suspicion of soliciting and receiving about RM11,000 in bribes in exchange for protecting foreign workers from legal action.
According to sources, the male suspect in his 30s was arrested about 4pm today when he turned up to give his statement at the MACC office in Penang.
""Preliminary investigations found that the suspect is believed to have committed the offences between November 2024 and April 2025.
""He is suspected of receiving bribe payments on a monthly basis on seven occasions via fund transfers into his Touch 'n Go eWallet account,"" the source said.
Penang MACC deputy operations director Mustafa Kamal Ahmad, when contacted, confirmed the arrest.
He said the case was being investigated under Section 16(a)(B) of the MACC Act 2009.
© New Straits Times Press (M) Bhd"
New Straits Times,"Money, power and oil: The grip that won't loosen",https://www.nst.com.my/opinion/columnists/2026/04/1423329/money-power-and-oil-grip-wont-loosen,"Tue, 21 Apr 2026 23:20:14 +0800","WHEN  the international community agreed to transition away from fossil fuels at the 2023 COP28 global climate summit, some hailed the moment as the beginning of the end for oil.
But little progress has been made since then, even though the vast majority of scientists agree there's overwhelming evidence of global warming and that it is driven chiefly by the burning of fossil fuels.
The Middle East war, meanwhile, has shown that the world is as dependent as ever on ""black gold"", with the effective closure of the Strait of Hormuz holding the global economy and energy supply in a chokehold.
Some have pointed to the ripple effects of the war as yet another reason to decrease humanity's dependence on fossil fuels.
But several global trends indicate the 2023 promise is still a ways away from coming true.
Among them is the agenda of United States President Donald Trump, whose energy slogan is ""drill, baby, drill"" and has intervened with military force in two countries with vast crude reserves: Venezuela and Iran.
But why is it so hard for countries to quit oil? There are some factors to consider.
First, it's the economy. If
financial markets rise and fall with the fluctuating price of crude, it's because they have deep ties to assets linked to hydrocarbons.
""We cannot make the transition by shutting down fossil fuel companies overnight, because that would be an unprecedented worldwide economic disaster,"" said Claudio Angelo, the international policy coordinator at Brazil's Climate Observatory.
The economies of some countries like Iraq, Kuwait and Saudi Arabia are completely dependent on oil.
But Angelo said even for other countries with more diverse economic models, like Brazil, removing crude oil exports would be enough to tank the economy.
Next is  political will.
Bill Hare, director of a policy institute called Climate Analytics, said some oil-exporting countries like the US, Canada and Australia have the means to undertake a green energy transition.
""For these countries, I think it's a matter of political will.""
But with Trump back in Washington, along with a host of other right-wing leaders assuming power around the globe, economic interests are once again being prioritised over the issue of global warming — with some denying the climate phenomenon even exists.
""There is a whole vision of the West, led by the US, of going back to a model that's already been tried,"" said Leonardo Stanley, an associate researcher at the Centre for the Study of State and Society in Buenos Aires.
Then, there's the powerful lobbyists.
""The oil and gas sector is the most powerful lobbying interest on Earth,"" said Climate Observatory's Angelo. ""For 30 years, they have been playing for time to delay changes.""
For example, an AFP investigation in 2023 showed that consulting firm McKinsey, with clients such as ExxonMobil and Saudi Aramco, defended their interests during a preparatory meeting for COP28.
Another question is — who foots the bill?
To move away from oil, financial support is needed for both wealthy oil-producing countries and poorer countries entirely dependent on oil imports.
""But to start this process, it's got to be some willingness from the big economic powers, the middle and big economic powers to actually come up with an international system that will facilitate this,"" said Hare.
But despite the headwinds, there has been some progress made in transitioning to
green energy.
Renewable energy (RE) sources accounted for nearly half of global electricity capacity  — a record —  last year, according to the International Renewable Energy Agency.
China, the world's largest producer of greenhouse gasses, nevertheless has become a global leader in RE production, increasing its wind and solar power capacities substantially within the past year.
And in Pakistan, solar power has gone from being a marginal source of power in 2020 to one of its main sources of electricity today.
Hare noted that RE sources have also led to decreased electricity bills in some regions of the US and Australia.
* The writer is from AFP
© New Straits Times Press (M) Bhd"
New Straits Times,"Government focuses on policy adjustments to address cost pressures, global supply crisis",https://www.nst.com.my/news/nation/2026/04/1423327/government-focuses-policy-adjustments-address-cost-pressures-global,"Tue, 21 Apr 2026 23:12:48 +0800","KUALA LUMPUR: The government is focusing on policy adjustments to manage cost pressures while simultaneously ensuring the supply of basic necessities needed to address the impact of the global supply crisis.
Economy Minister Akmal Nasrullah Mohd Nasir said the situation in the Strait of Hormuz has not yet shown a convincing resolution, despite certain diplomatic developments.
""The issue is not only whether the physical supply is disrupted or not, but also involves risk premiums, insurance costs, logistics, delivery delays, and disruptions to the global supply chain.
""What we are facing now is no longer a short-term shock. This is not just an issue of oil prices, but has evolved into a global supply crisis affecting energy costs, logistics, raw materials, food, services and ultimately the daily lives of the people.
""In other words, we are now in a phase of prolonged stress management, no longer just the initial shock management phase,"" he said during the daily briefing on the global supply crisis.
Akmal Nasrullah said that if this uncertainty continues, its impact on energy costs and the global supply chain could take up to 18 months to stabilise, depending on geopolitical developments and the recovery of trade routes.
""It means that Malaysia is not exempt from global pressures coming from various angles,"" he said.
He also said that during the period from April 13 to 17, 2026, the average global spot price of Brent crude oil decreased by 11.6 per cent, from US$31.67 per barrel to US$17.85 per barrel.
""Although last week's highest price reached US$32.46 per barrel, it is still below the peak of US$44.46 recorded after the outbreak of the crisis in West Asia,"" he added.
Akmal Nasrullah also emphasised that the movement of world oil prices indicates that the crisis is not yet over and that pressure is expected to continue.
Touching on the country's economic performance, Akmal Nasrullah said several economic indicators in Malaysia still have a strong foundation despite the challenging global environment, with the FBM KLCI closing at 1,695.21 points on April 17, 2026, compared to 1,691.31 points the previous week.
""This represents a weekly increase of 3.9 points or 0.23 per cent, continuing the positive momentum since the end of March, and over the past six weeks, this index has risen by 0.29 per cent.
""This week, the index strengthened to the level of 1,702.30, indicating that investor confidence in the domestic economic fundamentals remains resilient, thereby offsetting the negative impact from the decline in global Brent oil prices,"" he noted.
Akmal Nasrullah said the preliminary gross domestic product (GDP) estimate indicates that the economy is expected to grow by 5.3 per cent in the first quarter of 2026, compared to 4.4 per cent in the same period last year.
This performance is in line with market analysts' expectations of between 5.1 and 5.6 per cent, and is expected to surpass several regional economies, such as Singapore at 4.6 per cent and China at five per cent.
""However, these figures should not be interpreted as a sign that the pressure has passed. On the contrary, they show that the economy is still holding up in the face of external pressures that have not yet eased.
""Several indicators for March 2026 have yet to be finalised, and the full impact of this crisis typically reaches the economy with a lag through logistics costs, import prices, investment decisions, and consumer sentiment,"" said Akmal Nasrullah.
© New Straits Times Press (M) Bhd"
New Straits Times,Malaysia shifts tourism focus to stable markets amid global crunch,https://www.nst.com.my/news/nation/2026/04/1423325/malaysia-shifts-tourism-focus-stable-markets-amid-global-crunch,"Tue, 21 Apr 2026 23:11:52 +0800","KUALA LUMPUR: The government is looking to strengthen the tourism sector by refocusing on more stable markets, including Asean, Australia, India and East Asia – covering China, Japan and South Korea – to sustain visitor arrivals and national revenue following a global supply crisis that has affected air travel from the Middle East.
Economy Minister Akmal Nasrullah Mohd Nasir said the move was agreed by the National Economic Action Council to ensure the sector's resilience amid an uncertain global environment.
""In a prolonged global crisis, tourism is not merely about increasing visitor numbers, but is crucial in generating foreign exchange earnings and helping to offset external pressures we are currently facing,"" he said during a briefing on the global supply crisis, broadcast live on local television stations today.
He said that within a month of the crisis, a total of 288 flights from the Middle East to Malaysia were cancelled, involving 88,438 seats, although the segment accounted for less than one per cent of total tourist arrivals.
According to Tourism Malaysia, arrivals from China reached 4.7 million in 2025, a year-on-year increase of 25.1 per cent. As of February 2026, there were about 871 weekly flights across 30 cities, with a capacity of 170,862 seats.
The minister said strategies to boost visitor numbers must focus on Malaysia's strengths as a stable and accessible destination, supported by a well-developed transport system and sufficient domestic energy supply to sustain tourism experiences.
""More importantly, the benefits of tourism do not stop at hotels and airlines. When tourists arrive and spend, the impact is also felt by homestay operators, tour guides, local transport providers, restaurants, hawkers, retailers, handicraft entrepreneurs and various other small businesses.
""This economic spillover is vital to ensure small industries continue to thrive and local economies remain active. That is why strengthening the tourism sector at this time is not merely about promotion, but about ensuring more local businesses can survive and more people continue to have a source of income,"" he said.
He added that the Visit Malaysia 2026 campaign had been extended to 2027 to allow more time for the international tourism market to recover, with a target of 47 million foreign visitors and RM329 billion in tourism revenue.
© New Straits Times Press (M) Bhd"
