Source,Title,Link,Date,Article
New Straits Times,Loud bangs and a Trump evacuation: Chaos at correspondents' dinner,https://www.nst.com.my/opinion/columnists/2026/04/1426446/loud-bangs-and-trump-evacuation-chaos-correspondents-dinner,"Sun, 26 Apr 2026 11:28:01 +0800","IT was meant to be a glitzy Saturday night at a Washington ballroom featuring President Donald Trump, but the glamour was shattered by gunshots that left guests diving to the floor and the US leader bundled out by security personnel.
Trump was seated on the dais at the White House Correspondents' Association's annual dinner – the first time he is attending as president – when loud bangs disrupted the revelry and caused him and others on stage to look up in alarm.
Video captured by AFPTV, other news outlets, and AFP reporters attending the event showed a chaotic scene unfolding.
Moments after what sounded like gunshots, cries of ""Stay down!"" and ""Get down!"" were heard while guests, including correspondents, officials in the Trump administration and some members of his cabinet took cover.
Amid the chaos, the president was quickly surrounded by US Secret Service personnel, their weapons drawn, and they quickly rushed Trump off the stage and through a back curtain as the crowd crouched in shock.
The big band music stopped, and people in ball gowns and tuxedos turned quiet as agents swarmed around tables and over guests on the floor of the massive ballroom of the Washington Hilton, the very hotel where president Ronald Reagan survived an assassination attempt 45 years earlier.
""Shots fired upstairs,"" said Mehmet Oz, Trump's administrator of the Centers for Medicare and Medicaid Services, as he was being evacuated by security.
Also seen being rushed out of the ballroom was Health and Human Services Secretary Robert F Kennedy Jr – whose uncle, president John F Kennedy, was felled by an assassin's bullet in 1963 in Dallas, Texas.
[[nid:1426441]]
Alexandra Ingersoll, a correspondent for One America News, told AFP she was inside when the commotion began, and saw Secret Service spring into action to protect the president.
""I just ducked under the table and I was like 'I'm not going to risk this,'"" she told AFP. ""I didn't know if the shooter was neutralised or what was going on.""
With still few details on what actually occurred, the entire ballroom was ordered evacuated, and several hundred guests made their way into the Hilton lobby and out into the chilly air.
Guests were seen hugging, making calls, texting friends and loved ones, and their news bureaus.
Later the Secret Service said in a statement that it was investigating a shooting near the main security screening perimeter for the event.
""The president and the first lady are safe, along (with) all protectees,"" the agency said. ""One individual is in custody.""
It was not immediately clear whether the assailant fired shots, or security agents responded to the threat with gunfire of their own.
At about 8.40pm (0040 GMT), an AFP reporter saw police officers racing through the streets surrounding the Hilton, lifting barriers, ushering passersby over to different streets, and clearing cars from the area as quickly as possible.
A helicopter circled overhead. A few minutes later, a motorcade left the Hilton, in the direction of the White House.
* The writers are from Reuters
© New Straits Times Press (M) Bhd"
New Straits Times,"Man killed, wife and cousin injured in Tenom 4WD crash",https://www.nst.com.my/news/regional/2026/04/1426445/man-killed-wife-and-cousin-injured-tenom-4wd-crash,"Sun, 26 Apr 2026 11:27:59 +0800","TENOM: A man was killed while his wife and cousin were injured after their four-wheel-drive vehicle skidded and overturned at Km7 of Jalan Tenom-Enubai near Kampung Sri Meranti last night.
The victim, Victor Chung Yin Tat, 41, was pronounced dead at the scene in the 10.20pm incident.
His wife, 37, sustained severe injuries, including broken ribs on her left side, while his 28-year-old cousin suffered head injuries. Both were rushed to Tenom Hospital for treatment.
District police chief Superintendent Azmir Abd Razak said preliminary investigations revealed the Toyota Hilux was travelling from Kampung Bunsilon towards Tenom town.
""The incident occurred on a straight stretch of road, but the surface was wet due to rain and the area was dark.
""The driver is believed to have lost control before the vehicle skidded into the left shoulder of the road and overturned,"" he said when contacted today.
Azmir said the victim's body was sent to the Tenom Hospital forensics unit before being transferred to Keningau Hospital for a post-mortem.
The case is being investigated under Section 41(1) of the Road Transport Act 1987.
© New Straits Times Press (M) Bhd"
New Straits Times,New parties eye GRS after Usno departure,https://www.nst.com.my/news/regional/2026/04/1426437/new-parties-eye-grs-after-usno-departure,"Sun, 26 Apr 2026 11:15:21 +0800","KOTA KINABALU: Several political parties have applied to join Gabungan Rakyat Sabah (GRS), reflecting the state's dynamic political landscape, said its secretary-general, Datuk Seri Masidi Manjun.
Masidi, who is also Sabah Deputy Chief Minister II and Finance Minister, said the decision by the United Sabah National Organisation (Usno) to leave GRS was part of the ever-changing and unpredictable political reality in the state.
""People will come and go. But for now, there are already new applications from other political parties. Let the GRS chairman (Datuk Seri Hajiji Noor) announce it at the appropriate time,"" he told reporters here on Friday.
Masidi was speaking after attending a gala night organised by the Malaysia-China Chamber of Commerce (MCCC) Sabah branch.
Commenting on Usno's departure, he said politics was fluid, and it was often impossible to foresee developments beyond the next day.
""While I wish they had stayed, we respect their decision to quit GRS. I think we part as friends and not as enemies, and that is the most important thing,"" he added.
GRS information chief Datuk Joniston Bangkuai, who was also present, said he respected the move and described it as a normal occurrence in politics.
""We understand the reason given — that they are no longer compatible. For us in GRS, we will continue to focus on uniting all parties and communities in Sabah. We will not lose our focus,"" he said.
On Wednesday, Usno president Tan Sri Pandikar Amin Mulia confirmed the party had left the coalition following a meeting with Hajiji.
© New Straits Times Press (M) Bhd"
New Straits Times,#NSTviral: Mat Rempit swarm toll plaza in viral video,https://www.nst.com.my/news/nst-viral/2026/04/1426434/nstviral-mat-rempit-swarm-toll-plaza-viral-video,"Sun, 26 Apr 2026 11:11:58 +0800","KUALA LUMPUR: A group of motorcyclists turned a highway toll plaza into a scene of chaos early this morning, performing dangerous stunts and obstructing traffic.
The incident was captured in a 44-second video uploaded to X by UpdateInfo (
@update11111
) at 2.41am.
The footage depicts a large swarm of motorcyclists performing various stunts, including ""wheelies"", directly at the entrance of the plaza.
A large number of riders were also seen parked in front of the toll booths, watching the display.
The reckless antics caused a significant disturbance, with motorcycles circling back and forth as other vehicles attempted to navigate through the toll gates.
The exact location of the incident has yet to be identified. The New Straits Times has reached out to the authorities for further information.
© New Straits Times Press (M) Bhd"
New Straits Times,Johor Umno Youth calls for economic stimulus package amid energy crisis,https://www.nst.com.my/news/regional/2026/04/1426342/johor-umno-youth-calls-economic-stimulus-package-amid-energy-crisis,"Sun, 26 Apr 2026 10:56:00 +0800","JOHOR BARU: Johor Umno Youth has urged the state government to introduce a comprehensive economic stimulus package to cushion the impact of the global energy crisis.
State Umno Youth chief Noor Azleen Ambross said rising fuel costs were squeezing households and businesses across key sectors.
He proposed that the stimulus package prioritise vulnerable groups hardest hit by price hikes, including school and tour bus operators, tourist boat operators in Mersing, and small-scale fishermen and farmers.
Noor Azleen said following the wing's meeting yesterday, it was agreed that the state government and relevant authorities should implement immediate relief measures such as rebates, rental discounts, and reductions in premises taxes to assist small and medium enterprises (SMEs).
The wing also proposed that the State Housing Development Corporation offer rental discounts to tenants as cost-of-living pressures intensify.
Noor Azleen said the state must consider including single individuals under 40 in phase four of Bantuan Kasih Johor, a state financial aid programme for low- and middle-income groups.
""This aid should also include postal workers and security guards as eligible recipients, as the cost of living has increased significantly due to higher fuel prices,"" he said in a statement today.
On party matters, the youth wing welcomed the
Rumah Bangsa initiative
, which facilitated the return of 6,252 leaders at various levels.
Rumah Bangsa is an Umno-led outreach and reconciliation initiative aimed at reuniting former members and strengthening party ranks across all levels.
Noor Azleen said the initiative had boosted the party's ability to operate effectively by expanding membership, restoring leadership depth, tightening coordination from grassroots to state level, and sharpening its election machinery and outreach.
The party has recorded a surge in new memberships via online registration, particularly among youth, which he said reflected renewed confidence in Umno.
""A statewide campaign to attract more youth members through digital sign-ups will be rolled out soon, while divisions were encouraged to organise events to welcome newcomers and reinforce grassroots machinery,"" he added.
© New Straits Times Press (M) Bhd"
New Straits Times,"Shooting suspect was 'would-be assassin,' says Trump [WATCH]",https://www.nst.com.my/world/world/2026/04/1426340/shooting-suspect-was-would-be-assassin-says-trump-watch,"Sun, 26 Apr 2026 10:55:05 +0800","WASHINGTON: US President Donald Trump said Saturday that the suspect behind a shooting incident at a media gala in Washington was a ""would-be assassin,"" adding that the man was ""armed with multiple weapons.""
The man charged past a security checkpoint, Trump told a press briefing at the White House, adding: ""One officer was shot but saved by the fact that he was wearing a, obviously, a very good bulletproof vest.""
""We looked at all of the conditions that took place tonight, and I will say, you know, it's not a particularly secure building,"" the US leader added.
This is an image, unconfirmed, that I believe to be the body of the shooter at the
@whca
dinner.
Multiple shots were fired at the White House correspondents dinner with president Trump in attendance.
I heard 5-6 shots ring out, shortly before observing a dead body surrounded…
pic.twitter.com/5wH6dVencj
— Gavin J. Quinton (@GavinJQuinton)
April 26, 2026
© New Straits Times Press (M) Bhd"
New Straits Times,Health Minister praises Semporna mobile clinic team for daring mid-sea rescue [WATCH],https://www.nst.com.my/news/nation/2026/04/1426338/health-minister-praises-semporna-mobile-clinic-team-daring-mid-sea,"Sun, 26 Apr 2026 10:48:24 +0800","KUALA LUMPUR: Health Minister Dr Dzulkefly Ahmad has lauded the bravery and quick thinking of a Semporna mobile clinic boat team that saved two islanders from drowning after their vessel capsized.
In the April 22 incident, two residents were returning home after receiving treatment for non-communicable diseases when their boat overturned and sank in open water.
Despite being skilled swimmers, both victims suffered muscle cramps while adrift, nearly leading to a tragedy.
In a Facebook post, Dzulkefly expressed his pride in the mobile clinic team's response.
""I am immensely proud of the swift action and extraordinary courage shown by our team on the ground,"" he said.
He singled out crew member Azalan, who jumped into the sea to rescue the victims, and Captain Suaimi, who successfully deployed lifebuoys to the drifting islanders.
Two other team members, Samsi and Ansu, assisted in securing the victims and salvaging their boat.
""They not only ensured the safety of the victims but also saved the boat, which is the lifeline and source of livelihood for residents here.
""This is the true face of Health Ministry staff. Our motto, 'Kami Sedia Membantu' (We Are Ready to Help), is not just a slogan on paper; it is a manifestation of sacrifice translated into action, even when risking one's own life,"" he said.
Dzulkefly also noted the resilience of island communities that brave the waves in small boats to access medical supplies and treatment.
""This spirit strengthens my resolve to ensure the best health access reaches the furthest capes and our beloved islands.
""Thank you to the entire team in Semporna. You are unsung heroes. Continue to serve with heart and soul,"" he added.
https://www.facebook.com/reel/1515983893264858
NST, News, Malaysia News, Region, Dr Dzulkefly Ahmad, Semporna, mobile clinic, Health Ministry, boat rescue, Sabah, healthcare access, Semporna Community Mobile Boat Clinic, heroics
© New Straits Times Press (M) Bhd"
Malay Mail,‘True face of the Ministry of Health workforce’: Minister salutes Semporna mobile team for mid-sea rescue (VIDEO),https://www.malaymail.com/news/malaysia/2026/04/26/true-face-of-the-ministry-of-health-workforce-minister-salutes-semporna-mobile-team-for-mid-sea-rescue-video/217746,"Sun, 26 Apr 2026 14:10:33 +0800","KUALA LUMPUR, April 26 — Health Minister Datuk Seri Dzulkefly Ahmad today praised the Semporna Community Mobile Boat Clinic team for their swift and courageous rescue of two island residents whose boat capsized in Sabah waters last week.
The incident occurred on April 22 after the two residents had received treatment for non-communicable diseases and were heading home when their vessel overturned and sank, with both nearly losing their lives after suffering muscle cramps at sea.
“Mr Azalan (Boat Crew): Without hesitation, he immediately jumped into the sea to rescue the victims,” Dzulkefly said in a Facebook post.
He also gave a shout-out to the captain and two other members, whom he identified only by their personal names as Suaimi, Samsi and Ansu.
“With great skill, he ensured a life buoy was thrown accurately to the victims,” he said of Suaimi.
“Mr Samsi & Mr Ansu: They not only helped secure the victims’ safety, but also saved the boat itself because for residents here, a boat is their lifeline and source of income.
“This is the true face of the Ministry of Health workforce. The motto ‘We Are Ready to Help’ is not merely a slogan on paper, but a reflection of sacrifice shown through action, even when their own lives are at risk,” he added.
https://www.facebook.com/reel/1515983893264858/
Dzulkefly said he felt both sadness and pride after watching footage of the rescue, describing the team’s actions as an example of dedication beyond the call of duty.
He also highlighted the determination of island residents who continue to brave rough seas in small boats to obtain medicine and treatment.
The minister said their resilience strengthened his commitment to ensure quality healthcare services continue reaching remote coastal areas and islands.
He also thanked the entire Semporna team, describing them as unsung heroes who serve with heart and courage."
Malay Mail,Student injured after falling into seven‑metre well at Wakaf Bharu school in Kelantan,https://www.malaymail.com/news/malaysia/2026/04/26/student-injured-after-falling-into-sevenmetre-well-at-wakaf-bharu-school-in-kelantan/217744,"Sun, 26 Apr 2026 14:04:49 +0800","KOTA BHARU, April 26 — A 17-year-old male student sustained head and body injuries after falling into a well more than seven metres deep at Sekolah Menengah Kebangsaan Agama Falahiah, Wakaf Bharu, here today.
Wakaf Bharu Fire and Rescue Station (BBP) operations commander Azmi Sulaiman said the department received an emergency call at 9.12am, prompting six personnel and a Light Fire Rescue Tender (LFRT) to be dispatched to the scene.
“The team arrived about 11 minutes later and found the victim inside the well. A rescue operation was immediately carried out using specialised equipment, including ropes and a ladder,” he told Bernama.
The victim, Wan Ahmad Mukhlis Wan Md Fadhli, was safely brought out with only minor injuries and handed over to medical personnel for further treatment.
Preliminary information indicated that the student had been sitting on a cement cover over the well, which gave way under his weight.
Azmi said the well was previously used as an underground water source by the school but had long been abandoned, adding that the operation ended at 10am. — Bernama"
Malay Mail,MACC secures remand extension for preacher in RM12.3m NGO funds probe,https://www.malaymail.com/news/malaysia/2026/04/26/macc-secures-remand-extension-for-preacher-in-rm123m-ngo-funds-probe/217742,"Sun, 26 Apr 2026 13:52:40 +0800","SEREMBAN, April 26 — The Malaysian Anti-Corruption Commission (MACC) Negeri Sembilan has received approval to extend the remand of an independent preacher on suspicion of embezzling funds from a non-governmental organisation (NGO) totalling approximately RM12.3 million.
The five-day remand order until May 1 against the suspect, who is in his 30s, was issued by Magistrate Nurul Saqinah Rosli at the Seremban Magistrate’s Court here today.
The application to extend the remand was made after the original remand period for the suspect expired today.
Meanwhile, Negeri Sembilan MACC director, Awgkok Ahmad Taufik Putra Awg Ismail, when contacted, confirmed the matter and that the case is being investigated under Section 23 of the MACC Act 2009.
Previously, the state MACC had arrested an independent preacher suspected of abusing power and embezzling funds from an NGO totalling approximately RM12.3 million for personal gain.
MACC chief commissioner Tan Sri Azam Baki yesterday also reported that his party would call 14 to 15 witnesses to assist in the investigation into the embezzlement of NGO funds belonging to the independent preacher. — Bernama"
Malay Mail,"MOH launches oral health drive, targets older adults to keep 20 teeth by 2030, says Dzulkefly",https://www.malaymail.com/news/malaysia/2026/04/26/moh-launches-oral-health-drive-targets-older-adults-to-keep-20-teeth-by-2030-says-dzulkefly/217738,"Sun, 26 Apr 2026 13:43:38 +0800","KUALA SELANGOR, April 26 — The Ministry of Health (MOH) is targeting more than 50 per cent of senior citizens to retain at least 20 natural teeth by 2030, in line with the National Oral Health Strategic Plan 2022-2030.
Health Minister Datuk Seri Dr Dzulkefly Ahmad said that based on the National Oral Health Survey of Adults (NOHSA) 2020, only 34.3 per cent of senior citizens have at least 20 natural teeth, while 13.9 per cent experience oral functional limitations that affect their quality of life.
“Teeth are the gateway to the body. We want to ensure this gateway continues to function and protect against various risks, including infections and food-related issues, which are very important.
“I have stressed that there is no health without oral health, as it reflects the crucial role of dental health in maintaining overall well-being,” he said when met after launching the 6020 Campaign and the National-level Kembara Senyuman 2026 programme here today.
Dzulkefly said that to ensure the target is achieved, the ministry will roll out the Kembara Senyuman initiative nationwide, offering services such as denture provision directly to communities, care centres and rural areas.
He said efforts to ensure no one is left behind in accessing oral healthcare will include the use of 3D digital technology (3DDT) to produce high-quality dentures quickly.
He added that the initiative is among the government’s proactive measures in addressing the challenges of an ageing population, with the latest statistics showing that those aged 65 and above have reached 8.0 per cent of the population in 2025.
“Outreach programmes, or approaches that extend services to rural areas, are crucial to ensure no one is left behind, particularly among vulnerable or high-risk groups.
“We want to ensure that healthcare services and care continue to be delivered comprehensively, with a focus on senior citizens, the infirm, persons with disabilities, as well as those living in remote areas,” he said. — Bernama"
Malay Mail,Police seek mother accused of abusing three‑year‑old son in Batu Caves,https://www.malaymail.com/news/malaysia/2026/04/26/police-seek-mother-accused-of-abusing-threeyearold-son-in-batu-caves/217736,"Sun, 26 Apr 2026 13:29:55 +0800","KUALA LUMPUR, April 26 — Police are tracking down a woman suspected of abusing her three-year-old son in an incident in Batu Caves recently.
Gombak police chief ACP Noor Ariffin Mohamad Nasir said a report was lodged yesterday by the child’s grandmother, who lives in the same house.
Preliminary investigations found the incident occurred in early March at about 8 pm, when the complainant heard the child crying and suspected he was being abused by his mother.
“The suspect is a local woman and the child’s biological mother. She is not married, and the motive is still under investigation,” he said in a statement today.
The child has been taken for medical examination, which is ongoing.
Police are actively tracing the suspect to assist in investigations, with the case being probed under Section 31(1)(a) of the Child Act 2001.
Those with information are urged to contact investigating officer Insp Amirul Ashyraf Abu Hassan at 019-3491233 or the Gombak district police headquarters operations room at 03-61262222. — Bernama
* If you suspect child abuse, call the following hotlines for free and confidential support: Talian Kasih at 15999 or WhatsApp 019-2615999 (24/7); Talian BuddyBear at 1800-18-2327(BEAR) (noon-midnight daily); and One Crisis Centre (24/7) Wilayah Persekutuan at 03-26155555 (Kuala Lumpur General Hospital), 03-61454333 (Sungai Buloh Hospital) or 03-83124200 (Putrajaya Hospital)."
Malay Mail,"Global supply crisis presents opportunities, Malaysia remains safe investment destination, says Tengku Zafrul",https://www.malaymail.com/news/malaysia/2026/04/26/global-supply-crisis-presents-opportunities-malaysia-remains-safe-investment-destination-says-tengku-zafrul/217728,"Sun, 26 Apr 2026 13:16:23 +0800","KUALA LUMPUR, April 26 — Senior Political Adviser to the Prime Minister Tengku Datuk Seri Zafrul Abdul Aziz said the global supply crisis should be viewed as an opportunity to strengthen Malaysia’s position as a safe investment destination.
He said Malaysia has a proven track record of economic resilience and a robust investment ecosystem in navigating various crises.
“This is an opportunity. In every crisis, there are opportunities we must examine. Malaysia’s economy and investment ecosystem have weathered many crises, and we continue to maintain sound policy frameworks.
“This will, to some extent, boost investor confidence,” Tengku Zafrul told reporters after a contribution handover ceremony under the Bakul Rahmah Programme, organised by the Yayasan Tengku Zafrul Aziz in collaboration with the Teratai state assemblyman’s office, here today.
A total of 350 recipients from various communities, including senior citizens, single mothers and low-income families, received assistance.
Also present were Teratai assemblyman Yew Jia Haur and local community leaders.
Tengku Zafrul said Malaysia must continue positioning itself as a stable and safe investment destination.
He added that energy security is a key consideration for companies and investors when making investment decisions.
“Energy security is a major concern for companies and investors. Malaysia has demonstrated strength in terms of energy stability, reliability and resilience.
“This is another reason why many investors view Malaysia as a country that can be considered a safe investment destination,” said Tengku Zafrul. — Bernama"
