Source,Title,Link,Date,Article
New Straits Times,Aeon posts higher net profit of RM83.27mil in Q1,https://www.nst.com.my/business/corporate/2026/05/1442506/aeon-posts-higher-net-profit-rm8327mil-q1,"Mon, 18 May 2026 18:53:19 +0800","KUALA LUMPUR: Aeon Co (M) Bhd posted a higher net profit of RM83.72 million in the first quarter of its financial year ended March 31, 2026 (Q1 FY26), compared with RM68.10 million in the same period last year.
The general merchandise store and supermarket chain stated in a Bursa Malaysia filing today that the improvement was attributed to a more favourable product mix and higher variable income from the property management services segment.
This increase was driven by heightened festive shopping activity, supported by effective cost management and enhanced operational discipline.
Revenue inched down to RM1.242 billion in Q1 FY26, from RM1.244 billion in Q1 FY25, driven by effective cost management and improved operational efficiency.
Aeon managing director Tsugutoshi Seko said the company remain focused on strengthening its operational fundamentals and advancing key growth drivers.
""It would include improving efficiency, expanding their private brands offerings and enhancing customer engagement through their loyalty programme,"" he said.
At the same time, the group will continue to advance our sustainability initiatives to support longterm value creation.
""While ongoing global uncertainties may continue to influence consumer sentiment and spending patterns, we expect underlying demand to remain resilient, supported by steady spending on essential goods, sustained in-mall activity and supportive government stimulus initiatives,"" said Seko.
He noted that the group remains focused on executing its strategic priorities, navigating evolving challenges and delivering sustainable long-term value to our shareholders.
© New Straits Times Press (M) Bhd"
New Straits Times,Capital A net profit drops 96pct in Q1 due to forex loss,https://www.nst.com.my/business/corporate/2026/05/1442503/capital-net-profit-drops-96pct-q1-due-forex-loss,"Mon, 18 May 2026 18:33:42 +0800","KUALA LUMPUR: Capital A Bhd logged a lower net profit of RM22.45 million for the first quarter (Q1) ended March 31, 2026,  down 96.7 per cent compared with RM689.57 million in the same period a year earlier.
The decrease was mainly due to a RM2 million foreign exchange loss in the first quarter, compared with a RM21 million foreign exchange gain in the corresponding quarter of 2025.
It also reflected the cessation of RM15 million in interest income from discontinued operations following the debt settlement upon completion of the disposal.
Despite the lower earnings, Capital A reported higher revenue, rising 84.9 per cent to RM766.59 million from RM414.52 million in the corresponding quarter, according to its Bursa Malaysia filing.
Capital A said total segmental revenue before eliminations remained broadly stable year-on-year, with a slight decline to RM775 million from RM778 million in the same period last year.
It added that the group recorded improved operational momentum in Q1, supported by the expansion of its core businesses, including travel, logistics, maintenance, repair and overhaul, and ancillary travel-related segments.
No dividend was declared for the quarter under review.
Capital A said it has experienced minimal impact from the Middle East conflict.
""However, management recognises the correlation between the group's performance and the core airline business
""Anticipating potential capacity cuts, stop-gap measures—such as increasing fares, meal prices, and introducing a fuel surcharge—have been implemented to protect commission collection and meal supply. Capital A remains vigilant and continues to monitor market conditions,"" it added.
Capital A said the second quarter is typically a quieter period due to the low travel season, but expects a strong pickup in the following quarter with demand peaking in the fourth quarter.
""This growth will be supported by the e-commerce peak boosting the logistics business (Teleport) and heightened travel demand driving performance for AirAsia MOVE, Santan, and AirAsia Next,"" it added.
© New Straits Times Press (M) Bhd"
New Straits Times,Farmiera posts RM3mil in net profit for Q1,https://www.nst.com.my/business/corporate/2026/05/1442501/farmiera-posts-rm3mil-net-profit-q1,"Mon, 18 May 2026 18:33:06 +0800","KUALA LUMPUR: Poultry producer and distributor Farmiera Bhd logged a net profit of RM3.07 million for the first quarter ended March 31, 2026.
The company recorded revenue of RM167.20 million for the quarter, comprising RM87.17 million from poultry farming and RM80.03 million from poultry processing, according to its Bursa Malaysia filing.
It posted a profit before tax of RM4.49 million and a profit after tax of RM3.07 million for the period.
""The performance was supported by balanced contributions from both its poultry farming and poultry processing segments, which accounted for 52.14 per cent and 47.86 per cent of total revenue respectively,"" it said in a statement.
Farmiera managing director and chief executive officer Hong How Seng said that following the company's listing on the ACE Market last year, it remains committed to strengthen market position through upstream vertical integration to improve margins and enhance operational efficiency.
He said the strategy is progressing well, as shown by the completion and commencement of operations at four parent stock farms.
Hong added that the remaining two farms are expected to be completed in the second and fourth quarters of 2026, respectively.
""Looking ahead, we remain cautiously optimistic about our prospects, supported by ongoing government initiatives to strengthen food security, alongside the continued execution of our expansion plan,"" he said.
© New Straits Times Press (M) Bhd"
New Straits Times,Showdowns and spycraft on Trump-Xi summit sidelines,https://www.nst.com.my/opinion/columnists/2026/05/1442499/showdowns-and-spycraft-trump-xi-summit-sidelines,"Mon, 18 May 2026 18:32:40 +0800","WHILE Donald Trump and Xi Jinping were hailing their friendship for the cameras, it was less amicable for the rival Chinese and US security services.
From a standoff over a US Secret Service agent's weapon to a US staffer trampled during a melee, tensions bubbled to the surface throughout Trump's visit to Beijing.
The mutual distrust was underscored when US officials made staffers and media, including an AFP reporter, boarding Air Force One hand over all badges and pins given to them by the Chinese side.
Along with ""burner"" phones from the US delegation, the confiscated items were tossed in a trash can at the bottom of the stairs of the presidential jet.
For all Xi's warm words about being ""partners not rivals,"" this was always a summit between two superpowers with a long history of suspicion.
As they vie for supremacy without tipping over into conflict, both sides are taking their espionage and counterintelligence efforts to new heights.
The result in Beijing verged at times towards collective paranoia.
US officials and journalists travelling to China to cover the summit were advised to use phones and laptops that could be wiped or disposed of back home to preserve cybersecurity.
The frictions also played out on the ground in Beijing as US and Chinese officials appeared to be having their own shadow superpower battle.
Two incidents made headlines, including when Chinese officials blocked US officials and journalists in a room during Trump and Xi's visit to the Temple of Heaven.
""We're in the motorcade with the president. Do you not understand that?"" said one journalist, in scenes witnessed by an AFP reporter.
A Chinese official replied: ""The security of our side does not allow you.""
Voices were raised and the US group ended up pushing past the Chinese team to get to their vans in Trump's motorcade before it left.
""US press, we are going,"" a US official said. ""Be gentle but we are going. Don't run over anybody, do not do what they did to us.""
That appeared to refer to an earlier incident at the Great Hall of the People, in which a US staffer fell and had her ankle trodden on as officials from both sides tried to corral journalists rushing to film the start of the Trump-Xi talks.
Earlier at the temple, US and Chinese officials had clashed over whether a US Secret Service agent should be allowed to bring his weapon into the complex.
For nearly half an hour under the sun on Beijing's hottest day of the year, they had increasingly intense discussions as unyielding Chinese officials insisted the agent could not pass.
At almost every turn, there appeared to be diplomatic arm-wrestling between US and Chinese over timings, positions and alleged last-minute schedule changes.
US and Chinese officials like to talk about the principle of ""reciprocity"" in their relationship, particularly when it comes to confidence building measures.
But it can cut both ways – and Xi is now due to visit the White House in September.
At one point in the Temple of Heaven standoff, an official could be heard talking about what would happen on that trip.
Both sides are known for ensuring that when limitations are placed on numbers for officials or journalists, tit-for-tat measures are taken when the other country makes a return visit.
One senior US official in the administration of president Joe Biden was even reportedly denied breakfast after their counterpart did not get their morning meal.
With Trump and Xi eyeing three more meetings in 2026, it could be a long year for their staff.
* The writer is from AFP
© New Straits Times Press (M) Bhd"
New Straits Times,KPDN busts diesel syndicate abusing fleet cards in Penang raid,https://www.nst.com.my/news/regional/2026/05/1442497/kpdn-busts-diesel-syndicate-abusing-fleet-cards-penang-raid,"Mon, 18 May 2026 18:31:20 +0800","NIBONG TEBAL: The Domestic Trade and Cost of Living Ministry (KPDN) has crippled a syndicate suspected of misusing fleet cards to siphon subsidised diesel during a raid on a licensed wholesaler's premises here today.
The integrated operation under Ops Tiris 4.0 was carried out jointly with the Special Branch (E5) of the Penang police contingent headquarters following three weeks of intelligence gathering and surveillance.
Penang KPDN director S. Jegan said initial inspections at the premises uncovered activities involving the misappropriation of subsidised diesel.
He said authorities also seized 13 fleet cards believed to have been used in the operation.
""Investigations found that the premises was used as a transfer point for diesel from prime movers, which are believed to have repeatedly purchased fuel from nearby petrol stations using fleet cards,"" he said at the scene.
Enforcement officers also seized three prime movers, pumps, closed-circuit television (CCTV) equipment, purchase receipts and several business documents to assist investigations.
Authorities discovered about 10,600 litres of suspected diesel stored in five skid tanks and the original tanks of the prime movers, with the controlled goods valued at about RM53,000. The total value of the seizure was estimated at RM205,000.
Jegan said seven local men were detained to assist investigations.
The case is being investigated under Regulation 3(1) of the Control of Supplies Regulations 1974 for selling controlled goods without a licence, and Regulation 11 for purchasing controlled goods from unauthorised sources.
He said investigations were ongoing to identify individuals and companies involved in the diesel distribution chain, including the source of supply.
""Those convicted under the Control of Supplies Act 1961 face fines of up to RM1 million for the first offence and up to RM3 million for subsequent offences for individuals, or imprisonment of up to three years, or both.
""Companies may be fined up to RM2 million for the first offence and up to RM5 million for subsequent offences,"" he said.
KPDN would continue to strengthen enforcement and monitoring efforts, Jegan said, warning that strict action will be taken against any misuse of fleet cards for subsidised fuel diversion.
© New Straits Times Press (M) Bhd"
New Straits Times,"Gaza aid flotilla says Israeli forces intercepted 10 boats, contact lost with 23 vessels",https://www.nst.com.my/world/world/2026/05/1442488/gaza-aid-flotilla-says-israeli-forces-intercepted-10-boats-contact-lost,"Mon, 18 May 2026 18:21:03 +0800","ISTANBUL: The organisers of a flotilla of aid vessels bound for Gaza said on Monday that Israeli forces had intercepted 10 of their boats and that contact had been lost with a total 23 vessels in the eastern Mediterranean.
Earlier on Monday, Israel's foreign ministry had said on X that it ""will not allow any breach of the lawful naval blockade on Gaza.""
Ships from the Global Sumud Flotilla had set sail for a third time on Thursday from southern Turkiye, after earlier attempts to deliver aid to Gaza were intercepted by Israel in international waters.
Live video showed military vessels approaching the vessels on Monday.
""Military vessels are currently intercepting our fleet and (Israeli) forces are boarding the first of our boats in broad daylight,"" the Global Sumud Flotilla initially said on X.
""We demand safe passage for our legal, non-violent humanitarian mission.""
The group said 10 boats had been intercepted and contact lost with 23 of the 54 vessels in the flotilla, naming some two dozen Turks among those on the intercepted vessels, some 250 nautical miles (463 km) from Gaza. It said there were 426 people taking part in the flotilla from 39 countries.
Israel's foreign ministry also called on ""all participants in this provocation to change course and turn back immediately.""
The previous flotilla departed from Spain on April 12. But Israeli forces intercepted vessels in that group, taking more than 100 pro-Palestinian activists to Crete and detaining two others in Israel.
Last October, Israel's military halted another flotilla assembled by the same organisation, arresting Swedish activist Greta Thunberg and more than 450 participants.
Palestinians and international aid bodies, along with Turkiye and a number of other countries, say supplies reaching Gaza are still insufficient, despite a ceasefire reached in October that included guarantees of increased aid.
Most of Gaza's more than 2 million people have been displaced, many now living in bombed-out homes and makeshift tents pitched on open ground, roadsides, or atop the ruins of destroyed buildings.
Israel, which controls all access to the Gaza Strip, denies withholding supplies for its residents.
Its foreign ministry said more than 1.58 million tonnes of humanitarian aid and thousands of tons of medical supplies have entered Gaza since October 2025.
© New Straits Times Press (M) Bhd"
New Straits Times,Ampang PKR leader urges Rodziah to quit seat over Rafizi-linked event,https://www.nst.com.my/news/nation/2026/05/1442486/ampang-pkr-leader-urges-rodziah-quit-seat-over-rafizi-linked-event,"Mon, 18 May 2026 18:16:25 +0800","KUALA LUMPUR: An Ampang PKR divisional leader has called on Ampang MP Rodziah Ismail to vacate her parliamentary seat and resign from the party following her attendance at an event linked to former PKR deputy president Datuk Seri Rafizi Ramli in Petaling Jaya yesterday.
Ampang PKR deputy chief Daing Reduan Bachok said Rodziah's recent actions had triggered concern among grassroots members and party supporters.
He said any move that undermined party unity, eroded public confidence or contradicted the Reformasi struggle was unacceptable.
""The recent actions and stance of Ampang MP Rodziah Ismail have caused significant unease among members and supporters at the grassroots level.
""On the basis of the dignity of our struggle and respect for the people's mandate, I strongly urge Rodziah Ismail to immediately resign and vacate the Ampang parliamentary seat, as she no longer reflects the spirit of the struggle or loyalty to the party leadership,"" he said in a statement today.
Daing Reduan said Ampang voters had not given PKR and Pakatan Harapan a mandate for internal discord or factional politics.
""The people of Ampang gave their mandate to PKR and PH not to see the party weakened by internal political manoeuvring or the actions of those who fail to remain loyal to the party's cause.
""Ampang PKR wishes to stress that the grassroots here remain firmly behind the party president (Datuk Seri Anwar Ibrahim).
""We will not compromise on any action that could jeopardise party stability or erode public confidence in the Reformasi struggle,"" he added.
© New Straits Times Press (M) Bhd"
New Straits Times,WCT wins RM152.68mil Taiwan highway interchange contract,https://www.nst.com.my/business/corporate/2026/05/1442482/wct-wins-rm15268mil-taiwan-highway-interchange-contract,"Mon, 18 May 2026 18:15:16 +0800","KUALA LUMPUR: WCT Holdings Bhd has secured a RM152.68 million contract to undertake construction works for a highway interchange project in Taiwan.
In a Bursa Malaysia filing today, the company said the Taiwan branch of its wholly owned subsidiary, WCT Bhd, was awarded the contract by WU En De Construction Co Ltd on May 18, 2026.
It said the contract was awarded to WCT Berhad Taiwan Branch, comprising construction works between the Gaoke Interchange and Gangshan Interchange under the ""National Highway No. 1 - Addition of Gangshan Second Interchange Project"".
""The works under the contract involve road works, bridge structural works and drainage works,"" said the engineering, construction and property development company.
The project is expected to be completed within 42 months from the contract commencement date of Aug 1, 2026.
© New Straits Times Press (M) Bhd"
New Straits Times,Taiwan says would 'welcome' its president speaking to Trump,https://www.nst.com.my/world/world/2026/05/1442480/taiwan-says-would-welcome-its-president-speaking-trump,"Mon, 18 May 2026 18:14:46 +0800","TAIPEI: Taiwan would ""welcome"" an opportunity for its leader to speak to US President Donald Trump after he raised the possibility, a senior Taiwanese diplomat said Monday.
Trump told reporters on Friday that he had to speak to the man ""running Taiwan"" – an apparent reference to President Lai Ching-te – about arms sales.
A conversation between Lai and Trump would be a major break in US diplomatic policy and risk a rupture with China, which claims Taiwan is part of its territory.
Trump made the remarks to reporters aboard Air Force One on the way back to Washington after a summit in Beijing where Chinese President Xi Jinping had pushed him not to support Taiwan.
""I'm going to make a determination. I'm going to see,"" Trump said in response to a question about whether he would go ahead with arms sales to Taiwan.
""I have to speak to the person that right now is – you know who he is – that's running Taiwan.""
Taiwan Deputy Foreign Minister Chen Ming-chi said the government was seeking confirmation from the United States about whether Trump wanted to speak to Lai.
""We will use all channels to understand what the US side is actually thinking,"" Chen told reporters.
""We would of course very much welcome it,"" he said.
""If they are willing to talk with our president, I think that would be a very good opportunity and also a rare opportunity.""
In 2016, shortly after his first election victory, Trump accepted a phone call from then Taiwanese president Tsai Ing-wen, angering Beijing.
It was the first call between a Taiwanese leader and an incoming or serving US president since Washington switched recognition from Taipei to Beijing in 1979, and it stunned diplomats, world leaders and China watchers.
Trump has caused jitters in Taipei after he suggested arms sales to Taiwan could be used as a bargaining chip with China, which has threatened to seize the island by force.
Lai and others in his government have pushed back, insisting such sales are part of Washington's security commitment to the island.
Taiwan was at the ""core"" of global interests and ""will never be sacrificed or traded away"", Lai said in a statement on Sunday.
The United States is required under US law to provide weapons to Taiwan for its defence, but it has been ambiguous on whether US forces would come to its aid.
Chen said Trump had created ""some anxiety"" in Taiwan and the government was using ""all the communication channels to understand the real meaning behind"" his remarks.
""So far our understanding is there is no change even in the arms sale,"" Chen said, describing arms sales as the ""cornerstone"" of peace and stability across the Taiwan Strait.
© New Straits Times Press (M) Bhd"
New Straits Times,Cuckoo's earnings drops in Q1 on softer demand,https://www.nst.com.my/business/corporate/2026/05/1442476/cuckoos-earnings-drops-q1-softer-demand,"Mon, 18 May 2026 18:13:29 +0800","KUALA LUMPUR: Cuckoo International (MAL) Bhd posted lower net profit in the first quarter ended Mar 31, 2026 (Q1 FY26) due to softer consumer demand.
Earnings for the quarter under review slipped 10.1 per cent year-on-year to RM25.03 million from RM27.86 million a year ago.
Revenue dropped 23.1 per cent to RM227.83 million in Q1 FY26 from RM296.28 milliom in the same period last year as the company saw lower units sold in the quarter.
In a filing with Bursa Malaysia, the company noted that distribution and administration costs dropped 7.3 per cent to RM18 million and 14.5 per cenr to RM15.7 million, respectively.
The reduction in these expenses are mainly due to lower marketing expenses because of focused marketing spending.
Net losses on impairment of financial instrument rose 47.7 per cent to RM18.5 million, reflecting slower repayment behavior among spending shifted towards prioritising expenses in preparation for the Chinese New Year and Hari Raya celebrations in the first quarter.
Looking ahead, the the company remains cautiously optimistic on its long-term prospects.
""With consumers increasingly favouring rental arrangements as an alternative to outright purchases, the group is well-positioned to capitalise on this trend.
""Through continued investment in technology and wellness-focused home living solutions, including home appliances and household goods, home care services and other lifestyle solutions, the group is committed to sustain growth and build a resilient foundation for future growth,"" it added.
Cuckoo's share price closed unchanged on Monday at 43 sen, valuing the company at RM616.1 million.
© New Straits Times Press (M) Bhd"
