Source,Title,Link,Date,Article
New Straits Times,Johor polls: 'Main battle is between BN and PH' [WATCH],https://www.nst.com.my/news/nation/2026/06/1474541/johor-polls-main-battle-between-bn-and-ph-watch,"Sun, 28 Jun 2026 07:00:45 +0800","JOHOR BARU: All eyes will be on the Johor election over the next two weeks as  unity government partners Barisan Nasional (BN) and Pakatan Harapan (PH) go head-to-head in all 56 state seats.
Of the total, 14 seats will see straight fights between BN and PH: 10 of them were held by BN and   four were held by DAP.
Twenty-seven seats will see three-cornered contests, and 12 will have four-cornered fights.
Election Commission chairman Datuk Seri Ramlan Harun said only Bukit Naning, Puteri Wangsa and Bukit Batu will see five-cornered contests.
In all,   172 candidates will vie  for the 56 seats, a drop compared with the   239   in the 2022   polls.
Some observers attribute  the drop  to political fatigue and the Bersatu-Pas feud  in Perikatan Nasional. One political analyst  believes there is an understanding among Malay parties to avoid splitting the       community's vote.
Universiti Teknologi Malaysia Faculty of Social Sciences and Humanities lecturer Associate Professor Dr Mazlan Ali said he found it quite surprising that the number of candidates  had decreased, particularly given the emergence of new political parties.
""It appears that there is some kind of informal understanding between a party in the opposition bloc and perhaps BN.
""Many of these BN seats are straight fights with PH. This is likely because the opposition is now weaker due to  tensions between Pas and Bersatu. Even if Pas contests everywhere, it might not win and could end up splitting the Malay vote.
""That is why we are seeing some form of informal cooperation between BN and other parties. This is  being discussed among observers on the ground,"" he said.
PN is contesting 33 seats: 16 by Bersatu, 11 by Pas,  five by the Malaysian Indian People's Party  and one by new coalition member Parti Pejuang Tanah Air. Pejuang is fielding Suraya Sulaiman again  in Gambir,  where she  lost her deposit after polling 220 votes in a four-cornered fight in the last election.
Rifts in PN  show no sign of closing after Pas said it was withdrawing its election machinery from seats contested by Bersatu.  Because of this, Mazlan said   the main battle in the state election was between BN and PH.
""Despite a shaky start due to issues involving the Benut and Layang-Layang seats, BN appears serious and is sparing no effort to return as the state government.
""And from its previous statements and decision to go solo, it is clear that BN is treating PH as its main rival,"" he said.
PH, led by Datuk Seri Anwar Ibrahim, is mounting a  serious effort to deny BN.
Observers say this is reflected in PKR's decision to field heavyweight candidates such as former education minister Dr Maszlee Malik in a safe seat like Puteri Wangsa.
The seat was previously held by PH before it was handed over and won by Muda in the last state polls. Maszlee's placement in a safe seat suggests he is a  potential menteri besar  should PH  form the next Johor government.
Caretaker  Menteri Besar Datuk Onn Hafiz Ghazi is defending his Machap seat against PH's Nur Hafiz Roslan.
Twelve  seats  that were carried with slim majorities in the last election and will see    multi-cornered fights in this one, and  will be closely watched.
Among them is Bukit Batu, which will see a five-cornered contest. In the last state election, PH won the seat by 137 votes   in a four-cornered fight.
Other seats that recorded narrow  majorities are Jementah, Kemelah, Bukit Kepong, Bukit Pasir, Serom, Maharani, Tenggaroh, Tiram, Johor Jaya, Perling and Kota Iskandar.
A total of 2.7 million Johoreans are eligible to vote, with early voting on July 7 and polling day on July 11.
© New Straits Times Press (M) Bhd"
New Straits Times,Temperature records shattered in Europe as deadly heatwave moves east,https://www.nst.com.my/world/world/2026/06/1474536/temperature-records-shattered-europe-deadly-heatwave-moves-east,"Sun, 28 Jun 2026 06:17:41 +0800","COPENHAGEN: From Scandinavia to the Alps, Europeans endured sweltering conditions on Saturday as a heatwave linked to dozens of deaths spread east, shattering records with temperatures in some areas soaring above 40C (104F).
Preliminary all-time temperature records were set on Saturday in Germany, Denmark and the Czech Republic, and a new mark for the month of June in Switzerland. Similar records had been broken earlier this week in France and Britain.
Scientists said the stifling heatwave would have been virtually impossible without man-made climate change, which has made this week's night-time temperatures 100 times more likely than they would have been even two decades ago.
""This heat isn't pleasant summer weather. It's a health crisis,"" Katrin Goering-Eckardt, a German federal lawmaker and former parliamentary leader of the Green Party, said on X.
Such was the heat in Berlin, where temperatures climbed to 39C on Saturday, that police deployed two water cannons in the city to lightly spray people trying to cool down.
Saturday's new preliminary German record of 41.5C in Moeckern-Drewitz in the eastern state of Saxony-Anhalt topped a record set just the day before of 41.3C near Saarbruecken on the French border, Germany's Meteorological Service said.
The Danish Meteorological Institute meanwhile reported a 37C reading north of the city of Aarhus on Saturday, the highest on record since measurements began in 1874.
Officials in the Czech Republic measured a record 40.9C north of Prague, the Czech Hydrometeorological Institute said.
In the Slovak capital, Bratislava, authorities recorded the hottest night on record on Friday.
PEOPLE URGED TO SAVE WATER
German authorities issued extreme heat warnings across almost the entire country on Saturday. As the heatwave moved east, temperatures rose well above 30C across almost all of Poland.
The heating up of the River Danube led Hungary's Paks nuclear power plant to cut output on one of its reactors. Earlier, Switzerland's Beznau nuclear power station temporarily shut down its reactors due to the temperature of the River Aare.
In France, dozens of people, both young and old, have died due to the heatwave. Temperatures above 40C have disrupted rail travel and power generation, sparked alcohol bans, suspended classes and postponed outdoor events.
France's government said summer sales would be extended this year after a slow start due to the heatwave.
Italy's health ministry issued a red alert for the heatwave in 18 cities, including Milan, Rome, Turin, Venice, Genoa, Florence and Bologna, for Saturday and Sunday.
The flow of the River Po has dropped dramatically, with seawater advancing deep inland, posing threats to local farming and the ecosystem of Italy's most important waterway.
Even at night in the Alps there was little relief, with temperatures in Bolzano in Italy's South Tyrol never falling below 25.4C, the city's meteorologist Dieter Peterlin said, a June record.
Ecologists fear for Europe's glaciers.
FREE CANCELLATIONS TO REDUCE RAIL TRAVEL
Struggling with the prospect of damage to infrastructure, including buckling roads and swelling railway tracks, some rail providers have sought to reduce traffic.
German national rail operator Deutsche Bahn allowed customers to cancel long-distance travel until early next week.
Another operator, National Express, said it suspended some trains on Saturday afternoon in North Rhine-Westphalia, Germany's most populous state, as a precaution.
Near Hamburg, the main traffic lane on one of Germany's busiest motorways was partially closed after the heat split the asphalt.
In Switzerland, the Lausanne Pride march had extra water fountains and first responders, while Milan's Pride march was pushed back until 5 p.m. (1500 GMT) to reduce the heat's impact.
The Ironman European Championship long-distance triathlon taking place on Sunday in Frankfurt shortened the cycling and running courses due to the heat.
RECORD TEMPERATURES DRIVEN BY 'OMEGA BLOCK' PHENOMENON
The most extreme heat is forecast to begin fading over the weekend, with heavy thunderstorms expected on Sunday.
Paris said it would close its parks, gardens and the Canal Saint-Martin swimming area early on Saturday due to storm forecasts.
Across Europe, cultural landmarks have had to close, farming has suffered, and some hospitals have struggled to cope.
The heatwave has pushed temperatures well above their seasonal average, according to the Reuters Climate Monitor, driven by a phenomenon known as an Omega block because of its shape, similar to the Greek letter.
This weather pattern traps a bulging mass of hot air over regions for extended periods, with cooler air on its fringes.
© New Straits Times Press (M) Bhd"
New Straits Times,Newborn baby rescued from rubble of Venezuela quake,https://www.nst.com.my/world/world/2026/06/1474513/newborn-baby-rescued-rubble-venezuela-quake,"Sun, 28 Jun 2026 00:17:41 +0800","VENEZUELA: A newborn baby has been rescued from a fallen building 32 hours after the twin earthquakes that devastated a Venezuelan coastal city.
Video shared on social media Friday shows rescuers working under a floodlight atop collapsed masonry and bringing the infant out to applause late Friday in the hardest-hit city of La Guaira, north of the capital Caracas.
They carefully pass the baby, wrapped in a quilt, from person to person before cleaning the child gently with tissues, the video shows.
According to the user, Andreina Quintero, who published the video on social media, the baby was just 18 days old and was uninjured after being trapped for 32 hours. The child's mother, was rescued an hour after the child.
In a follow-up video later on Friday, Quintero showed the mother in a hospital bed, with a medical worker telling her that the baby did not appear to have injuries.
The medic then suggests that the mother saved the baby by covering the child with her body or another object.
At least 920 people were killed by back-to-back earthquakes on Wednesday of magnitudes 7.2 and 7.5 and thousands more were injured or remain missing.
© New Straits Times Press (M) Bhd"
New Straits Times,15 undocumented migrants nabbed in ops along Malaysia-Thailand border,https://www.nst.com.my/news/regional/2026/06/1474496/15-undocumented-migrants-nabbed-ops-along-malaysia-thailand-border,"Sat, 27 Jun 2026 23:34:33 +0800","PASIR MAS: A total of 15 undocumented migrants, including five women, were arrested in a series of operations along the Malaysia-Thailand border here today.
General Operations Force (GOF) Southeast Brigade commander Senior Assistant Commissioner Ahmad Radzi Hussain said the migrants, all from Myanmar, were detained after entering Malaysia illegally via the Golok River.
He said the migrants entered the country via Thailand and were believed to have planned to travel to Kuala Lumpur in search of work.
He said the arrests were made between 3.30am and 4.30am during Op Taring Wawasan Kelantan carried out in Kampung Banggol Kemian.
""In the first operation at about 3.30am, GOF personnel intercepted a suspicious Proton Exora. Upon noticing the presence of the authorities, the driver abandoned the vehicle and fled into a nearby forest.
""A search of the vehicle led to the discovery of four Myanmar men hiding in the rear passenger seats,"" he said.
He said the GOF later conducted four follow-up operations in the surrounding forest, resulting in the arrest of another 11 undocumented Myanmar nationals.
""The second and third operations saw the arrest of two men each, followed by the detention of two women in the fourth operation and three women in the final operation,"" he said.
Early investigations revealed that all the migrants had been smuggled into Malaysia by two unidentified men through the Golok River, he said.
He said the migrants told GOF personnel that they did not know the smugglers and intended to travel to the Kuala Lumpur area to seek employment.
Radzi said a Proton Exora, valued at about RM30,000, was seized during the operation.
He added that all 15 suspects, aged between 20 and 37, had been handed over to Pasir Mas district police for further action.
The case is being investigated under Section 6(1)(c) of the Immigration Act 1959/63.
© New Straits Times Press (M) Bhd"
New Straits Times,"Saarani: Culture must drive economic growth, not just preserve heritage",https://www.nst.com.my/news/regional/2026/06/1474490/saarani-culture-must-drive-economic-growth-not-just-preserve-heritage,"Sat, 27 Jun 2026 23:24:48 +0800","IPOH: Culture should be recognised not merely as a form of entertainment or nostalgia, but as an economic driver that creates opportunities and generates income for the people, Perak Menteri Besar Datuk Seri Saarani Mohamad said today.
He said a nation's identity is shaped not only by its physical development but also by its culture, traditions and values passed down through generations.
""A nation is not known only for its tall buildings or rapid development. It is also known through its culture, the language spoken, the food served, the songs sung, the clothing worn and the values inherited from generation to generation,"" he said at the opening of the Malaysia Culture Festival 2026 at Bulatan Sultan Azlan Shah.
Deputy Tourism, Arts and Culture Minister Chiew Choon Man was also present.
Saarani said cultural heritage should be preserved as a trust rather than reduced to exhibition pieces or objects of nostalgia.
""When culture is regarded as a trust, we will ensure it continues to thrive in families, schools and society, eventually becoming part of the younger generation's identity,"" he said.
He said Malaysia's cultural heritage survives because of individuals dedicated to preserving it, including artisans, craftspeople and traditional food makers.
""Behind every piece of songket are patient hands weaving thread by thread. Behind every wood carving are craftsmen who spend decades perfecting their skills.
""Behind every traditional dish is a recipe passed down through generations,"" he said.
On tourism, Saarani said Perak recorded more than 10.4 million domestic overnight tourists and 23.6 million domestic visitors in 2025, reflecting the sector's continued strength.
However, he said success should not be measured solely by visitor numbers, but by the benefits enjoyed by local communities.
""Hotels receive bookings, restaurants welcome more customers, small traders benefit from increased spending, and craft entrepreneurs receive more orders.
""To the younger generation, do not lose your roots while pursuing progress. Culture is not a barrier to development but the identity that gives it meaning,"" he said.
© New Straits Times Press (M) Bhd"
New Straits Times,18 foreigners arrested in Kuching joint operation,https://www.nst.com.my/news/regional/2026/06/1474487/18-foreigners-arrested-kuching-joint-operation,"Sat, 27 Jun 2026 23:22:58 +0800","KUCHING: The Sarawak Immigration Department detained 18 foreigners during a joint operation with the Padawan Municipal Council (MPP) around Mile 10, Kota Padawan, yesterday.
The department the operation ran from 6pm to 11pm and involved inspections of seven premises and shops suspected of operating online gambling and renting out rooms.
""A total of 26 foreigners were checked to verify their travel documents and immigration status.
""The operation resulted in the detention of 18 Indonesian nationals, comprising eight men and 10 women,"" it said in a statement today.
The suspects are believed to have committed offences under Section 15(1)(c) and Section 6(1)(c) of the Immigration Act 1959/63, and Regulation 11(7)(a) of the Immigration Regulations 1959/63.
All those detained have been taken to the Immigration Detention Depot for further investigation and action.
© New Straits Times Press (M) Bhd"
New Straits Times,"Russian hawks urge Putin to escalate war, drop US talks",https://www.nst.com.my/opinion/columnists/2026/06/1474482/russian-hawks-urge-putin-escalate-war-drop-us-talks,"Sat, 27 Jun 2026 23:15:14 +0800","SEETHING over Ukrainian drone strikes and angered by what they see as a failed Unied States promise to broker an end to the war on favourable terms, Russian hardliners are urging President Vladimir Putin to abandon diplomacy and escalate.
Calls for tougher measures are not new.
Nationalist voices have long pressed for full mobilisation, the destruction of Kyiv's government quarter, the assassination of President Volodymyr Zelenskyy and strikes on European drone factories.
Some hawks have even called on the Kremlin chief to consider using tactical nuclear weapons.
But Ukraine's deep strikes this month — targeting Moscow, St Petersburg and Crimea, as well as what Russia said were two deadly attacks on passenger buses — have sharpened and intensified those demands.
Analysts say the increasingly strident rhetoric reflects growing unease over the reach and impact of Ukrainian drone attacks, and a broader debate about how Russia — with its vast territory — can defend itself while still pursuing its war aims in a conflict it launched in 2022.
""What else needs to happen before we start fighting for real? War means victory at any cost.
""The Ukrainians are at war, so they're fighting with everything they've got,"" said Konstantin Malofeyev, a nationalist tycoon, after a Ukrainian strike set fire to a Moscow oil refinery  on June 18.
""Why are we not using nuclear weapons, which our forebears developed and stockpiled with the full might of the nation precisely for this purpose?""
Some nationalist commentators have urged Moscow to adopt what they cast as Iran's effective military and diplomatic tactics against the US.
The Obsessed by War blog, with over 650,000 followers, has called for rendering major Ukrainian cities  unliveable  through bombing.
Others say it is time to abandon US-brokered peace talks and pursue the  destruction of the Ukrainian state.
""The start of systematic air strikes on Moscow by the (Ukrainian) junta would have been impossible without the go-ahead from Washington. And why did Trump give Zelenskyy such a green light?
""The answer is very simple — Iran had Trump by the balls, and he was forced to sign a humiliating agreement,"" said nationalist blogger Yuri Baranchik, who has nearly 90,000 followers.
""Now he needs to take it out on someone quickly.
""So we've got no choice — either we'll get the better of Trump, or he'll get the better of us,"" Baranchik said on Telegram.
Sources close to the Kremlin say Putin can tolerate such rhetoric.
He sits atop a tightly controlled political system he has built over 26 years and nationalist bloggers need to conform to certain rules.
Analysts say, however, that such statements can still complicate decision-making by inflaming public sentiment and raising expectations of a more expansive military campaign, even as Moscow still wants to keep the door open for a potential diplomatic solution.
So far, the Kremlin has resisted the hawks' calls to abandon negotiations, even though three senior government officials said recently that talks with the US had gone nowhere and accused Washington of not following through on peace proposals it made at last year's Putin-Trump summit in Alaska.
Putin has also avoided endorsing the nationalists' most extreme proposals, although the Defence Ministry in April pointedly published the addresses of factories in several European countries it alleged made drones for Ukraine, in what appeared to be a warning they could be targeted.
Russia's Foreign Ministry  also signposted an escalation last month when it said Moscow intended to launch ""systematic strikes"" on military targets in Kyiv. Heavier bombing runs followed, including one in which a 1,000-year-old monastery in Kyiv was damaged.
For now, Putin appears confident in the current strategy.
He told military academy graduates  that Russia was close to seizing  Kostyantynivka in eastern Ukraine, as part of its push to control the Donbas region.
He also said political forces in Europe who were hostile to Russia looked likely to be eclipsed by rivals he cast as more reasonable.
""Those who want to restore normal relations with us, to stop this endless drive for a strategic defeat of Russia, are on the rise. It'll all work out in the end.""
* The writer is from Reuters
© New Straits Times Press (M) Bhd"
New Straits Times,BBC shuts down long wave radio service after almost a century,https://www.nst.com.my/world/world/2026/06/1474480/bbc-shuts-down-long-wave-radio-service-after-almost-century,"Sat, 27 Jun 2026 23:14:27 +0800","LONDON: The BBC has shut down its long wave radio service after almost 100 years, PA Media/dpa reported.
BBC Radio 4, which was the last long wave radio station in the United Kingdom, had the service permanently switched off at 1am on Saturday.
Long wave services have been used since 1934 and were used to transmit messages during the World War II.
Radio 4 moved to the frequency in 1978, where it has remained until now.
The BBC first announced in 2022 that it expected its long wave services to close and in 2024 it ended the separate scheduling of Radio 4 long wave ahead of the change.
The corporation said the service has been shut down as long wave technology is ""coming to the end of its life"" and its continued use would be a ""significant investment"" for a platform used by a small proportion of listeners.
The BBC also said it is focused on ""investing in platforms that best serve audiences and provide resilient coverage for the future"" amid the significant rise of digital listening.
In a statement, the corporation added: ""We also work closely with organisations that support vulnerable audiences around platform closures, to ensure listeners are helped in a timely and sensitive way.""
The radio station, known for hit shows such as
The Archers
and
Desert Island Discs
, will continue to be available across other platforms such as FM, DAB, television platforms, and on digital services.
The BBC has also confirmed that no Radio 4 programmes will be lost as a result of the closure.
Long wave radio is frequently used by those in remote and rural communities, as well as mariners and fishermen.
Prior to its closure, campaigners actively fought against the decision by citing the importance of the platform as a non-digital national communication network.
– Bernama-PA MEDIA/dpa
© New Straits Times Press (M) Bhd"
New Straits Times,Magnitude 6.1 quake hits Afghanistan,https://www.nst.com.my/world/world/2026/06/1474478/magnitude-61-quake-hits-afghanistan,"Sat, 27 Jun 2026 23:13:09 +0800","KABUL: A 6.1-magnitude earthquake hit Afghanistan on Saturday, the United States Geological Survey said, with AFP journalists in the capital Kabul and elsewhere reporting strong shaking.
The quake was widely felt by AFP journalists across multiple Afghan provinces, as well as in the Pakistani capital Islamabad.
The USGS recorded the epicentre in northeastern Afghanistan at a depth of 208.3 kilometres (129.4 miles).
Buildings rattled in Kabul, with one AFP journalist reporting a large crack stretching across an internal wall.
Journalists also felt the quake in Balkh and Badakhshan provinces, which border multiple countries including Tajikistan and Pakistan.
To the east, it was felt in provinces including Nangarhar and Khost.
Details on casualties and damage were not immediately available.
Earthquakes are common in Afghanistan, particularly along the Hindu Kush mountain range, near where the Eurasian and Indian tectonic plates meet.
In April, a 5.8-magnitude quake in Badakhshan province killed 12 people and shook many parts of the country.
In August 2025, a shallow 6.0-magnitude quake in the country's east wiped out mountainside villages and killed more than 2,200 people.
Weeks later, a 6.3-magnitude quake in northern Afghanistan killed at least 27 people.
Large tremors in western Herat, near the Iranian border, in 2023 and in eastern Nangarhar province in 2022 killed hundreds and destroyed thousands of homes.
Many homes in the predominantly rural country – devastated by decades of war – are shoddily built.
Poor communication networks and infrastructure in mountainous Afghanistan have hampered disaster responses in the past, preventing authorities for hours or even days from reaching far-flung villages to assess the extent of the damage.
© New Straits Times Press (M) Bhd"
