Source,Title,Link,Date,Article
Malay Mail,"Taiping reject claims of wrongdoing in transfer of Malaysian elephants Dara, Amoi and Kelat to Japanese zoo",https://www.malaymail.com/news/malaysia/2026/05/09/taiping-reject-claims-of-wrongdoing-in-transfer-of-malaysian-elephants-dara-amoi-and-kelat-to-japanese-zoo/219338,"Sat, 09 May 2026 14:55:09 +0800","IPOH, May 9 — There are absolutely no commercial elements in the agreement between Taiping Zoo & Night Safari and Japan’s Tennoji Zoo in Osaka involving the three Malaysian elephants known as Dara, Amoi and Kelat.
Taiping Municipal Council (MPT) president Mohamed Akmal Dahalan clarified that the agreement is strictly zoo-to-zoo and not a business transaction, contrary to allegations by some parties.
“The term ‘B2B’ (business to business) does not reflect the true spirit of this agreement,” he said in a statement today.
He clarified that the international cooperation programme complies with the Ministry of Natural Resources and Environmental Sustainability (NRES) Malaysian Zoo Standard Guidelines, countering viral accusations on social media, including claims of payments to the zoo and local council, and alleged non-compliance with existing laws.
He also highlighted that the agreement has undergone approval processes in accordance with the Wildlife Conservation Act 2010.
“Before the elephants were sent, MPT, Taiping Zoo and the Department of Wildlife and National Parks (Perhilitan) visited Osaka from Oct 6 to 10, 2022, to assess the existing facilities and identify the improvements needed by Tennoji Zoo,” he said.
He added that all relevant documentation, such as special permits, export applications, and responses to Japanese authorities, had been properly approved before the elephants were transported.
“MPT also wants to make it clear that animal welfare and well-being have always been our top priority in this programme. The Taiping Zoo will remain in regular contact with Tennoji Zoo and other relevant agencies to obtain the latest updates,” he said.
He added that the council is ready to cooperate with authorities, including the Malaysian Anti-Corruption Commission (MACC), should any further review or investigation into the programme be required.
The elephants are currently housed at Tennoji Zoo under a 25-year international cooperation agreement between the two zoos, with MPT acting as the representative for Taiping Zoo.
Local media previously reported that a group of activists and non-governmental organisations had urged the government to bring the elephants back to Malaysia, alleging the animals are suffering and ill-suited to the zoo’s environment. — Bernama"
Malay Mail,Putrajaya and Sarawak finalising RM1.8b Bintulu Port takeover deal,https://www.malaymail.com/news/malaysia/2026/05/09/putrajaya-and-sarawak-finalising-rm18b-bintulu-port-takeover-deal/219336,"Sat, 09 May 2026 15:18:38 +0800","KOTA SAMARAHAN, May 9 — The process of handing over Bintulu Port to the Sarawak State Government is expected to be completed within the next few months after all key issues have been finalised, said Transport Minister Anthony Loke.
He said a final meeting with Sarawak Deputy Premier Datuk Amar Douglas Uggah Embas will be held soon to finalise the matters.
“Currently, the final agreement is being finalised, as legal and pricing issues have already been resolved.
“As I announced earlier, the federal and the state governments have reached a consensus on the final cost of the handover,” he told a press conference after launching a new route under the BAS.MY Kuching Stage Bus Service Transformation Programme here today.
He said the draft final agreement has been completed and is now awaiting Cabinet approval before the official handover can take place, adding that the process has taken time as the relevant act on the dissolution of the Bintulu Port Authority was passed about two years ago.
He said the enforcement of the authority’s dissolution and the official handover to the state government remain subject to the signing of the final agreement.
The Federal Government and the Sarawak State Government had, in principle, agreed on a value of RM1.8 billion for the state’s acquisition of Bintulu Port.
Meanwhile, Loke said the Ministry of Economy has approved a RM445 million project to upgrade the Miri Airport building under Rolling Plan 1 (RP1) of the 13th Malaysia Plan (13MP), last month.
He said the upgrading works are expected to begin this year following approval of the cost based on the value assessment review session held on March 17.
“The expansion of Miri Airport is important as it is the second busiest airport in Sarawak after Kuching International Airport. Besides being a key domestic airport, it also serves as a major hub for Rural Air Services (RAS) operated by AirBorneo,” he said.
He said the service plays a crucial role in connecting Sarawak’s interior areas with major towns and improving air transport accessibility for rural communities. — Bernama"
Malay Mail,"Penang’s RM250m Taman Mengkuang water plant, set to reduce dependence on Sungai Dua supply, now 35pc complete",https://www.malaymail.com/news/malaysia/2026/05/09/penangs-rm250m-taman-mengkuang-water-plant-set-to-reduce-dependence-on-sungai-dua-supply-now-35pc-complete/219335,"Sat, 09 May 2026 15:09:30 +0800","BUKIT MERTAJAM, May 9 — The RM250 million Taman Mengkuang Water Treatment Plant (LRA) project undertaken by Perbadanan Bekalan Air Pulau Pinang (PBAPP) has now achieved 35 per cent progress.
Chief Minister Chow Kon Yeow said physical works on the project began on May 19 last year and have so far progressed smoothly according to schedule, with completion expected on Nov 18.
He said that once completed, the plant will obtain its daily supply from the Expanded Mengkuang Dam (EMD), the largest dam in the state, and will be capable of supplying up to 114 million litres per day (MLD) of treated water to consumers, particularly in the Seberang Perai Tengah district.
“This new plant is being built beside the EMD, which previously served as a strategic dam where water was stored for use during emergencies involving the Sungai Dua LRA.
“However, as water demand continues to rise, we are implementing the Water Contingency Plan 2030 (WCP2030), primarily aimed at utilising all available raw water sources in Penang, and the EMD is one such source that we can tap into through this project, alongside other initiatives under the WCP2030,” he told reporters after a site visit to inspect the progress of the project here today.
Also present were PBAPP chief executive officer Datuk K. Pathmanathan and state Infrastructure, Transport and Digital Committee chairman Zairil Khir Johari.
Elaborating further, Chow, who is also PBAPP chairman, said that in tandem with the water treatment plant project, two main pipelines are also being constructed to enable the distribution of treated water to consumers in the Seberang Perai Tengah, particularly in Bukit Mertajam and Tasek, while ensuring sufficient water supply and helping to optimise the operation of water pumps along the route, including in Permatang Tinggi, to channel supply to the southern areas of the state.
Meanwhile, Pathmanathan said the Taman Mengkuang LRA is the first of four new treatment plants being developed by PBAPP for Penang under Phase 2 of the WCP2030, with the remaining three plants set to utilise water sources from Sungai Kerian, Sungai Perai and Sungai Muda, and scheduled for completion by 2030.
“Overall, Phase 2 will increase PBAPP’s water treatment capacity in Seberang Perai by 478 MLD. As such, Seberang Perai will become less dependent on treated water supply from the Sungai Dua LRA.
“This will enable PBAPP to channel more treated water from Sungai Dua to Penang Island through dedicated pipelines and the Third Penang Undersea Twin Pipeline Project (PTSP-3),” he said.
Once operational, the Taman Mengkuang LRA will transform the role of the EMD from a strategic dry-season dam into a dual-function dam, serving not only as a source of water supply for the plant to produce more treated water, but also as a backup dam for Penang during dry seasons and other emergency situations involving Sungai Muda.
He said the main rationale behind the change in the EMD’s role is to optimise existing raw water resources to ensure sufficient water supply through 2030. — Bernama"
Malay Mail,"Fuel fraud risks carry severe penalties under Customs Act, warns lawyer",https://www.malaymail.com/news/malaysia/2026/05/09/fuel-fraud-risks-carry-severe-penalties-under-customs-act-warns-lawyer/219331,"Sat, 09 May 2026 13:41:39 +0800","KUALA LUMPUR, May 9 — False declarations, manipulated documents, or undocumented fuel movements could expose companies and individuals to severe penalties under the Customs Act 1967, cautioned Admiralty and Maritime lawyer Datuk J. Shamesh.
He was commenting on recent concerns raised by an industry player regarding revenue leakage and documentation gaps in Malaysia’s petroleum supply chain.
He highlighted that several provisions under the Act could apply, including Section 133, which covers false declarations, inaccurate statements and the submission of incorrect particulars, with penalties of up to RM500,000 in fines, seven years’ imprisonment, or both.
“In addition, Section 135 deals with the fraudulent evasion of customs duties or prohibition controls, while Section 138 concerns offences linked to the creation or use of false documents.
“Section 147 extends liability to agents, employees or company officers in cases where offences are committed by corporations,” he said, adding that those found liable face varying fines and imprisonment.
Shamesh added that irregularities involving subsidised fuel, excise duties, or sales tax liabilities could also be subject to scrutiny under other relevant legislation, depending on the specific circumstances.
Regulators would typically determine whether discrepancies arose from operational issues or deliberate misconduct by examining the frequency and pattern of inconsistencies, he explained.
“This includes determining whether the discrepancies repeatedly resulted in reduced revenue exposure, reviewing the integrity of operational records and audit trails, identifying unexplained stock gains or losses, and assessing whether there is evidence of concealment or falsification.
“Minor isolated variances can occur due to legitimate operational factors such as temperature adjustments, meter tolerances or tank calibration differences.
“However, recurring inconsistencies, unexplained blending activities, manipulated density readings or discrepancies unsupported by proper contemporaneous records may point towards possible revenue leakage or fraudulent declarations,” he emphasised.
Shamesh noted that effective regulatory reforms could include mandatory real-time inventory reconciliation, tighter licensing controls over bonded petroleum facilities, enhanced independent calibration and verification requirements, periodic forensic stock audits, and stronger inter-agency coordination between customs, maritime, tax and energy regulators.
He said such reforms should focus on risk-based enforcement and targeted transparency measures, without unnecessarily disrupting legitimate industry operations or fuel supply chains. — Bernama"
Malay Mail,"Malaysia’s airspace stays resilient amid rising regional flight traffic, says CAAM",https://www.malaymail.com/news/malaysia/2026/05/09/malaysias-airspace-stays-resilient-amid-rising-regional-flight-traffic-says-caam/219329,"Sat, 09 May 2026 13:34:32 +0800","KUALA LUMPUR, May 9 — Malaysia’s airspace operations remain resilient in handling high volumes of regional air traffic, underscoring the country’s role as a key aviation connectivity hub in Southeast Asia, according to the Civil Aviation Authority of Malaysia (CAAM).
In a statement today, CAAM said it continues to strengthen airspace efficiency within the Kuala Lumpur Flight Information Region (KL FIR) and Kota Kinabalu Flight Information Region (KK FIR) amid evolving global airspace dynamics and increasing operational complexity.
Regional traffic data showed that Kuala Lumpur International Airport (KLIA) remains among the busiest airports in Southeast Asia, supported by several of the region’s most heavily travelled routes.
CAAM said key corridors such as Kuala Lumpur-Singapore, Jakarta-Kuala Lumpur and Kota Kinabalu-Kuala Lumpur continue to record high flight frequencies.
“This underscores Malaysia’s strategic role in maintaining regional connectivity and ensuring the continuity of air travel across Asean,” it said.
The authority said continuous improvements in airspace design and air traffic management have enabled both KL FIR and KK FIR to accommodate growing traffic volumes while maintaining high standards of safety, efficiency and reliability.
These include the implementation of Required Navigation Performance Approach (RNP APCH) procedures at KLIA, as well as full Performance-Based Navigation (PBN) Standard Instrument Departure (SID), Standard Terminal Arrival Route (STAR) and RNP APCH procedures in the Kota Kinabalu FIR.
CAAM said the measures enable more precise routing, reduced track miles and improved arrival and departure efficiency.
It added that the expansion of Direct Route Operations (DRO) and User Preferred Routes (UPR) allows aircraft to operate on more efficient and flexible flight paths, reducing congestion, flight times and fuel consumption.
Enhanced cross-boundary coordination also supports more adaptive routing in response to changing operational conditions.
CAAM said the adoption of advanced air traffic management concepts such as System Wide Information Management (SWIM) and Flight and Flow Information for a Collaborative Environment (FF-ICE) enables real-time data sharing, improves predictability and supports more effective collaborative decision-making across the aviation ecosystem.
Advancements in Performance-Based Communication and Surveillance (PBCS) have also enhanced operational capacity by enabling more efficient aircraft separation while maintaining high safety standards, it said.
It further noted the efficiency of KL FIR and KK FIR as critical to supporting one of Southeast Asia’s busiest aviation networks, with KL FIR serving as a central node for major regional routes and KK FIR strengthening connectivity across East Malaysia while supporting growing cross-border traffic flows. — Bernama"
Malay Mail,Kedah govt to seek Sultan’s consent over fate of two Bersatu-sacked reps,https://www.malaymail.com/news/malaysia/2026/05/09/kedah-govt-to-seek-sultans-consent-over-fate-of-two-bersatu-sacked-reps/219324,"Sat, 09 May 2026 13:14:16 +0800","ALOR STAR, May 9 — The Kedah government will refer the positions of two state assemblymen — one a state executive councillor and the other a deputy speaker — sacked by Bersatu yesterday to the Sultan of Kedah, Sultan Sallehuddin Sultan Badlishah,
New Straits Times (NST)
reported.
Menteri Besar Datuk Seri Muhammad Sanusi Md Nor said any decision involving Suka Menanti assemblyman Dzowahir Ab Ghani, who is state agriculture, plantation and transportation committee chairman, and Sungai Tiang assemblyman Abdul Razak Khamis, who is a deputy state assembly speaker, must follow due process and receive the consent of the Kedah ruler.
“We need to discuss this in detail, inform the Sultan, and proceed according to established procedures.
“They are still carrying out their respective duties at this time,” he was quoted as saying.
Sanusi said both assemblymen continued to support the Perikatan Nasional-led state government and were not in the opposition.
“They are Independent assemblymen who support the state government. Their positions will be discussed further,” he reportedly said.
He added that the state government had previously received a letter from Bersatu requesting changes to the exco and deputy speaker posts, but no action was taken then as both were still party members.
Sanusi said the matter was also discussed with Bersatu president Tan Sri Muhyiddin Yassin and secretary-general Datuk Seri Mohamed Azmin Ali during the Kubang Rotan state constituency and Kedah Bersatu Aidilfitri open house on April 10.
“Now that official dismissal letters have been received, any action remains subject to the appointment procedures for exco members and the deputy speaker,” he was quoted as saying.
Yesterday, Bersatu disciplinary board chairman Datuk Mohd Radzi Manan issued a notice confirming the dismissal of Dzowahir and Abdul Razak over alleged breaches of ethics."
Malay Mail,Communications Ministry steps in to train small traders at Melaka central market,https://www.malaymail.com/news/malaysia/2026/05/09/communications-ministry-steps-in-to-train-small-traders-at-melaka-central-market/219320,"Sat, 09 May 2026 13:06:23 +0800","MELAKA, May 9 — The Communications Ministry will channel allocations to the National Information Dissemination Centre (Nadi) and the Madani Community to carry out targeted outreach programmes for traders at the Melaka Historic City Council (MBMB) Central Market in Bachang here.
Minister Datuk Fahmi Fadzil said his visit today found that many traders had requested classes on online sales, as well as assistance with applications for the Madani Subsidy Assistance Programme (BUDI) Individual for diesel.
“For small traders, some may not know how to apply for BUDI Individual. This is among the areas that need to be strengthened, including through the Madani Community.
“Entrepreneurship is one of the five main pillars at Nadi, including online sales, so we have asked Nadi to provide basic training for the traders here,” he told reporters when attending the Jiwa@Komuniti Madani Programme: Sembang Santai Parlimen Hang Tuah Jaya at the market.
Also present were Communications Ministry deputy secretary-general (Strategic Communications and Creative Industry) Nik Kamaruzaman Nik Husin and Information Department director-general Julina Johan.
At the programme, Fahmi spent more than two hours engaging with traders at food stalls, as well as those selling wet and dry goods. — Bernama"
Malay Mail,"Army deploys drones, ATVs and scramblers along Malaysia’s border ahead of Aidiladha to curb smuggling",https://www.malaymail.com/news/malaysia/2026/05/09/army-deploys-drones-atvs-and-scramblers-along-malaysias-border-ahead-of-aidiladha-to-curb-smuggling/219319,"Sat, 09 May 2026 13:01:36 +0800","PUTRAJAYA, May 9 — The Malaysian Army (TDM) is tightening security along the country’s borders to curb smuggling and cross-border crimes ahead of the Aidiladha celebrations later this month.
Army chief General Datuk Azhan Md Othman said the force remains on constant alert to ensure the continued security and sovereignty of the nation’s borders.
“We will further tighten control at every border, especially along the northern border between Malaysia and Thailand.
“It is during festive periods like this that activities violating regulations tend to occur,” he told reporters after officiating the Army Run 2026 in conjunction with the 93rd Army Day celebration here today.
According to Azhan, existing operations along the country’s borders will continue to ensure there are no security breaches at the nation’s entry points.
Earlier, Azhan said the army would continue strengthening the deployment of personnel and assets along the country’s borders to ensure border security remains safeguarded and under control.
He said the effort is being supported by the latest technology, including the use of drones, scrambler motorcycles, all-terrain vehicles (ATVs) and optronic equipment.
The media previously reported that the army successfully foiled an attempt to smuggle 20 cattle from Thailand, estimated to be worth RM225,000, during an operation at the border on May 4.
On Army Run 2026, Azhan said the event received an encouraging response, with the participation of 6,000 people comprising members of the Malaysian Armed Forces, government agencies, the private sector, amateur athletes and the public from across the country.
“Insya-Allah, we will organise this event again next year,” he said.
Meanwhile, the army, in a statement, said the inaugural Army Run 2026 reflected the close unity between army personnel and the public, in line with the Whole of Government and Whole of Society (WoGoS) approach in strengthening cooperation for the nation’s interests.
“Besides promoting a healthy and active lifestyle, the programme also serves as a platform to strengthen ties between the army and the people through community participation in a safe, organised and patriotic environment,” it said. — Bernama"
Malay Mail,‘Brave’ joins Bomba’s K9 unit,https://www.malaymail.com/news/malaysia/2026/05/09/brave-joins-bombas-k9-unit/219309,"Sat, 09 May 2026 12:35:17 +0800","JOHOR BAHRU, May 9 — The K9 Tracker Dog Unit of the Fire and Rescue Department (JBPM) has welcomed a new ‘member’ after its Labrador, Lottie, gave birth to a male puppy on March 18.
Housing and Local Government Minister Nga Kor Ming said the puppy, born to the dog under the care of fire officer Nelson Karupak, has been named ‘Brave’.
“I named this puppy ‘Brave’ in the hope that it will grow into a courageous and resilient four-legged hero in carrying out rescue duties,” he said when launching the World Firefighters’ Day Carnival 2026, themed ‘Bomba Tonggak Penyelamatan Negara’, at Plaza Angsana here today.
Also present were Deputy Housing and Local Government Minister Aiman Athirah Sabu and JBPM director-general Datuk Nor Hisham Mohammad.
He said JBPM currently has only 34 tracker dogs and requires a further 56 to reach optimal operational capacity.
Recognising the importance of the K9 unit, Nga said the Madani Government has approved an allocation of RM2.4 million to procure 16 new tracker dogs from the United Kingdom.
As a long-term strategic measure, he said JBPM is also planning to develop a K9 Operations Centre in Bertam, Penang, which will implement a domestic breeding programme.
The two-day World Firefighters’ Day 2026 celebration, is organised in conjunction with the 50th anniversary of the department.
The event is also enlivened by a static parade involving 550 participants and 50 fire engines and vehicles, including several belonging to His Majesty Sultan Ibrahim, King of Malaysia. — Bernama"
Malay Mail,"Need help getting around? Rapid KL rolls out ‘Ask Me’ helpers to guide commuters, starting at Pasar Seni",https://www.malaymail.com/news/malaysia/2026/05/09/need-help-getting-around-rapid-kl-rolls-out-ask-me-helpers-to-guide-commuters-starting-at-pasar-seni/219310,"Sat, 09 May 2026 12:44:34 +0800","KUALA LUMPUR, May 9 — Rapid KL has introduced the “Ask Me” customer assistance initiative at the Pasar Seni Bus Hub as the first location for its implementation in an effort to enhance the public transport travel experience through faster, clearer and more accessible information delivery.
Rapid KL said in a statement today that the initiative was introduced to help passengers obtain travel-related assistance more easily, particularly at bus hubs with high commuter traffic and multiple route connections.
According to the bus service operator, a special “Ask Me” podium will be placed at the hub to make it easier for passengers to identify where assistance is available.
“Passengers can obtain information on bus routes, stop locations, route changes, travel planning as well as travel pass products to help facilitate their daily journeys.
“This initiative is part of the Service Ambassador 2.0 Programme, which features Customer Service Assistants and Traffic Coordinators as the main personnel at key hotspots and major transport hubs,” the statement said.
Rapid Bus acting chief executive officer Ku Jamil Zakaria said the implementation of “Ask Me” reflects Rapid KL’s ongoing commitment to making public transport more responsive and reliable for users.
He said the Pasar Seni Bus Hub was selected as the first location because it is among the main bus hubs in the Klang Valley, handling 14 Rapid KL bus routes with an average of more than 6,000 passengers daily.
He said the implementation of “Ask Me” will also be expanded in stages to other locations based on operational needs and suitability, including at the Weld Quay Bus Terminal for Rapid Penang services.
“We want to ensure passengers can obtain assistance more quickly and easily, especially at locations that serve as key interchange points in their daily journeys.
“The presence of easily identifiable personnel not only helps reduce confusion, but also boosts users’ confidence when using public transport,” he said. — Bernama"
