Source,Title,Link,Date,Article
New Straits Times,"UK teenagers to trial social media bans, digital curfews",https://www.nst.com.my/world/world/2026/03/1403830/uk-teenagers-trial-social-media-bans-digital-curfews,"Thu, 26 Mar 2026 09:10:04 +0800","LONDON: Hundreds of British teenagers will trial social media bans and time limits on apps as part of consultations over new measures to keep children safe online, the government announced Wednesday.
The pilot was announced hours before the UK's upper house of parliament voted in favour of banning children from social media for the second time, piling pressure on the government to follow suit.
The government consultation seeks views from parents on whether to follow Australia and issue a blanket ban on social media for children under 16.
Three hundred youngsters aged 13 to 17 will try out different restrictions on social media use over six weeks to gauge the impact on their schoolwork, sleep and family life.
Some will have their social media apps disabled entirely, while others will have no access to them overnight, said the Department for Science, Innovation and Technology.
A third group will have a one-hour-per-day cap on the most popular apps for teenagers, including Instagram, TikTok and Snapchat.
The results will be compared to a fourth set of children who will continue to receive unlimited access.
""We are determined to give young people the childhood they deserve and to prepare them for the future,"" said technology minister Liz Kendall.
""These pilots will give us the evidence we need to take the next steps, informed by the experiences of families themselves.""
The House of Lords voted for the second time in favour of an amendment – which the government does not support – to ban social media for children under the age of 16.
It was the latest development in the parliamentary ping-pong, after MPs in the Labour-majority House of Commons this month struck down the amendment first voted in by the Lords in January.
Prime Minister Keir Starmer has not ruled out a ban, but his government says it is awaiting the conclusion of the consultation, due to close on May 26.
Australia in December became the first nation to prohibit people under the age of 16 from using immensely popular and profitable social media platforms.
Several other countries are considering similar bans, including France, where lawmakers in January passed a bill that would prohibit use by under-15s, which still needs final approval.
A jury in California in the United States on Wednesday found Meta and YouTube liable for harming a young woman through the addictive design of their platforms.
British public figures, including actor Hugh Grant, have urged the government to back a prohibition, saying parents alone cannot counter social media harms.
But some experts warn that restrictions could be easily circumvented and would rather that tech platforms focus on making their sites safer. - AFP
© New Straits Times Press (M) Bhd"
New Straits Times,PublicInvest lifts Ta Ann target price to RM6.42 on strong FFB growth outlook,https://www.nst.com.my/business/corporate/2026/03/1403828/publicinvest-lifts-ta-ann-target-price-rm642-strong-ffb-growth,"Thu, 26 Mar 2026 09:01:43 +0800","KUALA LUMPUR: Public Investment Bank Bhd (PublicInvest) has raised its target price for Ta Ann Holdings Bhd from RM5.64 to RM6.42, while keeping its 'Outperform' rating on the stock.
At Ta Ann's analyst briefing, the firm said management is targeting an average annual growth of 7.5 per cent in fresh fruit bunches (FFB) production over the next five years, mainly driven by the expansion of mature plantation areas and improved FFB yields.
""It aims to reach an FFB yield of 22.11 tonnes per hectare by 2030, a significant increase from 2025's 16.95 per cent.
""In our view, the stock is currently trading at an unjustifiable valuation of below a 10 times forward price-to-earnings ratio multiple, given the stronger crude palm oil price movements and attractive dividend yield of eight per cent, one of the highest amongst the Malaysian stocks,"" it said.
PublicInvest said that, given the stronger-than-expected FFB growth guidance and the upward earnings revision for its 29.4 per cent-owned Sarawak Plantation, it has raised its earnings forecasts for financial years 2026 to 2028 by 11 to 21 per cent.
Ta Ann's FFB production rose three per cent year-on-year to 686,538 tonnes, reaching its highest level since 2022, driven by a notable improvement in FFB yield from 15.95 tonnes per hectare in financial year 2024 to 16.95 tonnes per hectare.
PublicInvest stated that, due to the adverse US dollar-to-ringgit exchange rate and an anticipated 17 per cent year-on-year drop in log production, the timber segment is expected to face another challenging year.
""To mitigate its heavy dependence on the Japanese market, the group has diversified its plywood exports to Yemen as demand for building materials rises following regional conflicts.
""Despite the challenging outlook, management has vowed to stay in business and is currently in talks with the state government to lobby for a reduction in royalties. It also plans to replace all the ageing bulldozers, which would result in significant savings in manpower and spare parts costs,"" the firm added.
© New Straits Times Press (M) Bhd"
New Straits Times,HLIB upbeat on Malaysia's tech sector amid advanced packaging push,https://www.nst.com.my/business/corporate/2026/03/1403826/hlib-upbeat-malaysias-tech-sector-amid-advanced-packaging-push,"Thu, 26 Mar 2026 09:00:41 +0800","KUALA LUMPUR: Hong Leong Investment Bank Bhd (HLIB Research) remains cautiously optimistic about Malaysia's technology sector, citing efforts to close the country's advanced packaging gap.
Early developments are being driven by Penang-based Fusion Advanced Packaging (FusionAP), which is positioning itself as a geopolitically neutral partner to global semiconductor firms while leveraging Malaysia's growing role as a manufacturing hub.
The company aims to become the country's first domestic outsourced semiconductor assembly and test (OSAT) player focused on advanced packaging. It plans to establish a pilot production line requiring around RM400 million in capital expenditure, followed by a scale-up to high-volume manufacturing with an estimated RM2 billion investment.
HLIB Research noted that FusionAP's strategy centres on partnerships with global research and development institutes to accelerate access to critical intellectual property in silicon interposer and fusion bonding technologies.
""Alongside closing seed funding and securing initial customers, these represent key milestones for the next 12 months,"" it said in a note.
HLIB Research said complementing these efforts is the Malaysia Advanced Packaging Consortium (MAPC), led by Inari Amertron Bhd and Pentamaster Corp Bhd.
The bank said that MAPC could enhance collaboration across Malaysia's semiconductor value chain by improving visibility between chip designers, OSAT players and equipment manufacturers.
""Its long-term ambition is for Malaysia to capture around seven per cent or US$5 billion of the global advanced packaging market by 2035,"" it added.
From a broader perspective, the firm said successful entry into advanced packaging could drive a structural re-rating of Malaysia's semiconductor sector.
This is supported by higher average selling prices and stronger gross margins of about 40 per cent to 50 per cent, compared with 15 per cent to 20 per cent for traditional packaging.
However, HLIB Research cautioned that such upside remains contingent on execution, particularly as both FusionAP and MAPC are still at an early stage.
""We believe the read-through for Malaysian semiconductor players is compelling but remains contingent on FusionAP achieving commercial-scale execution,"" it said.
Given ongoing geopolitical uncertainties, HLIB Research continues to advocate a selective approach to the sector, favouring companies with exposure to structural themes such as supply chain localisation and semiconductor equipment demand.
Its top picks are Itmax System Bhd with a target price (TP) of RM5.74, UWC Bhd (TP: RM4.85) and Frontken Corp Bhd (TP: RM4.50).
© New Straits Times Press (M) Bhd"
New Straits Times,Anwar calls for ceasefire in Lebanon amid widening Middle East conflict,https://www.nst.com.my/news/nation/2026/03/1403822/anwar-calls-ceasefire-lebanon-amid-widening-middle-east-conflict,"Thu, 26 Mar 2026 08:58:55 +0800","KUALA LUMPUR: Malaysia has called for a ceasefire in the ongoing Middle East conflict to be expanded to include Lebanon, Prime Minister Datuk Seri Anwar Ibrahim said.
Anwar said the call was conveyed during a telephone conversation with Lebanese Prime Minister Nawaf Salam, noting that the country has been severely affected, with about one million people displaced and more than 1,000 fatalities recorded.
""I reaffirmed Malaysia's support for Lebanon's sovereignty, condemned attacks on civilian infrastructure and urged all parties to de-escalate tensions and return to dialogue, while also addressing the increasingly urgent humanitarian situation,"" he said in a Facebook post today.
During the conversation, the prime minister also extended Aidilfitri greetings to his counterpart and expressed appreciation for the Lebanese government's support in ensuring the safety and welfare of personnel from the Malaysian Battalion (Malbatt) serving under the United Nations Interim Force in Lebanon (Unifil).
""In concluding the conversation, I expressed Malaysia's commitment to continue working with Lebanon and international partners to restore regional peace and stability,"" he added.
Media reports stated that Israel has carried out airstrikes and launched ground operations in southern Lebanon following a cross-border attack by the Iran-backed Hizbollah group on March 2.
Lebanese authorities reported that at least 1,039 people have been killed and 2,876 others injured in the Israeli attacks to date. – BERNAMA
© New Straits Times Press (M) Bhd"
New Straits Times,Malaysia's healthcare sector seen as defensive haven amid market volatility,https://www.nst.com.my/business/corporate/2026/03/1403821/malaysias-healthcare-sector-seen-defensive-haven-amid-market,"Thu, 26 Mar 2026 08:58:51 +0800","KUALA LUMPUR: Malaysia's healthcare sector continues to serve as a resilient defensive haven amid rising geopolitical tensions and persistent inflationary pressures, said RHB Research.
The firm noted that the sector's premium valuations, relative to historical averages, reflect a structural re-rating of domestic healthcare assets, with locally focused players increasingly trading at a widening gap compared with regional peers.
It noted that the sector posted a solid fourth-quarter last year, with KPJ Healthcare and Duopharma Biotech outperforming expectations, while LAC Medical and IHH Healthcare delivered results in line with forecasts.
Earnings revisions across the sector were generally positive, it said, adding that it has raised KPJ Healthcare Bhd's target price to RM3.79 from RM3.37, driven by stronger revenue intensity growth and a lower effective tax rate.
A key development this quarter is the deliberate widening of the valuation premium between KPJ Healthcare and IHH Healthcare Bhd.
RHB Research said its recalibrated valuations imply 18.6 times for KPJ and 16.4 times for IHH, representing a premium gap of 13.4 per cent.
""We believe this premium is justified by KPJ's stronger domestic resilience amid geopolitical-driven inflationary pressures, as well as its higher return on equity and group-level EBITDA margins relative to IHH.
""KPJ operates at relatively low revenue intensity, which we believe offers significant upside as its centres of excellence strategy matures.""
RHB Research continues to favour a defensive positioning within the sector, naming KPJ Healthcare, LAC Medical and Duopharma Biotech as its top picks.
It said KPJ Healthcare stands out due to its relatively low exposure to medical tourism, which accounts for about six per cent of revenue compared with 14 per cent to 15 per cent for peers.
This makes it more resilient to external shocks, while any recovery in international patient flows could provide incremental upside.
""Amongst the large listed healthcare service providers, we view KPJ's secondary care hospitals as the primary beneficiaries of the upcoming medical and health insurance/takaful spillover (MHIT).
""The base plan coverage standardisation bodes well for the group's secondary network, which can absorb volume from the price-sensitive M40 segment while limiting exposure to potential insurance-driven downtrading,"" the firm said.
Meanwhile, LAC Medical is seen as a key beneficiary of Malaysia's healthcare infrastructure capital expenditure cycle, supported by growing recurring income streams, while Duopharma Biotech is entering 2026 on stronger footing following a robust fourth quarter.
© New Straits Times Press (M) Bhd"
New Straits Times,First Robot: Melania Trump brings droid to White House event,https://www.nst.com.my/world/world/2026/03/1403817/first-robot-melania-trump-brings-droid-white-house-event,"Thu, 26 Mar 2026 08:57:15 +0800","WASHINGTON: US First Lady Melania Trump brought a surprise guest to a White House event on Wednesday – a walking, talking, humanoid robot.
Instead of husband President Donald Trump at her side, it was the ""Figure 3"" android that accompanied Melania down the famous red carpet.
The 55-year-old Melania, whose signature focus as first lady is on AI and digital spaces, was hosting a summit on empowering children with educational technology.
""Thank you First Lady Melania Trump for inviting me to the White House,"" said the gray-and-black robot, gesturing with its hands in its brief opening remarks.
It then walked off the way it came.
There was applause from guests in the East Room of the White House, who included French first lady Brigitte Macron.
""It's fair to state you're my first American-made humanoid guest in the White House,"" said Slovenian-born Melania, reading from a prepared statement.
The former model, mother to the president's youngest son, 20-year-old Barron, went on to talk about how humanoid-based artificial intelligence would soon be used to educate children.
""Imagine a humanoid educator named Plato. Access to the classical studies is now instantaneous,"" she said.
""Predictably, our children will develop deep critical thinking, and independent reasoning abilities.""
Melania Trump has been taking on an increasingly public-facing role in recent months, after being an initially elusive presence at the White House early in her husband's second term.
She has hosted a number of events on AI and protecting children online.
But she has also taken on several money-spinning projects including a documentary called ""Melania,"" made in a multi-million-dollar deal with Amazon, and an audiobook of her autobiography that is narrated by AI. - AFP
© New Straits Times Press (M) Bhd"
New Straits Times,US–Iran tensions threaten global aluminium supply,https://www.nst.com.my/business/economy/2026/03/1403815/us%E2%80%93iran-tensions-threaten-global-aluminium-supply,"Thu, 26 Mar 2026 08:56:44 +0800","KUALA LUMPUR: The escalation of the US–Iran conflict has pushed London Metal Exchange (LME) aluminium prices above US$3,400 per metric tonne, raising the likelihood of the global market moving from a modest surplus in 2025 to a deficit in 2026 due to potential supply disruptions, according to Hong Leong Investment Bank Bhd (HLIB Research).
""A disruption to the Strait of Hormuz lasting more than one month could result in a deficit of up to 2.29 million tonnes, driven by logistical constraints that effectively strand Gulf exports, with smelter restart cycles estimated at three to six months.
""In a more severe scenario, where the Strait remains closed for an extended period of more than a month, the deficit could widen to 2.76 million tonnes, with restart timelines potentially stretching to six to 12 months,"" it said in a note.
The bank said that Press Metal Aluminium Holdings Bhd is well positioned to benefit from elevated aluminium prices driven by ongoing geopolitical tensions.
It has raised the group's financial year 2026 and 2027 (FY26/FY27) earnings forecasts by 13 per cent and 18.7 per cent, respectively, reflecting higher LME aluminium price assumptions, revised hedging positions, and stronger Main Japanese Port (MJP) premiums.
HLIB Research also upgraded the stock to ""Buy"" from ""Hold"", with a higher target price of RM8.63 from RM7.64.
It noted that Press Metal stands to gain from the current environment, supported by higher aluminium prices, softer alumina costs and stronger demand from the Asia Pacific region as buyers seek alternative supply sources.
HLIB Research said the Middle East region accounts for about nine per cent of global aluminium production but depends heavily on imported raw materials, leaving smelters vulnerable to disruptions in key shipping routes such as the Strait of Hormuz.
Several producers have already been affected, with Qatalum having earlier planned a shutdown before scaling back operations, while Aluminium Bahrain has begun curtailing capacity due to shipment disruptions.
HLIB Research added that Emirates Global Aluminium remains particularly exposed due to its reliance on imported raw materials, while smelters in Iran face elevated risks from ongoing military activity.
On the demand side, supply tightness is also emerging in Western markets, with the European Union and the United States heavily reliant on Middle Eastern aluminium imports, driving regional premiums higher.
Meanwhile, alumina prices are expected to remain subdued due to structural oversupply, which should support margins for producers like Press Metal.
""We expect the global alumina market to remain structurally oversupplied over the medium to long term, which should keep prices persistently soft, hovering around the US$300 a tonne,"" the firm said.
HLIB Research said the group has hedged about 65 per cent of its aluminium output at US$2,750 to US$2,800 per tonne, providing earnings visibility, while the remaining 35 per cent offers upside exposure to prevailing spot prices.
It said Press Metal is also seeing increased orders from the Asia-Pacific region, as customers look for immediate supply alternatives amid ongoing disruptions.
""We believe Press Metal stands to benefit from the current geopolitical backdrop, supported by elevated LME aluminium prices alongside lower alumina costs,"" it said.
© New Straits Times Press (M) Bhd"
New Straits Times,Johor Plantation shares rise 7.0pct year to date on steady dividends,https://www.nst.com.my/business/corporate/2026/03/1403813/johor-plantation-shares-rise-70pct-year-date-steady-dividends,"Thu, 26 Mar 2026 08:54:24 +0800","KUALA LUMPUR: JOHOR Plantations Group Bhd (JPG) has continued to reward shareholders with a consistent dividend policy, declaring a total of 12.25 sen per share since its 2024 listing, supported by recurring quarterly payouts.
Year-to-date, the stock has gained 7.0 per cent, lifting the company's market capitalisation to RM4.2 billion, reflecting solid fundamentals and growing investor confidence.
The 64.44 per cent-owned Johor Corp Bhd subsidiary closed financial year 2025 (FY25) with record earnings, driven by higher palm-product prices and volumes. Full-year net profit jumped 34.1 per cent to RM345.02 million, while revenue rose 13.1 per cent to RM1.72 billion from RM1.52 billion a year earlier.
In March 2026, the group declared an interim dividend of 3.0 sen per share, bringing the total full-year payout to 7.0 sen per share, equivalent to a dividend payout ratio of 50.7 per cent.
According to a stock exchange filing in February, JPG said that barring unforeseen circumstances, the group is cautiously optimistic in delivering a strong performance in FY 2026.
JPG is driving growth through strategic initiatives, including accelerating digitalisation, mechanisation, and completing its integrated sustainable palm oil complex this year.
Rakuten Trade Sdn Bhd said shares of the company have shown renewed strength, underpinned by improving technical indicators and steady buying momentum.
The counter formed two consecutive white candlesticks, extending its rebound from the RM1.50–RM1.60 consolidation range and signalling a shift in market sentiment.
The widening exponential moving average (EMA) lines indicate strengthening momentum, with the 20-day EMA providing key near-term support. While the Relative Strength Index (RSI) remains neutral, the overall trend has turned bullish, suggesting that the upward trajectory may continue.
Rakuten Trade noted that a breakout above RM1.65 would act as a critical catalyst to confirm the continuation of the short-term uptrend. If sustained, the stock could reach its first resistance at RM1.70, followed by further upside potential towards RM1.80.
From a trading perspective, the RM1.60–RM1.63 range is considered a favourable entry point, with immediate support at RM1.60 and stronger support at RM1.50. A break below RM1.50 would invalidate the bullish outlook, serving as a prudent stop-loss level.
© New Straits Times Press (M) Bhd"
Malay Mail,PLUS urges Raya travellers to plan return trips as 2.3 million vehicles expected on highways,https://www.malaymail.com/news/malaysia/2026/03/26/plus-urges-raya-travellers-to-plan-return-trips-as-23-million-vehicles-expected-on-highways/213917,"Thu, 26 Mar 2026 11:01:15 +0800","KUALA LUMPUR, March 26 — PLUS Malaysia Berhad has urged motorists to plan their return journeys to the Klang Valley using its MyPLUS-TTA digital travel schedule amid an expected surge in post-Hari Raya traffic.
In a statement today, the highway operator said traffic volume is projected to peak from March 27 to 29, with between 2 million and 2.3 million vehicles expected to use its network daily.
“Planning return journeys according to these recommended travel times will significantly assist in alleviating traffic congestion along the highway,” it said.
PLUS said it will activate Smart Lanes at 34 strategic locations and deploy PLUSRonda teams for 24-hour patrols to assist motorists.
It added that facilities at rest and service areas, as well as lay-bys, have been enhanced to accommodate higher traffic during the festive period.
PLUS also advised motorists to ensure their Touch ’n Go cards or eWallets have sufficient balance prior to their journey to avoid inconvenience at toll plazas.
It said real-time traffic updates are available via the PLUS application, Virtual Assistant PUTRI, X @plustrafik and @lpt2trafik, variable message signs and major national radio stations."
Malay Mail,"Anwar expresses support for Qatar, condemns attack on Ras Laffan LNG facility",https://www.malaymail.com/news/malaysia/2026/03/26/anwar-expresses-support-for-qatar-condemns-attack-on-ras-laffan-lng-facility/213900,"Thu, 26 Mar 2026 09:42:51 +0800","KUALA LUMPUR, March 26 — Malaysia has firmly expressed its support for Qatar’s sovereignty and strongly condemned the attack targeting the Ras Laffan Liquefied Natural Gas (LNG) facility, Prime Minister Datuk Seri Anwar Ibrahim said.
Anwar said that in a telephone conversation with Qatar’s Prime Minister Sheikh Mohammed bin Abdulrahman Al Thani, Malaysia described the energy infrastructure as critical to the global economy.
The Prime Minister said both leaders also agreed that all parties must de-escalate tensions and return to dialogue and diplomacy in the interest of regional stability.
“May peace in West Asia be restored soon, Insya-Allah,” he said in a Facebook post today.
a
Anwar said that he and Sheikh Mohammed also exchanged Aidilfitri greetings and expressed concern over the worsening security situation in West Asia.
He also conveyed condolences over a helicopter crash that claimed the lives of members of the Qatar Armed Forces as well as Turkish nationals, and expressed solidarity with the victims’ families.
Ras Laffan is the world’s largest LNG export terminal, accounting for about 20 per cent of global supply.
Last year, Qatar exported 81 million tonnes of LNG, with around 90 per cent destined for Asian markets.
The March 18 attack on the facility disrupted about 5.8 million tonnes of LNG supply for the month. — Bernama"
Malay Mail,Police detain man over viral Facebook post insulting Prophet Muhammad,https://www.malaymail.com/news/malaysia/2026/03/26/police-detain-man-over-viral-facebook-post-insulting-prophet-muhammad/213883,"Thu, 26 Mar 2026 08:55:34 +0800","KUALA LUMPUR, March 26 — Police detained a 47-year-old local man suspected of insulting Prophet Muhammad (PBUH) over a Facebook post that recently went viral.
Kuala Lumpur police chief Datuk Fadil Marsus said a report was received at 1.30 am last Sunday regarding the offensive post uploaded by an account using the name ‘Sakti Sakti Sakti’.
He said the suspect was arrested by a police team at 8.32 pm yesterday in Butterworth, Penang.
“A Vivo 29T mobile phone believed to have been used to upload the post was also seized,” he said in a statement yesterday.
He added that a three-day remand order has been obtained from today until March 27 to facilitate investigations.
The case is being investigated under Section 298A of the Penal Code for causing disharmony or enmity on religious grounds, Section 505© of the Penal Code for statements made with intent to incite, and Section 233 of the Communications and Multimedia Act 1998 for improper use of network facilities.
Fadil advised the public not to upload or share content touching on religious, racial or royal sensitivities (3R) that could disrupt national harmony.
“Firm action without compromise will be taken against any individual who violates the law,” he said. — Bernama"
