Source,Title,Link,Date,Article
New Straits Times,"10,000 jobs on offer at Perkeso carnival",https://www.nst.com.my/news/nation/2026/04/1426532/10000-jobs-offer-perkeso-carnival,"Sun, 26 Apr 2026 14:10:51 +0800","KUALA LUMPUR: A total of 10,000 job opportunities, with salaries ranging from RM3,000 to RM16,000, were offered at the two-day Social Security Organisation's (Perkeso) MYFutureJobs Premium Carnival 2026, which concluded today.
Human Resources Minister Datuk Seri R. Ramanan said the carnival featured a wide range of employers, including multinational corporations, government-linked companies (GLCs) and private sector firms.
""This is a very good opportunity, especially given the current economic situation, as it offers a wide range of job openings.
""There are 10,000 vacancies available, with salaries ranging from RM3,000 to RM16,000.
""This carnival will also be held in Borneo, expanding access to employment nationwide,"" he said after visiting the MYFutureJobs Premium Career Carnival 2026 at the Kuala Lumpur Convention Centre today.
Also present was Perkeso chief executive officer Datuk Seri Mohammed Azman Aziz Mohammad.
Ramanan said sectors with high demand include manufacturing and services, as well as nursing, banking and auditing.
""The services sector accounts for nearly 30 per cent of the job opportunities offered, reflecting positive growth in the industry,"" he said.
He added that the ministry, through Perkeso, has introduced the MyFutureJobs Career Exploration Centre, powered by artificial intelligence (AI), now operating at KL Sentral.
""The centre helps job seekers build profiles, match with suitable jobs and improve their chances of securing employment.""
He said the ministry aims to achieve at least 200,000 job placements this year through various initiatives, including MyFutureJobs.
Meanwhile, Ramanan said the ministry will launch a series of targeted crisis support initiatives to address the impact of global economic uncertainty stemming from ongoing geopolitical tensions.
He said the move follows a worrying trend in the labour market, which saw 5,900 Malaysians laid off in March, with workers in Selangor and Kuala Lumpur the hardest hit.
""As a proactive measure by the Madani government, the ministry will announce several comprehensive crisis support initiatives in conjunction with Labour Day on May 1,"" he said in a statement.
Ramanan added that the initiatives aim to enhance the marketability of job seekers through more dynamic interventions, including improvements to the Employment Insurance System Act.
""These improvements are expected to provide more comprehensive benefits to workers, including stronger social protection and easier access to reskilling and upskilling programmes.
""This effort is a critical step by the ministry to accelerate the redeployment of workers into more stable employment sectors, thereby reducing pressure on the national labour market,"" he said.
© New Straits Times Press (M) Bhd"
New Straits Times,Remand extended for independent preacher suspected of NGO funds abuse,https://www.nst.com.my/news/nation/2026/04/1426530/remand-extended-independent-preacher-suspected-ngo-funds-abuse,"Sun, 26 Apr 2026 14:03:54 +0800","SEREMBAN: The Negri Sembilan Malaysian Anti-Corruption Commission (MACC) has obtained a remand extension against an
independent preacher
on suspicion of embezzling funds from a non-governmental organisation (NGO) totalling about RM12.3 million.
The five-day remand order until May 1 against the suspect, who is in his 30s, was issued by magistrate Nurul Saqinah Rosli at the magistrate's court here today.
The application to extend the remand was made after the original remand period for the suspect expired today.
Meanwhile, Negri Sembilan MACC director, Awgkok Ahmad Taufik Putra Awg Ismail, when contacted, confirmed the matter and that the case is being investigated under Section 23 of the MACC Act 2009.
It was previously reported that the state MACC had arrested an independent preacher suspected of abusing power and embezzling funds from an NGO totalling about RM12.3 million for personal gain.
MACC Chief Commissioner Tan Sri Azam Baki yesterday had said that the commission would call 14 to 15 witnesses to assist in the investigation into the embezzlement of NGO funds belonging to the independent preacher.
© New Straits Times Press (M) Bhd"
New Straits Times,Timeline: How the shooting at the White House correspondents' dinner unfolded,https://www.nst.com.my/world/world/2026/04/1426522/timeline-how-shooting-white-house-correspondents-dinner-unfolded,"Sun, 26 Apr 2026 13:50:19 +0800","WASHINGTON: A gunman fired shots in the hotel hosting the White House correspondents' association dinner on Saturday, causing President Donald Trump and his cabinet to be rushed out before the suspect was taken into custody.
Here is a timeline of the incident and its immediate aftermath:
Around 8.35pm ET (0035 GMT on Sunday),
guests at the Washington Hilton dinner took cover when shots were heard, video footage showed. Soon after, Secret Service agents rushed towards Trump, escorting the president and his cabinet from the ballroom.
A sole gunman had rushed a Secret Service checkpoint in a lobby, Washington, DC, Mayor Muriel Bowser and interim police chief Jeffery Carroll later told reporters.
The suspect charged the Secret Service checkpoint in the hotel's lobby area and was armed with a shotgun, a handgun and multiple knives, Carroll said. As the suspect ran through that checkpoint, Secret Service members intercepted him.
A Secret Service agent was injured and transported to a local hospital, the mayor said, adding the suspect was also transferred to a local hospital where he was evaluated.
""We do know that law enforcement exchanged gunfire with the individual. ... The suspect in this case, he was not struck by gunfire,"" Carroll said. ""Law enforcement ... they actually tackled him into the ground and handcuffed him.""
[[nid:1426519]]
Around 9.17pm ET (0117 GMT),
Trump made his first comments after the shooting, saying law enforcement ""acted quickly and bravely."" Trump posted on Truth Social that ""the shooter has been apprehended."" Trump said he recommended that the event continue.
About 20 minutes later,
Trump posted again saying law enforcement asked him and others to leave the premises of the venue and that he was complying with that request. The event will be rescheduled ""within 30 days,"" Trump said.
Around 10.30pm ET (0230 GMT),
Trump addressed the media in a press conference at the White House, accompanied by the director of the FBI and the acting US attorney general. Trump and other law enforcement officials said preliminary information suggested the suspect was a lone shooter.
Around 11.13pm ET (0313 GMT)
, Jeanine Pirro, the US Attorney for the District of Columbia, told reporters the suspect was being charged with using a firearm during a crime of violence and assault on a federal officer with a dangerous weapon.
© New Straits Times Press (M) Bhd"
New Straits Times,Police hunt mother over alleged abuse of three-year-old in Batu Caves,https://www.nst.com.my/news/regional/2026/04/1426515/police-hunt-mother-over-alleged-abuse-three-year-old-batu-caves,"Sun, 26 Apr 2026 13:30:30 +0800","KUALA LUMPUR: Police are tracking down a woman suspected of abusing her three-year-old son in an incident in Batu Caves recently.
Gombak police chief ACP Noor Ariffin Mohamad Nasir said a report was lodged yesterday by the child's grandmother, who lives in the same house.
Preliminary investigations found the incident occurred in early March around 8pm, when the complainant heard the child crying and suspected he was being abused by his mother.
""The suspect is a local woman and the child's biological mother. She is not married, and the motive is still under investigation,"" he said in a statement today.
The child has been taken for a medical examination, which is ongoing.
Police are actively tracing the suspect to assist in investigations. The case is being investigated under Section 31(1)(a) of the Child Act 2001.
Those with information are urged to contact investigating officer Inspector Amirul Ashyraf Abu Hassan at 019-3491233 or the Gombak district police headquarters operations room at 03-61262222.
© New Straits Times Press (M) Bhd"
New Straits Times,'I've studied assassinations': Trump muses on reasons for latest shooting,https://www.nst.com.my/world/world/2026/04/1426513/ive-studied-assassinations-trump-muses-reasons-latest-shooting,"Sun, 26 Apr 2026 13:29:49 +0800","WASHINGTON: US President Donald Trump struck a philosophical tone Saturday after a shooter rushed a media gala in Washington, the latest in a series of incidents to target the Republican leader.
""I ask respectfully, why do you think this keeps happening to you?"" a reporter asked Trump after the chaotic incident at the White House Correspondents' Dinner.
Trump had a ready answer, and it was about the 79-year-old's own position in the pantheon of US presidents.
""Well, you know, I've studied assassinations,"" Trump said. ""And I must tell you the most impactful people, the people that do the most – you take a look at Abraham Lincoln... the people that make the biggest impact, they're the ones that they go after.""
""I hate to say I'm honoured by that, but I've done a lot,"" Trump added. ""We've changed this country, and there are a lot of people that are not happy about that. So I think that's the answer.""
Trump, who survived an assassination attempt at an election rally in 2024, added that ""I lead a pretty normal life, considering, you know, it's a dangerous life.""
""A lot of other people, you know, you read stories where they become basket cases. To be honest, I'm not a basket case.""
Trump meanwhile took a measured tone towards the press – despite previously calling it the ""enemy of the people"" – saying there was ""a tremendous amount of love and coming together"" after the incident.
He said he had been ready to give the ""most inappropriate speech ever made"" but would now be ""very boring"" when the dinner was rescheduled.
The shooting on Saturday, which Trump blamed on a ""would-be assassin,"" also caused him to riff on one of his favourite topics – the huge US$400 million ballroom he is building at the White House.
Trump said the venue for the correspondents' dinner, the Washington Hilton, was ""not particularly secure"" and showed the need for the construction of the new ballroom.
© New Straits Times Press (M) Bhd"
New Straits Times,What we know about the Trump press gala shooting,https://www.nst.com.my/world/world/2026/04/1426509/what-we-know-about-trump-press-gala-shooting,"Sun, 26 Apr 2026 13:19:51 +0800","WASHINGTON: US President Donald Trump and other attendees were evacuated Saturday night after gunshots were fired at a glitzy media gala in Washington.
As details continue to emerge and investigations are underway, here is what we know about the shooting:
What we know about the ballroom
Shots were heard after the welcoming speech at the annual dinner of the White House correspondents' association being held at the Washington Hilton Hotel, according to AFP reporters and other witnesses.
Tactical security teams with guns drawn took position on the stage where Trump was seated alongside his wife Melania, Vice President JD Vance and other officials, who were swiftly evacuated.
Hundreds of guests in black tie in the ballroom took cover under tables and later made their way into the hotel lobby and then outdoors as the event was postponed.
Authorities said no dignitaries or gala guests were hurt.
How the shooting unfolded
A ""sole gunman"" rushed through a security checkpoint in the hotel lobby just outside the ballroom where the dinner was taking place around 8:36 pm (0036 GMT), according to authorities.
Trump shared footage on his Truth Social platform which appeared to show the suspect charging at the checkpoint before being swarmed by officers.
""He was armed with a shotgun, a handgun and multiple knives,"" Metropolitan Police Department interim chief Jeffery Carroll told reporters.
Law enforcement exchanged gunfire with the suspect and ""intercepted that individual.""
A uniformed Secret Service officer was ""struck in his vest"" and taken to hospital, but was doing well, Carroll said.
The suspect was not hit by gunfire, but was taken to a hospital to be evaluated.
He was in custody and due to be arraigned on Monday in a federal court.
A long gun and shell casings were found on the scene, FBI Director Kash Patel said, adding that the agency was carrying out witness interviews as part of its probe.
[[nid:1426505]]
Who is the suspect?
Trump shared photos of the suspected shooter, shirtless and in handcuffs facedown on a carpeted floor, in what appears to be the Hilton lobby.
Authorities are yet to publicly confirm his identity, but US media reported that the suspect was a 31-year-old named Cole Tomas Allen from Torrance, California.
Based on preliminary information, ""we do believe he was a guest here at the hotel,"" Carroll told reporters.
The detained man is believed to be the only suspect in the case, officials said.
He is being charged with two counts currently: using a firearm during a crime of violence, and assault on a federal officer using a dangerous weapon, US Attorney Jeanine Pirro said.
Other charges could still be brought as the investigation proceeds.
""My impression is he was a lone wolf,"" Trump said, adding that the suspect's motivation was not yet clear but he believed the gunman was ""sick.""
[[nid:1426504]]
Were there security failures?
Questions swirled regarding the security at the reception and how a gun was brought into the hotel.
Attendees pointed out that there was a magnetometer placed outside the ballroom, but there was no such screening before that or at the entrance to the hotel itself.
Trump initially said it was ""not a particularly secure building,"" but later said the ballroom where the event was being held was not breached by the gunman and was ""very, very secure.""
The checkpoint that the suspect tried to charge past was ""right outside the ballroom,"" authorities said.
""Because that checkpoint worked, there was no one who was injured,"" Pirro said.
""We'll go through video across the hotel to figure out how the gun got in, how it got down here,"" Carroll added.
According to Trump, the security services did a ""much better job than Butler,"" where he was the target of an assassination attempt in 2024 during a campaign rally in the state of Pennsylvania.
© New Straits Times Press (M) Bhd"
New Straits Times,#NSTViral: Woman calls out diners for smoking in eatery [WATCH],https://www.nst.com.my/news/nst-viral/2026/04/1426497/nstviral-woman-calls-out-diners-smoking-eatery-watch,"Sun, 26 Apr 2026 12:57:42 +0800","KUALA LUMPUR: A viral video has surfaced showing a woman calling out several individuals for smoking and leaving cigarette ash on a restaurant table.
In the
36-second clip
shared by user @araaz_official on Threads, the woman is seen addressing the group while they remain silent.
She questions their lack of civic-mindedness and respect for other patrons.
""Look at that cigarette ash. Are you planning to clean it up or sweep it away? You don't think about that. You have no respect at all,"" she says.
She also expresses frustration that they chose to eat and leave without considering the mess left behind.
The video shows the woman saying she intends to report the matter to the Health Department for further action.
The individuals do not respond in the clip.
The video has since drawn praise from netizens, many of whom said smoking has no place in a restaurant.
""These people know it's an eatery, yet they still choose to smoke inside.
""They should think about those around them. If they want to smoke after eating, they should do it outside,"" said user @skullujang.
© New Straits Times Press (M) Bhd"
New Straits Times,Consumers are cautious as psychology of spending changes,https://www.nst.com.my/opinion/letters/2026/04/1426494/consumers-are-cautious-psychology-spending-changes,"Sun, 26 Apr 2026 12:53:34 +0800","LETTERS:
Malaysians are still spending, but the way they spend has changed. The new consumer is more price-sensitive, more selective and more cautious than before.
A familiar label still matters, but it no longer guarantees the sale. A few ringgit may appear small in a policy paper or boardroom discussion, but it is not small inside a monthly household basket.
The difference between two brands of cooking oil, rice, eggs, detergent, milk powder, shampoo or household cleaner becomes meaningful when repeated week after week.
Consumers are therefore comparing more carefully, switching brands more easily and waiting longer for promotions.
Food, personal care, cleaning products, transport and children's needs remain priorities because households cannot avoid them.
For businesses, the message is clear. A premium price now requires a stronger explanation. Brand reputation alone is no longer enough.
Consumers want visible value: better durability, better ingredients, better safety, better service, better convenience or a more trusted promise.
If the difference is only packaging and advertising, the cheaper product will win.
Trust is lost when consumers feel they are being asked to pay more for less. GDP growth may show that the economy is expanding. Inflation data may suggest that price increases are being managed.
Consumer sentiment surveys may point to caution or confidence. But none of these indicators alone can fully explain how Malaysians experience the economy in daily life.
A family does not calculate inflation through an abstract national basket. It calculates inflation through the items it cannot avoid buying.
For policymakers, this is a crucial signal. Malaysians are adapting, but adaptation has a cost.
They are substituting, delaying, downsizing and bargain-hunting. They remain active in the economy, but with more caution and less emotional confidence.
The response, therefore, cannot stop at advising people to spend wisely.
Consumers need stronger purchasing power, fair competition, transparent pricing, better wage prospects, targeted assistance and protection from unfair market practices.
Financial education also needs to reflect how households actually make decisions under pressure.
Malaysians want affordability, but not poor quality. They want value, but not manipulation.
They want trusted brands, but not blind loyalty. They want retailers to understand that every ringgit in the basket now carries more emotional weight.
Companies that offer honest value, affordable pack sizes, clear promotions, reliable quality and respectful communication will earn loyalty.
Malaysia's consumer in 2026 is not weak but wary.
The economy may be resilient, but the psychology of spending has changed. Every purchase has to work harder for its place in the basket.
DR NORAZAH MOHD SUKI
Professor
Marketing and E-Commerce
Universiti Utara Malaysia
© New Straits Times Press (M) Bhd"
New Straits Times,Pontian police seize 18 e-bikes used by foreigners on public roads,https://www.nst.com.my/news/regional/2026/04/1426493/pontian-police-seize-18-e-bikes-used-foreigners-public-roads,"Sun, 26 Apr 2026 12:53:30 +0800","PONTIAN: Police seized 18 micro-mobility vehicles, including electric motorcycles and bicycles, used by foreigners on public roads during a traffic crackdown on Friday.
The operation targeted the illegal use of e-bikes on main roads, with 56 people and 42 vehicles checked at roadblocks in Pekan Nanas, Jalan Utama Taman Seri Maju, and Pontian Jaya.
District police chief Superintendent Hadzrat Hussien Mion said micro-mobility vehicles were restricted from public roads under traffic laws due to safety concerns.
Police seized 18 e-bikes during the operation, while 30 summonses were issued to other motorists for various offences, including driving without a licence, lacking insurance, and having expired road tax.
Police also impounded three motorcycles and a car driven by foreigners without valid licences and insurance, as well as four bicycles ridden at night without lights.
Hadzrat said the operation followed public complaints and ongoing concerns over road safety involving e-bikes.
The use of e-bikes and other personal mobility devices on public roads is prohibited. Offenders face fines of up to RM2,000 or imprisonment of up to six months upon conviction, he said in a statement.
He said the prohibition was necessary as most e-bikes were not registered or insured, and were not designed to meet safety standards for traffic, posing a hazard to riders and other road users.
The cases are being investigated under Section 64 of the Road Transport Act 1987, which allows for vehicle seizures of up to 90 days, and Regulation 3(1) of the Road Traffic (Prohibition of Certain Micro-Mobility Vehicles) Rules 2021.
© New Straits Times Press (M) Bhd"
New Straits Times,'Get down!' Panic and chaos at glitzy media gala [WATCH],https://www.nst.com.my/world/world/2026/04/1426490/get-down-panic-and-chaos-glitzy-media-gala-watch,"Sun, 26 Apr 2026 12:46:14 +0800","WASHINGTON: A glitzy gala for the White House Correspondents' Association was shattered by gunfire on Saturday night, forcing security to rush President Donald Trump offstage as guests dived for cover.
Trump was seated on stage for the annual dinner — his first as president — when loud bangs disrupted the event.
Moments later, cries of ""stay down!"" echoed through the ballroom as guests in formal attire, including administration officials and cabinet members, took cover.
US Secret Service agents, with weapons drawn, surrounded the president and First Lady Melania Trump before ushering them through a back curtain.
Trump said later he initially ""thought it was a tray going down"" before realising it was gunfire.""It was either a tray or a bullet. I hoped it was a tray, but it wasn't,"" he said.
DUCKED UNDER THE TABLE
The music stopped and a hush fell over the room as agents swarmed the ballroom of the Washington Hilton.
The hotel is the same site where president Ronald Reagan survived an assassination attempt 45 years ago.
Mehmet Oz, the administrator of the Centers for Medicare and Medicaid Services, said there were ""shots fired upstairs"" as security evacuated him.
Health and Human Services Secretary Robert F. Kennedy Jr. was also rushed out of the room. Kennedy's father, Robert F. Kennedy, and his uncle, president John F. Kennedy, were both killed by assassins in the 1960s.
One America News correspondent Alexandra Ingersoll said she ducked under a table when the commotion began.
""I didn't know if the shooter was neutralised or what was going on,"" she said.
Trump later told reporters that a gunman, whom he described as a ""lone wolf,"" had charged through a security screening just outside the ballroom.
FOUGHT LIKE HELL
The room was ordered evacuated, and several hundred guests moved into the lobby and out into the street.
Trump's motorcade left the Hilton about 8.40pm and headed for the White House.
The president, still in his black-tie attire, later appeared at a press conference in the White House briefing room alongside Melania Trump, Vice President JD Vance, and FBI director Kash Patel.
Trump, who survived an assassination attempt at a rally in Butler, Pennsylvania, in 2024, said he ""fought like hell to stay"" at the dinner but was told by agents he had to leave.
He added that the gala would be rescheduled.
""We're going to do it again,"" Trump said. ""We're not going to let anyone take over our society.""
© New Straits Times Press (M) Bhd"
