Source,Title,Link,Date,Article
Malay Mail,"Rolls-Royce Cullinan, Porsche Taycan among 18 luxury cars seized as KL cops smash drug ring",https://www.malaymail.com/news/malaysia/2026/04/21/rolls-royce-cullinan-porsche-taycan-among-18-luxury-cars-seized-as-kl-cops-smash-drug-ring/217163,"Tue, 21 Apr 2026 17:29:11 +0800","KUALA LUMPUR, April 21 — A Rolls-Royce Cullinan, Porsche Taycan 4S and Mercedes-Benz AMG were among 18 luxury vehicles seized by police in a major Klang Valley drug bust.
MalaysiaGazette
reported today that nineteen suspects were arrested in the raids under Op Empis, with total seizures — including drugs, cash and high-value assets — estimated at RM14.15 million.
The Narcotics Criminal Investigation Department (NCID) of the Royal Malaysia Police (PDRM) said those detained comprise 12 local men, five local women and two Chinese nationals aged between 24 and 48.
NCID director CP Datuk Hussein Omar Khan said officers raided multiple locations, including apartments in Taman Wahyu and Kepong, uncovering drugs worth an estimated RM3.1 million.
Seized were 31.8kg of ketamine, 4.2kg of Erimin 5, 0.89kg of ecstasy pills and 6.5kg of MDMA.
“This syndicate was found to be operating under the guise of a money-changing business as a front for its drug distribution activities,” he said at a press conference today.
Hussein said the group is believed to have been active since early this year, using apartment units as storage and processing sites before distributing the drugs across the Klang Valley.
Investigations identified the 12th suspect as the syndicate leader, supported by others acting as storekeepers, runners and associates.
Urine tests found three suspects positive for drugs, while five have prior criminal records.
Four suspects have been remanded for seven days under Section 39B of the Dangerous Drugs Act 1952. Seven others are being held under the Dangerous Drugs (Special Preventive Measures) Act 1985, while eight have been released on police bail.
Police also seized jewellery, gold bars, luxury watches, handbags and laptops worth RM11.05 million, along with about RM4.9 million in cash in multiple currencies.
“The drugs seized are believed to be capable of affecting around 151,000 users. PDRM will not compromise with any parties involved in drug trafficking activities,” Hussein said."
Malay Mail,"Flash floods in Cameron Highlands draw federal probe, geologists deployed",https://www.malaymail.com/news/malaysia/2026/04/21/flash-floods-in-cameron-highlands-draw-federal-probe-geologists-deployed/217161,"Tue, 21 Apr 2026 17:04:55 +0800","KUALA LUMPUR, April 21 — The Natural Resources and Environmental Sustainability Ministry will dispatch geologists to Cameron Highlands following flash floods that sent muddy torrents onto a main road, as authorities move to pinpoint the cause and prevent a repeat, the
New Straits Times
reported.
Minister Datuk Seri Arthur Joseph Kurup said the ministry would work with multiple agencies — including the Public Works Department (JKR), the Department of Irrigation and Drainage (JPS) and local councils — in a coordinated investigation.
“We are aware of the incident, which occurred last night. This effort requires cooperation between multiple ministries and agencies.
“For our part, we will send geologists to conduct studies and provide technical assistance. A report will be issued once investigations are completed to determine what happened and how we can avoid similar incidents in the future,” he told reporters after attending the Climate Change and Sustainability Conference 2026 in Petaling Jaya today.
Heavy rain lasting more than two hours yesterday triggered the flash floods in the Habu Heights area, with runoff from surrounding hills surging onto the Ringlet main road.
Cameron Highlands police chief Azri Ramli said the downpour began at about 2pm in the hilly terrain, sending muddy water cascading downhill and across the roadway.
“The runoff from hilly areas surged onto the main road, causing flash floods. However, the situation remained under control, and the waters fully receded by around 4pm,” he said.
The incident briefly disrupted traffic along the route as water and debris flowed across the road.
No casualties were reported, though two police reports were lodged involving vehicles caught in strong currents.
“The involved vehicles were only pushed forward by the force of the water, and no injuries were reported,” he added.
Authorities have since cleared the affected stretch and confirmed it is now safe for road users."
Malay Mail,"Police: Kulim officer alleged to have stepped on man’s head to be investigated, focus on arrest SOP compliance",https://www.malaymail.com/news/malaysia/2026/04/21/police-kulim-officer-alleged-to-have-stepped-on-mans-head-to-be-investigated-focus-on-arrest-sop-compliance/217158,"Tue, 21 Apr 2026 17:09:02 +0800","KULIM, April 21 — Investigations into an incident involving a man being stepped on by a police officer during an arrest in Kulim, Kedah, are focused on compliance with arrest standard operating procedures (SOPs).
Kulim deputy police chief DSP Tengku Mohd Faisal Tengku Yeng said the Integrity and Standards Compliance Department (JIPS) has been instructed to conduct an investigation into the officer involved.
“The officer involved has been reassigned to administrative duties pending the outcome of the investigation,” he said in a statement today.
Meanwhile, he said the man involved in the incident has been remanded for three days until Thursday.
Yesterday, a 29-second video went viral on social media, showing a man being dragged off his motorcycle before his head was stomped on.
The 32-year-old suspect, who was detained at Jalan Sungai Ular near here, resisted arrest by kicking a police officer’s motorcycle before fleeing, and was later confirmed to have tested positive for methamphetamine.
Upon inspecting the suspect’s motorcycle, police found two transparent plastic packets believed to contain ketum juice.
The suspect, who has a prior criminal record, is being investigated under Section 30(3) of the Poisons Act 1952, Section 15(1)(a) of the Dangerous Drugs Act 1952, and Section 42(1) of the Road Transport Act 1987. — Bernama"
Malay Mail,"Rising waters push KL river past danger mark, says Irrigation and Drainage Dept",https://www.malaymail.com/news/malaysia/2026/04/21/rising-waters-push-kl-river-past-danger-mark-says-irrigation-and-drainage-dept/217156,"Tue, 21 Apr 2026 16:32:27 +0800","KUALA LUMPUR, April 21 — One of 29 rivers in the capital breached the danger level this afternoon, with authorities flagging a rising water trend.
In a statement on its website, the Department of Irrigation and Drainage said the reading involved the Flat Sri Johor Retention Pond Outlet Channel Station (F2), despite no rainfall being recorded in the area.
The water level at the station stood at 33.03m, or 0.37m above the danger threshold, with an upward trend recorded at 2.30pm.
The station’s thresholds are set at 27.5m (normal), 31.66m (alert), 32.16m (warning) and 32.66m (danger).
Elsewhere, water levels at two stations — Sungai Bidor near Changkat Jong in Hilir Perak and Sungai Perlis at Bukit Tok Poh (F2) in Kangar, Perlis — were recorded above warning levels.
At Sungai Perlis, the water level reached 2.06m, or 0.06m above the warning threshold, with an upward trend observed at about 2.30pm.
Meanwhile, Sungai Bidor recorded a reading of 3.49m, or 0.27m above the warning level, with an upward trend noted at 2.45pm."
Malay Mail,"Father of two jailed, fined RM300 over Cheras supermarket theft involving sardines and other daily essentials",https://www.malaymail.com/news/malaysia/2026/04/21/father-of-two-jailed-fined-rm300-over-cheras-supermarket-theft-involving-sardines-and-other-daily-essentials/217154,"Tue, 21 Apr 2026 16:17:03 +0800","KUALA LUMPUR, April 21 — A father of two was sentenced to one month in jail and fined RM300 by the Magistrates’ Court today after pleading guilty to stealing various daily necessities, including two tins of sardines.
According to
Utusan Malaysia
, Magistrate Faezahnoor Hassan handed down the sentence after Mohd Rashid Mohd Noh, 44, admitted to the charge when it was read to him.
The e-hailing driver faces an additional seven days’ jail if he fails to pay the fine.
According to the charge, Mohd Rashid stole 20 items — including two tins of sardines, all-purpose flour, dishwashing liquid, bath soap and an air freshener — worth RM404.22 from an Aeon supermarket in Taman Maluri, Cheras, at 8.10pm on April 18.
The offence was charged under Section 380 of the Penal Code, which carries a maximum jail term of up to 10 years and a possible fine.
For repeat offences, offenders may face imprisonment as well as a fine or whipping.
During proceedings, deputy public prosecutor Nor Farhana Mohd Poad urged the court to impose a sentence that would serve as a lesson to the accused.
However, defence counsel M. Soosai Raj from the National Legal Aid Foundation sought a lighter sentence, saying his client has two schoolgoing children to support.
“My client works as a driver and supports two children who are still in school. I ask that the minimum custodial sentence be imposed,” he said."
Malay Mail,"PM: Govt to announce support measures for those out of work, including unemployed graduates",https://www.malaymail.com/news/malaysia/2026/04/21/pm-govt-to-announce-support-measures-for-those-out-of-work-including-unemployed-graduates/217152,"Tue, 21 Apr 2026 16:20:01 +0800","KUALA LUMPUR, April 21 (Bernama) -- The government will soon announce additional measures to support those who were out of work due to the global supply crisis.
Prime Minister Datuk Seri Anwar Ibrahim said the initiatives would include unemployed graduates and diploma holders, so as to ensure their skills are not wasted.
""I will announce additional measures soon to assist those who were out of work, including unemployed graduates and diploma holders,” he told reporters after chairing a roundtable session with representatives of financial institutions, here today.
Also present were Bank Negara Malaysia governor Datuk Seri Abdul Rasheed Ghaffour and Treasury secretary-general Datuk Johan Mahmood Merican.
Prior to this, the government had already introduced several measures to cushion the impact of the global supply crisis, including maintaining petrol prices under the BUDI MADANI RON95 (BUDI95) programme and retaining diesel subsidies in Sabah and Sarawak.
Additional steps include higher monthly assistance under the Agri-Commodity and BUDI Diesel for individual diesel vehicle owners, farmers and smallholders; increased incentives for padi cultivation; and financing guarantees of up to RM5 billion to support micro, small and medium enterprises.
Malaysia’s unemployment rate stood at 2.9 per cent in February 2026, with 506,800 people out of work. — Bernama"
Malay Mail,"Matrade turns 47 offices abroad into ‘frontline hubs’ to shield exporters from trade turmoil, says Reezal Merican",https://www.malaymail.com/news/malaysia/2026/04/21/matrade-turns-47-offices-abroad-into-frontline-hubs-to-shield-exporters-from-trade-turmoil-says-reezal-merican/217151,"Tue, 21 Apr 2026 16:07:03 +0800","KUALA LUMPUR, April 21 — Datuk Seri Reezal Merican Naina Merican today reassured that Malaysia’s exporters are being supported through a comprehensive mitigation strategy as global trade disruptions intensify.
The Malaysia External Trade Development Corporation (Matrade) chairman said the agency is stepping up efforts to diversify into new markets and strengthen small and medium enterprises (SMEs).
“Firstly, we are leveraging our extensive global network by repurposing our 47 overseas offices into ‘frontline intelligence hubs’.
“These offices are no longer just promotional centres; they now act as our eyes and ears on the ground, capturing real-time data.
“We are also focusing on non-conflict markets to enhance access and expand into new opportunities,” Reezal Merican told a press briefing at the Matrade headquarters here today.
Beyond reports, these trade commissioners (TCs) are identifying tactical solutions by providing regular updates on how exporters can divert cargo to stable regional hubs and ports such as Salalah or Sohar, while also exploring alternative land and rail routes to bypass maritime chokepoints.
“Under our revised terms of reference (TOR), the role of the TCs has expanded to focus on new export opportunities arising from geopolitical tensions, while positioning Malaysia as an alternative sourcing destination.
“They are actively identifying emerging supply gaps and seeking alternative raw materials globally to support Malaysian industries to sustain production as some traditional supply chains are disrupted.”
Strategic market diversification, SME resilience and digital facilitation
At the same time, Matrade has also placed focus on strategic market diversification into non-conflict, non-landlocked markets with established ports and cost efficiencies.
Among the ports are Port Lekki in Nigeria (West Africa), Port Tanger Med in Morocco (North Africa), Cai Mep in Vietnam (Southeast Asia), and Mundra in India (South Asia).
“We appreciate the announcement of a RM60 million allocation by the Madani government to support our SMEs in expanding into new export markets.
“This investment will help our businesses penetrate high-potential regions such as Africa, Central Asia and Latin America, which is a key pillar of our market diversification strategy to reduce over-reliance on traditional trade corridors.
“By venturing into these emerging markets, our SMEs will be better positioned to manage rising operating and logistics costs through more competitive trade routes and alternative sourcing opportunities identified by our global network,” he added.
Reezal Merican also noted that Matrade has focused its resources most acutely on micro, small and medium enterprises (MSMEs) and SMEs, as these businesses are currently the most vulnerable, with 74.5 per cent facing significant working capital pressure.
“To complement these efforts and to provide our SMEs with the 24/7 support they need, I am proud to officially announce the Matrade Interactive Virtual Assistant, or MIVA, which is now live on the Madani Digital Trade Platform (MDTP).
“This AI-driven tool is designed to provide instant, real-time support for crisis-related enquiries, ensuring our exporters have a digital assistant to help them navigate challenges anytime, anywhere. We will remain accessible through our trade hotline and email too,” he said."
Malay Mail,"Selangor flood crisis not a quick fix, four-year timeline needed, says exco",https://www.malaymail.com/news/malaysia/2026/04/21/selangor-flood-crisis-not-a-quick-fix-four-year-timeline-needed-says-exco/217149,"Tue, 21 Apr 2026 16:01:41 +0800","KUALA LUMPUR, April 21 — Flooding that continues to plague residents in Selangor is unlikely to be resolved for another four years, as the state’s flood mitigation projects remain ongoing and incomplete.
According to
Kosmo! Online
, State Infrastructure and Agriculture Exco Datuk Izham Hashim said river widening and deepening works are still underway and will take time before delivering a broader impact.
“This flooding issue cannot be resolved in a short period such as one or three months. The process of widening rivers and preparing design plans takes time and must comply with established procedures.
“So it cannot be completed quickly,” he told a press conference at the Selangor State Legislative Assembly (DUN) lobby today.
Izham said Selangor has adopted modern water management technologies from the Netherlands, China and Germany, but their effectiveness is constrained by the state’s high rainfall and rapid development.
He noted that the Netherlands receives between 700 and 900mm of rainfall annually, compared with nearly 3,000mm in Selangor.
“Even though we use technology from overseas, we have to be realistic. Our soil structure, development density and rainfall levels are very different.
“What matters most is not just adopting technology, but how we adapt it to the actual conditions in Selangor,” he said.
Yesterday, Selangor Ruler Sultan Sharafuddin Idris Shah had again issued a strong rebuke of the state government over persistent flooding during the opening of the state legislative assembly, saying the issue has yet to be effectively addressed despite repeated advice."
Malay Mail,"Sarawak Water: Viral message of Sungai Liku reservoir drying up, water rationing is fake",https://www.malaymail.com/news/malaysia/2026/04/21/sarawak-water-viral-message-of-sungai-liku-reservoir-drying-up-water-rationing-is-fake/217139,"Tue, 21 Apr 2026 15:35:53 +0800","MIRI, April 21 — Sarawak Water Sdn Bhd has dismissed a viral message circulating on social media and WhatsApp claiming the Sungai Liku reservoir is drying up due to hot weather and urging consumers to store water in anticipation of possible rationing.
The utility company said in a statement posted on Facebook that the latest technical monitoring showed the water level at Sungai Liku remains normal and sufficient for treatment and distribution across Miri.
It stressed that there are currently no plans to implement water rationing or scheduled supply interruptions.
“The water treatment plant continues to operate at full capacity to ensure an uninterrupted supply of treated water to all consumers,” it said.
Sarawak Water added that it views the spread of false information seriously, noting that such claims could cause unnecessary concern and panic among the public.
It advised the public to verify information through official channels before sharing it.
Sarawak Water also called on the public to stop circulating the false message, adding that any official notices on water supply disruptions would be issued via its official website, verified Facebook page, or through recognised media organisations in Sarawak. — The Borneo Post"
Malay Mail,"Kota Tinggi Bypass Bridge nears finish line, set to open July 28, says deputy works minister",https://www.malaymail.com/news/malaysia/2026/04/21/kota-tinggi-bypass-bridge-nears-finish-line-set-to-open-july-28-says-deputy-works-minister/217138,"Tue, 21 Apr 2026 15:30:12 +0800","KOTA TINGGI, April 21 — The Kota Tinggi Bypass Bridge project, built at a cost of more than RM104 million, is now 85 per cent complete and scheduled to be operational on July 28, said Deputy Works Minister Datuk Seri Ahmad Maslan.
He said the steel arch bridge will feature four lanes in two directions, spanning 464 metres in length and 22.6 metres in width.
“In addition, a 1,359-metre road leading to the bridge will be built in both directions.
“The old bridge will be demolished to make way after this project is completed,” he told reporters at the Kota Tinggi Public Works Department (JKR) office here today.
Ahmad said the new bridge is higher than the existing one, which currently sits lower and interferes with the waterway.
The Kota Tinggi Bypass Bridge project began in September 2020 and was temporarily halted during the Covid-19 pandemic.
The steel arch bridge is part of the wider Kota Tinggi Bypass project aimed at improving traffic flow in the area.
Meanwhile, Ahmad said the Kota Tinggi JKR is also carrying out maintenance works on 772.91 kilometres (km) of federal roads and 135.59km of state roads.
He said the works include routine and periodic maintenance, pavement and non-pavement works, as well as drainage, sewer and slope repairs.
“Until April last year, RM42.863 million had been allocated for the maintenance of federal roads, including road repairs, drainage systems, and improvements to road furniture and signage,” he said."
Malay Mail,"No ‘wait-and-see’: Perak braces for West Asia spillover, sets up twin committees to shield state economy",https://www.malaymail.com/news/malaysia/2026/04/21/no-wait-and-see-perak-braces-for-west-asia-spillover-sets-up-twin-committees-to-shield-state-economy/217137,"Tue, 21 Apr 2026 15:22:24 +0800","IPOH, April 21 — The Perak government will establish two special committees to implement a crisis impact mitigation plan amid the ongoing West Asia tensions, Menteri Besar Datuk Seri Saarani Mohamad said.
He said the proposed committees — the Special Committee on Crisis Impact Mitigation and the Crisis Impact Monitoring Committee — were recommended following a state-level coordination meeting chaired by the state secretary.
“The specific roles of these two committees will be detailed at the upcoming State Executive Council meeting, followed by the phased implementation of mitigation and intervention measures,” he said.
Saarani said this in his winding-up speech at the State Legislative Assembly today at the Perak Darul Ridzuan Building here.
He also stressed that the state government has not adopted a “wait-and-see” approach but has instead acted proactively and in a coordinated manner from the outset.
He said Perak had actively participated in the Special Menteri Besar–Chief Ministers Meeting on April 2, which specifically discussed the impact of the global energy crisis and the mitigation measures required at all levels.
“On April 8, I presented the report from the special meeting at the State Executive Council meeting, and the state secretary will take the necessary follow-up actions,” he added.
He said a subsequent coordination meeting involving heads of departments, chaired by the state secretary on April 14, was held to gather detailed feedback from all departments and agencies on the impact of the crisis — not only on the state’s economic sectors but also on the rakyat’s daily lives.
“As a result, several early measures have been initiated, including prioritising food security and reassessing state allocations to better focus on urgent needs,” he said.
He added that Institut Darul Ridzuan (IDR) had conducted a preliminary study outlining the impact of the crisis, along with recommendations to enable the state government to take swift action, develop a communication plan, and implement data-driven intervention measures.
He noted that all state-level measures would be aligned with ongoing and planned federal initiatives to avoid duplication or resource leakages, while ensuring efforts complement and strengthen existing approaches.
“The initial phase of mitigation will focus on the most basic needs — what is on the people’s kitchen and dining tables — to ensure a continuous food supply, especially for those most affected by the rising cost of living,” he said.
He added that subsequent phases would focus on strategic sectors and ensure that groups such as farmers and small entrepreneurs are empowered should the energy crisis worsen.
Saarani said the government’s broader efforts are also focused on ensuring a stable food supply, assisting affected sectors such as transportation, agriculture and fisheries, and strengthening the state’s economic resilience in the face of global uncertainties.
To support the plan, he said the state government would realign its 2026 expenditure by prioritising initiatives that directly address current public needs.
He added that the state government would not hesitate to review less critical allocations to optimise available resources for intervention measures.
“At the same time, if necessary, the state government will not hesitate to consider a supplementary budget to strengthen mitigation efforts.
“This will help safeguard the welfare of the rakyat, support affected sectors and ensure continued economic growth,” he said."
