Source,Title,Link,Date,Article
New Straits Times,"Iran Guards say strikes against Kuwait, Bahrain in retaliation for US attack",https://www.nst.com.my/world/world/2026/06/1474673/iran-guards-say-strikes-against-kuwait-bahrain-retaliation-us-attack,"Sun, 28 Jun 2026 09:34:31 +0800","TEHERAN, June 28, 2026 (AFP) -
Iran's Revolutionary Guards said on Sunday that it carried out strikes against Kuwait and Bahrain in retaliation for US attacks on Iranian territory, warning any further aggression would be met with a ""crushing response.""
The Guards ""destroyed eight important US military facilities at the Ali al-Salem base in Kuwait and at the Fifth Fleet naval base in Port Salman in Bahrain,"" they said in a statement.
""Any enemy aggression, whatever the pretext, even against insignificant targets... will have a crushing response,"" the Guards added.
bur-ane/tc
© New Straits Times Press (M) Bhd"
New Straits Times,"PN: We won't support PH, but backing BN in Johor polls is still undecided",https://www.nst.com.my/news/nation/2026/06/1474671/pn-we-wont-support-ph-backing-bn-johor-polls-still-undecided,"Sun, 28 Jun 2026 09:34:13 +0800","KOTA BARU: Perikatan Nasional (PN) has yet to decide whether it will support Barisan Nasional (BN) in the Johor election for the 14 seats that will see straight fights between BN and Pakatan Harapan (PH).
PN secretary-general Datuk Seri Takiyuddin Hassan said the coalition would discuss the matter before making a decision.
""There are seats where the contest is only between BN and PH. We have not decided who our members should support in those constituencies.
""It is definitely not PH, but whether we will support BN has yet to be decided.
""We will discuss the matter with our members first,"" Takiyuddin told reporters after attending the Kota Baru Pas annual general meeting last night.
He said PN component parties had yet to reach a collective decision on the matter.
""We will wait for the meeting before making any decision.
""Of course, in constituencies contested by Pas, we will support Pas.
""Likewise, for seats contested by other PN component parties, we have yet to make a final decision and will discuss it together,"" he said.
Fourteen of the 56 seats contested in the upcoming 16th Johor election will see straight fights between BN and PH.
The nomination process concluded yesterday.
Three seats will see
five-cornered contests
, 27 will feature three-cornered fights, while 12 will involve four-cornered contests.
© New Straits Times Press (M) Bhd"
New Straits Times,"FBM KLCI likely to trade within 1,660-1,690 range next week",https://www.nst.com.my/business/corporate/2026/06/1474655/fbm-klci-likely-trade-within-1660-1690-range-next-week,"Sun, 28 Jun 2026 09:29:50 +0800","KUALA LUMPUR: The FTSE Bursa Malaysia KLCI (FBM KLCI) is expected to trade within the 1,660-1,690 range next week, with volatility likely to persist as investors monitor developments in the global technology sector, geopolitical events and foreign fund flows, an analyst said.
Rakuten Trade Sdn Bhd vice-president of equity research Thong Pak Leng told Bernama that, nevertheless, the combination of oversold market conditions and more attractive valuations should support bargain-hunting activity.
For the week just ended, the FBM KLCI futures contracts were mostly lower in tandem with the cash market performances.
On a Friday-to-Friday basis, the June 2026 contract slid 48.0 points to 1,668.0, the July 2026 contract was 47.5 points easier at 1,669.50, the September 2026 contract shed 47.0 points to 1,650.0, and the December 2026 contract dipped 44 points to 1,653.0.
Weekly turnover soared to 146,493 lots from 32,203 lots last week, while open interest surged to 93,884 contracts from 37,764 contracts in the preceding week.
On a Friday-to-Friday basis, the benchmark index slipped 44.29 points to 1,667.74 from 1,712.03 a week earlier.
© New Straits Times Press (M) Bhd"
New Straits Times,Uptrend seem on Bursa Malaysia next week on stock rotation factor,https://www.nst.com.my/business/corporate/2026/06/1474653/uptrend-seem-bursa-malaysia-next-week-stock-rotation-factor,"Sun, 28 Jun 2026 09:22:47 +0800","KUALA LUMPUR: Bursa Malaysia is expected to trade higher next week as investors continue rotating from high-growth technology stocks into blue-chip and defensive sectors amid a more cautious global market environment.
IPPFA Sdn Bhd director of investment strategy and country economist Mohd Sedek Jantan said following the strong outperformance of technology stocks in recent weeks, investors are likely to rebalance their portfolios towards financials, healthcare, consumer-related and other defensive counters that offer more resilient earnings and attractive dividend yields.
""The FBM KLCI's decline below the 1,680 level this week is also likely to attract bargain hunting, particularly in fundamentally strong blue-chip stocks that have become more attractively valued following the recent pullback,"" he told Bernama.
He said this moderation in technology leadership could also benefit emerging markets, including Malaysia, as investors broaden their exposure beyond the United States mega-cap technology sector.
""We also see the potential for foreign investors to turn net buyers of Malaysian equities, supported by the FBM KLCI's attractive valuation relative to regional peers, resilient domestic economic fundamentals, improving corporate earnings prospects and renewed interest in high-quality blue-chip and defensive companies,"" Mohd Sedek added.
For the week just ended, Bursa Malaysia were mostly lower on profit-taking as investors stayed cautious amid a lack of positive catalysts.
On a Friday-to-Friday basis, the key index dipped 44.29 points to 1,667.74 from 1,712.03 a week earlier.
On the index board, the FBM Emas Index fell 316.03 points to 12,3654.02, the FBMT 100 Index lost 318.03 points to 12,201.59, and the FBM Emas Shariah Index sank 317.36 points to 12,241.30.
The FBM Mid 70 Index erased 436.39 points to 17,726.19 and the FBM ACE Index gave up 47.22 points to 4,745.30.
By sector, the Plantation Index was up 9.76 points to 8,882.98, the Energy Index dropped 20.37 points to 745.90, the Financial Services Index tumbled 541.46 points to 19,663.12, and the Industrial Products and Services Index trimmed 10.98 points to 179.59.
Weekly turnover decreased to 15.54 billion units worth RM13.11 billion, from 16.92 billion units valued at RM14.62 billion a week earlier.
The Main Market volume narrowed to 7.78 billion units valued at RM11.58 billion against 9.73 billion units worth RM13.06 billion previously.
Warrants turnover expanded to 5.15 billion units worth RM628.56 million versus 4.18 billion units valued at RM538.65 million last week.
The ACE Market volume eased to 2.59 billion units valued at RM899.90 million compared with 2.99 billion units worth RM1.01 billion in the previous week
© New Straits Times Press (M) Bhd"
New Straits Times,"Zahid to Johor Umno: Don't be disappointed if not chosen as candidates, your turn will come",https://www.nst.com.my/news/regional/2026/06/1474644/zahid-johor-umno-dont-be-disappointed-if-not-chosen-candidates-your,"Sun, 28 Jun 2026 09:11:42 +0800","PONTIAN: Johor party leaders and members have been told to set aside any disappointment over not being selected as candidates for the state election.
Umno president Datuk Seri Ahmad Zahid Hamidi said the party should focus on strengthening its machinery to ensure Barisan Nasional (BN) secures victory and maintains Johor as a BN and Umno stronghold.
""We still hear murmurs in certain areas where some are disappointed because they were not selected as candidates or retained. However, that is all part of one's destiny.
""We all know there was no interference from any outside party. I leave it entirely to the menteri besar and the division leadership to make the final decision,"" he said after launching the 'Blue Wave' campaign for the Benut state constituency at Jalan Parit Ismail yesterday afternoon.
Zahid said those unhappy over not being chosen should remain patient, as their opportunity may come in the future.
""Wait for the right time; when destiny arrives, it never goes to the wrong address. I am confident that opportunity will come one day,"" he said.
He added that the party's strength lies in the loyalty of its members and leaders.
© New Straits Times Press (M) Bhd"
New Straits Times,"Quake jolts northeastern Japan, no tsunami warning issued",https://www.nst.com.my/world/world/2026/06/1474638/quake-jolts-northeastern-japan-no-tsunami-warning-issued,"Sun, 28 Jun 2026 09:00:07 +0800","TOKYO: An earthquake with a preliminary magnitude of 6.1 shook northeastern Japan early Sunday, but it posed no threat of tsunami, Kyodo News reported.
The focus of the 5.21am quake was in the Pacific off Iwate Prefecture at a depth of about 40 kilometres (km), according to the Japan Meteorological Agency.
The quake measured lower 5 on the Japanese seismic intensity scale of 7 in parts of Aomori and Iwate prefectures.
No abnormalities were reported at the Higashidori nuclear power plant in Aomori or at the Onagawa nuclear power complex in Miyagi Prefecture, according to Tohoku Electric Power Co.
There were also no abnormalities at a nuclear fuel reprocessing plant in Rokkasho, a Pacific coastal village in Aomori Prefecture, Japan Nuclear Fuel Ltd. said.
The quake comes just days after an M7.2 earthquake struck the same region, injuring at least 10 people, disrupting bullet train services and forcing schools to close temporarily.
Thursday's early-morning quake also occurred off Iwate at a depth of 44km, measuring upper 6 on the seismic intensity scale in Hashikami, Aomori.
At the time, the agency urged the public to remain alert for earthquakes of up to the same intensity level over the next week.
Elsewhere, Friday saw an M5.6 quake jolt the central Japan prefecture of Yamanashi and nearby areas. The late-night temblor, at a depth of around 20km, measured lower 6 on the seismic intensity scale in Fujikawaguchiko, Yamanashi.
No abnormalities were detected in the volcanic activity of Mt. Fuji, Japan's highest peak and a volcano that straddles Yamanashi and Shizuoka prefectures.
The quake-hit area is near the convergence of multiple tectonic plates, including the Philippine Sea Plate. It was the first time since 1924 that an earthquake measuring in the 6 range on the intensity scale had struck Yamanashi. – BERNAMA
© New Straits Times Press (M) Bhd"
New Straits Times,Woman suffers 70pct burns from electric shock during cable theft attempt,https://www.nst.com.my/news/regional/2026/06/1474631/woman-suffers-70pct-burns-electric-shock-during-cable-theft-attempt,"Sun, 28 Jun 2026 08:43:49 +0800","SUNGAI PETANI: A woman suffered burns to 70 per cent of her body after receiving an electric shock while allegedly attempting to steal cables from a Tenaga Nasional Bhd (TNB) substation in Taman Ria Jaya yesterday afternoon.
Kuala Muda police chief Assistant Commissioner Hanyan Ramlan said she was rushed to hospital and placed in a medically induced coma.
""Her condition is reported to be critical,"" he said today.
Hanyan added that investigations are ongoing, including efforts to establish the woman's identity.
© New Straits Times Press (M) Bhd"
New Straits Times,"Explosions in Kyiv, targeted by missile attack",https://www.nst.com.my/world/world/2026/06/1474627/explosions-kyiv-targeted-missile-attack,"Sun, 28 Jun 2026 08:37:21 +0800","KYIV, (Ukraine): A ballistic missile attack is underway in Kyiv, the Ukrainian military said early today.
""Air defence forces are operating in the capital. Remain in shelters!"", the capital's mayor Vitali Klitschko said on Telegram.
AFP journalists heard explosions and saw several flashes in the sky.
Russian strikes a day earlier in Dnipropetrovsk in central-eastern Ukraine and the northern Sumy region killed two people.
It also comes after Ukraine launched attacks on Volgograd and Belgorod in Russia's southwest, and Horlivka, in the Donetsk region of Ukraine, which is controlled by Moscow.
Three people were killed in the attacks, regional authorities said.
Russia has targeted Ukraine with near-daily strikes since the launch of its full-scale invasion in February 2022, the bloodiest conflict in Europe since the Second World War.
Ukraine has also stepped up its strikes in recent months, which it describes as retaliatory, against Russia and the territories occupied by Moscow. — AFP
© New Straits Times Press (M) Bhd"
New Straits Times,Trump nominates former Oklahoma state trooper to head ICE,https://www.nst.com.my/world/world/2026/06/1474621/trump-nominates-former-oklahoma-state-trooper-head-ice,"Sun, 28 Jun 2026 08:24:03 +0800","WASHINGTON: US President Donald Trump on Saturday nominated a former police officer from Oklahoma to be the next director of the controversial US Immigration and Customs Enforcement agency, or ICE.
Trump said Lance Schroyer was a former state trooper and United States Marine ""with DECADES of experience locking up the worst of the worst.""
Schroyer would succeed Todd Lyons, appointed acting director of ICE in March 2025. Lyons stepped down from the position in May, a few weeks after the dismissal of then secretary of homeland security Kristi Noem.
Lyons, Noem and Gregory Bovino, the former head of Customs and Border Control, were the face of Trump's mass deportation campaign when it was at its most visible and controversial point some months ago.
The proposed new head of ICE has been helping wage that campaign, Noem's successor Markwayne Mullin wrote in a post on X.
""Lance is coming straight from the operational field where he ran large scale operations and worked alongside state and federal partners to remove illegal aliens from Oklahoma,"" Mullin said.
Individuals nominated to head federal agencies are supposed to be confirmed by the Senate, but that has not happened with ICE since 2017. Since then, its leaders have served in that capacity as interim directors.
""It has been 11 years since @DHSgov has had a Senate-confirmed @ICEgov Director. The Senate must quickly confirm Lance Schroyer,"" Mullin wrote.
Many Americans view the Trump administration's anti-immigration drive as excessive.
The controversy rose when federal agents killed two US citizens, Renee Good and Alex Pretti, as they protested enforcement raids in the northern city of Minneapolis.
Deportations continue, with Americans who disagree with them now often focusing their ire on sprawling detention facilities where detainees are held.
© New Straits Times Press (M) Bhd"
New Straits Times,Iran says US violated peace deal as both sides attack,https://www.nst.com.my/world/world/2026/06/1474593/iran-says-us-violated-peace-deal-both-sides-attack,"Sun, 28 Jun 2026 08:09:30 +0800","TEHERAN: Iran accused the United States on Saturday of violating their deal to end the Middle East war and hit US targets in the Gulf in retaliation for US strikes on Iranian territory.
The exchange of fire, which came after Washington accused Teheran of attacking a cargo ship in the Strait of Hormuz, raised doubts about efforts to keep the crucial waterway open while both sides negotiate a final deal.
Israel, meanwhile, launched strikes in Lebanon and Hizbollah's leader Naim Qassem rejected a deal to end the conflict that has also threatened to derail the wider US-Iran peace effort.
US Central Command (Centcom) said the latest American strikes targeted Iranian missile and drone storage sites and coastal radar positions, and were a response to ""unwarranted aggression against commercial shipping by Iranian forces"" that ""clearly violated the ceasefire.""
Iran said ""these brutal attacks... are a blatant violation"" of the deal to end the war, which began with US-Israeli strikes on Iran in late February and has sent oil prices surging as it disrupted the world economy.
Iran's Revolutionary Guards said they had struck US sites in the Gulf region and that ""if the aggression is repeated, our response will be broader.""
H.A. Hellyer, of the London think tank the Royal United Services Institute, said ""Iran is likely to continue calibrated, low-level coercive activity in and around the Strait of Hormuz... to create persistent pressure on international shipping without triggering a wider conflict.""
He said November's US midterm elections give Washington ""incentives for a quicker agreement"" while, for Iran, ""a drawn-out negotiation accompanied by controlled pressure in the strait can work to its advantage.""
Bahrain said it was targeted by several Iranian drones early on Saturday and accused Teheran of ""sabotaging peace efforts.""
Also on Saturday, British maritime security agency UKMTO said an ""unidentified projectile"" damaged an oil tanker in the strait.
'PROJECTILE IMPACT'
On the US strikes, Iranian media reported an explosion at a pier in the southern city of Sirik late Friday. It quoted a military source saying a ""projectile impact"" caused the blast.
""Sirik Port is operating normally,"" Mehr news agency later said.
Centcom described the operation as ""a powerful response to yesterday's attack on a commercial ship that was transiting the Strait of Hormuz.""
US President Donald Trump had earlier denounced what he described as an Iranian drone strike on the vessel as ""a foolish violation of our ceasefire agreement.""
Iran has warned vessels not to enter or leave the Gulf through the strait without permission, but ships have continued to move, some using a route not authorised by Teheran.
Despite the latest flare-up, oil prices have fallen sharply on hopes that traffic through Hormuz – through which in peacetime around a fifth of the world's oil and liquefied natural gas exports travel – would continue to recover.
The economic impact on Iran remains unclear, but on Saturday the country's statistics agency said that year-on-year inflation had hit 88.6 per cent, up from 68 per cent in February.
LEBANON THREATS
Lebanon was drawn into the Middle East war in early March, when fighter group Hizbollah launched rockets at Israel in support of Iran. That provoked an Israeli invasion and fighting that has also undermined the US-Iran ceasefire.
On Friday, Israel and Lebanon signed an agreement supported by the US aimed at securing long-term peace between the two countries.
But on Saturday, Hizbollah's chief Qassem rejected the deal. He called it ""humiliating, shameful and a surrender of sovereignty"" and labelled it ""null and void.""
He instead called for the full implementation of Washington's deal with Teheran, which includes an end to the fighting in Lebanon.
Hizbollah has repeatedly called for a full Israeli withdrawal from southern Lebanon, but the Washington deal does not appear to provide for that.
Israeli Prime Minister Benjamin Netanyahu has insisted Israeli troops will remain in the so-called security zone they occupy in southern Lebanon and civilians prevented from returning until Hizbollah was disarmed.
On Saturday, the Israeli premier called the deal historic and ""a blow to Iran and Hizbollah.""
And he asserted that both the United States and Lebanon ""have recognised Israel's right to maintain a security zone inside Lebanon for as long as it remains necessary to safeguard our security.""
The agreement is not universally popular in Israel. Netanyahu's far-right security minister Itamar Ben Gvir denounced it as ""a big mistake"" on Saturday.
Ben Gvir insisted that only Israeli forces were capable of disarming Hizbollah. Earlier in the day, Defence Minister Israel Katz said he had told the country's troops ""to prepare for an extended stay in the security zone.""
Meanwhile, the Israeli military said it carried out an airstrike on Saturday targeting suspected fighters in the south – the first such attack since Washington announced the framework agreement between the two countries.
Lebanon's National News Agency then reported early Saturday evening that Israel had carried out fresh strikes in the south of the country.
The health ministry later reported at least one killed and two wounded in an Israeli airstrike on Nabatieh al-Fawqa.
© New Straits Times Press (M) Bhd"
New Straits Times,Gazans flee scorching tents for a polluted sea,https://www.nst.com.my/opinion/columnists/2026/06/1474591/gazans-flee-scorching-tents-polluted-sea,"Sun, 28 Jun 2026 08:05:35 +0800","RESIDENTS of the Gaza Strip have been flocking from suffocating tents to the territory's polluted Mediterranean shore to bathe and wash their clothes, as summer temperatures rise and fresh water remains hard to come by.
Nearly all Gaza's population was displaced during two years of war between Israel and Hamas, with Gazans now crammed into ​a narrow strip along the coast, mainly in tents and damaged buildings.
""The only outlet in the Gaza Strip, from north to south, is the sea,"" said Wadie al-Ras, 36, a displaced Palestinian standing on Gaza City's shore.
""The tents we have been staying in since the war are a torment.""
Before war with Israel broke out in October 2023, Gaza City's sandy beach was a favourite spot for locals to relax. Now it is their only refuge from the crammed, makeshift tents, which are a hotbed of bugs and disease.
Temperatures in Gaza range between 28 and 31 degrees Celsius in the mornings, and inside the tents, it feels far hotter.
The sea offers little comfort. The water is thick with sewage and waste, the result of a collapse of infrastructure that once served a population of more than two million people.
""The seawater is not clean. There's sewage in it, filled with dirt,"" said Shehab al-Suwaireki, 36, a displaced father of six.
With no steady supply of fresh water, however, families have been left with little choice.
""We go in and wash (clothes) and bathe then we get out,"" Suwaireki said. ""In any case, germs are getting to our bodies.""
Many water pumps have stopped working due to Israeli bombardment, while sewage stations, pumping facilities, and water treatment plants have all been severely damaged, said Husni Muhanna, a spokesperson for the Gaza municipality.
""Residents resort to the beach despite all the dangers,"" Muhanna said.
The war began when Hamas-led militants attacked Israel from Gaza on Oct 7, killing 1,200 people and seizing 251 hostages.
Israel responded with an all-out assault on Gaza that killed at least 73,000 Palestinians, according to health officials in the Hamas-controlled territory.
Despite an October 2025 truce, Israel has continued to carry out deadly attacks in Gaza, which it says aim to thwart imminent attacks by Hamas and other militants.
Hamas has so far rebuffed calls to lay down its arms in exchange for Israel ​withdrawing its troops.
Aid and basic essentials are scarce.
Nahed Hamouda, a 56-year-old father of four who has been displaced from Jabalia, north of Gaza City, said the tents were ""like an oven.""
""There's no electricity, no fan, no water, even the food is inedible,"" he said, as he sat fanning himself with a piece of cardboard.
* The writer is from Reuters
© New Straits Times Press (M) Bhd"
