Source,Title,Link,Date,Article
New Straits Times,"24,751 early voters head to Johor polls [WATCH]",https://www.nst.com.my/news/nation/2026/07/1482368/24751-early-voters-head-johor-polls-watch,"Tue, 07 Jul 2026 07:38:21 +0800","JOHOR BARU: A total of 24,751 early voters eligible to vote in the 16th Johor election will cast their ballots today at 64 gazetted polling centres across the state.
The early voting electorate comprises 12,041 members of the Malaysian Armed Forces (ATM) and their spouses, as well as 12,710 Royal Malaysia Police (PDRM) and General Operations Force (GOF) personnel and their spouses.
Of the total PDRM early voters, 12,067 will vote in person today, while 643 have cast their ballots by post.
All 53 police polling centres and 11 military polling centres will open simultaneously at 8 am. Polling will close progressively between noon and 6pm, depending on the location and the number of registered voters.
Polling centres with small electorates, including Tenang Police Station in the Tenang state constituency, with only six voters, and Bukit Besar Police Station in the Pasir Raja constituency, with 11 voters, are expected to close as early as noon.
Meanwhile, polling centres at the Muar District Police Headquarters (IPD), Kahang Police Station in the Kahang constituency and Johor Baru Utara IPD will remain open until 6pm.
To ensure a smooth voting process, the police have deployed 3,565 personnel, comprising 647 officers, 2,806 rank-and-file personnel and 112 civilian staff, to oversee operations statewide.
Their duties include securing polling centres, escorting ballot boxes, managing traffic, conducting crime prevention patrols, staffing operations rooms, monitoring strategic locations and enforcing the law throughout the election.
All early ballot boxes will be kept at designated police stations and will only be opened for counting after the close of ordinary polling on Saturday.
The 16th Johor election has attracted 172 candidates contesting 56 state seats, with polling day for 2.7 million registered voters set for July 11.
For the latest updates on the 16th Johor election, visit https://prn.bernama.com/johor/ – BERNAMA
© New Straits Times Press (M) Bhd"
New Straits Times,"Malaysia's FMM, Hong Kong productivity council deepen smart manufacturing push",https://www.nst.com.my/business/economy/2026/07/1482366/malaysias-fmm-hong-kong-productivity-council-deepen-smart,"Tue, 07 Jul 2026 07:36:24 +0800","HONG KONG: The Federation of Malaysian Manufacturing (FMM) plans to scale up its collaboration with Hong Kong Productivity Council (HKPC) to accelerate the adoption of smart manufacturing and Industry 4.0 among enterprises in both economies.
FMM president Jacob Lee Chor Kok said both parties have been aggressive in their efforts to identify factories in Malaysia that Hong Kong enterprises can assist to improve productivity among manufacturers in the country.
""HKPC are bringing some of their engineers to visit our factories. They will give us solutions and proposals to further improve operations.
""That happened immediately after we signed an MoU with them,"" he told reporters in an interview at the South China Morning Post GBA-Asean Summit.
The FMM and HKPC signed a memorandum of understanding in April to strengthen industrial collaboration and improve manufacturing productivity in both economies.
However, Lee said the pace of collaboration is still slow and will also be costly for Hong Kong enterprises to come to Malaysia for these visits in the long run.
To further streamline the partnership with HKPC, Lee said that FMM plans to invite Hong Kong-based technology or solution provider companies to either set up their operations in Malaysia or initiate a joint venture with local talents.
""I believe this will speed up the rollout of Industry 4.0 or smart manufacturing in both Malaysia and Hong Kong,"" he added.
Meanwhile, Lee said there is a need for Asean and China's Greater Bay Area (GBA) to have a more resilient and integrated supply chain amid the geopolitical tensions and high tariffs environment.
A greater integration of supply chain between both economies enables Malaysia to seek alternative supply sources amid limited options during the escalating geopolitical tensions.
""At the moment, even though Malaysia is an oil-producing nation, with the disruption in the oil supply, we need to import from the Middle East as there are about 34 critical materials that are in shortage.
""So we need to work together to see how we can have alternative supply sources, working together with the GBA and China in particular.
""However, Malaysia is non-aligned politically, so the neutral policy that the Malaysian government is adopting is actually helping Malaysia to steer through the geopolitical conflicts,"" he added.
He said the China Plus One strategy is benefiting Malaysia mainly from the renewed interest in investments to the country coming from China as well as Taiwan.
""We need to reconstruct the model between GBA and Asean and go beyond asking what China or what GBA could manufacture for Asean to what we can build together for Asean, China as GBA, as well as the global market.
""In Malaysia, I think our trade policy and even our investment policy are moving towards creating a spillover effect from the foreign direct investment into Malaysia, and then to strengthen the local supply chain,"" said Lee.
Additionally, Lee said the local manufacturing is eyeing a shared digital certification and product traceability system in an effort to improve supply chain integration with the GBA.
The move will help to create a single and shared digital standard, where a shipment can be traced by its production batch from the factory floor in Malaysia and all the way to consumers in the GBA.
""We will open up a massive, high-yield market for processed food, agricultural products, and cold chain logistics. We would want to put the emphasis on the food sector because we feel that the food sector has a lot of regulations to comply with for food safety.
""Recently, there were 40 containers of durians, not from one origin, that were shipped to China. There was one container that was tested with high doses of the fertiliser, and the whole 40 containers of durians were shipped back to Malaysia. That became a very big challenge.
""So, we do hope that if we can establish an e-certification and interoperability and be accepted by both the regions where there is trust, that can reduce a lot of repeat testings and reduce a lot of paperwork and time for clearance,"" added Lee.
© New Straits Times Press (M) Bhd"
New Straits Times,Race to recover bodies ahead of Venezuela quake cleanup,https://www.nst.com.my/world/world/2026/07/1482364/race-recover-bodies-ahead-venezuela-quake-cleanup,"Tue, 07 Jul 2026 07:33:30 +0800","CARABALLEDA: The international rescue teams are packing up and heavy excavators are clearing rubble left by Venezuela's earthquakes.
But for Raul Alvarado the search goes on.
Watching volunteers pick through the crushed remains of his 12-storey apartment building, Alvarado knows his mother, father and older brother are inside.
Their third-floor apartment now sits at eye level, crushed under piles of concertinaed concrete slabs from the OPP 26 building in coastal Caraballeda, one of the districts hardest hit by the quakes.
Deaths from the June 24 disaster have crept past 3,500, but for families like Alvarado's there is still the race to find the tens of thousands reported missing.
Twelve days after the quakes hit, time is running short.
Diggers are already clearing parts of the OPP complex, shaking the ruins even as volunteers and families continue to burrow for the bodies of loved ones.
""They were together, the three of them, hugging,"" said Alvarado of the last moment he saw his family.
He managed to pull himself out of the rubble because he was in a different room.
""This building was full. My neighbour had five grandchildren, all of them are trapped in there.""
Stuck in the layers of floors, a microwave, mattresses and crates of beer are the only signs of the building's previous life.
Nearby, a large excavator slams its shovel into another building's remains.
The UN has estimated that as many as 50,000 people could be missing in one of Latin America's worst earthquake disasters. The government has yet to give any estimate.
But the OPP complex is only one among the nearly 200 buildings that were destroyed or collapsed when the 7.2- and 7.5-magnitude quakes struck. Most of those are in the epicentre, the coastal La Guaira area.
All around Alvarado's building lies destruction. Some apartment blocks are stripped of their facades. Others are fully collapsed, floor slabs stuck together. Others simply disappeared into rubble.
Dozens of families of the missing wait on top of mountains of debris where the OPP buildings once stood. Volunteers and firefighters dig small tunnels through the concrete floors to reach lower apartments.
Some sit under makeshift shelters, others use picks and drills powered by generators. Inside one hole, the body of a young girl lies trapped, covered in lime.
Alny Pacheco, a volunteer working at one tunnel, said since the earthquakes they had taken out 12 dead. On Monday, his team had found another.
MISSING ONLINE
After the quakes, online registries appeared to help find the missing. One, ""Venezuela Earthquake Disappeared"", has more than 30,000 names still unaccounted for. Another, ""Venezuela Looks for You"", has registered 25,000 already found, and another 18,100 unaccounted for.
""The high number of people reported missing on online platforms remains horrifyingly credible,"" Jens Laerke, deputy spokesperson for the UN Office for the Coordination of Humanitarian Affairs (OCHA), told AFP.
""That does not mean all are under the rubble, but it illustrates the scale of the distress facing families.""
National Assembly President Jorge Rodriguez has said images from drones, registries and family accounts showed an estimated 30,000 people were in La Guaira. Around 19,800 escaped or had been rescued, he said.
He did not refer to the whereabouts of the other approximately 10,000, or say whether that figure included confirmed deaths.
Professor Katsu Goda, of Western University's earth sciences department in Canada, said a combination of the unusual double quake and the potential vulnerability of reinforced concrete materials may have contributed to the high number of missing.
The first earthquake would have weakened many structures, while the second shock likely caused additional collapses before occupants could escape. As a result, damage was amplified, he told AFP.
""When reinforced-concrete buildings collapse, they often generate enormous volumes of dense rubble that are extremely difficult and dangerous to search,"" he said.
""In some cases, progressive or 'pancake' collapses can trap occupants within compressed layers of debris, making rescue operations and victim identification particularly challenging.""
The scale of the disaster, as in Haiti in 2010, also meant many people could be classified as missing for a while, he said.
For Daniela Alvarez – who is looking for her sister, nieces and brother-in-law in an OPP block – time is running out.
""How can they be looking to demolish everything without knowing if people are still under there?"" she said.
""Our families will come out in pieces.""
© New Straits Times Press (M) Bhd"
New Straits Times,MB: Mid-term review to find and fix issues,https://www.nst.com.my/news/nation/2026/07/1482355/mb-mid-term-review-find-and-fix-issues,"Tue, 07 Jul 2026 07:15:12 +0800","IPOH:  The state government will undertake a mid-term review of the Perak Sejahtera 2030 blueprint to ensure the state's long-term development agenda remains relevant and aligned with current economic realities.
Menteri Besar Datuk Seri Saarani Mohamad said the review would be carried out by  Institut Darul Ridzuan (IDR) and the State Economic Planning Unit (Upen) following the appointment of Dr Zulqarnain Mohamad as IDR's chief executive officer.
""We have appointed a new CEO for IDR, and the work will commence together with Upen.
""We have to complete the study before next year because we usually hold the state leadership retreat annually. The review must be finalised before that,"" he said.
Saarani was speaking after presenting the fourth-year progress report on Perak Sejahtera 2030 here yesterday.
He said the findings of the review would determine whether adjustments were needed to the blueprint, including its flagship initiatives.
""It depends on the outcome of the mid-term review. We found that some districts have progressed much further, while others are still moving slowly, so adjustments will have to be made,"" he said.
He said the review would also assess whether the economic focus assigned to each district remained appropriate.
Under the  blueprint, he said each district had been assigned an economic niche based on its strengths.
""Every district has its own character. They are expected to focus on their respective niches, but if the district officer and the district development committee find that the original focus is no longer suitable, we will realign it.
""This will enable the district to better develop its own strengths while encouraging healthy competition among districts.
""We are not competing to undermine one another. Rather, we complement each other,"" he said.
He added that the rationalisation and review of projects under the Perak Sejahtera 2030 Dashboard would ensure that all monitored projects and initiatives remained fully aligned with the state's development direction.
Saarani said the next phase of Perak Sejahtera 2030 would also focus on targeted ""quick-win"" projects to complement ongoing efforts to enhance the implementation of the development blueprint.
He said these measures would form the foundation for ensuring that Perak Sejahtera 2030 remained a dynamic development framework that was effectively implemented and delivered meaningful benefits to the people.
© New Straits Times Press (M) Bhd"
New Straits Times,Australia's Lynas signs deal with South Korea's JS Link to develop Malaysian magnet factory,https://www.nst.com.my/world/world/2026/07/1482353/australias-lynas-signs-deal-south-koreas-js-link-develop-malaysian,"Tue, 07 Jul 2026 07:11:08 +0800","Lynas Rare Earths said on Tuesday it has signed a partnership deal with South Korea's JS Link to develop a magnet factory in Malaysia.
The companies have also agreed that the Australian rare-earths producer will supply rare-earth materials to JS Link's magnet factory in South Korea and the planned factory in Malaysia until January 2038.
The partnership follows a magnet manufacturing deal between the two companies last year.
Under the latest deal, JS Link will establish a magnet factory in Kuantan, Malaysia, with an operating capacity of 3,000 tonnes per annum of neodymium-iron-boron (NdFeB) permanent sintered magnets.
To support the development of the Malaysian facility, Lynas will invest around A$50 million (US$34.78 million) in JS Link shares.
© New Straits Times Press (M) Bhd"
New Straits Times,"Delivering results, building confidence",https://www.nst.com.my/news/nation/2026/07/1482349/delivering-results-building-confidence,"Tue, 07 Jul 2026 07:01:37 +0800","THE Perak Sejahtera 2030 blueprint remains firmly on track, with its implementation beginning to translate the state's economic growth into tangible benefits for the people.
Menteri Besar Datuk Seri Saarani Mohamad said the blueprint has over the past four years become the state's key development framework for strengthening the economy, attracting investments, creating jobs and improving the people's well-being.
""When the blueprint was launched on June 15, 2022, both the country and the state were still grappling with the effects of the Covid-19 pandemic, which had placed immense pressure on people's livelihoods, the economy and the state's finances.
""Four years on, the state's foundations have been strengthened and the results of its implementation are beginning to show,""  said Saarani when presenting the fourth-year progress report of Perak Sejahtera 2030 at a hotel here yesterday.
Carrying the theme ""Delivering Results, Building Confidence"" (Hasil Dirasa, Keyakinan Dibina), the report assesses the progress of the state's long-term development agenda and how it has begun to improve the lives of the people while strengthening confidence in Perak's future.
Saarani said the progress was reflected in the state's economic performance, with Perak recording gross domestic product (GDP) growth of 5.7 per cent last year, surpassing the national growth rate of 5.2 per cent.
He said Perak was also the country's sixth-largest contributor to the national GDP at 5.3 per cent, underscoring its growing role in Malaysia's economic expansion.
""Investor confidence has also strengthened, with approved investments rising from RM6.61 billion in 2022 to RM15.76 billion in 2025,"" he said.
He attributed the increase to the state's five strategic growth nodes, which have become the cornerstone of job creation, stronger industrial value chains and wider economic spillover across Perak.
Among the initiatives introduced under the blueprint are the Perak Sejahtera Card, mobile shops and Pasar Sejahtera Rakyat, aimed at helping people obtain essential goods at more affordable prices.
Saarani said the true measure of the state's economic progress was not headline investment or growth figures, but whether the benefits were being felt by the people.
He said the primary objective of  Perak Sejahtera 2030  was to ensure the state's people have stable and quality sources of income, enabling them to improve their standard of living while stimulating economic activity.
""Our starting point has always been to ensure that the people of Perak have stable, quality incomes. Once they have a steady income, they will spend.
""When people spend, the entire business ecosystem benefits. If someone buys a motorcycle, the motorcycle shop benefits. If they buy a burger, the burger stall benefits. The same applies across all sectors.
""That, in turn, strengthens the capacity of businesses to grow. Ultimately, this is what we want to achieve through Perak Sejahtera — creating opportunities for the people to earn stable, quality incomes and enjoy a better quality of life.""
Saarani also expressed his appreciation to  Sultan of Perak Sultan Nazrin Muizzuddin Shah for the ruler's continued guidance and support for the state's development agenda.
""We are grateful and extend our deepest appreciation to His Royal Highness Sultan Nazrin Muizzuddin Shah for his constant guidance. Tuanku regularly calls us for discussions, offers advice and shares valuable views.
""His Royal Highness wants to ensure that what the government is implementing today will ultimately benefit the people and be felt by them. We, therefore, extend our heartfelt gratitude to Tuanku for his unwavering support,""  said Saarani.
© New Straits Times Press (M) Bhd"
New Straits Times,'Year 4 Learning Matrix is for early intervention',https://www.nst.com.my/news/nation/2026/07/1482347/year-4-learning-matrix-early-intervention,"Tue, 07 Jul 2026 06:50:13 +0800","Your browser does not support the audio element.
THE 2026 Year Four Learning Matrix, scheduled for Oct 6-8, will be used to identify learning needs and guide early intervention, not rank pupils or schools, said the Education Ministry.
Education Ministry Examinations Board director Ab Aziz Mamat said the learning matrix would be conducted as ""an assessment for learning"", enabling teachers, schools and parents to identify pupils' mastery levels and learning gaps before they enter secondary school.
""Assessing pupils in Year Four gives us the opportunity and space to help them in Years Five and Six.
""The data are used by schools to plan and implement appropriate interventions for those who need additional support.""
He said the results would serve as a diagnostic tool to help teachers identify pupils' strengths and weaknesses and design targeted interventions.
""The data is for interventions at the pupil and school levels, not to rank schools or compare performances.""
Ab Aziz said the findings would also help the ministry identify  learning gaps nationwide and evaluate the  education system's effectiveness to support evidence-based policymaking.
He added that the assessment could identify, among other things, disparities between urban and rural schools so that pupils could receive support based on their needs.
""If a pupil is identified as requiring more comprehensive intervention, the school and teachers must ensure the weaknesses are addressed before the pupil enters secondary school.""
Ab Aziz said the learning matrix was introduced after feedback from teachers, parents and stakeholders on the need for a standardised mechanism to assess mastery levels.
He said concerns over pupils' readiness for secondary school, including the lack of continuity between primary and secondary education, were also taken into account.
""We ultimately decided not to reinstate Ujian Pencapaian Sekolah Rendah or Pentaksiran Tingkatan 3. Instead, our focus is on developing the competencies of every pupil within the education system.
""That is why, through the National Education Plan 2026-2035, we are introducing the Year Four and Form Three Learning Matrix to address past weaknesses and better prepare future generations for increasingly complex global challenges,"" he added. — BERNAMA
© New Straits Times Press (M) Bhd"
New Straits Times,"Russian strikes kill 28 in Kyiv area, exposing Ukraine air-defence shortages",https://www.nst.com.my/world/world/2026/07/1482343/russian-strikes-kill-28-kyiv-area-exposing-ukraine-air-defence,"Tue, 07 Jul 2026 06:46:44 +0800","KYIV: Russia hammered Kyiv and the surrounding region with missiles and drones early on Monday, killing at least 28 people and exposing Ukraine's critical shortage of US-made air-defence interceptors, officials said. Rescuers were digging bodies from the rubble of a Kyiv high-rise ripped open in the overnight bombardment.
The latest attack came on the eve of a Nato summit where US President Donald Trump is due to hold talks with Ukraine's President Volodymyr Zelenskyy in a renewed push for peace.
Ukraine's military was unable to down any of the 23 ballistic missiles fired by Russia, according to air force data, reflecting its increasing vulnerability to Moscow's strikes as stocks of its prized Patriot missiles run out.
Zelenskyy has pleaded for interceptors — the only weapon in Ukraine's arsenal that can shoot down ballistic projectiles, whose high velocity and steep flight path make them difficult to stop.
Speaking in his nightly video address, Zelenskyy said it was ""simply absurd that, in the modern world, production has still not been scaled up to the level actually required to protect people from ballistic terror.""
He said that Ukraine had the know-how to produce the weapons and if it received US licences to manufacture U.S. Patriot systems ""our production would be sufficient not only to defend Ukraine but also to assist partners who need them."" Earlier, the president called for ""strong decisions"" at the Nato summit in Turkiye, which begins on Tuesday, to ensure Ukraine can defend itself. Ukrainian air force data shows air defences shot down just four of 49 ballistic missiles in July.
""As long as Patriot missiles sit in our allies' stockpiles, Russia is only encouraged to keep destroying residential buildings,"" Zelenskiy said on X. ""The U.S. and Europe have the power to stop this terror.""
Ukraine intercepted 37 other missiles and more than 90% of the 351 drones used during Monday's attack, the air force said.
© New Straits Times Press (M) Bhd"
New Straits Times,"Pulau Tuba gets sea ambulance, emergency birthing unit",https://www.nst.com.my/news/nation/2026/07/1482339/pulau-tuba-gets-sea-ambulance-emergency-birthing-unit,"Tue, 07 Jul 2026 06:40:12 +0800","Your browser does not support the audio element.
THE Health Ministry has rolled out a RM1.45 million sea ambulance and emergency birthing unit (EBU) on Pulau Tuba for the benefit of more than 5,000 island residents.
The ministry said in a statement yesterday the 12-metre sea ambulance, which began operations on May 20, was custom-built for patient transport and equipped with modern emergency care facilities.
The facility was delivered 18 weeks ahead of schedule due to efficient project management, it added.
""With an average of seven to 10 emergency referrals by sea to Langkawi's health facilities every month, the need for this service is undeniable,"" said the statement.
The sea ambulance now enables faster, safer and more efficient patient transfers, strengthening emergency response for the entire island community, it added.
Meanwhile, the EBU facility is a rebranding of the alternative birthing centre (ABC) from July 2024, supported by RM50,000 in upgrades and equipment.
""The EBU serves as a primary facility to ensure expectant mothers receive early treatment in obstetric emergencies, especially when transfer to a hospital is hampered by bad weather or rough seas,"" said the ministry.
Since becoming operational, the EBU has helped manage maternal referrals more systematically, with an average of six cases per year.
To date, no emergency births have been recorded on the island.
""This achievement reflects the effectiveness of the health team's risk screening, antenatal monitoring and early referral practices,"" it said.
Health Minister Datuk Seri Dr Dzulkefly Ahmad launched both initiatives at Klinik Kesihatan Pulau Tuba yesterday. — BERNAMA
© New Straits Times Press (M) Bhd"
