Source,Title,Link,Date,Article
New Straits Times,U Mobile sets up advisory panel for enterprise innovation platform,https://www.nst.com.my/business/corporate/2026/07/1482335/u-mobile-sets-advisory-panel-enterprise-innovation-platform,"Tue, 07 Jul 2026 06:30:31 +0800","Your browser does not support the audio element.
KUALA LUMPUR: U Mobile Sdn Bhd has roped in industry leaders in artificial intelligence (AI), enterprise innovation, small and medium enterprise (SME) development and digital ecosystems to strengthen its enterprise innovation platform (EIP).
Together, they formed an advisory panel to guide the EIP, which is U Mobile's open innovation platform designed to connect enterprises, technology partners, startups, academia and ecosystem stakeholders to accelerate innovation and digital transformation.
The advisory panel will offer insights on key innovation priorities, evolving enterprise demands and opportunities to strengthen ecosystem partnerships.
Its members include SME Association of Malaysia national president Dr Chin Chee Seong, Malaysia Smart City Alliance Association chairman Dr Raslan Ahmad, Data Management Association Malaysia Chapter president Dr Habsah Nordin and Konsortium AI Negara founding member Tan Aik Keong.
""The panel will also provide input on the development of commercially relevant use cases and innovation pathways that support EIP's ambition of helping organisations move from experimentation and pilot initiatives towards scalable, real-world applications,"" U Mobile said.
Chief technical officer Woon Ooi Yuen said the advisory panel will help the platform identify high-impact innovation opportunities, foster collaboration and drive the development of practical, real-world use cases.
""As EIP enters its next phase, these insights will be invaluable in helping us build stronger pathways from co-creation and experimentation to enterprise adoption and real-world impact,"" he said.
© New Straits Times Press (M) Bhd"
New Straits Times,Charlie Kirk widow comes face-to-face with alleged killer,https://www.nst.com.my/world/world/2026/07/1482333/charlie-kirk-widow-comes-face-face-alleged-killer,"Tue, 07 Jul 2026 06:23:32 +0800","LOS ANGELES: The widow of assassinated right-wing activist Charlie Kirk came face-to-face Monday with the man alleged to have killed him, during a court hearing in the western United States.
Erika Kirk was among those attending a preliminary hearing that will determine if there is enough evidence for 23-year-old Tyler Robinson to face trial over the September 2025 shooting on a Utah university campus.
The killing of Kirk, a right-wing luminary whose Turning Point USA organization was key to mobilizing young people to vote for President Donald Trump, sent shockwaves through America's politics and roiled debate for weeks.
Erika Kirk, who was accompanied in the Utah court by Donald Trump Jr and other high-profile figures on the right, said her husband had been ""beloved.""
""Every court proceeding serves as a painful reminder of his death and the loss that has irrevocably impacted our lives and the lives of his children,"" she wrote on social media hours before the proceedings started.
""We remain deeply grateful for the support, prayers, and kindness we have received. This outpouring has sustained us during the darkest days of our lives.""
On the first day of the hearing, which is scheduled to last all week, Robinson appeared in court in handcuffs, wearing a gray suit and a dark tie.
He has not yet indicated whether he intends to plead guilty or not.
Investigators say Robinson – raised Mormon in a Republican household – murdered Charlie Kirk because he could not tolerate the ""hate"" he preached.
Detectives say Robinson confessed to the murder in text messages sent to the transgender person with whom he shared an apartment, and with whom he was in a romantic relationship.
Charlie Kirk was a 31-year-old Christian nationalist who played a major role in spreading disinformation about the 2020 presidential election - which Trump refuses to accept he lost.
He positioned himself as a staunch defender of the traditional family and was highly critical of the LGBT community and transgender individuals.
Erika Kirk has become a polarizing figure in the growing schism on the right of American politics, where some have accused her of exploiting her husband's death.
© New Straits Times Press (M) Bhd"
New Straits Times,Trump says there will either be a deal with Iran or US will 'finish the job',https://www.nst.com.my/world/world/2026/07/1482325/trump-says-there-will-either-be-deal-iran-or-us-will-finish-job,"Tue, 07 Jul 2026 06:10:20 +0800","WASHINGTON: President Donald Trump said on Monday the United States would either reach a deal with Iran or ""finish the job,"" renewing his threat of military action as Teheran projects defiance following the funeral of Supreme Leader Ayatollah Ali Khamenei.
Indirect US-Iran talks ended last week without any public sign of headway toward a lasting peace, despite a 60-day ceasefire intended to create space for diplomacy following the US and Israeli strikes that triggered the conflict.
""We're either going to make a deal or we're going to finish the job. OK. And it won't be tough to finish the job. I'd rather make a deal, because I don't want to affect 91 million people,"" Trump told reporters in the Oval Office.
""We can knock down their bridges in one hour, we can knock out their energy supply.... They don't have any money now.
""We haven't given them any money."" Secretary of Iran's Supreme National Security Council Mohammad Baqer Zolqadr called Trump's threat ""delusional.""
""Iranians are unfamiliar with the language of threats. So speak to the Iranian people with respect, otherwise we will respond in another language,"" Zolqadr said in comments carried by state media.
Trump spoke after Khamenei's weekend funeral where, rather than looking weakened by the war that began with US and Israeli strikes on Feb 28, Iranians appeared to be defiant,  united and determined ‌to shape what comes next.
The 60-day ceasefire was intended by Washington to revive ​diplomacy on stopping Iran developing a nuclear arsenal.
© New Straits Times Press (M) Bhd"
New Straits Times,"Microsoft cuts 4,800 jobs as it revamps Xbox",https://www.nst.com.my/world/world/2026/07/1482317/microsoft-cuts-4800-jobs-it-revamps-xbox,"Tue, 07 Jul 2026 06:00:36 +0800","WASHINGTON: Microsoft said Monday it was eliminating about 4,800 jobs – roughly two percent of its global workforce – in a cost-cutting move that will deliver a sweeping restructuring of its struggling Xbox gaming division.
The cuts include the deepest overhaul in Xbox's history, with approximately 3,200 gaming jobs to be shed over the coming fiscal year, including positions at four studios that are being spun off or sold.
The announcement is the latest in a string of mass layoffs by the technology giant as it spends massive amounts of money to stay in the artificial intelligence race, with companies investing tens of billions of dollars in AI-ready data centers and computing power.
""Our business is changing because the world around it is changing,"" Amy Coleman, Microsoft's executive vice president, wrote in a memo to all employees.
""Companies don't get to choose whether their industry changes; they only get to choose whether they change with it.""
Coleman said the layoffs fell mostly within Microsoft's commercial business and Xbox.
She said the eliminated roles were ""not being replaced by AI,"" but acknowledged that automation is reshaping how work is done across the company.
On the commercial side, she said the cuts would build on Microsoft's $2.5 billion push, announced last week, to embed 6,000 engineers with major clients to accelerate AI adoption.
At Xbox, CEO Asha Sharma told employees in a separate memo that 1,600 positions were being cut immediately, with the rest to follow through fiscal year 2027.
Xbox has been through successive rounds of cuts since Microsoft's $68.7 billion acquisition of Activision Blizzard in 2024 after a long review process by regulators over competition concerns.
© New Straits Times Press (M) Bhd"
Malay Mail,"PM’s  Dept: Luxury vehicle seen used by Anwar an existing govt asset, official car under maintenance",https://www.malaymail.com/news/malaysia/2026/07/07/pms-dept-luxury-vehicle-seen-used-by-anwar-an-existing-govt-asset-official-car-under-maintenance/226635,"Tue, 07 Jul 2026 09:16:15 +0800","KUALA LUMPUR, July 7 — A luxury vehicle used by Prime Minister Datuk Seri Anwar Ibrahim recently is an existing government asset and not a new official vehicle.
The Prime Minister’s Department (JPM) together with the Ceremonial and International Conference Secretariat Division (BIUPA) in a statement on Facebook yesterday announced that the BMW vehicle is an asset under the supervision of BIUPA which is specifically for the country’s official logistics use.
According to the statement, the asset is provided to meet the requirements of international security protocols and standards during official visits by heads of state and heads of government with the rank of president or prime minister to Malaysia.
“For that purpose, this vehicle must meet specially designed security specifications to withstand high-calibre ballistic threats, explosions, and modern security risks including drone threats.
“The use of the vehicle by the Prime Minister is temporary on the advice and security assessment of the Royal Malaysian Police (PDRM),” the statement said.
The statement also informed that the temporary change was made because the Prime Minister’s official vehicle, which was gifted by the Yang di-Pertuan Agong, is undergoing regular maintenance.
The clarification was made to deny allegations and speculations that have been circulating on social media platforms regarding the ownership status of the luxury vehicle used by the Prime Minister. — Bernama"
Malay Mail,Did you see this hit-and-run? Police seek witnesses after man dies changing punctured tyre on Cheras-Kajang Highway,https://www.malaymail.com/news/malaysia/2026/07/07/did-you-see-this-hit-and-run-police-seek-witnesses-after-man-dies-changing-punctured-tyre-on-cheras-kajang-highway/226633,"Tue, 07 Jul 2026 09:04:33 +0800","KUALA LUMPUR, July 7 — A 46-year-old man was killed moments after changing a punctured tyre when a passing MPV struck him as he removed a makeshift warning bucket from the Cheras-Kajang Highway.
The driver of the vehicle then fled the scene without stopping, police said today.
The collision happened at about 10pm yesterday at Kilometre 13.0 of the highway.
Kajang district police chief Assistant Commissioner Naazron Abdul Yusof said preliminary investigations found that the victim had pulled his silver Toyota Innova onto the left shoulder after one of its tyres burst.
He had been travelling with five passengers.
After replacing the tyre, he walked to the rear of the vehicle to remove the bucket he had placed on the carriageway to warn approaching motorists.
“After changing the tyre, the victim walked to the rear of the vehicle to remove a bucket that had been placed as a warning sign for other road users.
“While the victim was removing the bucket, another red Toyota Innova approached from behind, struck him and continued driving without stopping,” Naazron said in a statement.
The victim, a Malaysian, suffered severe injuries and was pronounced dead at the scene.
The case is being investigated under Section 41(1) of the Road Transport Act 1987.
Police urged anyone who witnessed the collision or has information about the red Toyota Innova involved to contact the investigating officer, Inspector Nur Faezah Mohd Zakria, at 012-326 8496."
Malay Mail,Anwar urges Johor early voters to choose Pakatan as polling begins,https://www.malaymail.com/news/malaysia/2026/07/07/anwar-urges-johor-early-voters-to-choose-pakatan-as-polling-begins/226632,"Tue, 07 Jul 2026 09:01:37 +0800","JOHOR BAHRU, July 7 — Prime Minister Datuk Seri Anwar Ibrahim today extended his best wishes to all early voters casting their ballots in the 16th Johor state election.
In his Facebook post, Anwar, who chairs Pakatan Harapan (PH), hoped that all eligible voters would do their part to secure the best for Johor.
“Happy voting to all early voters in the Johor state election. Do your best for this state.
“Choose Harapan candidates for a better future for Johor. Vote Harapan,” he said in the post.
A total of 24,751 eligible early voters will cast their ballots at 64 polling centres across the state today.
The early voters include 12,041 Malaysian Armed Forces (MAF) personnel and their spouses, along with 12,710 Royal Malaysia Police (PDRM) and General Operations Force personnel and their spouses.
A total of 53 early polling centres for PDRM and another 11 for the MAF will open simultaneously at 8am today, with closing times staggered between noon and 6pm depending on the location and number of registered voters.
PH is fielding candidates in all 56 state seats, comprising 20 from PKR, 19 from Amanah and 17 from DAP.
The state polls feature 172 candidates competing, as 2.7 million voters prepare to head to the polls on Saturday.
For the latest updates on the 16th Johor state polls, visit https://prn.bernama.com/johor. — Bernama"
Malay Mail,Early voting for Johor election begins at 64 centres statewide,https://www.malaymail.com/news/malaysia/2026/07/07/early-voting-for-johor-election-begins-at-64-centres-statewide/226631,"Tue, 07 Jul 2026 08:57:25 +0800","JOHOR BAHRU, July 7 — A total of 64 early voting centres for the 16th Johor state election opened at 8am today to enable 24,751 members of the security forces and their spouses to fulfil their responsibilities.
According to Election Commission (EC) statistics, a total of 12,041 members of the Malaysian Armed Forces (MAF) and their spouses will carry out their responsibilities at 11 designated polling centres.
The remaining 12,710 voters, comprising Royal Malaysia Police (PDRM) personnel and General Operations Force (GOF) members and their spouses, are scheduled to cast their votes at 53 polling centres.
All polling centres will close in stages according to the set EC schedule starting at noon today until 6pm.
A Bernama survey found that weather conditions in several districts, including Batu Pahat, Muar, Pontian and Tangkak, were reported to be sunny.
On Saturday, approximately 2.7 million ordinary voters involving 56 state seats will cast their ballots.
For the latest news on the 16th Johor state election, please visit
https://prn.bernama.com/johor/
. — Bernama"
Malay Mail,Defence minister: Malaysia to receive first LCS on time despite missing anti-ship missiles,https://www.malaymail.com/news/malaysia/2026/07/07/defence-minister-malaysia-to-receive-first-lcs-on-time-despite-missing-anti-ship-missiles/226630,"Tue, 07 Jul 2026 08:51:41 +0800","KUALA LUMPUR, July 7 — Malaysia will take delivery of its first Littoral Combat Ship (LCS) as scheduled in December despite the vessel being delivered without its planned anti-ship missile system following the cancellation of its Naval Strike Missile (NSM) procurement, Defence Minister Datuk Seri Mohamed Khaled Nordin said.
Speaking during a ministerial briefing in the Dewan Rakyat yesterday, Khaled said the Royal Malaysian Navy’s (RMN) long-delayed lead vessel would still be handed over on schedule, even without the surface-to-surface missile system originally intended for the class, as reported by Utusan Malaysia.
“In terms of the ship’s delivery, even though we do not have a surface-to-surface missile system, the delivery schedule remains as previously announced.
“The first LCS is still expected to be delivered in December 2026 even though it will not have a surface-to-surface missile system.
“But I would like to emphasise, as I mentioned earlier in my speech, that the LCS is equipped with many other weapons systems. The only capability it currently lacks is the surface-to-surface missile,” he said.
Khaled said the vessel would still be equipped with a 57mm naval gun, anti-submarine and anti-air warfare systems, as well as electronic warfare capabilities despite the absence of its surface-to-surface missile system.
“For surface warfare, we currently have limited capabilities through the 57mm gun.
“The weapons systems we do have are designed for anti-submarine warfare, including anti-submarine missiles.
“We also have anti-air warfare capabilities, as well as electronic warfare systems to disrupt an adversary’s systems in the event of an attack,” he said.
He added that the gap in the Navy’s anti-surface warfare capability could be temporarily covered by the Royal Malaysian Air Force (RMAF), whose F/A-18D Hornet fighter aircraft can deploy Harpoon or Maverick air-to-surface missiles until a replacement missile system is procured.
“While we do not have a surface-to-surface missile system, the RMAF can provide support. We have F/A-18D aircraft capable of launching air-to-surface missiles to bridge the LCS’s anti-surface warfare capability gap using Harpoon or Maverick missiles,” he said.
Khaled also said the Navy’s Littoral Mission Ship (LMS) Batch 2 programme, with deliveries expected towards the end of 2027, would provide the RMN with a renewed surface-to-surface missile capability.
“When the second LMS Batch 2 vessel arrives around October, November or December 2027, we will have a 200km-range surface-to-surface missile capability.
“So we hope that while negotiations continue to find an alternative to the NSM, by the time we complete LCS 2, 3 and 4, we will already have a new missile system to replace the NSM,” he said.
Malaysia is currently seeking a replacement for the cancelled NSM system while negotiations continue over the procurement, with the government aiming to equip subsequent LCS vessels with a new anti-ship missile before they enter service."
Malay Mail,"Johor polls: 24,751 early voters set to cast ballots today",https://www.malaymail.com/news/malaysia/2026/07/07/johor-polls-24751-early-voters-set-to-cast-ballots-today/226629,"Tue, 07 Jul 2026 08:52:08 +0800","JOHOR BAHRU, July 7 — A total of 24,751 early voters eligible to vote in the 16th Johor state election will cast their ballots today at 64 gazetted polling centres across the state.
The early voting electorate comprises 12,041 members of the Malaysian Armed Forces (ATM) and their spouses, as well as 12,710 Royal Malaysia Police (PDRM) and General Operations Force (GOF) personnel and their spouses.
Of the total PDRM early voters, 12,067 will vote in person today, while 643 have cast their ballots by post.
All 53 police polling centres and 11 military polling centres were set to open simultaneously at 8am. Polling will close progressively between noon and 6pm, depending on the location and the number of registered voters.
Polling centres with small electorates, including Tenang Police Station in the Tenang state constituency, with only six voters, and Bukit Besar Police Station in the Pasir Raja constituency, with 11 voters, are expected to close as early as noon.
Meanwhile, polling centres at the Muar District Police Headquarters (IPD), Kahang Police Station in the Kahang constituency and Johor Bahru Utara IPD will remain open until 6pm.
To ensure a smooth voting process, the police have deployed 3,565 personnel, comprising 647 officers, 2,806 rank-and-file personnel and 112 civilian staff, to oversee operations statewide.
Their duties include securing polling centres, escorting ballot boxes, managing traffic, conducting crime prevention patrols, staffing operations rooms, monitoring strategic locations and enforcing the law throughout the election.
All early ballot boxes will be kept at designated police stations and will only be opened for counting after the close of ordinary polling on Saturday.
The 16th Johor state election has attracted 172 candidates contesting 56 state seats, with polling day for 2.7 million registered voters set for July 11.
For the latest updates on the 16th Johor state election, visit
https://prn.bernama.com/johor/
— Bernama"
Malay Mail,Lim Kit Siang urges Johoreans not to split Pakatan vote in ‘test of the Malaysian Dream’,https://www.malaymail.com/news/malaysia/2026/07/07/lim-kit-siang-urges-johoreans-not-to-split-pakatan-vote-in-test-of-the-malaysian-dream/226625,"Tue, 07 Jul 2026 08:34:41 +0800","JOHOR BAHRU, July 7 — DAP veteran Tan Sri Lim Kit Siang has called on Johoreans not to split Pakatan Harapan’s (PH) vote in the upcoming Johor state election, saying it is crucial to realising the Malaysian Dream.
The 85-year-old party stalwart warned that if votes are split, the vision of a Malaysia free from race-based politics and discrimination would come under threat.
“This will also put an end to the Malaysian Dream,” he said during his brief appearance at a PH campaign event in Taman Perling here last night.
Lim, who has retired from active politics, described the upcoming Johor state election as a test of the Malaysian Dream.
“Are we going forward, or are we going backwards?
“So, let us not break or split our votes,” he said in a mix of Mandarin and English.
Present were DAP vice-chairman Teo Nie Ching, who is also the Johor DAP chairman; the party’s deputy secretary-general Ramkarpal Singh; and its strategic director Liew Chin Tong.
They were joined by PH’s state election candidates Andrew Chen Kah Eng (Stulang), Alan Tee Boon Tsong (Perling) and Kartiyani Jeyapalan (Skudai).
Lim, a former long-serving parliamentarian, said Malaysia must have its own aspirations rather than simply looking at the progress of other countries.
DAP veteran Tan Sri Lim Kit Siang (centre) makes a brief appearance at a Pakatan Harapan campaign event in Taman Perling, Johor Bahru, during the run-up to the Johor state election. — Picture by Ben Tan
He said he had observed Chinese President Xi Jinping’s concept of the China Dream during a recent trip.
“I have been to China a few times before, but I don’t feel at home there. I feel more at home when I return to Malaysia.
“As a Malaysian, I too have a dream, one called the Malaysian Dream,” he said, adding that the dream could be realised only if Malaysians placed their national identity above the racial sentiments that continue to shape the country’s politics.
Lim said efforts to build a more inclusive and united Malaysia would not happen overnight because the country is made up of various races, with Malays forming the majority.
He said the confidence of all parties is needed to achieve this gradually.
“Change can only be achieved through patience, understanding and the willingness to correct existing mistakes,” he said.
Lim also touched on Malaysians who have migrated abroad, including to neighbouring Singapore.
He said those living overseas may have a strong desire to return and contribute to Malaysia’s development if they are convinced the country is on the right track.
“Our responsibility is to ensure that Malaysia becomes a country that gives them the confidence to return for a better future together,” he said.
The Malaysian Dream, also known as “
Impian Malaysia
”, is a concept that advocates a progressive, inclusive and united society where Malaysians are treated equally regardless of race or religion.
It seeks to replace race-based politics with a shared national identity, social democracy and equitable economic growth.
However, the concept has also drawn criticism from Opposition parties, civil society groups and former DAP members who have become disillusioned with the party."
