Source,Title,Link,Date,Article
Malay Mail,"Zahid says BN cooperation in unity govt driven by shared goals, not political complacency",https://www.malaymail.com/news/malaysia/2026/05/09/zahid-says-bn-cooperation-in-unity-govt-driven-by-shared-goals-not-political-complacency/219308,"Sat, 09 May 2026 12:22:53 +0800","KUALA LUMPUR, May 9 — Umno and Barisan Nasional (BN) are comfortable working with all component parties in the Unity Government, as they share common objectives, particularly in serving the interests of the people, said Datuk Seri Dr Ahmad Zahid Hamidi.
The Umno president said the ease of cooperation that has emerged does not indicate complacency, but is instead the result of strong understanding among parties in the government to ensure the people are not burdened by political polemics.
“The people must not be troubled by prolonged polemics and differences in stance or views,” the Deputy Prime Minister said in a special interview held in conjunction with Umno’s 80th anniversary recently.
Ahmad Zahid, who is also the BN chairman, said that in the interest of the people, all parties in the Unity Government have agreed to set aside differences and political considerations to ensure the effective implementation of every agenda outlined in the 15th General Election (GE15) manifesto.
He said the government gave priority to common ground in the manifestos of parties contesting GE15, particularly on issues related to the cost of living, education and unemployment.
“On matters concerning education and unemployment, there is no disagreement between the competing parties,” said Ahmad Zahid, who is also the Rural and Regional Development Minister.
He also said that 47 per cent of the manifestos of parties in the Unity Government had common elements, thereby forming a strong foundation for existing cooperation.
“Why should we be concerned about differences when we share the same goal?
“In addition, there are detailed issues that we must address. That is why we have the Inter-Party Consultative Council, to resolve differences and ensure the manifesto is implemented with clear purpose,” he said.
In the meantime, Ahmad Zahid emphasised that all component parties in the Unity Government, including DAP, uphold the four main pillars enshrined in the Federal Constitution.
“This is evident in the comfort that has developed and the strong respect shown towards the agreement to form the Unity Government, which is founded on four main pillars, namely Islam, the Malay Rulers, the Malay language and the special rights of the Malays.
“They not only respect it but also acknowledge that that this is a fact enshrined in the Constitution,” he said.
The Unity Government was formed after GE15 in 2022, when no coalition secured a simple majority, and is led by Pakatan Harapan together with BN, Gabungan Parti Sarawak, Gabungan Rakyat Sabah and Parti Warisan, as well as supported by several other parties and independent Members of Parliament. — Bernama"
Malay Mail,"Boy, 12, dies after being trapped under concrete block in Pasir Puteh",https://www.malaymail.com/news/malaysia/2026/05/09/boy-12-dies-after-being-trapped-under-concrete-block-in-pasir-puteh/219306,"Sat, 09 May 2026 12:09:57 +0800","PASIR PUTEH, May 9 — A 12-year-old boy was killed after being crushed by a concrete block while playing in front of his home in Kampung Telaga Papan, Semerak, here yesterday,
Harian Metro
reported.
In the 2.30pm incident, Mohammad Yusof Nor Ismail was believed to have been playing in a sand excavation area near the concrete blocks together with his uncle, Mohd Yunus Nasir, who is also 12.
Pasir Puteh police chief Superintendent Saari Yaacob said a family member later alerted others after the two children were found to have fallen into a sand pit and were discovered trapped under a concrete block.
“The victim was found unconscious, and the family contacted the Cherang Ruku Health Clinic. A health assistant later confirmed that the child had died,” he told
Harian Metro
when contacted
Saari added that another child sustained neck injuries and was sent to Tengku Anis Hospital (HTA) for treatment.
Earlier, Jejak Jalanan activist Tengku Mohd Harith Hakimin Tengku Abdul Azis said the victim’s family were recipients of monthly aid from the non-governmental organisation.
He said the boy’s body is still at HTA for post-mortem arrangements, and the NGO will assist with burial matters."
Malay Mail,"Burden or duty? Debate grows over proposed filial responsibility law, with calls for govt support",https://www.malaymail.com/news/malaysia/2026/05/09/burden-or-duty-debate-grows-over-proposed-filial-responsibility-law-with-calls-for-govt-support/219302,"Sat, 09 May 2026 11:55:56 +0800","KUCHING, May 9 — Members of the public have shared their views following reports that the government is considering ‘filial responsibility law’ to legally require children to care for their ageing parents.
The proposal came after Deputy Prime Minister Datuk Seri Ahmad Zahid Hamidi was quoted as saying that several countries had already implemented similar laws, with Malaysia still in the discussion and review stage.
Robert Ukin, 40, said he would support the law, describing it as ‘a rightful duty of children towards their parents’.
“We should not neglect them.
“As children, we need to ensure that we care for our parents, including their daily needs, medical care and wellbeing,” he told
The Borneo Post
here.
He added that caregiving responsibilities could be shared among siblings through mutual agreement.
“We are no one without our parents.
“Caring for them is not a burden but a moral obligation.”
Gerald Marcel Peter Blodi, 21, also supported the proposal, saying that it could help prevent neglect of elderly parents.
“I have seen parents being neglected nowadays, even in my own area.
“It makes me sad because we should not treat our parents that way,” he said.
He added that such legislation could serve as a safeguard in cases where children abandoned their responsibilities, though he noted challenges in caring for the elderly people, including exposure to online scams.
He expressed hope that the proposed law would improve protection and welfare for senior citizens.
Meanwhile, Zaidil Peri, 60, said caring for ageing parents was already a family responsibility and should not need to be legislated.
“I think it is already a responsibility. So if it’s made into law, then it’s the right thing for children to do,” he said.
Zaidil, however, added that any such law should be accompanied by government support, including financial assistance.
“Taking care of the elderly folks is not easy. There are expenses for medicine and daily necessities.”
Nur Shafira, 17, said she strongly supported the idea of caring for ageing parents.
“I don’t see any problem with it.
“My parents provided me with education, food and shelter.
“It’s something I can never repay, so I will take care of them when they are older,” she said. — The Borneo Post"
Malay Mail,"Proposed care law for ageing parents should consider support systems for families, says Sarawak minister",https://www.malaymail.com/news/malaysia/2026/05/09/proposed-care-law-for-ageing-parents-should-consider-support-systems-for-families-says-sarawak-minister/219300,"Sat, 09 May 2026 11:18:41 +0800","KUCHING, May 9 — The proposed new law requiring children to care for their ageing parents must reflect the diverse realities across Malaysia, said State Minister of Women, Childhood and Community Wellbeing Development Sarawak Datuk Seri Fatimah Abdullah.
Commenting on the federal government’s consideration of the legislation announced by Deputy Prime Minister Datuk Seri Ahmad Zahid Hamidi, she said while Sarawak welcomed the intention, she also stressed that policy formulation must be comprehensive and sensitive to local contexts.
“So we hope it would be very holistic, very extensive, taking into account the Sarawak context as well: what it is like in longhouses, in villages, and in urban areas,” she said this at a press conference called after the Special Committee on Citizenship Status (JKKSK) Article 15A Sarawak Level No. 2/2026 monthly meeting at the National Registration Department (JPN) office here.
Fatimah said while the concept aligned with cultural and religious values, implementation must consider the varying capacities of families.
“When we come up with the policy later, we also need to look at the situation of the children who need to care for their parents, and what support systems need to be in place,” she said, adding that many elderly preferred to age at home, based on findings from Swinburne research.
She also noted that senior citizens remained among the largest groups applying for welfare assistance under the Welfare Department.
“It is stated that although they have children, their children often do not have stable incomes and have their own families to support.
“That is commonly mentioned.”
Fatimah also hoped Sarawak would be included in discussions on the proposed law to ensure regional perspectives are reflected in the final framework.
On citizenship matters, the state minister said applications under Article 15A involving illegitimate children continued to make up the highest number of cases in Sarawak, with Kuching recording the most submissions, at nine, through JPN Kuching.
It was informed that a total of 32 applications were tabled during yesterday’s meeting.
Fatimah said 21 applications involved illegitimate children; those born before their parents’ marriage was properly registered.
“The second category involves foster children with 10 cases, namely children cared for by individuals other than their biological parents, while the third category involves one adopted child application.”
Fatimah added that out of the 314 applications received under Article 15A between 2024 and May 8 this year, a total of 191 involved illegitimate children, while 98 were guardianship cases and 25 involved adopted children.
“From 2024 until May 8 this year, there have been 314 citizenship applications under Article 15A, and the majority fall under the illegitimate children category with 191 cases.”
She said the committee’s role was to facilitate and verify applications before recommending whether they should be supported, while reminding applicants to ensure all required documents are submitted.
“There are cases where birth certificates are not included, making the applications incomplete.
“We need applicants to complete the forms because we do not want their applications to be rejected,” she said.
Fatimah also stressed that all final decisions on citizenship applications remained under the jurisdiction of the Home Ministry, and would be subject to existing regulations and policies.
On approved applications, she said there were 141 applications between 2023 and 2024, with the applicants currently undergoing the process of obtaining citizenship certificates.
“The record shows that a total of 1,037 applicants successfully received their citizenship certificates between 2023 and April 2026,” she added. — The Borneo Post"
Malay Mail,"Everything, everywhere, at once: Sabah’s Tamparuli sets record for largest simultaneous local elections with 94 villages",https://www.malaymail.com/news/malaysia/2026/05/09/everything-everywhere-at-once-sabahs-tamparuli-sets-record-for-largest-simultaneous-local-elections-with-94-villages/219297,"Sat, 09 May 2026 10:59:25 +0800","TAMPARULI, May 9 — Tamparuli has made history after its Village Development and Security Committee (JKKK) election process was recognised by the Malaysia Book of Records (MBOR) for the “Most Villages in a Simultaneous Village Committee Election”.
Tuaran MP and Tamparuli assemblyman Datuk Wilfred Madius Tangau said the recognition was awarded under that category involving the simultaneous election of village committees.
He said the JKKK election involved a total of 94 villages across five mukim conducted simultaneously within the Tamparuli constituency, namely Mukim Tenghilan, Topokon, Mangkaladoi, Pantai and Mukim Tamparuli.
“This recognition is a highly proud achievement for the entire people of Tamparuli because it proves that rural communities are also capable of carrying out a community election process in an organised, transparent and integrity-driven manner.
“It also reflects the commitment of all parties, including the Tamparuli Sub-District Office, UPPM, election personnel, as well as the village communities who collectively ensured the success of this process,” he said during the Presentation Ceremony of JKKK Appointment Letters at the Tamparuli Sub-District Multipurpose Hall here.
The MBOR certificate was presented by its representative Dr Stanley Tulis Missun to Tamparuli Sub-District Officer Hannevy W. Harry, who also chaired the JKKK Election Process Organising Committee for the constituency, on March 15, 2026.
Earlier, the JKKK Appointment Letter Presentation Ceremony was officiated by Rural Development Minister Datuk Rubin Balang.
Rubin also witnessed the presentation of appointment letters by Madius to representatives of JKKK committees from each mukim within the constituency.
“We are grateful for the support provided by Rural Development Ministry, which enabled the JKKK election process to be carried out successfully.
“The implementation of the simultaneous election is also part of efforts to strengthen a more democratic and inclusive village governance system,” Madius added.
In a related development, Madius also announced the implementation of the Sustainable Village Programme Competition at the Tamparuli Sub-District level, in collaboration with strategic partners Zero Waste Sabah and the Institute for Development Studies Sabah (IDS).
He said the programme focuses on sustainable community development through strengthening the village economy, preservation of customs and culture, waste management, environmental conservation and overall community sustainability. — The Borneo Post"
Malay Mail,Lorry driver killed while crossing road after being hit by teen motorcyclist in Gua Musang,https://www.malaymail.com/news/malaysia/2026/05/09/lorry-driver-killed-while-crossing-road-after-being-hit-by-teen-motorcyclist-in-gua-musang/219294,"Sat, 09 May 2026 10:11:57 +0800","GUA MUSANG, May 9 — An elderly lorry driver was killed after he was believed to have been hit by a motorcycle ridden by a 17-year-old while crossing a road in Gua Musang on Friday night,
Sinar Harian
reported.
In the 8.30pm incident at Kilometre 41 of the Gua Musang–Kuala Krai road, the victim, Mat Zaki Jusoh, 62, died at the scene.
Gua Musang police chief Superintendent Sik Choon Foo said preliminary investigations found that the accident occurred when the teenage motorcyclist was travelling from Paloh towards Gua Musang.
“Upon reaching the location, the lorry driver was crossing the road to get to his vehicle which was parked on the opposite side,” he was quoted as saying.
“Upon reaching the location, the motorcycle is believed to have collided with the elderly man. As a result of the impact, he was flung and died at the scene,” he told the Malay daily.
Sik said the victim’s body was sent to the Forensic Unit at Gua Musang Hospital for post-mortem.
He said the case is being investigated under Section 41(1) of the Road Transport Act 1987.
Investigations are ongoing, and witnesses or anyone with information have been urged to contact police at 09-9121222 to assist in the probe."
Malay Mail,Anwar: Amir Hamzah to provide explanation regarding govt's allocation to Tengku Mahkota of Pahang,https://www.malaymail.com/news/malaysia/2026/05/09/anwar-amir-hamzah-to-provide-explanation-regarding-govts-allocation-to-tengku-mahkota-of-pahang/219291,"Sat, 09 May 2026 09:53:46 +0800","CEBU, May 9 — Prime Minister Datuk Seri Anwar Ibrahim will request Finance Minister II Datuk Seri Amir Hamzah Azizan to write and provide a comprehensive explanation regarding the Federal Government’s allocation for the State of Pahang.
Media reports today stated that the Tengku Mahkota of Pahang, Tengku Hassanal Ibrahim Alam Shah, called for Federal Government intervention in Pahang’s revenue matters, including the approval of river sand exports.
“I respect the Tengku Mahkota. However, the Tengku Mahkota should also understand the macro (economy), because the allocation for the State of Pahang is large, not small.
“While criticisms can be made, I think it is reasonable to first listen to what the macroeconomy is, the current economic pressures, and the leakages occurring,” he said when asked to comment on Tengku Hassanal’s remarks after attending the 48th ASEAN Summit and Related Meetings here today.
He added that the country is currently dealing with many challenges.
“Therefore, as citizens, we respect (the views) and we will examine them thoroughly,” he said. — Bernama"
Malay Mail,"UiTM should be a Royal University, says alumni group citing royal address and legacy",https://www.malaymail.com/news/malaysia/2026/05/09/uitm-should-be-a-royal-university-says-alumni-group-citing-royal-address-and-legacy/219275,"Sat, 09 May 2026 09:42:36 +0800","SHAH ALAM, May 9 — The Alumni Federation of Universiti Teknologi Mara (PAUiTM) has proposed that the university be granted Royal University status, in recognition of its significant role and contributions to the nation since its establishment.
PAUiTM said the proposal was in line with the royal address by the Tengku Permaisuri of Selangor, Tengku Permaisuri Norashikin, who is also UiTM Pro-Chancellor, during the First Session of the 104th UiTM Convocation Ceremony last Wednesday (May 6), in which she described the public university as a “Royal University”.
Drawing on the wisdom and foresight of the Tengku Permaisuri of Selangor, PAUiTM is of the view that it is highly appropriate for UiTM to be proclaimed a Royal University, in view of its significant role and contributions to the nation.
“More significantly, Article 1(A) of the Universiti Teknologi Mara Act 1976 (Act 173) provides that the university is established in accordance with Article 153 of the Federal Constitution, thereby underscoring UiTM’s special position and the great trust placed in it within the country’s higher education landscape.
“PAUiTM holds the view that Her Royal Highness’ call for UiTM to be protected against any efforts that could undermine or distort its original purpose of establishment is a very clear position that should be respected by all parties,” the alumni said in a post on their official Facebook page yesterday.
PAUiTM also conveyed its gratitude for the Tengku Permaisuri of Selangor’s address in conjunction with the UiTM Convocation Ceremony, which carried profound messages, values, and reminders for university staff and alumni.
The alumni said Her Royal Highness’ address not only highlighted academic excellence but also underscored UiTM’s role as an institution founded on the nation’s trust to empower the education of the people, particularly the Malays, Orang Asli, and natives of Sabah and Sarawak, in accordance with Article 153 of the Federal Constitution and Act 173.
“Her Royal Highness’ address also carried a balanced and mature message, emphasising the importance of preserving harmony in a plural society, respecting cultural diversity, and ensuring that the legitimate interests of all races continue to be protected in accordance with the provisions of the Constitution.
“Although UiTM fundamentally upholds the Bumiputera empowerment agenda, the institution has produced competent professionals serving the country across various disciplines and sectors, and has indeed proven its ability to produce high-quality graduates,” according to the post.
PAUiTM also welcomed Her Royal Highness’ emphasis on the importance of knowledge, competitiveness and readiness among the younger generation in confronting geopolitical challenges, global economic changes, as well as the rapid advancement of technology.
“Today’s graduates must possess not only skills, but also wisdom, moral values and the ability to lead society guided with a sense of humanity.
“In this regard, PAUiTM will continue to remain committed to working with the university to strengthen alumni networks through the unification of alumni associations at campus, faculty and club levels, as well as contributing expertise and safeguarding UiTM’s legacy as a bastion of knowledge and a catalyst for national development over the past seven decades,” the post said. — Bernama"
Malay Mail,"Anwar backs Selangor Sultan’s concerns over pig farms, cites public health risks",https://www.malaymail.com/news/malaysia/2026/05/09/anwar-backs-selangor-sultans-concerns-over-pig-farms-cites-public-health-risks/219273,"Sat, 09 May 2026 09:28:50 +0800","CEBU, May 9 — Prime Minister Datuk Seri Anwar Ibrahim said the concerns raised by Sultan of Selangor Sultan Sharafuddin Idris Shah over pig farming in the state were justified due to repeated excesses that have affected public health.
Speaking at a press conference after the closing of the 48th Asean Summit here on Friday, Anwar said there had been inadequate control and enforcement over certain farming operations.
“The Sultan of Selangor voiced his views because what is happening now involves too many excesses that are affecting public health and are not being properly controlled,” he said.
The Prime Minister stressed that, in principle, he did not agree with pig farms operating without strict regulation, particularly when located too close to residential areas.
He said one of the main concerns was the existence of farms near villages and housing areas, including in Klang.
“In principle, I do not agree with pig farming being allowed just anywhere. There must be strict controls, and the farms must be located far away from residential areas.
“It is not only Muslim residents who object to living near such areas, even Chinese residents also do not want to live nearby. So the farms should be located further away,” he said.
Anwar said that pig farming operations must also adopt modern technology and provide assurances that no environmental pollution will occur.
“If there are companies capable of meeting these strict conditions, then it would be difficult for the government to reject their applications outright.
“That is why, for the time being, let us put this matter on hold first,” he said.
On Thursday, Sultan Sharafuddin maintained his stance against allowing pig farming activities in any district in Selangor, according to a statement issued by the Sultan’s private secretary, Datuk Mohamad Munir Bani. — Bernama"
