Source,Title,Link,Date,Article
New Straits Times,Penang expands list of heritage items to 50,https://www.nst.com.my/news/nation/2026/05/1450635/penang-expands-list-heritage-items-50,"Fri, 29 May 2026 06:00:42 +0800","Your browser does not support the audio element.
Fort Cornwallis, asam laksa and char kway teow are among the latest additions to Penang's list of cultural heritage, as the state continues the push to gazette its multicultural legacy.
The gazettements on May 7 bring the number of items under the Penang State Heritage Enactment 2011 to 50, comprising 15 historical sites, seven intangible cultural heritage and 28 dishes.
New landmarks added to the list are Penang Free School, Penang High Court, Kapitan Keling Mosque, Acheen Street Malay Mosque, Khoo Kongsi, the Penang State Museum Board building and St George's Church.
Penang Tourism and Creative Economy Committee chairman Wong Hon Wai yesterday said the recognitions were a major milestone in the state's cultural preservation efforts.
""Although the Penang State Heritage Enactment 2011 was passed in 2011, no official state-level cultural heritage gazettement had been carried out under the enactment over the past 15 years.
""As such, the Penang government took proactive and important steps this year to translate the legal provisions into concrete action.""
On Jan 22, the state gazetted several intangible cultural heritage elements, including the nasi kandar and kopitiam culture, the Thaipusam and Chingay processions, St Anne's Feast in Bukit Mertajam and the Penang Tanjong dialect.
Also in the list were traditional dishes such as ""nasi kandar"", ""pasembor"", ""oh chien"", ""Hokkien mee"", ""mi udang"" and ""roti Benggali"".
Wong said the gazettement reflected the state's commitment to preserving Penang's historical memory, cultural diversity, artistic heritage and social identity.
He said the recognition of the heritage of various ethnic communities reflected Penang's culture of openness and coexistence.
""Heritage is not merely a repository of local memories, but also an important bridge in strengthening national unity.""
Wong added that all items on the list would be proposed for recognition under the National Heritage Act and nominated for the United Nations Educational, Scientific and Cultural Organisation's Representative List of the Intangible Cultural Heritage of Humanity.
He said the initiative would strengthen Penang's standing as an international cultural heritage tourism destination and support growth in sectors such as tourism, education and research as well as creative economy.
© New Straits Times Press (M) Bhd"
New Straits Times,NHRA seeks tenancy act,https://www.nst.com.my/news/nation/2026/05/1450633/nhra-seeks-tenancy-act,"Fri, 29 May 2026 06:00:33 +0800","Your browser does not support the audio element.
The National House Rental Association (NHRA) has urged the government to expedite the enactment and implementation of a residential tenancy act (RTA) to protect homeowners from being penalised for illegal activities carried out by tenants.
NHRA president Prakash P. Kalivanan highlighted growing public concern over residential properties being used for illicit operations, including Bitcoin mining, prostitution, harbouring undocumented immigrants, storing stolen goods and loan-sharking activities.
He said under current legal provisions, property owners could face investigation or legal action if authorities determined they had knowledge of the unlawful activities or failed to take reasonable preventative steps.
""A majority of homeowners rent out their properties in good faith and are often unaware of the activities carried out by their tenants.
""Many rely on rental income to meet their financial commitments. They should not be unfairly victimised due to the actions of tenants acting without their knowledge.""
Prakash said the Housing and Local Government Ministry should deliver a comprehensive RTA without further delay.
""The legislation is crucial in establishing a balanced, transparent, and legally secure rental ecosystem.""
He said this would also regulate the residential market by outlining the explicit rights, responsibilities and obligations of all parties involved, minimising disputes and improving enforcement mechanisms.
Prakash said landlords should exercise reasonable diligence and take proactive measures to shield themselves from potential legal complications.
He added that property owners must ensure they prepared a proper, legally stamped, written tenancy agreement that explicitly prohibited tenants from conducting illegal activities on the premises.
""Landlords are strongly encouraged to carry out basic tenant verification and background checks, including verifying identification documents and ensuring all personal details provided are authentic, before handing over the keys.
""Furthermore, they should conduct periodic inspections of the rented property after giving reasonable notice to ensure the premises are being used strictly for lawful residential purposes.""
Prakash said maintaining documentation, such as copies of tenant identification, rental payment records and written correspondence, was vital to demonstrate that the landlord acted responsibly, should any issue arise.
He said landlords must also report any suspicious or illegal activity on their property to the authorities immediately.
""Prompt action will prevent further misuse of the premises and protect the homeowner from possible legal implications,"" he added.
© New Straits Times Press (M) Bhd"
New Straits Times,TM accelerating AI and digital innovation capabilities,https://www.nst.com.my/business/corporate/2026/05/1450631/tm-accelerating-ai-and-digital-innovation-capabilities,"Fri, 29 May 2026 06:00:24 +0800","Your browser does not support the audio element.
KUALA LUMPUR: Telekom Malaysia Bhd (TM) reaffirmed that it is on track to becoming a digital powerhouse by 2030 through the disciplined execution of its PWR 2030 strategy.
Managing director and group chief executive officer Amar Huzaimi Md Deris said TM is entering a new growth phase centred on artificial intelligence (AI), digital innovation and sustainability.
""To strengthen how we create value, we are accelerating AI and digital innovation capabilities while embedding sustainability more deeply across our business, operations and strategic investments,"" he said in a statement.
In 2025, TM distributed about RM2 billion in shareholder and economic value.
TM has been expanding its AI ecosystem through AI-ready data centres, graphics processing unit-as-a-service offerings, cloud infrastructure and cybersecurity solutions.
Of the RM2 billion distributed, about RM1.2 billion was returned to shareholders through dividends, equivalent to 31 sen per share. A further RM750 million was contributed through taxes, zakat and socioeconomic initiatives, TM said in a statement.
TM also reiterated its revised dividend policy of a minimum payout ratio of 75 per cent of net profit.
Beginning from the first quarter of 2026, dividends will be declared and paid on a quarterly basis.
In 2025, TM recorded a revenue growth of 11.4 per cent to RM11.9 billion, while pre-tax profit stood at RM2 billion and operating cash flow was at RM2.5 billion.
Total shareholders' return stood at 23.5 per cent, alongside a 21 per cent increase in share price.
On the sustainability front, TM generated RM135 million in revenue from low-carbon products and services in 2025 while reducing carbon emissions by 34 per cent compared with its 2019 baseline.
© New Straits Times Press (M) Bhd"
New Straits Times,Australia charges woman over Islamic State links,https://www.nst.com.my/world/world/2026/05/1450630/australia-charges-woman-over-islamic-state-links,"Fri, 29 May 2026 06:00:24 +0800","Your browser does not support the audio element.
SYDNEY: Police yesterday charged a woman linked to the Islamic State (IS) group with membership of a terrorist organisation and entering a known conflict zone.
Both charges carry a maximum penalty of up to 10 years in prison.
Hundreds of women from Western nations were lured to the Middle East as IS gained prominence in the early 2010s, in many cases following husbands who had signed up as militants.
A joint counter-terror police team said they would allege that the woman, 34, travelled to Syria between 2013 and 2014 with a man to join IS.
The man was now believed to be imprisoned in the Middle East, they added.
The woman was detained by Kurdish forces in 2019 and held in the al-Hawl Internally Displaced Persons camp until returning to Australia last September, they said.
Her arrest follows the return to Australia this month of a number of women and children linked to suspected IS fighters.
Two women —  a mother and a daughter —  were arrested on arrival in Melbourne.
Police accused them of having kept a woman as a slave after travelling to Syria in 2014 to support the group.
A third woman was also arrested on arrival here and charged with entering a restricted area and joining a terrorist organisation.
This week, 13 more IS-linked Australians — four women and their nine children — flew home from Syria.
In a statement following their landing, federal police said none of the cohort had been charged with an offence.
Australia's Human Rights Commission urged the government in March to help repatriate its citizens still in Syria.
But others have accused the women of turning their back on Australia and believe they should be left to face the consequences.
© New Straits Times Press (M) Bhd"
New Straits Times,"RON95 subsidy adjustment is last resort, says govt adviser",https://www.nst.com.my/news/nation/2026/05/1450615/ron95-subsidy-adjustment-last-resort-says-govt-adviser,"Fri, 29 May 2026 01:10:15 +0800","KUALA LUMPUR: Any move to adjust RON95 petrol subsidies will be a last resort for the government due to its direct impact on household spending, according to a senior economic adviser in the Prime Minister's Office.
Prime Minister's Office senior economic and finance adviser Nurhisham Hussein said Putrajaya currently has several policy options available but is proceeding cautiously given the sensitivity surrounding fuel prices and broader cost-of-living pressures.
Nurhisham spoke on the Keluar Sekejap podcast hosted by former health minister Khairy Jamaluddin and former Umno information chief Shahril Hamdan which aired on YouTube yesterday.
Speaking about the fuel shortage as a result of the global oil uncertainties involving the conflict at Straits of Hormuz ship route, he said the government had already reduced the subsidised fuel quota from 300 litres to 200 litres monthly, which he claimed only affected about 10 per cent of consumers in the country.
""About 90 per cent of consumers using fuel in Malaysia are not affected by the 200-litre RON95 quota,"" he said speaking to Khairy on the show.
Nurhisham said among the policy options available to the government were increasing the subsidised fuel price from RM1.99 per litre to RM2.05 or RM2.10, or further reducing the monthly quota, which he added was ""a last option"".
He said that any rationalisation involving petrol subsidies would likely be deferred for as long as possible.
""Petrol is a very sensitive issue and it has a direct impact on the rakyat's pockets.
""Even if there is a petrol subsidy adjustment, it will be pushed back later.""
He added that while fuel prices had eased for now, the outlook for the global oil market remained uncertain, especially in the third quarter of the year.
Nurhisham said China had reduced imports for the time being while major oil-producing countries had increased output, helping to calm markets temporarily.
""But at some point you cannot rely on reserves forever. China will start importing again and countries will also need to rebuild strategic reserves,"" he said.
He warned that analysts were already expecting July and August to become ""very uncomfortable"" periods for oil markets due to renewed demand and lingering physical supply shortages.
""At this point, the market is too optimistic,"" he said, adding that there was ""no guarantee"" fuel prices would remain stable between July and September.
Nurhisham also highlighted ongoing efforts to tighten the Subsidised Diesel Control System (SKDS), particularly for the logistics sector, saying the government had previously allocated excessive diesel subsidies under the programme.
""We gave too much when we started SKDS. Now we are tightening it to create savings because we now have enough data to understand better,"" he said.
He added that the government had recently announced the expansion of the Subsidised Diesel Scheme (SKTS) to include jeeps and pickup trucks in peninsular Malaysia as well as Sabah and Sarawak.
He acknowledged that fuel consumption trends remained a concern despite various rationalisation efforts and work-from-home initiatives.
He said government data showed petrol usage had slightly increased even after flexible work arrangements were introduced in the public sector.
""We are still trying to figure out why. People may save during the work week but travel more during weekends or long holidays,"" he said.
He also said that some existing measures had yet to significantly reduce overall fuel consumption despite quota reductions and subsidy rationalisation initiatives.
""Having said that, this also underscores the need for Malaysians to avoid wastage not only in fuel consumption, but also in water and food usage.
""Not just energy, but food and water is also a key issue,"" he said.
Nurhisham also shared concern over food wastage, saying that although Malaysia generally has sufficient food supply, large amounts of vegetables, chicken and eggs were discarded due to expiry dates.
In a chain circle, all the other sectors will also be affected.
For instance, when fertiliser supplies are affected, farmers may not be able to grow their crops properly, which reduces overall agricultural output.
He also said that medicines and medical supplies were sufficient, with alternatives provided by the Health Ministry should there be any shortages.
© New Straits Times Press (M) Bhd"
New Straits Times,Govt demands probe into alleged abuse of Malaysian volunteers by Israeli forces,https://www.nst.com.my/news/nation/2026/05/1450612/govt-demands-probe-alleged-abuse-malaysian-volunteers-israeli-forces,"Fri, 29 May 2026 00:45:47 +0800","KUALA LUMPUR: The government is demanding an immediate probe into the alleged harsh treatment of Malaysian volunteers detained by Israeli forces during a recent humanitarian mission to Gaza.
Home Minister Datuk Seri Saifuddin Nasution Ismail says the government will not compromise on protecting the safety, welfare, and rights of Malaysians abroad, in line with international legal principles and universal humanitarian values.
""The government also demands that the welfare, dignity, and legal rights of all detained activists be fully respected and protected,"" he said in a Facebook post yesterday.
He added that the government calls for consistent diplomatic efforts to prevent any escalation of tensions that could threaten international stability and security.
""As Malaysians, we are deeply concerned when allegations arise involving harsh physical treatment, elements of intimidation, and the denial of basic rights to the activists involved.
""I understand that various parties, including human rights organisations and legal representatives, are currently gathering testimonies and evidence related to the incident,"" he said.
He added that the government will continue to monitor the situation closely and ensure that the interests and safety of Malaysian citizens remain a top priority.
A total of 28 Malaysians who participated in the Global Sumud Flotilla (GSF) 2.0 humanitarian mission to Gaza who were detained by Israeli forces returned safely to the country last Monday.
However, another activist, Razman Mat Ali, remains hospitalised in Istanbul, Turkiye, after suffering a collapsed lung as a result of being punched by Israeli soldiers during the incident.
–BERNAMA
© New Straits Times Press (M) Bhd"
New Straits Times,Mafia boss' network assets worth over US$232mil seized in Italy,https://www.nst.com.my/world/world/2026/05/1450608/mafia-boss-network-assets-worth-over-us232mil-seized-italy,"Thu, 28 May 2026 23:59:25 +0800","ROME: Italian authorities have seized assets worth more than €200 million (US$232 million), allegedly linked to the Mafia empire and drug trafficking network of late Cosa Nostra boss Matteo Messina Denaro, police said on Thursday, reported German Press Agency (dpa).
Three people were arrested during a large-scale operation carried out across several countries, authorities said.
Messina Denaro was captured in Sicily in January 2023. As head of the Cosa Nostra, he was one of Italy's most wanted criminals for more than three decades.
His downfall came when he sought treatment for cancer at a clinic. Eight months after his arrest, he died in prison at the age of 61 without facing trial.
The recent raids were part of an investigation into money laundering linked to drug trafficking operations allegedly connected to Messina Denaro, authorities said.
The money had been amassed through the reinvestment of drug money accumulated since the 1980s in several countries in Europe and beyond.
Investigators identified eight companies believed to be linked to the network.
They also identified gold and luxury properties in the most exclusive locations on Spain's Costa del Sol.
– Bernama-dpa
© New Straits Times Press (M) Bhd"
Malay Mail,The great migration: Why Singapore giants like Gardenia are moving to Johor,https://www.malaymail.com/news/malaysia/2026/05/29/the-great-migration-why-singapore-giants-like-gardenia-are-moving-to-johor/221748,"Fri, 29 May 2026 09:10:42 +0800","JOHOR BAHRU, May 29 — In Senai’s sprawling industrial belt, Gardenia Malaysia’s massive bakery sits alongside warehouses operated by tech giant Seagate and e-commerce heavyweight Shopee.
The facility, located 45km from the Tuas Second Link, is run by Singapore-listed QAF Group, owner of the Gardenia brand.
Last week, the bread maker announced it would shift production from its Pandan Loop facility in Singapore to Johor Bahru, a move resulting in 141 retrenchments in the republic.
Gardenia said the relocation aims to improve efficiency and maintain competitiveness in a challenging global market.
While the company has not disclosed the exact site for the transferred production, its Senai plant is currently its only major Johor facility, capable of churning out 8,000 loaves and 20,000 tortilla wraps every hour,
CNA
reported
A general view of the city of Johor Bahru on November 13, 2022. — Picture by Yusof Mat Isa
A ‘structural shift’
Analysts say Gardenia’s move reflects a growing trend of Singapore companies relocating manufacturing across the Causeway.
Similar shifts by major players like Asia Pacific Breweries Singapore (APBS) and Yeo Hiap Seng (Yeo’s) point to a broader “structural shift,” according to Johor-based property consultant Samuel Tan.
“Moving operations to Johor makes strong commercial sense,” said Tan, CEO of Olive Tree Property Consultants.
“Companies no longer need to produce goods where they sell them. Johor allows Gardenia to manufacture at a lower cost while still trucking fresh products into Singapore daily.”
This realignment is turbocharged by the Johor-Singapore Special Economic Zone (JS-SEZ).
While the full masterplan is pending, firms are already moving to capitalise on incentives, including a special 5 per cent corporate tax rate for 15 years, sharply lower than Malaysia’s standard 24 per cent.
Lennon Tan, president of the Singapore Manufacturing Federation (SMF), describes this as “rightsizing geography.” He also insists it is not a vote of no-confidence in Singapore, but a strategic restructuring.
“F&B players are keeping HQ, brand innovation, and supply chain orchestration in Singapore, while moving the heavy lifting to Johor,” he said.
Johor Menteri Besar Datuk Onn Hafiz Ghazi speaks during an interview with Bernama at Saujana, the official residence of the Johor Menteri Besar in Johor Bahru on March 8, 2026. — Bernama pic
Industry precedents
In March, Yeo’s announced it would lay off 25 employees in Singapore and shift manufacturing to Malaysia to “optimise capacity.”
Similarly, APBS, which brews Tiger Beer, is cutting 130 roles as it shifts production to Malaysia and Vietnam. Its Singapore facility will eventually pivot to logistics and innovation.
The investment wave has been record-breaking. In March, Johor announced RM110 billion in investments for 2025, the highest ever for a Malaysian state. Menteri Besar Datuk Onn Hafiz Ghazi noted these projects are expected to create 25,000 jobs.
Economist Sedek Jantan of IPP Financial Advisers compares the relationship to Hong Kong and Shenzhen in the 1990s.
“Hong Kong retained high-value finance functions while Shenzhen became the manufacturing powerhouse. We are seeing a similar Asean supply chain realignment,” he said.
However, Johor’s boom comes with growing pains.
Teh Kee Sin of the SME Association of South Johor warned that an influx of foreign firms intensifies competition for skilled workers and industrial land.
“There will be stronger competition for workers, pushing wages higher, while industrial rents are also likely to rise,” he said.
Resource strain is another concern. Johor’s fast-growing data centre industry has already pressured water and electricity supplies.
Prime Minister Datuk Seri Anwar Ibrahim recently acknowledged the issue, noting that Putrajaya has begun rejecting data centre applications unrelated to AI to protect local resources.
A file photograph shows the Johor-Singapore Causeway. — Reuters pic
The human cost
The trend also raises concerns for Malaysians employed in Singapore. While jobs are moving to Johor, the salary gap remains vast.
Outside Yeo’s factory in Pasir Gudang, one employee noted that manufacturing roles in Johor pay RM3,000 to RM5,000, compared to over S$2,000 (RM6,200) in Singapore.
“The gap is still very big,” the employee said. “But we also know these jobs in Singapore are becoming fewer.”
Looking ahead, SMF’s Tan expects more F&B and light manufacturing firms to move, while high-value sectors like semiconductors and aerospace remain anchored in Singapore.
“The question is no longer ‘Singapore or Malaysia’,” he concluded. “It’s how companies can best use both.”"
Malay Mail,"APAD probes LRT derailment near Chan Sow Lin, demands full report from Rapid KL",https://www.malaymail.com/news/malaysia/2026/05/29/apad-probes-lrt-derailment-near-chan-sow-lin-demands-full-report-from-rapid-kl/221742,"Fri, 29 May 2026 08:42:42 +0800","KUALA LUMPUR, May 29 — The Land Public Transport Agency (APAD) has launched a thorough investigation into the Light Rail Transit (LRT) train derailment near the Chan Sow Lin station on Thursday morning, warning of strict enforcement action if negligence is found.
The incident, which occurred on the Ampang-Sri Petaling line, resulted in significant service disruptions. Rapid KL confirmed the derailment after videos of the stalled train began circulating on social media.
APAD said it conducted a site inspection immediately after the incident, led by its director-general, alongside representatives from the Rail Enforcement and Rail Planning divisions, to assess the situation and ensure immediate remedial actions were taken by the operator.
A second inspection was held at 3.00 pm yesterday, involving officials from the Ministry of Transport (MOT) to review the investigation’s initial progress, operational safety levels, and necessary follow-up measures.
“In line with the directive of the transport minister, APAD has immediately opened an investigation file to conduct a thorough probe into this incident,” the agency said in a statement today.
The investigation aims to identify the root cause of the derailment, focusing on compliance with standard operating procedures (SOPs), asset maintenance, safety systems, and train operations.
APAD said that the safety of users, the reliability of the rail system, and the integrity of public transport services “cannot be compromised under any circumstances.”
The operator has been directed to submit a full report as soon as possible. APAD will review this report in detail before conducting further interviews and examinations to determine if there were elements of non-compliance, negligence, or violations of operating licence conditions.
Should any violations be found, enforcement action may be taken under Section 101 of the Land Public Transport Act 2010.
Furthermore, the investigation covers potential negligence under Sections 202 and 128 of the same Act. This includes possible action against any individual found to have failed in their responsibilities or acted negligently to the extent of compromising rail safety.
APAD added that it will continue to work closely with the MOT and relevant agencies to ensure that public confidence in the rail system is maintained."
